text,start,duration,time_midpoint,vader,textblob,llama3,vader_norm,textblob_norm,llama3_norm
years do not travel with your luck well,3610.859,5.401,3613.5595,0.6249,0.0,-0.7,0.06331889510341077,0.004033376425066699,-0.23686098730763636
let's be civilized about this that's,3613.859,4.081,3615.8995,0.0,0.4,0.4,0.06244852373416044,0.0041953089754223055,-0.23877619323934948
better now just mind your business and,3616.26,3.18,3617.85,0.4404,0.5,0.2,0.06176739607567443,0.004335181219459913,-0.2403330701204926
that would you drive me to the planet,3619.44,3.899,3621.3895,0.0,0.0,0.7,0.060634524736308905,0.004601032045425585,-0.24306808256932638
please Edwina right away yeah yeah as,3620.819,3.78,3622.709,0.6908,0.2857142857142857,0.7,0.06024626658995968,0.004704299717290068,-0.2440583784911284
soon as I can put on some clothes I'll,3623.339,2.881,3624.7795,0.0,0.0,0.4,0.05967436544318508,0.004871110363723627,-0.24558074814295544
try to salvage some of the wreckage I,3624.599,4.561,3626.8795,0.0,0.0,-0.7,0.059140941816074655,0.005046457193534458,-0.24708594013680088
seem to have made of Our Lives I mother,3626.22,6.139,3629.2895,0.0,0.0,0.2,0.05858669764889407,0.00525564600778603,-0.2487658475993153
I think you'd better be quiet,3629.16,3.199,3630.7595,0.4404,0.25,-0.7,0.05827872721194372,0.00538756758760785,-0.24976596750395633
hello Jerome well good morning Mrs,3633.72,3.66,3635.55,0.6124,0.7,0.4,0.05741137308679515,0.005841360603816562,-0.2528988443428015
Fulton doctor I looked everywhere for,3635.76,3.24,3637.38,0.0,0.0,0.2,0.05712506002318126,0.006024788948494623,-0.254045615114144
you last night later this is Jerome,3637.38,3.0,3638.88,0.0,0.0,0.2,0.056904788487180204,0.0061794721202789605,-0.25496540360354786
right now I'd like to have a laboratory,3639.0,3.96,3640.98,0.3612,0.2857142857142857,0.4,0.05661401981205495,0.006402764997003634,-0.2562229879888105
to myself for a while oh yes very well,3640.38,3.36,3642.06,0.624,0.2,0.4,0.056470837725089755,0.006520731995298682,-0.2568562329902786
uh all right Mina my spare glass is in,3643.74,3.66,3645.57,0.0,0.2857142857142857,0.2,0.05602428458836658,0.006919282844835319,-0.2588520319055939
the top draw of the desk would you get,3646.2,3.5,3647.95,0.2023,0.5,0.3,0.05572784454880161,0.007203142395211326,-0.26015218133536333
them please,3647.4,2.3,3648.55,0.3182,0.0,0.5,0.05565273451527179,0.0072764912885535955,-0.2604732966507083
and you angry at me because of what I,3654.599,5.401,3657.2995,-0.5106,-0.5,-0.7,0.05444200743093251,0.00843209190472173,-0.26486171540125
did last night did we know I thought,3657.42,4.02,3659.43,0.0,0.0,0.2,0.05408725892064129,0.008739011933654547,-0.265849733764512
this over very carefully and I've almost,3660.0,3.119,3661.5595,0.2006,-0.13,0.4,0.05369714466035395,0.00905629688385818,-0.2668070099392411
come to a conclusion,3661.44,3.98,3663.43,0.0,0.0,0.4,0.05332047903395827,0.009343860451963577,-0.26762337062671704
I'm thinking of destroying the formula,3663.119,5.46,3665.849,-0.5574,-0.2,-0.7,0.05277939523204081,0.009728338958092955,-0.26864586436672105
destroying it so then you are angry yeah,3665.42,4.96,3667.9,-0.6908,-0.35,-0.7,0.05226699681063211,0.010065706170873587,-0.2694840409299161
I've been in better moods,3668.579,3.301,3670.2295,0.4404,0.5,-0.7,0.05161823012610461,0.010461852877492461,-0.2704047477860913
you think you'd feel any better if I,3670.38,3.36,3672.06,0.4404,0.5,-0.7,0.05105375401349996,0.010783026660653278,-0.27110538672117995
fixed you some toast and coffee you,3671.88,3.0,3673.38,0.0,0.1,0.7,0.05061450775184745,0.011020128110007679,-0.27159839314439577
haven't had any breakfast yet remember,3673.74,3.359,3675.4195,0.0,0.0,0.3,0.04987915792270893,0.011395682565548508,-0.2723403447790686
yeah thank you I'm starved how are they,3674.88,4.08,3676.92,0.0258,0.0,0.3,0.04929156341285115,0.011679242103238821,-0.2728711515085069
coffee and coffee butter in there you,3677.099,3.601,3678.8995,0.0,0.0,0.6,0.04845209027689341,0.012062899093275898,-0.2735522757279205
can use this plug as your own music all,3678.96,2.82,3680.37,0.0,0.6,0.7,0.047778549548595485,0.012355067726266933,-0.2740444358306352
you know I've decided that the formula,3681.78,3.9,3683.73,0.0,0.0,0.6,0.046068516627711914,0.013046056630771066,-0.2751259384499953
is the most dubious Discovery since,3684.059,3.721,3685.9195,-0.4201,0.5,-0.7,0.04481886676596255,0.013514025445546078,-0.2757993583467834
itching powder and just about as useful,3685.68,4.56,3687.96,0.4404,0.3,-0.7,0.043558001079359566,0.013962099912468275,-0.2764053907288848
oh I wouldn't say that it showed your,3687.78,4.74,3690.15,0.0,0.0,-0.7,0.042103508561496535,0.014454970453128017,-0.2770333124027431
bursitis and improved your vision I must,3690.24,5.16,3692.82,0.6249,0.0,0.4,0.040191538373485186,0.01507133134511261,-0.27776827796965187
say it made you feel young,3692.52,4.62,3694.83,0.0,0.1,0.7,0.038653906940575584,0.015545607252777179,-0.2783000805976705
I'm beginning to wonder if being young,3695.4,3.719,3697.2595,0.0,0.1,-0.7,0.03668534490746177,0.01612953654796242,-0.27891905000437256
is all is cracked up to be,3697.14,4.74,3699.51,0.0,0.0,0.2,0.034756846823841815,0.0166798406245884,-0.279469897088727
and dream of use we remember it as a,3699.119,4.74,3701.489,0.25,0.0,0.4,0.0329795207865783,0.017170416725862114,-0.27993698479622964
time of Nightingales and Valentines at,3701.88,4.5,3704.13,0.0,0.0,0.4,0.030491802219015804,0.017833591376198717,-0.28053598037891153
one of the facts not adjustment near,3703.859,4.44,3706.079,0.0,0.1,0.3,0.0285730263080527,0.01832837650426254,-0.2809608033312243
idiocy in a series of low comedy,3706.38,4.02,3708.39,0.1027,-0.15,0.4,0.02620900890610528,0.018919993917381358,-0.28144629735038207
disasters that's what youth is I don't,3708.299,5.421,3711.0095,-0.5574,0.0,-0.7,0.023415943226405108,0.019595771406807152,-0.28197362058191583
see how anyone survives it,3710.4,3.32,3712.06,0.0,0.0,-0.7,0.022262770335498533,0.019867992273544247,-0.2821784777740917
and tell me something because he's been,3714.079,5.74,3716.949,0.0,0.0,0.4,0.016655534544840145,0.021140438885135268,-0.28308468070108034
bothering me why did you want a divorce,3716.16,6.659,3719.4895,-0.3182,0.0,-0.7,0.013591136571389677,0.02180292827370615,-0.2835265930773857
oh Barnaby it wasn't me it was the,3719.819,4.8,3722.219,0.0,0.0,0.4,0.010189026899250749,0.02251356197216125,-0.28398084038154336
formula you ought to understand that oh,3722.819,3.121,3724.3795,0.0,0.0,0.3,0.007418271425082232,0.023074079014039916,-0.28432613841820814
I understand it was a formula that,3724.619,3.861,3726.5495,0.0,0.0,0.2,0.004568391063921096,0.023634342080193025,-0.2846609772957177
brought it out,3725.94,4.379,3728.1295,0.0,0.0,0.7,0.002452376848553201,0.02404005403684577,-0.2848975959135981
brush whatever,3728.48,5.319,3731.1395,0.0,0.0,0.2,-0.0016710790437214143,0.024806427666395625,-0.28533261328828774
some subconscious aversion to me,3730.319,5.701,3733.1695,-0.4404,0.0,-0.7,-0.004518015526719571,0.0253174647876486,-0.28561504624189654
a virgin to you,3733.799,5.641,3736.6195,0.0,0.0,0.4,-0.00947277045826975,0.026172896777738982,-0.28607650674894924
I love you you Potato Head,3736.02,5.4,3738.72,0.6369,0.5,0.8,-0.012558104167402488,0.02668437226763798,-0.2863469674770231
oh I know there isn't some buried,3739.44,3.419,3741.1495,0.0,0.0,0.3,-0.016188459693541178,0.02726586476934935,-0.28665081300531414
resentment that you don't consciously,3741.42,3.899,3743.3695,-0.4404,0.1,-0.7,-0.01956126455490872,0.02778673678810016,-0.28692077551772377
realize well I certainly don't,3742.859,4.381,3745.0495,0.5423,0.2142857142857142,-0.7,-0.022147441799359464,0.028173658646005895,-0.2871206343415357
consciously realize it and I think,3745.319,4.161,3747.3995,0.0,0.1,0.7,-0.025811780518302067,0.028703549351131043,-0.28739441186885806
that's pretty,3747.24,2.24,3748.36,0.4939,0.25,0.4,-0.027324631110431208,0.02891609098924209,-0.2875045362021717
right a minute what about the way you,3750.059,4.321,3752.2195,0.0,0.2857142857142857,0.2,-0.033487577988794905,0.029744578728879686,-0.28793806797210614
kept bringing up Hank and twister,3751.44,4.34,3753.61,0.0,0.0,0.4,-0.03573933849785496,0.03003238241637735,-0.28809121994517545
do you love him,3754.38,4.199,3756.4795,0.6369,0.5,0.7,-0.04043525234895237,0.03060697940192337,-0.28840323050457634
now that is ridiculous I don't know you,3755.78,4.6,3758.08,-0.3612,-0.3333333333333333,0.4,-0.04308171858478897,0.030915548813399626,-0.2885753372814882
kissed him didn't you you can't seem to,3758.579,3.78,3760.469,0.3818,0.0,-0.7,-0.047066026613382446,0.03135931139157573,-0.2888303668198231
get that out of your mind can you no I,3760.38,4.38,3762.57,-0.296,0.0,-0.7,-0.05060170259085882,0.03173209062423476,-0.2890534121877252
can't well all right are you in love,3762.359,5.161,3764.9395,0.5245,0.3928571428571428,-0.7,-0.054622271895494706,0.032131821155464854,-0.28930433917351545
with this um who is it of course not,3764.76,5.099,3767.3095,0.0,0.0,0.2,-0.05867605349149896,0.032508584756910514,-0.28955547226945866
well you went smooching with her on,3767.52,4.44,3769.74,0.2732,0.0,0.6,-0.06286401805104591,0.032869810099458996,-0.2898140609729365
roller skates and may I ask what was,3769.859,4.141,3771.9295,0.0,0.0,0.4,-0.06666086945054084,0.03317238352638033,-0.29004866337448376
your hidden aversion or subconscious,3771.96,3.54,3773.73,-0.4404,-0.0833333333333333,-0.7,-0.06979869265089285,0.033404314919591546,-0.2902432482255947
discontent or whatever it is you want to,3774.0,3.54,3775.77,0.0772,0.0,-0.7,-0.07336920893573497,0.033647998824808484,-0.29046603066901044
call it that made you go playing patty,3775.5,4.799,3777.8995,0.2023,0.0,0.4,-0.07711186887428192,0.03387996127757607,-0.2907017710327499
cake with her all over town doing a Swan,3777.54,5.64,3780.36,0.0,0.0,0.7,-0.08145337079373913,0.03411838620807966,-0.29097899639266966
Dive acting like a,3780.299,5.841,3783.2195,0.3612,0.0,0.5,-0.08651798173108217,0.03435397144702438,-0.2913088999812483
I'll finally,3786.42,3.78,3788.31,0.0,0.0,0.7,-0.09557010679792387,0.03465684779792595,-0.29192120176375885
don't say anything darling I would,3788.46,3.899,3790.4095,-0.4717,0.0,0.7,-0.09931168529227571,0.03473610605763562,-0.29218466974025964
we should be fighting,3792.359,4.921,3794.8195,-0.3612,0.0,-0.7,-0.10717478974477009,0.03481093455441233,-0.292762401859508
we're having doubts about our marriage,3795.0,4.38,3797.19,-0.296,0.0,0.7,-0.11139864860142593,0.034797771627912547,-0.29308807601318076
that isn't right that's just my point,3797.28,4.019,3799.2895,0.0,0.2857142857142857,0.7,-0.11513474799417626,0.03475400118593049,-0.2933857752521622
that's why I'm going to destroy the,3799.38,4.4,3801.58,-0.5423,-0.2,-0.7,-0.11920104631290808,0.03467244554842823,-0.2937184580444227
oh no really are you crying,3806.22,3.74,3808.09,-0.6771,-0.15,-0.8,-0.1306576082411184,0.0342569292566648,-0.29468473827424985
are you sure you want to throw away two,3813.9,5.04,3816.42,0.3818,0.5,-0.7,-0.1449462663074449,0.03335893507564328,-0.2958835822925874
years of hard work yes I am but still in,3815.7,4.919,3818.1595,0.1655,-0.2916666666666667,0.4,-0.14785643729250672,0.03312363643707449,-0.29611731457961565
my head unfortunately,3818.94,3.24,3820.56,-0.34,-0.5,-0.7,-0.1518216747753827,0.03277358025083225,-0.2964256192969047
I'm going to forget it it's too,3820.619,5.121,3823.1795,-0.2263,0.0,-0.7,-0.15607501460541803,0.03235931498539903,-0.29673974731378117
dangerous it's utterly unpredictable,3822.18,3.56,3823.96,-0.4767,-0.3833333333333333,-0.8,-0.15732634862056585,0.03222958745966116,-0.29682824477630637
um now please please don't use this,3827.4,3.0,3828.9,0.5574,0.0,-0.7,-0.1650590853675527,0.03134483119692329,-0.29732490396193706
water can't you see the sign just use,3828.9,4.56,3831.18,0.0,0.0,0.7,-0.16850936708442898,0.030901262349713434,-0.2975120412030414
the bottle water out of the cooler,3830.4,5.219,3833.0095,0.0,0.0,0.4,-0.17121877278642067,0.030530218850095884,-0.29764033405747403
and make plenty of coffee I need a lot,3833.46,4.58,3835.75,0.0,0.0,0.7,-0.17517257572302425,0.02995044930832519,-0.29779274672319683
this morning,3835.619,2.421,3836.8295,0.0,0.0,0.2,-0.1766938203050785,0.0297145149644205,-0.29783878472271763
hello this is Mr Oxley oh Mr Oxley Dr,3844.2,4.56,3846.48,0.0,0.0,0.2,-0.18928351075524352,0.02743531362650474,-0.2978446167498088
Faulkner's here in the plan he just came,3847.079,3.361,3848.7595,0.0,0.0,0.4,-0.1919663399424795,0.026857337810411434,-0.2977256849480325
in with Mrs Fulton,3848.76,4.62,3851.07,0.0,0.0,0.4,-0.19456123067544348,0.02625819924279999,-0.29755234670178327
oh yes sir well how is Mrs Fulton is she,3850.44,5.399,3853.1395,0.5859,0.0,0.2,-0.19677472627488088,0.025711042857529433,-0.2973496224824401
behaving normally well she didn't try to,3853.38,4.739,3855.7495,0.2732,0.15,0.3,-0.1994109276930428,0.02500803316437836,-0.2970266763688967
hit me but she wasn't there to life,3855.839,4.441,3858.0595,0.0,0.0,-0.7,-0.2015937386475518,0.024374907671519643,-0.29667515939860367
never mind now listen carefully Miss,3858.119,4.921,3860.5795,-0.0258,-0.1,0.4,-0.2038073603131378,0.02367381615719936,-0.2962178137416917
Laurel I don't want them to leave have,3860.28,4.559,3862.5595,-0.1083,0.0,0.4,-0.20541951889359203,0.023116201232852823,-0.29580203473614514
the guards hold them if they try to go,3863.04,3.36,3864.72,0.0,0.0,-0.7,-0.20704669372307297,0.022501815924992487,-0.29528937517148
you understand,3864.839,3.72,3866.699,0.0,0.0,0.6,-0.2084126942362934,0.021934319514628303,-0.294763824543708
and notify the entire board of directors,3866.4,3.179,3867.9895,0.0,0.0,0.42,-0.20923768300238288,0.021562149097922752,-0.2943914025654833
that I want to see them in the,3868.559,2.821,3869.9695,0.0772,0.0,0.4,-0.210401343241194,0.02098838052146546,-0.29377307736038855
conference room immediately I'll be,3869.579,4.161,3871.6595,0.0,0.0,0.4,-0.21129918654418703,0.020496450644115143,-0.2931991768737516
right down,3871.38,2.36,3872.56,0.0,0.065079365079365,-0.5,-0.21174274259651027,0.020233655438984987,-0.2928756121393037
now this is funny tasting coffee it's,3878.22,3.899,3880.1695,0.4404,0.25,0.4,-0.2145868459505421,0.01800360230052701,-0.2896224893624648
bitter yeah I know I noticed it that's,3880.02,3.599,3881.8195,-0.1531,-0.1,-0.7,-0.21500513855840553,0.017520050261057706,-0.2887886411525306
not the coffee it's the after effects of,3882.119,3.121,3883.6795,0.0,0.0,-0.7,-0.21539885215327073,0.016975987088108598,-0.28779095172222463
the formula,3883.619,3.781,3885.5095,0.0,0.0,0.5,-0.2157091882444301,0.01644227898821337,-0.2867482560020403
for a minute what a fool I was to let,3885.24,4.8,3887.64,-0.4404,0.0,-0.7,-0.2159789469385409,0.015823604190588952,-0.28545608721159305
you take that stuff last night,3887.4,4.86,3889.83,0.0,0.0,-0.5,-0.2161591772766333,0.01519147504195244,-0.2840378169676411
you couldn't help it hey that's your,3890.04,4.74,3892.41,-0.3089,0.0,0.4,-0.216253408410002,0.01445295556899228,-0.28224659988042267
third cup I know it it's your second cup,3892.26,5.4,3894.96,0.0,0.0,0.2,-0.21623020114127187,0.01373095451053773,-0.2803445303314633
isn't it yeah it's good,3894.78,5.88,3897.72,0.2528,0.7,0.4,-0.21608583598570913,0.012960023585949563,-0.2781337986943133
have you taken an overdose,3897.66,5.52,3900.42,0.0,0.0,-0.8,-0.2158359901964712,0.01221812171299853,-0.27581361853536973
perhaps I didn't no I mean a serious,3900.66,4.56,3902.94,0.1501,-0.0885416666666666,0.2,-0.2155159518176931,0.01153812048628873,-0.2735034906343195
overdose you know it's perfectly logical,3903.18,3.36,3904.86,0.6369,0.25,-0.8,-0.21522167047327548,0.011028951710596093,-0.2716473007604431
to assume that you'd have behaved even,3905.22,2.01,3906.225,0.0,0.0,-0.7,-0.21498841983652273,0.01067203033973802,-0.27027610944421754
remember Mr Oxley jumping around yeah,3908.579,4.5,3910.829,0.296,0.0,0.7,-0.21407518980530185,0.009502301138425878,-0.26532682483328357
yeah why I'm going to be embarrassed,3911.52,4.339,3913.6895,-0.0772,0.0,-0.7,-0.21342759604070533,0.008804736549488872,-0.26199241613794033
when I see him again,3913.079,2.78,3914.469,0.0,0.0,0.7,-0.21324271118879076,0.00861885919020631,-0.2610483966540923
I could really make it with you you,3917.88,3.479,3919.6195,0.0,0.2,0.6,-0.21195630366641982,0.007439845105579716,-0.2544195960769113
drank a whole glassful,3919.619,3.96,3921.599,0.0,0.2,0.4,-0.2114426677134551,0.0070110164763968665,-0.25168680085063055
I don't know,3921.359,6.661,3924.6895,0.0,0.0,0.3,-0.2106347712564915,0.006370764455732535,-0.2472084555804004
12 10 5 might even turn you into an,3923.579,6.011,3926.5845,0.0,0.0,0.2,-0.21014210174703712,0.005996757941131226,-0.24433223197085796
I'm just imagining you not being able to,3931.2,5.72,3934.06,0.0,0.5,0.7,-0.20828477840771187,0.00465493053148487,-0.23207769718930216
talk or feed yourself or even,3934.14,6.86,3937.57,0.0,0.0,0.2,-0.20748744333582134,0.004086370419417213,-0.22590989187611574
because you're very embarrassing yeah,3936.92,6.159,3939.9995,-0.1065,0.2,0.2,-0.20697392291413416,0.003710911593158463,-0.2215206667515623
well you know it's just about what could,3941.0,4.319,3943.1595,0.2732,0.0,-0.7,-0.20636159249517522,0.0032405987765001727,-0.21569360282761524
oh hi hey do you ever find the fish,3947.18,5.379,3949.8695,0.0,0.0,0.4,-0.20531356433173675,0.0022888348125158194,-0.20302398203146169
what'd you do with him,3950.64,5.36,3953.32,0.0,0.0,0.7,-0.20493322526411956,0.0018123527906998326,-0.19643594876039572
yeah I'm Keen are you serious minutes,3952.559,6.321,3955.7195,0.5267,-0.3333333333333333,0.3,-0.20474170183231402,0.0014817006086330015,-0.19185709766703402
what's on your mind,3956.0,5.2,3958.6,0.0,0.0,0.2,-0.2045979763037884,0.0010821418142640837,-0.18638697041530666
body be could you and your wife beat me,3958.88,4.06,3960.91,0.0,0.0,-0.7,-0.2045555524036876,0.0007573328780359931,-0.18203756106707047
right away maybe that's your drinking,3961.2,3.659,3963.0295,0.0,0.2857142857142857,0.3,-0.20457734425081936,0.00045412998539311384,-0.17808840329869494
I'll be right there,3964.859,5.401,3967.5595,0.0,0.2857142857142857,0.7,-0.2048332243496661,-0.00021739319671449232,-0.1698297707520647
any other orders sir,3970.26,4.799,3972.6595,0.0,-0.125,0.2,-0.20549355569947372,-0.0010263956509071488,-0.16093228597289186
going up good morning gentlemen good,3972.359,5.22,3974.969,0.7003,0.7,0.7,-0.2059332585250931,-0.0014164071176513363,-0.15707933503151425
morning we'll be here shortly so please,3975.059,3.601,3976.8595,0.4572,0.0,0.7,-0.20636242841737584,-0.0017485185786478303,-0.1540204441472538
we must act quickly you all know why,3978.66,4.32,3980.82,0.0,0.3333333333333333,0.7,-0.20747374779886169,-0.0024866120806023937,-0.14792359652094833
you're here to negotiate with Dr Fulton,3980.88,4.02,3982.89,0.0,0.0,0.3,-0.20817422974778652,-0.002897708215073566,-0.14492252261642835
for his formula as far as money goes I,3982.98,3.96,3984.96,0.0,0.1,0.4,-0.20896057305467586,-0.0033279557049932214,-0.14206128617218378
say all out and hang the expense yes but,3984.9,3.6,3986.7,0.2144,0.0,0.4,-0.20969007125079586,-0.003705420104638622,-0.13977137251734134
as chairman of your board of directors I,3986.94,2.76,3988.32,0.0,0.0,0.6,-0.2104271014084929,-0.004070583398507597,-0.13773927190809587
want to point out that Fulton made his,3988.5,3.119,3990.0595,0.0772,0.0,0.4,-0.21128219915371615,-0.004478183127336398,-0.1356698708535893
discovery on our time I've got bad news,3989.7,4.98,3992.19,-0.5423,-0.6517691120975355,-0.7,-0.21242180861246546,-0.005000422789619749,-0.1333023180255018
for you GJ we do not have the formula,3991.619,6.841,3995.0395,0.5766,0.0,0.5,-0.21411000038868094,-0.005740955330575526,-0.1304403364070859
what last night Dr lintel Dr Lantern Dr,3994.68,6.179,3997.7695,0.0,0.0,0.3,-0.21590972514647291,-0.006498554626938736,-0.12804641927423954
Lantern Dr Fulton's assistant brought me,3998.46,4.8,4000.86,0.0,0.0,0.6,-0.21816426081909493,-0.007415523441780499,-0.12576468968235058
a dose of the formula and I took it I,4000.859,3.901,4002.8095,0.0,0.0,0.4,-0.21969500716666981,-0.008025120360152137,-0.12454981442777485
can't tell you with what eagerness I,4003.26,4.68,4005.6,0.4019,0.0,0.8,-0.2220148681689244,-0.008937124170318594,-0.12309389732045478
waited the results but they were not no,4004.76,5.52,4007.52,0.3252,0.0,-0.7,-0.2236889683311724,-0.009590118542066123,-0.12227458251413499
reactions at all the formula that Dr,4007.94,4.98,4010.43,0.0,0.0,0.3,-0.22632937808651196,-0.010616813730200507,-0.12129655705342078
thingamabad brought me is incomplete now,4010.28,4.259,4012.4095,0.0,0.0,-0.7,-0.22818541619888907,-0.011339083816159765,-0.12080073001828681
there must be another ingredient that he,4012.92,3.78,4014.81,0.0,0.0,0.3,-0.23048841490193434,-0.01223902585944116,-0.12036940521110476
knows nothing about Dr Fulton has made,4014.539,3.841,4016.4595,0.0,0.0,-0.7,-0.23209732772683694,-0.01287172326018983,-0.12017357644512047
no record of it and there's nothing in,4016.7,3.72,4018.56,-0.296,0.0,-0.7,-0.23416914404666267,-0.013693092839903139,-0.12003383243170077
his notes to tell us what it is and,4018.38,5.479,4021.1195,0.0,0.0,0.4,-0.23671587622820803,-0.014715857039665704,-0.12001566980364443
without that ingredient we are helpless,4020.42,3.439,4022.1395,-0.4588,0.0,-0.8,-0.23773409443193724,-0.01512964474204722,-0.12005117174394214
every rule of this organization who,4024.26,3.42,4025.97,0.0,0.0,0.2,-0.24155159670223644,-0.01671177211239089,-0.12037659760429573
knows that he's been an employee for,4026.299,2.941,4027.7695,0.0,0.0,0.2,-0.24333023215518296,-0.01746875499817213,-0.12062179870645318
over 10 years failure may not have been,4027.68,3.3,4029.33,-0.5106,-0.3166666666666667,-0.7,-0.244858666111129,-0.01813138377435053,-0.12087525931470552
intentional Fulton was not himself,4029.24,4.079,4031.2795,0.0,0.0,-0.7,-0.24674376738333556,-0.01896637594684344,-0.12123848050630505
yesterday morning oh definitely not well,4030.98,4.319,4033.1395,0.223,0.0,-0.7,-0.2485107287300825,-0.019769544333300654,-0.12162623966151062
let's Hobbies himself now there is no,4033.319,4.141,4035.3895,-0.296,0.0,-0.7,-0.25059753064375123,-0.020748247279035396,-0.12213875435353878
doubt about it we are now dealing with a,4035.299,3.961,4037.2795,-0.3612,0.0,-0.7,-0.25229969857317225,-0.021575243106388985,-0.122597372335198
sane and adult scientist and I,4037.46,5.399,4040.1595,0.0,0.1,0.7,-0.25478818118937796,-0.022841650106934328,-0.1233277750852801
anticipate no difficulties well,4039.26,5.279,4041.8995,0.0191,0.0,0.8,-0.25622123021222143,-0.023609134859149113,-0.1237778727321206
all right Oliver go ahead if you want to,4042.859,3.48,4044.599,0.0772,0.2857142857142857,0.6,-0.2583248089988102,-0.024801221551463873,-0.12447312836758499
it's up to you I wonder what's keeping,4044.539,3.721,4046.3995,0.0,0.0,0.3,-0.2596384204960864,-0.0255960144959446,-0.12492546413357504
them doctor would you mind taking a look,4046.339,4.52,4048.599,0.0,0.0,0.7,-0.2611361290584706,-0.026565173453557796,-0.1254548074998399
come on in,4059.559,4.0,4061.559,0.0,0.0,0.2,-0.2674544690019349,-0.032207812845757286,-0.1278548679481691
what's the matter,4061.76,4.799,4064.1595,0.0258,0.0,-0.5,-0.2682288596649782,-0.033325651374941194,-0.12819018700703905
now come on in this is Fulton forget all,4063.559,4.681,4065.8995,-0.2263,0.0,0.4,-0.2686595420636368,-0.03407089647496077,-0.1283880267833511
about last night I assure you I have,4066.559,4.8,4068.959,0.34,0.0,0.4,-0.26925062085881013,-0.03537601609431088,-0.12868497313106636
come in yes yes your fathers are always,4068.24,5.04,4070.76,0.6597,0.0,0.4,-0.26950153014124445,-0.03614113648782779,-0.1288297598957764
experimenting aren't you I believe you,4071.359,5.76,4074.239,0.0,0.0,0.4,-0.26978802082430836,-0.03761249481409382,-0.12904737529160787
know everybody here yes,4073.28,3.839,4075.1995,0.4019,0.0,0.3,-0.2698220518112274,-0.038017172734419666,-0.12909320515507006
once you sit over here,4081.339,6.821,4084.7495,0.0,0.0,0.7,-0.26914936113697563,-0.042004292883828384,-0.12922177767989448
do I have to no I want to sit here,4083.96,5.579,4086.7495,-0.3447,0.0,-0.7,-0.2687860418805819,-0.04283085696652941,-0.1291751435789439
I think I speak for everyone here when I,4090.859,3.301,4092.5095,0.0,0.0,0.8,-0.2673366770216131,-0.045194938467741114,-0.12890309994738708
say that I consider you one of the great,4092.78,3.6,4094.58,0.6249,0.7503656471155087,0.6,-0.2666751510107041,-0.046038757396717624,-0.1287562968453179
man of modern science I asked you to,4094.16,3.9,4096.11,0.0,0.2,0.4,-0.2661403919003645,-0.04666026105485613,-0.1286314693087333
come here today to discuss the sale of,4096.38,5.54,4099.150000000001,0.0,0.0,0.2,-0.2649653166144755,-0.047889992323842084,-0.12834276784305193
your formula our organization,4098.06,3.86,4099.990000000001,0.0,0.0,0.4,-0.26461484621592074,-0.04822857557189944,-0.12825355693439663
our organization is ready to offer you a,4102.92,4.14,4104.99,0.3612,0.2,0.6,-0.26230694248111946,-0.050233068989881044,-0.12763952219325095
block of stock the income from which is,4105.08,5.9,4108.03,-0.4404,0.0,0.5,-0.26072579520779476,-0.051442662849608856,-0.12719799013757768
sufficient to keep you and Mrs Wilton,4107.06,3.92,4109.02,0.0,0.0,0.4,-0.26018311229556323,-0.051835080242057394,-0.12704328349330704
to keep you and Mrs Fulton in comfort,4111.38,3.959,4113.3595000000005,0.3612,0.0,0.6,-0.2576502344191857,-0.05354647672975508,-0.12630301269387378
for the rest of your life now the,4113.239,5.341,4115.9095,0.0,0.0,-0.7,-0.2560496830364887,-0.054545509801133485,-0.12582163027096788
question is how much cash do you want,4115.339,5.301,4117.9895,0.0772,0.2,-0.5,-0.25468570799038515,-0.05535676336744753,-0.1254040621601959
