text,start,duration,time_midpoint,vader,textblob,llama3,vader_norm,textblob_norm,llama3_norm
this time is for good too,1626.96,5.44,1629.68,0.4404,0.7,0.7,0.02333214458999066,0.12305044501304152,0.02353899443484151
joe like old time you sing a song for,1629.6,5.199,1632.1995,0.3612,0.1,0.7,0.023710452815291317,0.12418947251617049,0.026255826945988117
mama no mom not in front of all these,1632.4,6.56,1635.68,-0.296,0.0,-0.7,0.024226829358284057,0.1257452653592645,0.029979211433520933
people joe you singer for,1634.799,5.161,1637.3795,0.0,0.0,0.4,0.024476348275418922,0.12649728511511787,0.03178455280865955
where love is king,1641.44,5.599,1644.2395,0.6369,0.5,0.7,0.02546604679007524,0.12947956299425867,0.03898428805023005
when boy meets girl,1644.0,7.72,1647.86,0.0,0.0,0.5,0.025977096338535798,0.13101772099283332,0.04272598124027175
is what they see,1647.039,4.681,1649.3795,0.0,0.0,0.2,0.02618926053256447,0.1316556243336633,0.04428406612271596
when the moon hits your eye like a big,1655.279,7.12,1658.839,0.3612,0.0,0.7,0.0274792600455326,0.13552050559418657,0.05381534048060354
pizza pie that's slowly,1658.24,4.159,1660.3195,0.0,-0.3,0.3,0.027676357833206773,0.13610820440797514,0.055280120611085684
when the world seems to shine like,1663.12,4.559,1665.3995,0.3612,0.0,0.8,0.028342793544340338,0.13808777327538374,0.06024890662995258
you've had too much wine that's a,1665.36,4.799,1667.7595,0.0,0.2,-0.7,0.028647206722303722,0.13898745627442002,0.06252653305548356
bells will ring tingling,1670.799,5.041,1673.3195,0.0,0.0,0.7,0.02935138083019065,0.14105526299817,0.06781350989731721
and you'll sing,1673.84,5.68,1676.6799999999998,0.0,0.0,0.7,0.029768145667336512,0.14226878398195086,0.07095409356788264
the bella bravo,1675.84,7.8,1679.74,0.0,0.0,0.8,0.030141853966836427,0.14334930549109312,0.07377706239316939
hearts will play to pretty,1679.52,4.12,1681.58,0.872,0.25,0.7,0.030363912899903093,0.14398756959692213,0.07545740221789102
when you dance down the street with a,1694.88,6.799,1698.2795,0.0,-0.1555555555555555,0.8,0.03228830491158056,0.14936657018408128,0.09009685167709323
cloud at your feet you're in love,1697.279,4.4,1699.479,0.6369,0.5,0.7,0.03242023380260485,0.14972296218643008,0.0911045700966564
when you walk,1703.12,5.439,1705.8394999999998,0.0,0.0,0.2,0.03310573107185052,0.15154212139008347,0.0963460377860386
in a dream,1706.159,7.281,1709.7995,0.25,0.0,0.4,0.033520568838388234,0.1526132430916943,0.09952097073682115
but you know you're not dreaming,1708.559,4.881,1710.9995,0.0,0.0,0.4,0.03364446900686785,0.15292829627365975,0.1004694411355744
school's in me but you see black,1716.399,12.55,1722.674,0.0,-0.1666666666666666,0.4,0.03480603822925736,0.15575441846888008,0.10935741138596404
that's amore,1736.159,6.531,1739.4245,0.0,0.0,0.7,0.036334204115307835,0.15900976174474785,0.12098653953471236
when you dance down the,1762.48,6.439,1765.6995,0.0,-0.1555555555555555,0.7,0.038404256034909455,0.16203092800089056,0.13635097023012543
at street feet,1765.36,3.559,1767.1395,0.0,0.0,0.2,0.03850620756093033,0.1621175294192125,0.13708541658968731
but you know,1776.64,4.29,1778.785,0.0,0.0,0.2,0.03928696613471608,0.16249822615795856,0.14259376485912778
you're not,1778.32,5.72,1781.1799999999998,0.0,0.0,-0.7,0.039437898315198644,0.16250440818572817,0.14362967753797323
much why not tomorrow,1806.96,4.959,1809.4395,0.0,0.2,-0.7,0.0409715129031545,0.16060896821092077,0.15323128912966122
when you are,1811.919,4.171,1814.0045,0.0,0.0,0.2,0.041176618826142417,0.15994636219756247,0.1543109363605131
in a dream,1815.039,2.64,1816.359,0.25,0.0,0.4,0.04127778703719466,0.15956412514504775,0.1548145892097045
but you know,1817.679,3.991,1819.6745,0.0,0.0,0.2,0.04141492214740359,0.15897858245077792,0.15546177137045306
you're not dreaming,1819.679,13.36,1826.359,0.0,0.0,0.4,0.041672491630381336,0.15762738688500857,0.1565431751270172
you eat i gotta make important,1847.84,3.04,1849.36,0.2023,0.4,0.3,0.04236618854455519,0.15116669164748614,0.1579056814327206
announcements,1849.52,3.759,1851.3995,0.0,0.0,0.6,0.04241333797354614,0.1504534500850395,0.15784458129763748
tonight i tell you,1850.88,5.12,1853.44,0.0,0.0,0.2,0.04245817559373766,0.1497162950506931,0.1577530303384866
is the finest night in the whole life of,1853.279,4.801,1855.6795,0.0,0.2,0.8,0.042504699385971775,0.14887993637255656,0.15761732073586784
me and mama,1856.0,5.36,1858.68,0.0,0.0,0.8,0.04256262849590783,0.1477142291601272,0.15737731811075956
like my papa and me soon they're gonna,1858.08,6.439,1861.2995,0.3612,0.0,0.7,0.0426090815101706,0.1466539198729362,0.15711292386399797
be another fisherman in the family i see,1861.36,5.199,1863.9595,0.0,0.0,0.4,0.042652325347997455,0.1455362070397831,0.15679170719153934
congratulations mama do you feel all,1864.519,4.28,1866.659,0.5994,0.0,0.7,0.04269216836297823,0.14435929812527626,0.1564109996600366
we've got to have back with us the,1873.279,4.561,1875.5595,0.0,0.0,0.7,0.04279472292834164,0.1401704844221514,0.1547602720547348
second most finest fisherman in all,1875.84,3.28,1877.48,0.0,0.25,0.6,0.04281105987887231,0.13920371360272144,0.15432352480872633
california,1877.84,4.16,1879.92,0.0,0.0,0.7,0.042828854656242574,0.13794293948853642,0.1537276488213039
my son of joe,1879.12,2.88,1880.56,0.0,0.0,0.4,0.042832973755210946,0.13760628356672244,0.15356414197621523
but last night i got to thinking old,1882.48,4.72,1884.84,0.0,0.05,-0.7,0.04285466624270076,0.13529241445482848,0.15240099310386132
boats not big enough for two big,1885.12,4.08,1887.16,0.0,0.0,-0.7,0.042862171068964436,0.1339935899140783,0.1517250721943503
fishermen like us so i talked to mr,1887.2,4.959,1889.6795,0.3612,0.0,0.7,0.042866936969022225,0.13254843891567106,0.15096011916505123
speziato this afternoon and i'm proud to,1889.2,6.0,1892.2,0.4767,0.8,0.4,0.04286818140411514,0.13106734847479404,0.15016708901269438
say he sold me the santa clara and i,1892.159,5.201,1894.7595,0.0,0.0,0.3,0.042865841497659124,0.1295279061819347,0.14933804139670115
give pop a good trade in a job what's,1895.2,4.0,1897.2,0.4404,0.7,0.4,0.042860230921830646,0.12802749162729732,0.148529599641073
the matter captain,1897.36,5.12,1899.92,0.0258,0.0,0.5,0.042850093322837464,0.12631864013485655,0.1476130674539179
all we always 500 cash,1899.2,6.56,1902.48,0.0,0.0,0.8,0.042836814246136855,0.12467586990276447,0.14674046288167325
500 bucks what pop why don't you ask me,1902.48,5.679,1905.3195,0.0,0.0,0.7,0.04281784899937055,0.12281564017421219,0.14576715708552201
first but you come home you stop running,1905.76,3.68,1907.6,-0.4215,0.25,0.3,0.04279939353433063,0.1212933012561747,0.14498557353974753
around the country like a hobo you got,1908.159,4.081,1910.1995,0.3612,0.0,0.4,0.042774856615894516,0.11952799847336147,0.1440994206535465
home for good no well even if i did,1909.44,4.719,1911.7995,0.27,0.7,0.7,0.042757901458446636,0.11842588669485551,0.14355857439839664
i don't want to be a fisherman now what,1912.24,5.4,1914.94,-0.0572,0.0,0.2,0.04272051984192076,0.11622901036842408,0.14251232602096958
are you going to do,1914.159,3.481,1915.8995,0.0,0.0,-0.7,0.04270801556151481,0.11554909530323461,0.1421977847612063
i'm gonna play golf cause you're gonna,1920.559,3.12,1922.119,0.34,0.0,0.7,0.04261467996089953,0.11104651294018497,0.14023878187522698
a what's a golf what's a golf,1925.12,5.12,1927.68,0.0,0.0,0.2,0.04251322767020425,0.10688718482903108,0.13864389751464104
i mean what's golf,1927.919,4.561,1930.1995,0.0,-0.3125,-0.5,0.04246167752980883,0.10496350738941469,0.13798379850333886
you hit a little ball with the stick you,1930.24,3.84,1932.16,0.0,-0.1875,0.6,0.042419157497985756,0.10345039330692901,0.13750129096175243
don't want to be a fisherman huh you,1932.48,3.6,1934.28,-0.0572,0.0,-0.7,0.04237080870914688,0.10179862114190896,0.13701289889044888
want to hit a little ball with a stick,1934.08,4.079,1936.1195,0.0772,-0.1875,0.6,0.04232686318794328,0.10035263274882554,0.13661926575594102
why there's a lot of money in it sure,1936.08,3.68,1937.92,0.3182,0.5,0.7,0.04228205631717457,0.09892610736743118,0.1362628859890689
pop if i win a couple tournaments i,1938.159,3.12,1939.719,0.5859,0.8,0.7,0.042235516098488114,0.09748998229745863,0.13593703370315263
could fish for 10 years and never make,1939.76,2.88,1941.2,0.0,0.0,-0.7,0.04219587492723317,0.09629981148909642,0.1356926274814853
that kind of money and i bet you never,1941.279,3.441,1942.9995,0.0,0.6,-0.7,0.04214609604970931,0.0948443142069468,0.13542605987691525
heard of ben hogan he won 10 000 in two,1942.64,3.68,1944.48,0.5719,0.0,0.5,0.04210381565929882,0.09363930468714413,0.13523284930808965
days at pinehurst you want to make a,1944.72,3.28,1946.36,0.0772,0.0,0.7,0.04204840216825367,0.09209958864494217,0.13502300580879034
living hitting a little boiler with a,1946.32,3.68,1948.16,0.0,-0.1875,0.5,0.041993539938257496,0.09061564856895478,0.1348609352599503
stick and harvey's father won twenty,1948.0,3.679,1949.8395,0.5719,0.0,0.3,0.0419407573186882,0.08922269576661183,0.1347454663678621
thousand dollars at inverness and jimmy,1950.0,3.039,1951.5195,0.0,0.0,0.4,0.04188642114679164,0.08782148467957551,0.13466587160897214
thompson won five thousand and tamara,1951.679,3.041,1953.1995,0.5719,0.0,0.6,0.04183054767698153,0.08641264859376112,0.13462353812538974
shannon oh they won all this money half,1953.039,4.161,1955.1195,0.5719,-0.1666666666666666,0.4,0.04176481086451997,0.08479349541336509,0.13462251169531558
for what we had a little boiler with a,1954.72,4.24,1956.84,0.0,-0.1875,0.4,0.04170420052523541,0.08333463458308321,0.13466608201613914
stick harvey well that's what he said,1957.2,3.92,1959.16,0.2732,0.0,0.4,0.04161992210957148,0.08135597760852986,0.13479406484895198
well he knows how to say it papa joe,1958.96,4.319,1961.1195,0.2732,0.0,0.7,0.04154646091432188,0.07967491420531946,0.1349664756555096
could be a great goal see huh i can see,1961.12,3.279,1962.7595,0.6249,0.8,0.5,0.04148337458217259,0.07826127601088742,0.13515770485827938
it all now,1963.279,2.88,1964.719,0.0,0.0,0.5,0.041406083584567516,0.07656456421315927,0.1354441190545464
we're on the course at pinehurst there's,1964.399,3.361,1966.0795,0.0,0.0,0.7,0.04135119433853478,0.0753817801008591,0.1356811387708534
a thousand people following us we're,1966.159,3.52,1967.919,0.0,0.0,0.4,0.041275383818491926,0.0737766223021202,0.13605277584609712
ready to tee off on the last hole now i,1967.76,3.759,1969.6395,0.3612,0.1,0.8,0.04120281765623202,0.07226935323197034,0.13645504087019789
hand joe the club he walks up to the,1969.679,3.921,1971.6395,0.4939,0.0,0.4,0.04111644744466217,0.07051031369487208,0.1369910306915015
ball very nonchalantly,1971.519,5.121,1974.0795,0.0,0.2,0.2,0.041008143194863726,0.06835473993162973,0.13774765000678685
he takes aim he swings and it's a,1973.6,6.4,1976.8,0.0,0.0,0.6,0.040883590801803774,0.0659397701870503,0.1387271815250738
screamer right down the fairway,1976.64,3.36,1978.32,0.0,0.065079365079365,0.7,0.0408122584243389,0.06458548628908993,0.13933549476548363
then i hand him his nibbling what's this,1980.88,4.0,1982.88,0.4939,0.0,0.3,0.04059077333235443,0.06050305555712363,0.14141107971373643
that's a little sticker now he hits the,1983.039,3.841,1984.9595,0.0,-0.1875,0.4,0.040486043403721646,0.05863246182769968,0.1424769535931737
ball right up on the green it's about 25,1984.88,3.76,1986.76,0.0,0.0428571428571428,0.7,0.04039348112418502,0.05700880222856194,0.14345734105379898
feet from the cup now if he sinks this,1986.88,3.76,1988.76,0.0,-0.1,0.4,0.040288614439029286,0.05520118922217664,0.1446067677395666
he beats hogan he'll be the new champ he,1988.64,4.48,1990.88,0.4767,0.1363636363636363,0.8,0.040175103461694894,0.053280867577609435,0.1458920636162654
aims he putts and the ball is going,1990.64,4.24,1992.76,0.0,0.0,0.4,0.040072418767336054,0.05157462870591295,0.1470872623054638
right for the cup it's at the cup and it,1993.12,5.6,1995.92,0.0,0.2857142857142857,0.4,0.0398955375659932,0.04870056155029844,0.14920801656814373
rims the edge and goes around and around,1994.88,7.919,1998.8395,0.0,0.0,0.7,0.03972734843663408,0.04603948840404957,0.1512850957988037
and around and around,1998.72,4.079,2000.7595,0.0,0.0,0.4,0.039614244286148,0.044287009015610564,0.15270909994691773
but it doesn't go in he don't go in but,2003.039,5.52,2005.799,0.0,0.0,-0.7,0.039307966875870556,0.039680700212393415,0.15664889244322738
wait hogan putts,2005.279,5.361,2007.9595,0.0,0.0,0.3,0.039172492633295225,0.03770412500139112,0.15842069669051895
he hits his ball and it knocks joe's,2008.559,3.921,2010.5195,0.0,0.0,0.4,0.039008732133787576,0.035361580083039613,0.16057868817812115
ball right into the cup it's in the,2010.64,3.6,2012.44,0.0,0.2857142857142857,0.7,0.03888357740424366,0.03360431395998542,0.16223652396424226
scene we watch,2012.48,3.919,2014.4395,0.0,0.0,0.3,0.03875117858383092,0.031775246027445095,0.16399553833059952
he's my son,2014.24,3.279,2015.8795,0.0,0.0,0.8,0.0386545039487675,0.030458498441251473,0.16528189699558316
and they take him up to the judge's,2016.399,2.961,2017.8795,0.0,0.0,0.2,0.03851839596928976,0.028630680783081338,0.16709384584022077
stand and they give him his trophy he's,2017.519,3.441,2019.2395,0.0,0.0,0.6,0.038424622593090034,0.02738859736803937,0.16834173491185295
the new champion then they present him,2019.36,3.679,2021.1995,0.5994,0.0681818181818181,0.7,0.038287742313242584,0.02559998903965885,0.17016092832438418
with a ten thousand dollar check,2020.96,4.4,2023.16,0.0,0.0,0.8,0.038148777343280586,0.023812954299020722,0.17200313980898393
i take it and pop i give you some money,2023.039,6.0,2026.039,0.0,0.0,0.4,0.03794099375111945,0.021193100013506758,0.17474471143240194
you pay off the new boat i buy mama mink,2025.36,8.28,2029.5,-0.1027,0.1363636363636363,0.7,0.03768536315535391,0.018051987555023897,0.17808878143813703
you two send your kids to harvard,2029.039,4.601,2031.3395,0.0,0.0,0.6,0.037546902979379605,0.016386834279398937,0.17988370990045222
they'll be doctors,2034.88,3.039,2036.3995,0.0,0.0,0.8,0.03715675543184237,0.011824710739765048,0.18486645260092394
trying to kill me joe,2041.84,3.8,2043.74,-0.6908,0.0,-0.8,0.03656661436184413,0.0052641845943909495,0.19215009657156557
that's enough for today joe,2047.279,3.36,2048.959,0.0,0.0,0.3,0.036129667256274485,0.000650214114463519,0.1973122895795254
here we are joe let's go on a register,2051.119,4.8,2053.519,0.0,0.0,0.4,0.03573610081497849,-0.0033409153390320454,0.20177439700942526
me hey dig this rug they really live it,2058.839,4.681,2061.1795,0.0,0.1363636363636363,0.7,0.0350502227945165,-0.009948664475847828,0.20908976161261902
up here huh well yeah my dad used to,2061.839,3.04,2063.359,0.5106,0.0,0.7,0.034849429659354336,-0.011804017661625432,0.21111466029976683
take me to all these places when i was a,2063.52,3.04,2065.04,0.0,0.0,0.2,0.03469285383668574,-0.013226980824826724,0.21265571676907
kid and he said it's very important to,2064.879,4.081,2066.9195,0.2716,0.52,0.5,0.03451602804484788,-0.014809397005243717,0.21435553179829386
socialize so mix mingle,2066.56,4.16,2068.64,0.0,0.0,0.7,0.03435253234428353,-0.0162497545206351,0.21588846940767636
names please uh this is joe anthony and,2070.72,3.919,2072.6795,0.3182,0.0,0.4,0.033962552633371064,-0.019599374510159532,0.21939226160652206
i'm javi miller jr,2072.96,3.919,2074.9195,0.0,0.0,0.2,0.033742606373157034,-0.021436518146683653,0.2212720934143532
joe anthony yes entered from san,2074.639,4.96,2077.119,0.4019,0.0,0.4,0.03352407529235644,-0.02322571279271147,0.22307010431182733
francisco uh-huh,2076.879,5.441,2079.5995,0.0,0.0,0.7,0.03327458238849758,-0.025225352688910817,0.22503705089554527
but i i don't see any harvey miller jr,2079.599,3.441,2081.3195,0.0,0.0,-0.5,0.033099689202620956,-0.02660027597978134,0.2263608785807332
oh that's right joe's the player i'm his,2083.04,5.599,2085.8395,0.0,0.2857142857142857,0.6,0.03263270414849785,-0.030166089184120778,0.22967138974023243
caddy the caddy house is next door son,2085.04,6.16,2088.12,0.0,0.0,0.4,0.032393038188808454,-0.03193810771408883,0.2312426484948071
oh yes thank you wait a minute we're,2088.639,4.561,2090.9195,0.6369,0.0,0.4,0.03209511344359255,-0.034087535819260203,0.2330740654237503
partners if he can't stay i don't stay,2091.2,4.719,2093.5595,0.0,0.0,0.5,0.03181041432735231,-0.036087523104173534,0.23469736616974313
well no joe uh excuse me just a second,2093.2,4.96,2095.68,0.0516,-0.025,-0.7,0.03157911606407465,-0.03767447931471865,0.23592518338933363
no joe don't worry about me i'll be all,2095.919,4.241,2098.0395,0.0531,0.0,0.7,0.03131907101379411,-0.03941983655230788,0.23721190176862494
right we caddies have an awful lot of,2098.16,4.56,2100.44,-0.4588,-0.3571428571428571,0.4,0.0310517028761276,-0.04117346340526338,0.238436245123393
fun together and and you belong here and,2100.16,5.439,2102.8795,0.5106,0.3,0.8,0.03077719003345509,-0.04293285368253334,0.23959420546447552
i belong there we'll be together,2102.72,5.04,2105.24,0.0,0.0,0.7,0.030508972229161293,-0.04461352314125127,0.24063310768384338
thank you very much sir caddy house is,2105.599,3.921,2107.5595000000003,0.3612,0.26,0.7,0.030243015434872202,-0.046244228014099595,0.24157699270742564
you told me before,2109.52,3.04,2111.04,0.0,0.0,0.2,0.029839665959447797,-0.04865266370137099,0.2428526747111277
i better go along with him take my word,2112.64,4.0,2114.64,0.4404,0.5,0.6,0.029417348286086626,-0.05109536502751654,0.24399817039268534
for it you'll be all right,2114.8,5.52,2117.5600000000004,0.0,0.2857142857142857,0.7,0.029071195147611407,-0.05304064725928751,0.2448002182739101
come on i'll introduce you around,2116.64,3.68,2118.48,0.0,0.0,0.7,0.02896149394292188,-0.0536468811133614,0.24502973453098942
mr anthony bruce rieber gloria hi gaston,2121.28,5.76,2124.1600000000003,0.0,0.0,0.2,0.028277831986833955,-0.05731928957709781,0.2462061227888698
lerong how do you do sidney benthal,2124.72,4.879,2127.1595,0.0,0.0,0.2,0.027912660131376422,-0.05920990597666454,0.24666401749286934
how'd you do,2127.04,6.079,2130.0795,0.0,0.0,0.3,0.02755464502623769,-0.061018228177636614,0.2470043599666721
jonathan preen and harry bill hi,2129.599,6.561,2132.8795,0.0,0.0,0.4,0.027209165420148465,-0.06272252368550862,0.2472351467573352
i'm kathy taylor hi,2133.119,5.201,2135.7195,0.0,0.0,0.3,0.026856729149205658,-0.06442155889378488,0.24737572167643992
uh mr anthony is from san francisco,2136.16,3.439,2137.8795,0.0,0.0,0.2,0.026587412295772408,-0.06569388598709024,0.24742086033762126
we'll say if you're from san francisco,2138.32,2.72,2139.6800000000003,0.0,0.0,0.4,0.026362138186925677,-0.06674135392754157,0.24741842875395192
you must know ted kohler of kohler,2139.599,4.0,2141.599,0.0,0.0,0.7,0.026121303724233526,-0.06784468225735435,0.24737637462027892
heisler and dodge i don't oh but you,2141.04,3.92,2143.0,0.0,0.0,0.2,0.025945027157871482,-0.06864168256170225,0.247320315896921
must if you play at the bay city country,2143.599,3.201,2145.1995,0.34,0.0,0.7,0.025667563596206762,-0.06987848849798368,0.24718979479903985
club i don't,2144.96,4.24,2147.08,0.0,0.0,-0.7,0.025429693599960244,-0.07092195537914525,0.24703765182837337
what club do you represent up there,2146.8,3.6,2148.6000000000004,0.0,0.0,0.3,0.02523702092864935,-0.07175600235032331,0.24688779341640418
i know now you played in the phoenix,2150.4,3.04,2151.92,0.34,0.0,0.4,0.02481505240193644,-0.07354865183308283,0.2464785299410161
open didn't you no,2151.92,4.32,2154.08,0.2235,0.0,-0.7,0.024539780171046206,-0.07469359424554518,0.24615315238297414
anthony anthony san francisco,2153.44,5.04,2155.96,0.0,0.0,0.4,0.024299781293339737,-0.07567645645765415,0.24583286887539413
what business your family in fish,2156.24,4.56,2158.52,0.0,0.0,0.4,0.02397244619652426,-0.07699443581173286,0.24534237268372708
importing or exporting,2158.48,4.8,2160.88,0.0,0.0,0.2,0.0236702347447498,-0.07818868476002183,0.24483585203907504
i beg your pardon i would like to know,2165.76,4.16,2167.84,0.5859,0.0,0.4,0.022777335583779142,-0.08159531604402269,0.24305007704204212
i would like to know if i can have a,2182.88,4.56,2185.1600000000003,0.3612,0.0,0.4,0.02055755517115157,-0.0893334629699104,0.2368824663197801
locker hey you're quite a tomboy aren't,2184.48,5.119,2187.0395,0.0,0.0,0.4,0.020317939219444536,-0.09011048147867874,0.23607952059644957
well sticks and stones will break my,2195.92,4.88,2198.36,0.2732,0.0,-0.7,0.018885143808524504,-0.09453453420441515,0.2307586167828879
bones and names will never harm me,2197.44,5.52,2200.2000000000003,0.431,0.0,0.7,0.018654369852918292,-0.09521240066067013,0.229820733641299
could i have a locker yeah down that way,2200.8,3.039,2202.3195,0.296,-0.1555555555555555,0.4,0.018389417789167563,-0.09597905676883463,0.22871700686643434
thank you so you're a gentleman thank,2203.839,4.76,2206.219,0.6124,0.0,-0.7,0.017904616603095752,-0.0973500536982812,0.2266237510434263
well look at skinny boys,2216.0,4.04,2218.02,0.2732,0.0,0.7,0.016462259360139883,-0.10118975866952434,0.2198446634430842
hello fellas,2280.64,3.4,2282.34,0.0,0.0,0.4,0.00970290590740432,-0.11425137772459948,0.17706952969339185
the wise guy,2322.8,3.12,2324.36,0.4767,0.7,0.3,0.006895098148926041,-0.1160199374021776,0.15177602676877772
don't you uh,2353.44,2.639,2354.7595,0.0,0.0,-0.7,0.00599948573242969,-0.11420301881175265,0.13932783498092696
hey buddy you got a towel somebody took,2357.28,3.839,2359.1995,0.0,0.0,0.3,0.005962040289205935,-0.11372942053449635,0.13810026257724903
you got all the small caddies here,2362.56,5.12,2365.12,0.0,-0.25,0.6,0.00595198324936883,-0.1130172959456119,0.13673527696376153
i got soap in my eyes,2365.359,4.961,2367.8395,0.0,0.0,-0.7,0.005962988508360221,-0.11265955563349794,0.13621708828890147
i went over to get some water and it,2367.68,4.32,2369.84,0.0,0.0,0.2,0.005977477780767059,-0.11238416470103442,0.1358811406443653
wasn't any,2370.32,3.2,2371.92,0.0,0.0,-0.7,0.005998355761636683,-0.11208687967430955,0.13557337734030972
it's murder when you get soap in your,2372.0,2.56,2373.28,-0.6908,0.0,-0.7,0.006015239944511291,-0.11188648516970727,0.13539532807991222
and you you can't get the,2374.56,3.76,2376.44,0.0,0.0,-0.5,0.006064449365744143,-0.11140257027658643,0.13505083777005258
wash it and i'm in my underwear,2378.32,9.08,2382.86,0.0,0.0,-0.5,0.006208160735453362,-0.11034118799620157,0.13463285382944004
reporting on the santa barbara open with,2388.8,4.1,2390.8500000000004,0.0,0.0,0.7,0.006471197638558884,-0.10887537071452841,0.1345918734774
joe anthony,2391.119,3.441,2392.8395,0.0,0.0,0.2,0.006551581298189656,-0.10848565712941732,0.1346565010794029
again pop i told you we need a new one,2394.56,4.32,2396.72,0.0,0.1363636363636363,0.4,0.0067258096327876375,-0.10769740364109322,0.13486084129661724
you wait i make a quick smoke like a,2396.96,3.52,2398.7200000000003,0.3612,0.3333333333333333,0.4,0.0068247171052987915,-0.107276693026361,0.1350043586385821
joe anthony approaches the ball,2400.48,5.04,2403.0,0.0,0.0,0.4,0.007057511941310789,-0.10634357043220247,0.13539224221453938
down behind the ball lining it up on his,2403.359,2.901,2404.8095,0.0,-0.2777777777777778,0.6,0.007164698251986099,-0.10593568719890775,0.13558720134619265
cell phone,2405.52,3.2,2407.12,0.0,0.0,0.3,0.007309224951327494,-0.10540337863818487,0.13586097678502
he goes over to the golf bag,2408.72,4.399,2410.9195,0.0,0.0,0.4,0.007565790748818123,-0.1045001381429947,0.13636735118277385
wait one second joe,2411.28,3.36,2412.96,0.0,0.0,0.3,0.007713389847128271,-0.10400081994063527,0.1366657981741454
he's going to take it,2413.119,3.281,2414.7595,0.0,0.0,0.6,0.007849306150131524,-0.10355226057535201,0.1369430980372683
to the cup,2414.64,4.4,2416.84,0.0,0.0,0.3,0.008013217920725253,-0.10302409768357597,0.13727902759840452
to get out of the way anthony waits very,2416.4,5.04,2418.92,0.0,0.2,0.2,0.008184408463147837,-0.10248585466678255,0.1376300721744385
he's now by the hole and he's,2421.44,3.679,2423.2795,0.0,0.0,-0.7,0.008567221978973744,-0.10132482008509623,0.13840939196956933
don't be nervous,2425.52,4.96,2428.0,0.2057,0.0,0.5,0.009018944334182934,-0.1000177501974262,0.1393082866065113
he approaches the ball,2428.319,3.361,2429.9995,0.0,0.0,0.4,0.009222118282942067,-0.09944858041169657,0.13970272415054927
he's fights,2430.48,3.76,2432.36,-0.4019,0.0,0.6,0.00947114538321168,-0.0987648327998427,0.14017661741645107
here it goes it's rolling rolling it,2431.68,8.159,2435.7595,0.0,0.0,0.7,0.009847406725463866,-0.09775776250363813,0.14087113849774985
goes round and round and in,2434.24,5.599,2437.0395,0.0,-0.2,0.4,0.009994517542399209,-0.09737176658285478,0.14113531528793294
nice going anthony little boy nice spot,2443.28,3.92,2445.24,0.651,0.3374999999999999,0.7,0.011008737787779048,-0.0948112529558434,0.14283847055346754
joe congratulations we'll see you at the,2445.599,3.921,2447.5595000000003,0.5994,0.0,0.6,0.011318451667983316,-0.094059754439278,0.1433166514645499
party kathy i'll be there oh mr anthony,2447.2,5.36,2449.88,0.4019,0.0,0.7,0.011638536432184895,-0.09329601154131456,0.14379015569317624
won't you join us at the party well no,2449.52,5.839,2452.4395,0.1808,0.0,-0.7,0.01200356674451196,-0.09243984932020871,0.1443046083379607
yeah hey joe you are absolutely,2452.56,5.2,2455.16,0.296,0.2,0.7,0.012405458558349236,-0.09151409615089316,0.14483981077056748
oh very nice officially sir yes will you,2455.359,4.401,2457.5595,0.6997,0.78,0.7,0.012771925994711194,-0.09068419092737587,0.1452996707331513
get out of here oh all right i don't,2457.76,3.52,2459.5200000000004,0.0,0.2857142857142857,-0.7,0.013079761942080315,-0.08999685591965051,0.1456654631538518
want to disturb anything joe so i'll see,2459.76,2.88,2461.2000000000003,-0.34,0.0,0.3,0.013349617555044938,-0.08940126173250756,0.14597092605763679
you back in the moat,2461.28,3.12,2462.84,0.0,0.0,0.3,0.013618478883105061,-0.08881399516038939,0.1462613105489278
