text,start,duration,time_midpoint,vader,textblob,llama3,vader_norm,textblob_norm,llama3_norm
breaks it's in the cup,3230.0,4.8,3232.4,0.0,0.0,-0.5,0.14338823044047197,0.18920275449492516,0.041786289742865745
the winner of our tournament you were,3234.8,3.12,3236.36,0.5859,0.0,0.8,0.14791856175321227,0.1893158002540852,0.04843708249225394
invited to compete in the ten thousand,3236.24,3.599,3238.0395,0.0,0.0,0.7,0.14984005797300787,0.18934567592607313,0.0513233238011462
dollar invitational to be held at,3237.92,4.0,3239.92,0.0,0.0,0.4,0.15198943166016562,0.18936640552010903,0.05459889758751622
monterey week after next,3239.839,4.48,3242.079,0.0,0.0,0.6,0.1544522683465423,0.18937368154038833,0.05841381688513748
good luck thank you sir good luck joe,3241.92,5.04,3244.44,0.9231,0.7,0.7,0.15713665656161097,0.18936148678436182,0.06264534927085601
thank you good luck thanks until then,3244.319,6.161,3247.3995,0.8834,0.4499999999999999,0.7,0.1604833684392774,0.18931658360193002,0.06802515328025292
you'll be my houseguest at carmel no yes,3246.96,6.56,3250.24,-0.3089,0.0,0.5,0.16367074385600938,0.18924263059191204,0.07325351748288067
yes and last but certainly not least the,3250.48,6.19,3253.575,0.6059,0.075,0.6,0.16737396704267238,0.18911741658135459,0.07945328691246811
club's check for 500. thank you,3253.52,6.76,3256.9,0.3612,0.0,0.8,0.17101507650040265,0.18895151163795884,0.08567801951624639
paid in full,3261.92,4.72,3264.28,0.0,0.35,0.8,0.1788670871994792,0.18843786376417498,0.09953216483686265
for the last 10 years it has been the,3264.96,3.359,3266.6395,0.0,0.0,0.6,0.1812978162037048,0.18823164107208668,0.10394085760407255
custom for the winner to turn over the,3266.64,3.679,3268.4795,0.5859,0.0,0.2,0.18316272828062,0.1880567886392292,0.10736244949032021
check to our charity fund,3268.319,4.081,3270.3595,0.4215,0.0,0.7,0.18503863001154136,0.18786547468129847,0.11083906268230785
i know mr anthony would insist on,3270.319,4.641,3272.6395,0.0,0.0,0.4,0.1872711375525132,0.18761634164931545,0.115023103094005
following this noble tradition,3272.4,4.24,3274.52,0.4588,0.3,0.8,0.18907536170590006,0.187396791214447,0.11844239440389644
thank you from all of us,3276.64,7.199,3280.2395,0.3612,0.0,0.8,0.1943382789638592,0.18665128431958292,0.12862096324372996
and boy when you sank it that was really,3283.839,3.681,3285.6795,0.0,0.2,0.4,0.19899635284532494,0.18583440606048154,0.13790955427390011
something joe my dad couldn't have done,3285.68,3.84,3287.6,0.0,0.0,0.6,0.20055191593013952,0.18552110157555893,0.1410777646116849
better no it was nothing it was really,3287.52,4.319,3289.6795,0.1779,0.35,-0.7,0.20218058743135628,0.18516727241285202,0.14443466960703114
nothing but how is charity gonna get pop,3289.52,4.319,3291.6795,0.5719,0.0,0.3,0.20369027843448953,0.1848127114966136,0.14758586301941198
off the hook for the 500 years on the,3291.839,4.0,3293.839,0.0,0.0,0.7,0.2052555211372145,0.18441423185517888,0.15089725086892122
new boat and furthermore how are we,3293.839,3.041,3295.3595,0.0,0.1363636363636363,0.7,0.20631584630795674,0.1841239502523399,0.15316867376332072
going to eat,3295.839,3.201,3297.4395,0.0,0.0,0.6,0.20770859673891864,0.18371389619364975,0.1561908867526674
well joe money's not the important thing,3296.88,3.439,3298.5995000000003,0.1301,0.4,0.7,0.20845557581124127,0.1834787272350971,0.15783178756110802
it's the fact that now you're on your,3299.04,3.519,3300.7995,0.0,0.0,0.2,0.2098127465000294,0.1830200022489437,0.16085343040837882
way i sure am,3300.319,3.52,3302.079,0.3182,0.5,0.7,0.21056660908598804,0.18274557449088155,0.16255679757624472
and now we're invited to play in a,3302.559,2.24,3303.679,0.34,0.0,0.7,0.21147319039710613,0.18239452515799076,0.1646317669760636
tournament and that's ten thousand,3303.839,4.0,3305.839,0.0,0.0,0.8,0.21263441891715026,0.18190675702183196,0.1673372998597911
dollars we can keep,3304.799,3.04,3306.319,0.0,0.0,0.7,0.2128828258426958,0.18179620817431544,0.16792378565889185
joe anthony yeah sign this please,3309.119,5.44,3311.839,0.5423,0.0,0.8,0.2154941046421957,0.18046881510798926,0.17429230066478638
see you ready autograph hunters,3312.16,4.08,3314.2,0.3612,0.2,0.4,0.21647695676981696,0.17986971272870944,0.1768102852466536
what is this compliments of the santa,3314.559,5.441,3317.2795,0.481,0.0,0.6,0.217642743326468,0.17906024178148194,0.17991541495907534
barbara businessman's association,3316.24,6.16,3319.32,0.0,0.0,0.4,0.21834468789569178,0.1785064663769363,0.18186388016543767
look at these golf balls you look at him,3325.2,5.28,3327.84,0.0,0.0,0.4,0.2206985498291796,0.17604544544411196,0.18910283027340088
look at this complete outfit,3327.92,4.879,3330.3595,0.0,0.1,0.7,0.22122519306483437,0.17527205510704819,0.19097877439018401
give those boys a handsome tip,3330.48,3.68,3332.32,0.4939,0.5,0.7,0.22158429909063657,0.1746559611271601,0.19235882730059778
now keep it and thanks very much for,3334.16,4.0,3336.16,0.4404,0.23,0.7,0.22216368377892565,0.1734131575414928,0.19486621439572333
your trouble thanks for the gift,3335.839,4.081,3337.8795,0.4767,0.0,0.6,0.22237167998839583,0.1728412372408715,0.19590746464123032
anthony you old hound dog you,3339.92,6.399,3343.1195,0.0,0.1,0.4,0.2228189743890633,0.17103997273576754,0.19878308866715858
see joey golf can do for you and back in,3344.16,3.919,3346.1195,0.0,0.0,0.4,0.222954664660731,0.16996937324504832,0.20023623936093649
san francisco we can live at home and,3346.319,3.441,3348.0395,0.0,0.1363636363636363,0.6,0.22299786261476504,0.1692692506402971,0.20109572161313613
practice with all these golf balls we're,3348.079,3.28,3349.719,0.0,0.0,0.4,0.22300870143606585,0.1686473046869369,0.20180377470495553
gonna have to catch up by my short game,3349.76,3.12,3351.32,0.0,-0.2,0.4,0.2229962942090478,0.1680461838745082,0.20244164428027467
remember you can't count on luck all the,3351.359,2.561,3352.6395,-0.357,0.0,-0.7,0.22296982042046573,0.16754472484520908,0.2029407539058084
what do you mean luck oh i'm sorry luck,3353.92,7.76,3357.8,0.6908,-0.40625,0.2,0.22273194183757092,0.1655314678124112,0.20467115533617594
travel well deluxe i certainly intend to,3358.319,6.161,3361.3995,0.5423,0.4071428571428571,0.7,0.22244717074335732,0.1640784114522135,0.20568009013339653
harv oh yeah,3361.68,2.8,3363.08,0.296,0.0,0.7,0.22228305646297045,0.1633863844513892,0.20609858348916055
and by the way i'm not going to san,3364.72,3.68,3366.56,0.0,0.0,-0.7,0.221884007803103,0.1619258792113113,0.20686424896545508
you're not going home,3368.4,3.28,3370.04,0.0,0.0,0.7,0.22141027036700417,0.16042856230194694,0.2075009377280796
i'll practice every day the country club,3369.839,4.401,3372.0395,0.0,0.0,-0.7,0.22110670715280048,0.15955169565306404,0.2078117859462333
is right nearby nearby what,3371.68,4.879,3374.1195,0.0,0.2857142857142857,0.5,0.2207682078263923,0.1586267683110368,0.20809477495296813
kathy taylor's home in carmel,3374.24,4.079,3376.2795,0.0,0.0,0.7,0.22039358001620205,0.15765255333456618,0.2083470330839888
joe we can't take a vacation now our,3376.559,4.0,3378.559,0.0,0.0,0.7,0.21997431551202457,0.15660935281344632,0.2085695278181708
whole future's at stake i just won a,3378.319,4.48,3380.559,0.5719,0.1,-0.7,0.2195875931898303,0.15568135743263276,0.20872965686251696
tournament didn't i yeah but not against,3380.559,3.52,3382.3190000000004,-0.1139,0.0,0.2,0.21923367510822564,0.15485493662618915,0.2088448156621711
hogan or sneed that's who you're gonna,3382.799,3.361,3384.4795,0.0,0.0,0.7,0.21878304480347774,0.15382798342838655,0.20895493583853994
have to play at monterey look harvey,3384.079,4.401,3386.2795,0.34,0.0,0.4,0.21839499641809304,0.15296192819304097,0.20902178504156188
i've never met a kathy taylor before and,3386.16,6.0,3389.16,0.0,0.0,0.2,0.21775243408484934,0.1515563103102902,0.20908484386622578
i like her i'm human,3388.48,5.04,3391.0,0.3612,0.0,0.7,0.21732947313594925,0.1506458041149858,0.20909877438184477
i'll go to her place remember joe you,3393.52,4.64,3395.84,0.0,0.0,0.4,0.21617796027220768,0.14820407480014797,0.20904794276697483
have to practice every day,3395.68,4.24,3397.8,0.0,0.0,0.3,0.21569842748434861,0.1471961368240245,0.2089952502842662
one of us has to go home and tell the,3399.92,3.04,3401.44,0.0,0.0,-0.7,0.2147928912691393,0.14529519145321304,0.2088555908182793
folks how we're doing,3401.44,3.119,3402.9995,0.0,0.0,0.3,0.21440040105788694,0.14446925891360995,0.2087811199019884
well gee joe san francisco's out of the,3402.96,5.44,3405.68,0.2732,0.0,0.3,0.21372164004667005,0.14303359515172331,0.20863567724099474
way if we're going to carmel we order,3404.559,3.841,3406.4795000000004,0.0,0.0,0.7,0.21351852075256578,0.1426014751501056,0.2085885084919901
i guess you're right,3411.68,2.879,3413.1195,0.0,0.2857142857142857,0.3,0.211832016858535,0.1389436839202037,0.20814666144161764
one of us will have to go home and let,3414.64,4.0,3416.64,0.0,0.0,0.2,0.21094672711839974,0.13695498351016935,0.20788808834028558
the folks know how we're doing i'll meet,3416.4,3.6,3418.2000000000003,0.0,0.0,0.4,0.21055724083401364,0.13606316014781167,0.2077693225642116
you in monterey the morning of the,3418.64,2.959,3420.1195,0.0,0.0,0.4,0.21008034848744644,0.13495713768662357,0.207619673482852
qualifying round,3420.0,2.96,3421.48,0.0,-0.2,0.2,0.2097439029632371,0.13416752785154182,0.20751126445293988
okay you take the clubs and i'll give,3421.599,2.561,3422.8795,0.2263,0.5,0.3,0.20939916369519368,0.13335045765387488,0.20739772709878618
the folks your love,3422.96,3.119,3424.5195,0.6369,0.5,0.7,0.20899692005319626,0.13238686481488646,0.20726207782648523
you take the rest,3426.079,3.04,3427.599,0.0,0.0,0.2,0.20824665619223381,0.1305601351162497,0.20699980798581755
oh that's cathy,3429.119,3.68,3430.9590000000003,0.0,0.0,0.3,0.20743552579972185,0.12854211066645727,0.20670245600705875
sounds like she has a cold,3431.04,3.68,3432.88,0.3612,-0.6,0.2,0.20697526490106977,0.12737712404751117,0.20652723060402947
well i'll see you in a week,3432.799,3.201,3434.3995,0.2732,0.0,0.4,0.20661298800376068,0.12645002741760283,0.20638594869621743
that's yours,3436.0,6.179,3439.0895,0.0,0.0,0.6,0.2055047036600988,0.12355856608135263,0.205935023084872
okay now you send the rest of my things,3445.04,3.039,3446.5595,0.2263,0.5,0.4,0.2037700656388949,0.11886637029015545,0.20517087223819852
let's go champ we're riding with you,3452.799,5.65,3455.624,0.4767,0.0,0.8,0.20171487757889758,0.11304615716047006,0.2041688079223816
how do you like that i almost ran off,3461.04,5.039,3463.5595,0.3612,0.0,-0.7,0.1999596414628557,0.10785447925286584,0.2032252566945745
without giving any money to my caddy,3462.559,3.52,3464.3190000000004,-0.2584,0.0,-0.7,0.19979377446668653,0.10735348937485331,0.20313174158162103
i knew you changed your mind we're still,3466.319,4.8,3468.719,0.0,0.0,0.4,0.19884009560625904,0.10443859206359807,0.20257904479931996
buddies sure buddies how much money we,3468.48,3.599,3470.2795,0.3182,0.35,0.4,0.19850481477620793,0.10339999760702727,0.20237856430239226
we have uh,3473.52,3.68,3475.36,0.0,0.0,-0.5,0.19742385888084582,0.10000321617371591,0.20170979534806543
35 36 and 50 cents,3477.2,4.48,3479.44,0.0,0.0,0.5,0.19656743829416923,0.09726037068891202,0.20115505385220114
oh rolling in though what did you get i,3479.839,3.441,3481.5595,0.0,0.0,0.3,0.19612660609980986,0.0958310154590137,0.20086070698573733
had you in a caddy's pool but i spent,3481.68,4.48,3483.92,0.0,-0.1,0.4,0.19563889950457092,0.09423600051465858,0.2005279563380421
3.69 on the party for you,3483.28,5.2,3485.88,0.4019,0.0,0.8,0.19523653127642274,0.09290938659675695,0.20024772810801084
look harley i can't go up there broke,3486.16,4.159,3488.2395,-0.4215,0.0,-0.7,0.1947552514842329,0.09131005995342173,0.1999056678458458
i'll hang on to the 30.,3488.48,4.319,3490.6395,0.0,0.0,0.4,0.19426916907614497,0.08968109375319874,0.1995524768334359
and you keep the rest for food and bus,3490.319,4.0,3492.319,0.0,0.0,0.4,0.19393107669405735,0.08854007759120909,0.19930217587072852
oh don't mention it you're entitled to,3494.319,3.52,3496.079,0.2732,0.0,0.8,0.19318029226059472,0.08598323980133078,0.1987324861740679
enjoy yourself,3496.4,6.32,3499.56,0.4939,0.4,-0.7,0.1924927119522543,0.08361438572902345,0.19819364617475044
joe don't thank me have a good time,3497.839,7.451,3501.5645,0.1999,0.7,0.3,0.19210002096923293,0.08225008240545713,0.19787840934931414
kathy is this carmel or indianapolis,3557.119,3.521,3558.8795,0.0,0.0,0.3,0.18182519913016637,0.04429942279259326,0.18740076155487775
what would your mother say if she saw,3559.359,3.121,3560.9195,0.0,0.0,0.3,0.18149170469876208,0.04302561083352252,0.18697801910873002
you driving like that i don't know why,3560.64,4.08,3562.68,0.3612,0.0,-0.7,0.18120558654120478,0.04193273566442756,0.18661057197189676
don't you ask brody hello mother say,3562.48,4.8,3564.88,0.0,0.0,0.3,0.18085022150996735,0.040575655953045464,0.18614799203572308
hello to joe anthony hello joe anthony,3564.72,5.119,3567.2795,0.0,0.0,-0.7,0.1804653775698751,0.03910681100761691,0.18563917800240085
hello mother oh don't you dare my name,3567.28,5.039,3569.7995,0.0,0.0,0.2,0.18006427135225472,0.0375773585843494,0.18510002460379008
is grace and i lie about my age hello,3569.839,4.081,3571.8795,0.4215,0.0,0.4,0.17973554871723868,0.03632546090377391,0.18465133524494384
joe just won the tournament what good,3573.92,6.52,3577.1800000000003,0.765,0.7,0.8,0.17890737329570014,0.03318023552763384,0.18349303248967397
foot joe wonderful come along,3575.839,4.601,3578.1395,0.5719,0.8500479735022907,0.7,0.17875890548155404,0.032618059644901824,0.18328108374179006
can't you piggies be quiet,3591.28,4.12,3593.34,0.0,0.0,0.7,0.17646488718441694,0.02403327472247499,0.17983210350401876
thank you mr farmer,3609.44,3.72,3611.3,0.3612,0.0,-0.7,0.17389033181706567,0.014776244653842256,0.1755420802229433
hello hello doggies,3678.72,6.399,3681.9195,0.0,0.0,0.6,0.16504251840990403,-0.008885668456274618,0.15661943932873212
i'm pouring skinny leave me alone i,3682.079,7.081,3685.6195,-0.296,0.0,-0.7,0.16462907043698355,-0.009431471904789605,0.15554566630256764
wouldn't taste good anyhow,3685.119,4.041,3687.1395,-0.3412,0.7,-0.7,0.16446052665875655,-0.009632493135852186,0.1551023609786875
what are you complaining about,3698.0,7.119,3701.5595,-0.2023,0.0,-0.6,0.16289832882190913,-0.01084359675512728,0.1508348287914672
you belong you're an animal i'm a humane,3700.88,7.64,3704.7,0.0,0.0,-0.7,0.16256667202410552,-0.010935130464042061,0.14989087474842866
and i'm hungry,3705.119,3.401,3706.8195,0.0,0.0,0.4,0.16234452053198462,-0.01096179515336082,0.14925093706150913
well don't be selfish i don't want any,3720.72,4.8,3723.12,0.5318,-0.5,-0.7,0.1606797747259598,-0.010251149583569829,0.14425407720504935
of your hay you can have that can i just,3723.039,5.28,3725.679,0.0,0.0,0.2,0.16042522447923616,-0.00999707356153547,0.1434578430055551
please have a carrot,3725.52,6.24,3728.64,0.3182,0.0,0.4,0.16013290448370807,-0.009656466158204204,0.1425326477730251
thank you you're very kind,3728.319,3.441,3730.0395,0.7346,0.78,0.7,0.15999555938420326,-0.009478269540272153,0.14209392457194664
will you impress me,3737.68,2.639,3738.9995,0.4404,0.0,0.7,0.15912839351839214,-0.008081336930159949,0.1392636551474717
8 30. oh thanks rodney for waking me up,3758.64,5.12,3761.2,0.4404,0.2,0.4,0.15706510980292193,-0.002815694996242027,0.132098279672243
i got to get these clubs to joe right,3762.319,3.76,3764.199,0.0,0.2857142857142857,0.6,0.15679510290051565,-0.0019191720604535092,0.13111445467671004
good morning,3767.359,2.48,3768.599,0.4404,0.7,0.7,0.1564024895569145,-0.0005285007705178941,0.12966449300496743
thanks again rodney i'll see you soon,3776.079,4.641,3778.3995,0.4404,0.2,0.7,0.15554251227662083,0.002880048002779176,0.12640767169320347
watch my thing,3778.72,5.0,3781.22,0.0,0.0,0.5,0.15529859120208955,0.003937745816030163,0.125463619773304
oh how am i gonna get out of here,3785.119,4.281,3787.2595,0.0,0.0,-0.7,0.154781423074898,0.00631333484210844,0.1234322747462135
hello how do you do i'm looking for mr,3819.52,4.0,3821.52,0.0,0.0,0.3,0.1519662545316556,0.022372279145901973,0.11167324140212909
anthony he forgot his club so i brought,3821.68,3.52,3823.44,0.0,0.0,0.4,0.1518137682318254,0.023388649504323768,0.11100330818463751
him to him so he could practice mr,3823.52,3.839,3825.4395,0.0,0.0,0.4,0.1516554934931239,0.024458855138174893,0.11030449469856837
anthony is out cycling with miss taylor,3825.2,3.919,3827.1595,-0.1531,0.0,0.4,0.15151976365698808,0.025388888285381772,0.10970244481744279
i'll take them,3827.359,5.561,3830.1395,0.0,0.0,0.7,0.1512855023716475,0.027020427988570656,0.10865737363596516
no i wanted to see,3829.119,3.801,3831.0195,-0.296,0.0,-0.7,0.15121653801949217,0.027507037202905135,0.10834828659324619
nice doggies,3879.839,3.28,3881.479,0.4215,0.6,0.7,0.14739192324404285,0.05842967818789563,0.09030661065294351
hello doggies,3881.28,4.0,3883.28,0.0,0.0,0.7,0.14725895960669064,0.05962000850127766,0.08965266076434672
i'm not the same fella,3883.119,4.24,3885.239,0.0,0.0,-0.7,0.14711451497486872,0.060919701620533825,0.08894068241625591
if you don't believe me take us take a,3885.28,2.52,3886.54,0.0,0.0,0.3,0.14701868801114729,0.06178558966151595,0.08846747518913878
the guy you want is still inside,3889.76,6.24,3892.88,0.0772,0.0,0.7,0.1465527486988682,0.06603439874838209,0.08615734819576283
hey what are you doing out here,3893.359,4.641,3895.6795,0.0,0.0,0.3,0.14634749566379243,0.06792469044542315,0.08513520025084909
you're not supposed to be with the guest,3896.0,4.64,3898.32,0.0,0.0,-0.7,0.1461541343643052,0.06971480154331905,0.08416998863574988
come on with me,3898.0,2.64,3899.32,0.0,0.0,0.7,0.14608095918089714,0.07039445701257092,0.08380417154316212
party lifted now,3905.599,5.041,3908.1195,0.4019,0.0,0.7,0.14543807856678903,0.07641067116240638,0.08057896565193517
we'll forget all about your diet,3907.119,6.041,3910.1395,-0.2263,0.0,-0.7,0.14529069895043117,0.0777995707918466,0.07983710211473818
uh good morning mr mornings splendid,3931.76,5.12,3934.32,0.7717,0.7666666666666666,0.7,0.14352705851311645,0.09454994380283079,0.0709203387503369
morning splendid wonderful morning and,3934.319,3.76,3936.199,0.8176,0.8500479735022907,0.8,0.14338973295182142,0.09585484200532501,0.0702250701842171
it's the best time to get up is in the,3936.88,2.479,3938.1195,0.6369,0.8500479735022907,0.5,0.143249285116268,0.09718810546612164,0.06951415629168975
morning isn't it,3938.079,3.04,3939.599,0.0,0.0,0.3,0.14314102022831843,0.0982147784199677,0.06896629668070892
breakfast sir sure,3939.359,4.161,3941.4395,0.3182,0.5,0.4,0.1430062487382142,0.09949128313647018,0.06828453630321057
i mean uh yes i suppose i might have a,3941.119,4.72,3943.479,0.4019,-0.3125,0.2,0.14285677911323844,0.10090473346871362,0.06752878750688947
bite yes so what might i serve you sir,3943.52,5.039,3946.0395,0.4019,0.0,0.2,0.1426689210431827,0.10267730812563595,0.0665795941313953
oh the sausages are fine,3945.839,5.28,3948.479,0.2023,0.4166666666666667,0.3,0.1424897073040571,0.10436370317652197,0.06567488445070503
oh wonderful mm-hmm,3948.559,4.721,3950.9195,0.5719,0.8500479735022907,0.2,0.14231017166959037,0.10604802320182385,0.06476946866677556
and ham ham the morning is just,3951.119,3.68,3952.959,0.0,0.0,0.7,0.14215993022781762,0.1074531773889926,0.06401258488476592
wonderful oh,3953.28,4.64,3955.6,0.5719,0.8500479735022907,0.8,0.1419650802626632,0.10926907440354158,0.06303218336581426
uh eggs with it oh nothing like,3954.799,4.961,3957.2795,-0.2755,0.0,0.3,0.14184098260818667,0.11042149491023234,0.062408555425764504
eggs with it in the morning,3957.92,4.72,3960.28,0.0,0.0,0.7,0.1416188925732162,0.11247528526906059,0.06129414351318837
a paint a muffin that is very nourishing,3959.76,4.88,3962.2,0.0,0.2,0.6,0.14147650205673307,0.11378581091831128,0.06058089281398919
bacon bacon wonderful,3962.64,4.08,3964.68,0.5719,0.8500479735022907,0.8,0.1412922124497585,0.11547403810934707,0.059659626181368025
all wonderful fine how about just one,3964.64,3.36,3966.32,0.6705,0.7083333333333334,0.8,0.1411700855252127,0.11658750995760628,0.059050530463359424
more for the road,3966.72,2.96,3968.2,0.0,0.5,0.7,0.1410298047007402,0.11786092813955262,0.058352541266395594
one more yeah,3968.0,2.559,3969.2795,0.3597,0.5,0.8,0.14094910844323297,0.11859063269991438,0.057951914430353656
lamb chops are very uh nourishing in the,3970.559,5.201,3973.1595,0.0,0.2,0.3,0.1406580856263787,0.12120396051665472,0.056513307761404764
morning i'll check that thank you,3972.96,3.92,3974.92,0.3612,0.0,0.7,0.14052548345376703,0.12238465471100729,0.05586144985205408
little buns little ones oh yes i love,3980.16,4.08,3982.2,0.7675,0.0416666666666666,0.8,0.139972853605359,0.12723077474953887,0.05317428930516856
no we missed something you're cold,3984.24,4.24,3986.36,-0.0803,-0.6,-0.7,0.13965350086164582,0.12997178237757037,0.051646677049588724
you're getting warmer warmer wha no,3986.4,4.24,3988.52,0.296,0.0,0.7,0.13948652513367205,0.1313863241032027,0.05085630525194518
you're cold you were warm you're hot,3988.48,5.68,3991.32,0.2263,0.0833333333333333,0.6,0.13926880459216318,0.1332107669468345,0.04983497997689152
hippers i just adore skippers hmm,3990.64,5.12,3993.2,0.5574,0.0,0.4,0.13912177194963113,0.13442971823657365,0.04915145581532526
potato sir,3994.16,3.52,3995.92,0.0,0.0,0.2,0.13890776913672262,0.13618443867496224,0.048165959085918655
want me to ruin my waistline oh sorry,3997.68,6.359,4000.8595,-0.5859,-0.5,-0.7,0.13851502350264921,0.13934304633858696,0.04638773732586038
sir all right thank you,3999.68,4.359,4001.8595,0.3612,0.2857142857142857,-0.7,0.13843482824392436,0.13997795556680784,0.04602968227364571
uh shall we start over oh no,4007.039,5.841,4009.9595,-0.296,0.0,0.5,0.13777600194192458,0.14506100436970695,0.04315660497808583
no no i'll i'll have to get some warm,4010.799,2.961,4012.2795,0.4191,0.6,0.2,0.1375840675480481,0.14649643736094978,0.04234341684682544
one place okay i'll be here i'll be here,4013.76,4.88,4016.2,0.2263,0.5,0.2,0.1372561945501796,0.1489003314736018,0.040980095502565185
or the appetite,4019.359,4.641,4021.6795,0.0,0.0,0.4,0.13679007213443647,0.15221234550177395,0.039099276961376585
how do you do hello and all the,4021.44,4.32,4023.6,0.0,0.0,0.2,0.13662441291075372,0.15335947370580713,0.038447339304084414
excitement of arriving yesterday i don't,4024.0,3.68,4025.84,0.4939,0.0,0.6,0.13642962760793456,0.15468817936914508,0.037691971637096935
believe we've missed thank you although,4025.76,3.839,4027.6795,0.0772,0.0,0.4,0.13626837460429214,0.1557717200089571,0.037075840202519514
you do look familiar,4027.68,4.56,4029.96,0.0,0.375,0.4,0.13606679883995204,0.15710532481552256,0.03631740702816461
my name's ben tall sydney benton the,4029.599,5.681,4032.4395,0.0,0.0,0.4,0.1358454859953827,0.15854286893959837,0.035499814220833564
name's miller harvey miller jr,4032.24,5.44,4034.96,0.0,0.0,0.3,0.13561815379322778,0.15999061934187336,0.03467646890648937
may i present miss carlton miss kennedy,4035.28,4.96,4037.76,-0.296,0.0,0.4,0.13536273818248298,0.16158251212682273,0.033771343375771604
miss carlton ms kennedy mr miller how do,4037.68,4.96,4040.16,-0.1531,0.0,0.3,0.1351413322079783,0.1629329503012092,0.03300377946752898
you do me oh no that's mr laurent,4040.24,4.799,4042.6395,-0.296,0.0,0.3,0.13491012172780836,0.16431421731676996,0.032219067474311594
awfully pleased to know you awfully but,4042.64,4.64,4044.96,0.2724,-0.25,0.4,0.13469140491095868,0.16559385657815476,0.031492530836588796
i have seen you somewhere before i have,4045.039,3.921,4046.9995,0.0,0.0,0.3,0.1344972666649838,0.16670792667004133,0.030860422752029958
never been there before,4047.28,5.279,4049.9195,0.0,0.0,0.2,0.1342161319329196,0.16828535338831932,0.02996622974910823
at the uh golf tournament dance at santa,4048.96,6.56,4052.24,0.0,0.0,0.2,0.13398997947080657,0.16952385272961107,0.029264959053312164
barbara santa barbara you are right it,4052.559,5.201,4055.1595,0.0,0.2857142857142857,0.7,0.13370191503076567,0.17106270185890113,0.028394777937926944
was santa barbara it could not have been,4055.52,3.839,4057.4395,0.0,0.0,-0.7,0.13347414556457046,0.17224920060873236,0.02772485122843388
santa barbara,4057.76,3.279,4059.3995,0.0,0.0,0.7,0.1332763347208026,0.17325827882665476,0.027155885427034024
well who are you,4059.359,4.72,4061.719,0.2732,0.0,0.2,0.13303979453115006,0.17443922312861654,0.026491036096237656
who am i where are you from where am i,4061.039,4.08,4063.079,0.0,0.0,0.2,0.13289984884228728,0.17512489809593892,0.02610556797607786
from miami to london from london to,4066.16,9.45,4070.885,0.0,0.0,0.3,0.13207806740160422,0.17896134695960922,0.023957769017653185
boston i'm known as the gay continental,4069.839,7.841,4073.7595,0.0,0.4166666666666667,0.5,0.1317672298942147,0.18033039533745326,0.023195690811660417
continent continent continental,4077.68,7.6,4081.48,0.0,0.0,0.2,0.13090935699029096,0.18388631601073205,0.021230079378692795
and i got this wake white accidental,4081.52,7.2,4085.12,-0.0772,0.0,0.2,0.13049283302226536,0.1854997375026799,0.020346131473621683
all my people have riches and velveteen,4085.28,6.24,4088.4,0.5267,0.0,0.7,0.13011064107433692,0.18691791302828117,0.01957406195073813
bridges and white tie and tails and top,4088.72,4.079,4090.7595,0.2023,0.25,0.4,0.12983159419819718,0.18791678788429414,0.019033364049340782
and top hats and top hats and top hats,4092.799,3.761,4094.6795,0.5267,0.5,0.4,0.12936021320957283,0.18953613824875484,0.018162943371826192
and they breakfast in bed with their,4096.56,4.32,4098.72,0.0,0.0,0.7,0.12886393230728574,0.19115176206220022,0.017303164355573317
having cocktails and tea around for,4103.839,9.121,4108.3995,0.0,0.0,0.4,0.1276303411121172,0.19479390257510812,0.015404726277523229
wee bit oldies i keep drinking as long,4108.159,6.721,4111.519499999999,0.0,-0.05,0.4,0.1272187869524717,0.19589711775605995,0.014843261819379266
