text,start,duration,time_midpoint
supposedly will not let himself be,4078.38,3.36,4080.06
captured until he has killed one of my,4080.18,2.46,4081.41
if a white man kills an Indian on your,4082.64,5.58,4085.43
territory we will hang him,4084.74,5.52,4087.5
that will be something for Cochise to,4088.22,4.16,4090.2999999999997
you will go now,4099.259,4.881,4101.6995
I will bring you our decision,4100.819,3.321,4102.4795
I trust none of it four days ago we were,4112.04,4.199,4114.1395
given our territory on a piece of paper,4114.679,4.5,4116.929
today we cannot go into Mexico the,4116.239,5.1,4118.789
American General says no,4119.179,5.341,4121.8495
already our territory is smaller where,4121.339,5.641,4124.1595
will we get corn blankets horses if not,4124.52,4.08,4126.56
by taking them from the Mexican as we,4126.98,3.719,4128.839499999999
always have the American government will,4128.6,4.199,4130.699500000001
give us cattle we will raise them and,4130.699,4.56,4132.978999999999
trade them for our needs the answer of a,4132.799,4.581,4135.0895
I am not afraid I speak from my heart,4140.48,6.379,4143.6695
you you speak well speak more,4142.699,4.16,4144.7789999999995
it is not the Apache way to be,4147.14,4.079,4149.1795
grandmothers to cattle Cochise has lost,4148.88,3.959,4150.8595000000005
his taste for battle and so he is ready,4151.219,2.701,4152.5695
to surrender,4152.839,3.661,4154.6695
he throws away our victories it is not,4153.92,4.68,4156.26
this false peace we need but I Know,4156.5,4.46,4158.73
no I say this,4169.1,4.44,4171.320000000001
the Americans keep cattle but they are,4171.44,5.04,4173.96
not soft or weak,4173.54,4.86,4175.97
why shouldn't the Apache be able to,4176.48,3.6,4178.28
learn new ways,4178.4,3.839,4180.3195
it is not easy to change but sometimes,4180.08,4.8,4182.48
it is required,4182.239,5.58,4185.0289999999995
Americans are growing stronger,4184.88,6.0,4187.88
well we are growing weaker,4187.819,6.301,4190.9695
if a big wind comes a tree must Bend,4190.88,6.98,4194.37
or be lifted out by its roots,4194.12,3.74,4195.99
I will make a test of it for three moons,4213.739,4.161,4215.8195
I break the arrow,4221.659,5.721,4224.519499999999
I will try the way of peace,4223.64,3.74,4225.51
we'll give my word to the American,4230.6,3.66,4232.43
General tonight,4231.92,5.759,4234.7995
those who stay with me must keep my word,4234.26,5.399,4236.9595
let all others walk away,4237.679,5.181,4240.2695
they are no longer my brothers,4239.659,3.201,4241.259499999999
More Walk Away than stay,4244.699,7.261,4248.3295
and I will no longer be your chief,4248.36,6.56,4251.639999999999
I walk away,4251.96,2.96,4253.44
I walk away,4260.719,5.281,4263.3595000000005
I walk away,4263.239,5.841,4266.1595
I walk away,4266.0,3.08,4267.54
I walk away,4270.62,5.78,4273.51
I walk away,4273.38,3.02,4274.89
who else comes,4283.28,3.26,4284.91
who else comes,4286.82,3.32,4288.48
take your women your children,4301.76,5.28,4304.400000000001
your horses your weapons,4304.4,4.86,4306.83
leave our territory,4307.04,5.159,4309.6195
I lead you my name also,4309.26,6.12,4312.320000000001
now I am ashamed to be a cheerokawa,4312.199,5.161,4314.7795
I will take the name Mexican enemies,4315.38,4.02,4317.39
they've given me the whites will learn,4317.36,4.56,4319.639999999999
it and you will earn it,4319.4,7.04,4322.92
from now on I am Geronimo,4321.92,4.52,4324.18
if Geronimo or his followers come to,4327.32,5.04,4329.84
this territory again,4329.9,5.839,4332.8195
let them come with weapons,4332.36,3.379,4334.0495
I'm worried they're taking a long time,4337.159,3.54,4338.929
I'm worried too,4340.699,4.741,4343.0695
boy this is delicious what is it,4342.679,5.52,4345.439
Pony your honor Journal,4345.44,6.12,4348.5
Pony what kind of me said,4348.199,7.761,4352.0795
a pony is a small horse General,4351.56,4.4,4353.76
we will try this piece,4370.76,4.32,4372.92
but there must be a waiting time but,4372.86,5.22,4375.469999999999
time for testing three moons why is it,4375.08,5.099,4377.6295
needed the white man has not shown in,4378.08,4.56,4380.36
the past that he will keep a peace,4380.179,5.851,4383.1045
three-month Armistice it's a good idea,4382.64,11.099,4388.1895
the first stone,4393.739,3.381,4395.429499999999
for every day without War there will be,4399.08,2.82,4400.49
three moons have passed the pile will be,4401.9,2.819,4403.309499999999
and we will place a white flag on it and,4404.719,5.221,4407.3295
there will be peace my heart is glad,4407.0,4.44,4409.22
I am not yet glad,4411.44,4.62,4413.75
to talk a piece is not hard,4413.84,5.06,4416.37
to live it is very hard,4416.06,7.34,4419.7300000000005
I will wait three moons to be glad,4418.9,4.5,4421.15
not everyone was happy about the Treaty,4423.64,4.36,4425.820000000001
there were those who still thought,4426.199,4.621,4428.509499999999
Cochise was a liar and a murderer,4428.0,4.62,4430.31
another could never be peace until he,4430.82,4.02,4432.83
was dead but the 90 days of the,4432.62,3.84,4434.54
Armistice began,4434.84,3.78,4436.7300000000005
I saw things unheard of things that,4436.46,3.98,4438.45
never happened before in the southwest,4438.62,4.74,4440.99
near Ford Grand a Cavalry Patrol past,4440.44,4.6,4442.74
some Apaches,4443.36,3.66,4445.19
they didn't talk they didn't pretend,4445.04,4.5,4447.29
they'd become friends overnight but they,4447.02,4.94,4449.490000000001
didn't shoot,4449.54,2.42,4450.75
two days later the first Butterfield,4455.9,4.319,4458.059499999999
Stage in five years left Tucson,4457.46,4.62,4459.77
I rode with it on my way back to the,4460.219,2.701,4461.5695
stronghold,4462.08,27.84,4476.0
time to stretch Gents,4489.92,8.47,4494.155
you can believe I thought I can ride,4500.06,2.28,4501.200000000001
through this country without having his,4501.199,3.841,4503.1195
liver turn white yeah Paula could even,4502.34,4.26,4504.47
think about settling down getting,4505.04,3.86,4506.97
hey cover take cover,4513.64,4.8,4516.04
last you Jeffers you're not murdering,4522.28,4.72,4524.639999999999
coach she's both we'll be slamming shut,4524.96,4.219,4527.0695
now listen to me,4532.36,3.819,4534.269499999999
now this isn't Cochise and his man it's,4534.44,3.96,4536.419999999999
a battle of renegade Indians there are,4536.179,3.54,4537.9490000000005
very few of them or they've been rushing,4538.4,2.819,4539.809499999999
they're very badly armed too what they,4541.219,5.181,4543.8095
want is our guns,4543.56,2.84,4544.9800000000005
hell they got us pinned down here so we,4546.739,2.881,4548.179499999999
can't get across they're waiting for a,4548.42,3.18,4550.01
night so why don't we do wait for him to,4549.62,4.02,4551.63
push us when it's dark I keep your mouth,4551.6,3.18,4553.1900000000005
shut will you,4553.64,2.7,4554.990000000001
who's a good shot,4554.78,4.82,4557.19
I'm not bad there,4556.34,3.26,4557.97
all right now when I yell Maury you and,4560.36,3.54,4562.13
this fella you start firing on the,4562.699,2.52,4563.959
while you're reloading one again you,4565.219,3.48,4566.959
call the bank keep it up and I make it,4567.14,3.18,4568.7300000000005
Upstream what are you gonna do set up a,4568.699,4.941,4571.1695
smoke signal all right start shooting,4570.32,3.32,4571.98
how many rounds you got left two,4620.659,6.241,4623.7795
why those signals are Jeffers did this a,4623.84,7.04,4627.360000000001
lot of good a lot of good,4626.9,3.98,4628.889999999999
and I live to see,4691.94,3.84,4693.86
suppose you remember to talk about it,4694.159,4.641,4696.4794999999995
when you get back to Tucson,4695.78,3.02,4697.29
I think it goes well there are many good,4705.92,5.7,4708.77
signals it has gone well for 12 days I,4708.32,5.52,4711.08
still wait to be glad,4711.62,4.079,4713.6595
now you will forget about peace and War,4713.84,4.62,4716.150000000001
now you will think only of your bride,4715.699,4.621,4718.009499999999
is the ceremony a long one,4718.46,3.0,4719.96
with us the ceremony of Love takes place,4721.46,5.82,4724.37
here the rest is small let the woman who,4723.5,8.06,4727.53
is to marry come here time has come,4727.28,4.28,4729.42
let the man who is to marry take his,4750.699,5.001,4753.1995
place beside her,4753.32,10.519,4758.5795
your left hand,4768.219,5.12,4770.779
your right hand,4773.36,2.96,4774.839999999999
now you will kneel down upon the Earth,4792.52,8.1,4796.570000000001
now your blood mixes now for you there,4800.62,6.52,4803.88
is no rain for one is shelter to the,4804.44,3.9,4806.389999999999
now for you there is no cold,4808.34,6.12,4811.400000000001
for one is warmth to the other,4811.159,6.06,4814.188999999999
now there is no loneliness,4814.46,4.86,4816.89
now forever,4817.219,5.601,4820.0195
there is no loneliness,4819.32,3.5,4821.07
there are two bodies but now there is,4823.42,5.799,4826.3195000000005
but one blood in both of them,4826.34,6.72,4829.7
go now Ride the White Horses to your,4829.219,5.371,4831.9045
secret place,4833.06,33.96,4850.04
look the evening is full and happy for,4867.02,5.159,4869.5995
we will listen to the sound of the,4872.179,3.961,4874.1595
broken through the night,4873.98,5.54,4876.75
and listen to the Bells,4876.14,3.38,4877.83
it's as though they are singing in my,4879.98,2.95,4881.455
sixteen stones,4901.04,5.119,4903.5995
my white brother told me of the attack,4908.48,3.96,4910.459999999999
on the passenger wagon it was Geronimo,4910.159,4.5,4912.409
we Trail him two days but he crossed,4912.44,4.64,4914.759999999999
into Mexico,4914.659,2.421,4915.8695
you did not follow we wanted to but we,4918.62,6.3,4921.7699999999995
did not good,4922.4,4.56,4924.679999999999
from now on we will protect all whites,4924.92,4.799,4927.3195000000005
leaving Tucson and Fort Lowry also we,4926.96,5.52,4929.72
will guard Apache Pass,4929.719,4.861,4932.1495
this peace does not hold let it be the,4932.48,4.5,4934.73
whites who break it up must not be,4934.58,3.84,4936.5
not even bad Indians,4938.42,18.98,4947.91
you are asleep,4957.4,3.48,4959.139999999999
quiet because I'm so happy,4961.88,4.319,4964.0395
I'm afraid if I over my mouth I happen,4964.04,3.42,4965.75
rush out in a funny noise like,4967.46,11.219,4973.0695
the word that was made by Adam when he,4978.679,6.421,4981.8895
opened his eyes and saw Eve who are they,4980.719,6.421,4983.9295
don't you know,4985.1,5.639,4987.9195
they can I know so little,4990.739,3.621,4992.549499999999
when you grow tired of me and go back to,5001.36,4.26,5003.49
your people wow that is a bad thought,5003.58,4.2,5005.68
never think it again you are my people,5007.78,5.7,5010.63
will you tell me that,5011.08,4.74,5013.45
each day of our life together I'll tell,5013.48,3.6,5015.28
I'll always remember the moments of,5017.08,3.48,5018.82
these days,5019.06,4.22,5021.17
we will remember,5020.56,2.72,5021.92
quiet of the nights we will talk of them,5024.159,5.241,5026.7795
in time to come we will see our children,5029.56,5.84,5032.4800000000005
ride white horses Maybe,5031.9,3.5,5033.65
I can do better myself never mind by the,5073.199,7.261,5076.8295
time he's a grown man he will know how,5076.9,3.56,5078.679999999999
what is it at Sunrise I bond this one up,5089.8,5.879,5092.739500000001
the canyon he had this I know this boy,5092.679,4.621,5094.9895
hello Bob you're Ben Slade's boy aren't,5097.3,4.68,5099.64
you yeah Captain Jeffords I've been,5099.28,4.919,5101.7395
praying you'd be up here oh my how I've,5101.98,4.259,5104.1095
been praying ah and I don't get flushing,5104.199,3.721,5106.059499999999
nobody's gonna hurt you what happened,5106.239,4.44,5108.459
you lose your way not exactly,5107.92,4.2,5110.02
you're the one who said these Apaches,5110.679,2.941,5112.1495
one at peace,5112.12,3.0,5113.62
I don't call it peaceful when they go,5113.62,3.539,5115.3895
right on stealing,5115.12,4.86,5117.55
what got stolen,5117.159,5.52,5119.919
two young Colts of mine beauties,5119.98,5.34,5122.65
swipe night before last by Apaches,5122.679,4.741,5125.0495
attract them all day,5125.32,4.56,5127.599999999999
followed their tracks up the canyon I,5127.42,5.58,5130.21
ended up out there at dark last night,5129.88,4.92,5132.34
and that red skin jumped me in the,5133.0,4.32,5135.16
morning none of my people took them,5134.8,4.56,5137.08
The Boy Who Lies,5137.32,4.2,5139.42
I know this boy's father he's one of the,5141.52,4.32,5143.68
worst haters of the Apaches now if we,5144.04,3.42,5145.75
can show that he's wrong it'll be a good,5145.84,3.78,5147.7300000000005
thing people will hear about it,5147.46,3.719,5149.3195
maybe you still have some men like,5149.62,2.94,5151.09
they talk your way with their tongues,5152.56,4.52,5154.820000000001
but not with their hearts,5154.12,2.96,5155.599999999999
you speak wisely,5157.239,4.861,5159.6695
I will see these horse signs,5159.159,4.861,5161.5895
all right Bob Wall Mosey Down take a,5162.1,4.039,5164.119500000001
you called the boy Bo is it his name oh,5210.46,4.44,5212.68
just to be friendly here they are,5213.04,4.099,5215.0895
shoot and my boy gets out of the way,5218.92,4.4,5221.12
running Century I run,5245.52,4.08,5247.56
the fake one is called cheese somebody,5257.44,3.66,5259.2699999999995
give me guns watch out son you stay,5259.6,4.039,5261.619500000001
clear in this,5261.1,2.539,5262.369500000001
well what are you standing there for,5313.719,3.92,5315.679
you on Siri,5327.28,9.51,5332.035
are you bad hurt,5379.9,3.02,5381.41
there is one who still lives,5391.679,6.581,5394.9695
give me a knife and bring him to me it,5395.219,5.861,5398.1495
will not be done bring them to me no it,5398.26,4.879,5400.699500000001
will not be done,5401.08,5.0,5403.58
there's some things a man cannot bear,5403.139,6.761,5406.5195
you hear me this piece is a lie they,5406.08,5.98,5409.07
don't want peace it is not a lie and I,5409.9,4.259,5412.0295
will not let you make it a lie,5412.06,4.2,5414.160000000001
if you're a child that you thought peace,5414.159,3.301,5415.809499999999
would come easy,5416.26,3.6,5418.06
you who taught me so well,5417.46,4.5,5419.71
is it my brother who asks me to spit on,5419.86,6.08,5422.9
my word why do you speak to me,5421.96,3.98,5423.95
speak to her,5427.96,2.9,5429.41
when she hears Island here,5432.04,5.22,5434.65
you will hear me now,5435.04,3.84,5436.96
your bath is,5437.26,4.32,5439.42
this was not done by the military,5438.88,4.56,5441.16
Geronimo broke the piece no less than,5441.58,3.54,5443.35
these whites,5443.44,4.08,5445.48
as I bear the murder of my people so you,5445.12,4.92,5447.58
will bear the murder of your wife,5447.52,5.4,5450.22
I am Cochise I do not betray my people,5450.04,4.32,5452.2
or their children,5452.92,3.54,5454.6900000000005
no one on my territory will open War,5454.36,4.2,5456.46
not even you,5458.56,10.71,5463.915
I have given my permission they wanted,5481.08,4.24,5483.2
to see you,5483.82,3.98,5485.8099999999995
we've come to pay our respects Tom,5488.139,6.06,5491.169
I can help we've rounded up every man,5491.62,5.76,5494.5
that had anything to do with the ambush,5494.199,4.98,5496.688999999999
they're going to pay the full penalty,5497.38,4.319,5499.5395
for what they've done,5499.179,5.52,5501.939
nothing can compensate you but the,5505.06,3.599,5506.8595000000005
terrible thing that's happened,5506.92,3.36,5508.6
but your friends here are trying to tell,5508.659,3.06,5510.188999999999
you that your very loss has brought our,5510.28,3.6,5512.08
people together in the will to peace,5511.719,4.5,5513.969
without that will treaties are worth,5513.88,5.0,5516.38
little or nothing,5516.219,2.661,5517.5495
his words meant very little to me then,5520.96,5.4,5523.66
But as time passed I came to know that,5523.0,6.12,5526.06
the death of son Sierra put a seal on,5526.36,6.299,5529.5095
the peace and from that day on wherever,5529.12,6.48,5532.36
I went in the cities among the Apaches,5532.659,6.961,5536.139499999999
in the mountains I always remembered,5535.6,7.52,5539.360000000001
my wife was with me,5539.62,3.5,5541.37
