text,start,duration,time_midpoint
I got a story to tell.,57.425,1.25,58.05
A yarn about cow country and cow punchers.,59.383,2.292,60.529
Cattle and men.,62.133,1.042,62.654
"I was working for the Strobie Ranch
learning my trade.",63.966,2.709,65.3205
"Trade of worn leather,
saddle blisters and branding irons.",67.175,2.958,68.654
"Trade with some song,
some fun and some luck.",71.008,2.5,72.258
"It was as good a job
as a man could ask for.",74.841,2.167,75.9245
"Lonely, sometimes cold.",78.008,1.583,78.7995
"So much distance,
you thought you'd never get back,",79.925,2.5,81.175
"but for me, a young kid,
it was a fine time.",83.633,2.167,84.7165
Memories are mostly good.,86.55,1.333,87.2165
"You're up there on top of the world,
where the air was clear and thin.",89.008,3.583,90.7995
The only sound was the wind in the pines.,93.341,2.375,94.5285
We were in the business of growing beef.,96.925,2.0,97.925
"Always moving the cattle
and looking for new feed.",99.133,2.5,100.383
They were those new bald-faced heifers.,103.3,2.166,104.383
"Not like the longhorns,
wild and spooky but friendly critters.",105.55,4.333,107.7165
Gentle as a dog.,110.466,1.209,111.0705
Seasons melted away peacefully,112.966,2.125,114.0285
"from spring to summer, fall, then winter.",115.175,3.708,117.029
"Cows had to look out
for themselves in the snow.",119.8,2.375,120.9875
The winter drift.,122.842,1.0,123.342
"Soon as a man on horseback
could get around,",125.382,2.125,126.4445
they'd go out and locate the cattle.,127.592,1.833,128.5085
Spot them for the spring roundup.,130.092,1.665,130.92450000000002
"They'd come back
from the winter drift cold and worn out.",133.092,2.833,134.50850000000003
Our foreman was Owen Daybright.,138.05,1.582,138.841
He knew what he was doing.,140.132,1.335,140.7995
We all liked him.,141.925,1.0,142.425
There was his foster brother Lee Strobie.,144.507,2.085,145.5495
Their father owned the ranch.,147.882,1.46,148.612
"The night they got back,
the trouble began.",149.925,2.125,150.9875
"Well, look what's turned up.",152.342,1.5,153.092
"Hiya, Cal.",153.967,1.0,154.467
People still drink whiskey.,155.175,1.375,155.8625
"-Hiya, Lee.
-Beat down to my shoes.",156.842,2.083,157.88350000000003
"That's what comes from working for someone
you've known too long, Lee.",159.3,3.457,161.0285
Seen my wife this winter?,167.717,1.125,168.2795
"Jen comes into town
a couple of times with your old man.",168.925,2.75,170.3
How'd Arch look?,171.925,1.0,172.425
"Oh, just fair, I'd say.
Cold weather always seems to bother him.",173.007,3.25,174.632
How'd Jen look?,176.592,1.0,177.092
"The way to find that out
is go home and see for yourself.",178.132,2.835,179.5495
"-Yes.
-Can I borrow your razor, Cal?",181.05,1.707,181.9035
"-I don't want to scare her.
-In the back.",182.842,1.915,183.79950000000002
"-Keeping you busy, Doc?
-A night doesn't go by…",185.092,1.75,185.967
They've been trying to get him all-day,186.925,1.542,187.696
"for that girl who used to work
at the Eaton house.",188.55,2.457,189.7785
I wouldn't know her name.,193.925,1.292,194.571
"What's her trouble, Doc?",198.342,1.208,198.94600000000003
"Oh, small variety.",199.842,1.665,200.67450000000002
About that big.,202.217,1.04,202.73700000000002
"Arrived a couple of hours ago,
they tell me.",203.757,2.168,204.841
"-You wouldn't go?
-That's right.",208.217,1.958,209.19600000000003
"I don't take calls like this
until I hear from the father,",210.757,2.918,212.216
and that isn't likely.,214.717,1.125,215.2795
"There's a rifle on you, cowboy.",227.967,1.583,228.75850000000003
"Get down and walk over here
so I can see who you are.",231.507,2.418,232.716
Get down now!,235.507,1.0,236.007
"-Owen, is that you?
-Yes.",242.882,3.125,244.4445
Put that gun down.,247.55,1.0,248.05
He's a friend.,248.882,1.0,249.382
"-What are you doing here?
-Helping.",263.216,2.0,264.216
Nobody else would come.,266.258,1.167,266.8415
So I heard.,267.841,1.0,268.341
How's Lee?,270.05,1.0,270.55
He wants to see you.,272.466,1.0,272.966
I'll be home as soon as she's asleep.,274.05,1.875,274.9875
Her brother Dick Fasken from out of town.,281.425,2.083,282.4665
He spent the day looking for the man.,284.633,1.875,285.5705
Is Lily all right?,288.05,1.0,288.55
"You've got company, Lily.",295.3,1.25,295.925
"-Hello, Owen.
-Lily.",304.091,1.209,304.6955
And beautiful.,313.966,1.0,314.466
"Good color, too.",316.258,1.0,316.758
The doctor wouldn't come.,323.175,1.25,323.8
Jen came instead.,325.966,1.084,326.508
"Don't even think about it, Lily.",327.8,1.625,328.6125
"I'm really pretty lucky, Owen.",331.591,1.625,332.4035
"I couldn't face up
going back to the restaurant to work.",335.05,2.75,336.425
"Mrs. Burke offered us work
at her place when I'm ready for it.",339.341,3.209,340.9455
"We're grateful, too.",344.591,1.0,345.091
"It sounds queer to say it here and now,
but he'll have a good life, Owen.",346.758,4.958,349.23699999999997
"I'm sure he will, Lily.",354.175,1.166,354.75800000000004
I'm sure he will.,357.925,1.0,358.425
"You've seen me before, Owen.",394.55,1.416,395.25800000000004
There's been a change.,396.341,1.125,396.9035
"Somebody washed your face
and got you a new dress.",397.675,2.25,398.8
"Arch, and a tub in my own room.",400.008,2.458,401.23699999999997
I bathe every day now.,403.05,1.125,403.6125
It's an improvement.,405.425,1.0,405.925
How was the winter?,408.466,1.0,408.966
"Well, we stayed alive,
and we kept the cattle alive.",410.883,2.583,412.17449999999997
It was snowing at the ranch.,413.8,1.416,414.50800000000004
"I didn't see our nearest neighbor
in nearly five weeks.",415.508,2.75,416.883
"We missed you, Owen.",420.3,1.0,420.8
I brought Lily some grub.,428.05,1.25,428.675
Who was it?,433.466,1.0,433.966
"Goodnight, Jen.",437.008,1.0,437.508
Hold it a minute.,443.55,1.0,444.05
"-Do you live in these parts?
-Around here.",450.091,2.0,451.091
Who's the father?,453.383,1.0,453.883
That'd be Lily's business.,456.175,1.375,456.8625
"-I'll find out.
-Sure.",457.8,1.25,458.425
"-I'll find out if it takes me a lifetime.
-Fine.",459.758,2.25,460.883
It's a nice country to live in.,462.633,1.583,463.42449999999997
Who was that?,489.341,1.0,489.841
Owen Daybright.,492.133,1.0,492.633
"-Your husband's foster brother, isn't he?
-That's right.",494.716,2.75,496.091
"He brought this food, too.",503.383,1.333,504.04949999999997
You're wrong.,508.216,1.0,508.716
"He's good, and there's no one else
around here like him.",509.757,3.167,511.3405
"Yes, he keeps his ace as a kicker,
and he draws to it every time.",521.966,3.417,523.6745
"-Three times.
-Mr. Kicker.",525.55,2.083,526.5915
"It's a game of chance, boys.",528.425,1.416,529.1329999999999
We'll play again sometime.,534.591,1.334,535.258
"-I ran your errand.
-Thanks, Owen.",544.425,2.166,545.5079999999999
It's paid for like you pay for a coat.,547.716,2.459,548.9455
I appreciate it.,550.675,1.0,551.175
It isn't the first time you saved my hide.,552.258,2.125,553.3205
"Why don't you grow up, boy?",555.8,1.375,556.4875
"Look, it happens.",557.966,1.459,558.6955
I sleep well.,559.966,1.0,560.466
Your wife was there.,563.55,1.0,564.05
Does she have any idea?,565.216,1.167,565.7995
It happened before I met Jen.,570.633,1.5,571.383
"Even so, she wouldn't understand it,
you know what she's like.",572.883,2.708,574.2370000000001
Why should I know what she's like?,576.008,1.708,576.8620000000001
"That's right, you don't.",578.175,1.208,578.779
She's what all the others weren't.,580.8,1.708,581.654
She's everything I ever wanted for myself.,583.508,2.167,584.5915
"It's been a long time,
let's get back to the ranch.",587.925,2.041,588.9454999999999
"Stop right there, Daybright.",591.133,1.417,591.8415
"You, move away.",592.841,1.0,593.341
You brought Lily $500.,601.008,1.375,601.6955
That's right.,606.8,1.0,607.3
Doesn't she need it?,608.466,1.0,608.966
Not that kind.,610.133,1.0,610.633
"That wasn't grub money,
it was get-out-of-town money.",611.633,2.542,612.904
I'll ask you one time.,615.55,1.125,616.1125
Was it yours?,617.8,1.0,618.3
"Point that gun to the floor, Son,
and turn around.",619.216,2.459,620.4455
They'll be other times.,630.55,1.166,631.1329999999999
"You're a conclusion jumper,
and I don't like them.",632.05,2.166,633.1329999999999
"-Quit it, Owen.
-I'll handle this myself, Con.",634.3,2.166,635.3829999999999
Not as long as I'm the sheriff.,636.55,1.583,637.3415
"All right, Con.",639.716,1.0,640.216
You've scared me twice tonight.,644.3,1.583,645.0915
"Next time you point a gun at me, shoot it.",646.05,2.125,647.1125
"Well, welcome home, boys.",692.425,2.125,693.4875
"-How are you, Arch?
-You look fit, Son.",694.633,1.833,695.5495000000001
"-How are you, Owen?
-Good.",696.591,1.209,697.1955
"-How's the leg?
-It's got the misery.",697.883,1.625,698.6955
Same as every winter for 20 years.,699.591,1.792,700.487
"-Evening, boys.
-Hello, Mr. Willoughby.",701.508,2.0,702.508
"I thought you might want
some hot coffee, Arch.",703.841,1.959,704.8205
"Well, thank you, Mr. Willoughby.",705.883,1.667,706.7165
Same old dishwater?,708.258,1.042,708.779
"-You don't want any, huh?
-Oh, no, I was just kidding.",711.216,2.584,712.508
"-Then watch your language.
-How's the bad stomach?",714.633,2.375,715.8205
"Owen, some days I doubt
if I'll make it to sundown.",717.716,3.917,719.6745
"Why don't you stop
eating your own cooking?",721.716,2.125,722.7785
"Oh, I'm stuck here, I can't help it.",724.008,2.375,725.1955
"Arch, these cigars aren't from Pittsburgh.",732.716,2.125,733.7785
Kansas City.,734.966,1.0,735.466
The place sure is going downhill fast.,738.758,2.25,739.883
How'd it go?,743.8,1.0,744.3
Ask the foreman.,745.925,1.0,746.425
I just took orders.,747.3,1.083,747.8415
You got a wife waiting for you.,750.633,1.583,751.4245000000001
I hadn't forgotten.,752.716,1.0,753.216
I'll look in on her.,755.8,1.0,756.3
"-Goodnight.
-Goodnight, Son.",758.591,1.375,759.2785
"Goodnight, Lee.",760.05,1.0,760.55
The boy looks trim.,762.633,1.042,763.154
Nobody could've worked harder this winter.,765.508,2.0,766.508
He's got a lot to make up for.,767.675,1.5,768.425
He'll come around.,770.716,1.0,771.216
Maybe Jen has something to do with it.,772.216,1.917,773.1745
"Anyway, he can handle it alone now.",775.258,1.75,776.133
"Well,
It sounds like you're giving notice, Owen.",777.425,3.041,778.9454999999999
Lee's married now.,782.3,1.0,782.8
Jen's a fine daughter for you.,784.05,1.5,784.8
I'm just crowding the place.,786.091,1.417,786.7995
"-Oh, if you're not comfortable here…
-I'm not forgetting, Arch.",787.591,3.084,789.133
"You've done all you could
to make me belong.",790.925,1.666,791.7579999999999
"When you picked me up,
I was just a stray orphan,",792.675,3.208,794.279
"foul-mouthed and flea-bitten,
15 years ago.",796.091,2.167,797.1745
"It's been a long time, a good time.",799.008,1.75,799.883
Now It's time for me to go.,801.8,1.375,802.4875
You really mean it.,804.591,1.0,805.091
"Well, I want to push on
and try my own wings.",806.55,2.208,807.654
How do I say this?,812.633,1.458,813.3620000000001
"When I took you, it was for Lee.",816.05,1.958,817.029
"I couldn't get around outside
and raise my own boy,",818.716,2.667,820.0495
so I picked you to do it for me.,821.466,1.667,822.2995
"What I didn't know then
was that I needed you, too.",823.3,3.541,825.0704999999999
I need you now.,828.508,1.0,829.008
"All right, Arch.",836.341,1.0,836.841
"I was hinting at you for a raise, anyhow.",840.925,2.083,841.9665
"-Goodnight.
-Goodnight.",845.841,1.125,846.4035
"Jen, will you hurry up and come on out?",849.55,1.958,850.529
"I don't know why, all of a sudden,
you can't get dressed in front of me.",854.258,3.125,855.8205
"I'll be two more minutes, Lee.",857.466,1.5,858.216
"On top of all winter, that's a long time.",860.05,2.083,861.0915
I know that better than you.,862.341,2.25,863.466
You mean you've missed me?,867.258,1.333,867.9245000000001
Of course.,869.05,1.041,869.5704999999999
You're beautiful.,883.05,1.0,883.55
"Do you think so, Lee?",884.883,1.083,885.4245000000001
Do you really mean it?,887.216,1.125,887.7785
"The first time I saw you,
you were wearing a pair of split britches.",889.008,3.375,890.6955
You helped me come out of the backcountry.,894.008,2.125,895.0705
You and Arch.,896.425,1.0,896.925
"This is the second Sunday dress
I ever owned, Lee.",899.133,2.75,900.508
"The first one I wore
to my mother's funeral.",902.966,2.167,904.0495
"Then I used it to bury my father,
then I burned it.",905.258,3.167,906.8415
"Now you're a lady of fashion, huh?",910.8,1.791,911.6954999999999
"Well, that's what it says
in Godey's Lady's Book.",915.091,2.792,916.487
"I haven't done
many smart things in my life,",923.008,2.208,924.1120000000001
but marrying you is one of them.,925.758,1.625,926.5705
"We'll be happy, Lee.",928.341,1.042,928.862
"Nothing can stop us, honey.",930.258,1.542,931.029
Check in to the last call!,944.758,1.417,945.4665
Where have you been?,957.966,1.042,958.487
"-Morning, Mr. Willoughby.
-Morning, Owen.",960.633,2.167,961.7165
Nice to see a real man back again.,963.175,1.958,964.154
"Well, thanks, Mr. Willoughby.",965.216,1.459,965.9455
"Good morning, real man.",966.925,1.541,967.6954999999999
"That nasty old noise woke you up,",968.55,1.833,969.4665
"or were you waiting for the sun
to hit your dimpled cheeks?",970.466,2.792,971.862
"You Sunday men
haven't lost any sleep in so long",973.925,2.666,975.2579999999999
you've forgotten what you go to bed for.,976.675,2.0,977.675
Mr. Willoughby's buttering the foreman.,978.758,2.0,979.758
"All right, all right, I slept late.",982.133,2.125,983.1955
"Why is it that when a man's out
on the range alone and eating his cooking,",984.341,2.917,985.7995
he wishes to get up for breakfast?,987.341,1.417,988.0495
"Because when he's home
he lies there and has to figure out",988.841,2.292,989.987
"if it's worth
the bellyache getting up for it.",991.216,2.125,992.2785
"You haven't done the contract
for the South, Esterly.",993.633,2.958,995.1120000000001
"Anytime my cooking gets so bad
that you got to go hungry,",996.675,2.833,998.0915
"Arch will give you time before you know
what gave you the miseries.",999.841,2.75,1001.216
"-That's telling him, Mr. Willoughby.
-No offense, sir.",1002.675,2.666,1004.0079999999999
"-Mr. Willoughby accepts your apology.
-I do.",1005.466,2.542,1006.737
There are no hard feelings.,1008.175,1.291,1008.8204999999999
"-How about another cup of coffee?
-Sure.",1009.55,2.125,1010.6125
"I have to move you, Sheriff.",1013.591,1.459,1014.3205
"-Taking the census again?
-Yes.",1015.55,2.208,1016.654
I like to see who comes and who goes.,1017.925,2.25,1019.05
"Hello, Hub.",1041.8,1.0,1042.3
I got your letter a week ago.,1043.341,1.459,1044.0704999999998
You're an uncle.,1045.341,1.0,1045.841
How's Lily?,1047.841,1.0,1048.341
She's doing all right.,1049.508,1.125,1050.0705
Who's that?,1052.966,1.0,1053.466
"Brothers, aren't you?",1062.925,1.083,1063.4665
I'll kill a man before I leave here.,1064.925,1.833,1065.8415
"Anybody special, or would I do?",1067.258,2.25,1068.383
"I don't know the man yet, but I will,
keep an eye on me.",1069.591,2.417,1070.7994999999999
The name's Fasken.,1072.091,1.0,1072.591
"-Where are the horses?
-Behind the depot.",1074.591,2.209,1075.6954999999998
Fasken boys were looking for Lily.,1095.425,1.708,1096.279
"They heard she'd been taken in
and given a home",1099.341,1.875,1100.2785
"by a widow named Mrs. Burke,
who owned a ranch nearby.",1101.3,3.541,1103.0705
"We're looking for Lily,
we're her brothers.",1116.175,1.833,1117.0915
I didn't know Lily had this much family.,1118.091,2.0,1119.091
She never said a word.,1120.3,1.125,1120.8625
"-Maybe she's ashamed of us.
-Not Lily.",1121.716,2.0,1122.716
She's not that kind.,1123.925,1.041,1124.4455
She's in her room.,1125.508,1.042,1126.029
"-I'll call her.
-Nevermind.",1130.3,1.291,1130.9455
"-Is this the room?
-Yes.",1131.675,1.083,1132.2165
So you sent for him?,1140.508,1.0,1141.008
The reason's over there.,1142.883,1.208,1143.487
I didn't ask for you to come.,1150.716,1.459,1151.4454999999998
"-I didn't ask for you to come, you hear?
-We're this kind of family.",1153.55,3.333,1155.2165
We don't waste any love on each other.,1157.925,1.916,1158.883
"We've fought amongst ourselves,
we've even shot at each other.",1160.008,2.792,1161.404
We got one tie.,1163.133,1.0,1163.633
We're blood relations.,1164.425,1.291,1165.0705
"Go away, Hub.",1166.05,1.0,1166.55
"Do you want to marry Owen Daybright, Lily?",1171.008,2.125,1172.0705
"I don't want him, and I don't want you.",1174.258,1.958,1175.237
I'll manage myself without any help.,1176.383,1.833,1177.2995
Daybright knows something.,1196.466,1.334,1197.1329999999998
"If he can't talk when I'm done with him,
he'll write the name with his feet.",1197.883,3.083,1199.4245
"Scratch him, boy.",1235.133,1.0,1235.633
"Hey, Mr. Kicker, you dropped something.",1246.383,2.125,1247.4455
What he needs now is that fourth ace.,1249.216,2.334,1250.3829999999998
That's no way to break a horse.,1265.633,1.583,1266.4245
"Get on him
and ride him like you were taught.",1267.3,2.083,1268.3415
"Ride him, boy, ride him!",1290.341,1.375,1291.0285
There you go.,1300.133,1.0,1300.633
Did you have to use that whip?,1308.05,1.541,1308.8205
Owen's touchy.,1310.341,1.0,1310.841
Stop being such a farmer.,1313.3,1.416,1314.008
A good whipping never hurts any filly.,1315.091,1.959,1316.0704999999998
"-All those authorizations came in?
-All but Mrs. Burke's.",1330.133,2.708,1331.487
I'll ride over.,1332.925,1.0,1333.425
"Cut me a horse, Hewie,
and one for yourself.",1336.3,2.083,1337.3415
"-Hi, Lily.
-Hello, Owen.",1359.758,1.25,1360.383
"Hello, Hewie.",1362.716,1.0,1363.216
"Good day, ma'am.",1364.841,1.0,1365.341
How do you feel?,1368.8,1.0,1369.3
I feel good.,1371.175,1.0,1371.675
"-Why?
-I just wondered.",1372.8,1.875,1373.7375
That's mighty good to hear.,1379.3,1.375,1379.9875
"Well, thank you.",1382.05,1.0,1382.55
"Well, I just asked
because you look real fine, Lily.",1386.008,3.792,1387.904
Just fine.,1396.841,1.0,1397.341
"-Had your breakfast?
-Mr. Willoughby's best.",1409.8,2.083,1410.8415
I can outcook him with my two arms broken.,1411.966,2.542,1413.2369999999999
"Business first, then we'll trade recipes.",1415.091,1.917,1416.0494999999999
"Write a note authorizing us
to cut out your cattle at roundup",1417.091,2.459,1418.3204999999998
and bring them home.,1419.633,1.0,1420.133
"I've been wondering
if I was being snubbed.",1420.716,1.709,1421.5704999999998
"The only thing that can snub you
is a mountain.",1422.508,2.333,1423.6745
I'll get paper and a pen.,1425.091,1.459,1425.8204999999998
"Thanks, Owen, but I'm all right again.",1430.175,2.25,1431.3
"You look fine, Lily.",1432.591,1.0,1433.091
"Yes, that's what Hewie says.",1434.05,1.416,1434.758
"I wish I could find the words to thank you
for bringing me the money, but I can't.",1438.258,4.292,1440.404
"Well, don't try.",1442.716,1.0,1443.216
I hate to see you fronting for Lee.,1445.3,1.833,1446.2165
"Well, I'm thinking of Arch.",1449.3,1.875,1450.2375
"You go on standing in front of Lee,
protecting him,",1452.841,2.417,1454.0494999999999
letting his dirt rub off on you.,1455.341,1.625,1456.1535
"I'm thinking of Jen,
and all she's done for me.",1459.383,2.75,1460.758
That's why I can't tell.,1463.508,1.208,1464.112
We'll both keep it a secret.,1466.425,1.416,1467.133
"-Lily, it isn't right…
-Owen.",1469.175,1.333,1469.8415
"I've been afraid of a lot of things
this past winter.",1470.591,2.625,1471.9035
"What people would say about me,
how I'd raise a baby,",1474.008,3.708,1475.862
and how I'd keep us both alive.,1479.425,1.583,1480.2165
"Well, now it's happened,
and I'm not afraid anymore.",1482.466,2.625,1483.7785
"I'm not glad it happened,
I was wrong, and I know that.",1487.091,2.709,1488.4454999999998
I'm just not afraid of living anymore.,1492.925,1.916,1493.883
Is Daybright here?,1499.425,1.0,1499.925
In the house.,1501.883,1.0,1502.383
Start walking to that shed over there.,1508.55,1.916,1509.508
"You won't get hurt
if you don't break for the house.",1511.883,2.333,1513.0495
What is this?,1530.55,1.0,1531.05
"You bought your ticket, you'll see.",1531.675,1.75,1532.55
"Goodbye, ladies,
see you after the roundup.",1539.216,2.125,1540.2785
Daybright.,1551.841,1.0,1552.341
So you sent for big brother.,1555.258,1.458,1555.987
"Why don't I remind myself
to pack a gun when I visit my neighbors?",1560.216,2.709,1561.5704999999998
"-That money was yours, Daybright.
-Oh, it was, huh?",1564.383,2.417,1565.5915
That baby will need a name…,1567.175,1.375,1567.8625
Do you want another helping?,1575.175,1.416,1575.883
"Come on, pull the trigger.",1581.341,2.292,1582.4869999999999
"First, you shoot me,
then Hewie because he saw you.",1584.758,2.5,1586.008
"Then, you'll have to shoot Mrs. Burke
and your sister because they'll see you.",1588.258,3.458,1589.987
"Well, come on, pull the trigger.",1591.925,1.833,1592.8415
"-Quit it, Owen, he'll do it.
-I don't think he's got the guts.",1593.925,3.0,1595.425
"-Put that down.
-That gun down, big brother.",1600.383,2.292,1601.529
"You won't use it,
and I'll break your arm if you keep it!",1602.966,2.959,1604.4454999999998
"Get up, Hub!",1636.591,1.125,1637.1535
"Dick, put that gun down.",1637.966,1.209,1638.5704999999998
"Go ahead, cut down on her,
she's only your sister.",1641.175,2.041,1642.1955
You have to kill somebody.,1643.3,1.333,1643.9665
"-Be careful who you poke in the belly.
-Hewie, that's enough.",1646.466,2.917,1647.9244999999999
"-Whatever you say, Lily.
-All right, Hub, this is still our dance.",1650.55,3.166,1652.133
"Haven't I made enough trouble
for myself and my baby?",1656.175,2.666,1657.508
"You want to add murder, too?",1659.341,1.5,1660.091
"Owen, take them to the sheriff.",1661.8,1.583,1662.5915
"If you need someone
to sign the complaint, I'll do it.",1663.466,2.667,1664.7994999999999
"All right, Lily, you've got the right.",1668.341,1.917,1669.2994999999999
I hear the Lazy W is for sale.,1681.55,2.208,1682.654
"-How much?
-They're asking $35,000 cash for it.",1684.175,3.333,1685.8415
That reminds me you owe me some money.,1687.883,2.458,1689.112
"I generally do, Arch.",1690.966,1.084,1691.5079999999998
"Joe Benson told me yesterday at the bank
that you were overdrawn.",1692.133,3.208,1693.737
"Don't worry,
the old man covered it for you.",1695.675,2.166,1696.758
"Still trying to fill
those inside straights?",1698.425,2.166,1699.508
"-I always forget what you told me.
-Hey, have you been spending our money?",1700.675,3.75,1702.55
You know that's a joint account.,1704.883,1.625,1705.6955
How much did he draw?,1707.175,1.083,1707.7165
He said you drew it in gold.,1710.133,1.417,1710.8415
Makes a nice clink in the pocket at that.,1712.425,2.166,1713.508
"I'll see you later,
I must get ready for work.",1715.55,2.0,1716.55
"Is there some cream there, Jen?",1719.133,1.708,1719.987
Excuse me.,1724.05,1.0,1724.55
"You don't believe
that story about the 500, do you?",1736.133,2.542,1737.404
"No, I don't.",1738.883,1.0,1739.383
"Honey, there are certain things
that you've to understand.",1741.633,2.875,1743.0705
"I don't like Arch knowing
everything that's going on.",1745.383,2.667,1746.7165
"I can understand
your not wanting him to know.",1750.466,2.25,1751.591
That $500 is a lot of money.,1753.341,1.959,1754.3204999999998
"I didn't like taking it either,
but it was for a lady's honor.",1755.883,5.458,1758.612
"Stop it, Lee, stop it.",1761.508,1.125,1762.0705
I know all about you and Lily.,1763.05,1.5,1763.8
"Oh, I know what you're thinking.",1768.383,2.625,1769.6955
"Oh, honey.",1771.425,1.0,1771.925
That $500 was to help Owen out.,1772.966,2.542,1774.2369999999999
"I don't want Arch
or anybody else to know about it.",1776.133,2.5,1777.383
"Now that the fat's in the fire,
I'll have to tell you the truth.",1780.258,3.167,1781.8415
"You see, Owen got in trouble with Lily,",1783.508,3.25,1785.133
and the least I could do to help him was…,1787.966,2.084,1789.0079999999998
You know how much I think of Owen.,1790.341,1.75,1791.216
"The least I could do to help him
was to give him the money.",1792.258,2.708,1793.612
You're a liar.,1795.091,1.0,1795.591
"You're a mean, contemptible liar.",1796.8,1.958,1797.779
You're all alike.,1817.341,1.0,1817.841
"You, Arch, and Lee.",1818.716,1.0,1819.216
"-You could be a little clearer.
-You're all liars.",1819.8,2.333,1820.9665
"Well, I'm through, I'm leaving.",1822.216,1.584,1823.0079999999998
"-Slow down to a walk.
-That $500 you gave Lily.",1824.675,2.875,1826.1125
"-I know where it came from.
-Wait a minute, Jen.",1827.633,1.958,1828.612
Protecting him again.,1829.675,1.083,1830.2165
Fighting with Lily's brothers.,1831.133,1.542,1831.904
"You knew all about her
and Lee from the start.",1832.758,1.917,1833.7165
"It's just a lot of talk,
I'd pay it no mind.",1834.758,2.042,1835.779
"Owen, why can't you be your own man?",1836.883,2.958,1838.362
These misunderstandings happen.,1842.841,1.584,1843.6329999999998
"All married people quarrel
once in a while, I guess.",1845.216,2.584,1846.5079999999998
I hate him.,1848.8,1.0,1849.3
You and I are kind of in the same fix.,1856.841,1.917,1857.7994999999999
Arch is all the family we got.,1859.508,1.5,1860.258
"With him, we belong to something.",1861.633,1.667,1862.4665
"Shouldn't we give him back
a little bit in return?",1864.3,2.458,1865.529
"Owen, what can I do?",1873.341,1.209,1873.9454999999998
What can I do?,1875.258,1.042,1875.779
Stay around for Arch.,1877.008,2.375,1878.1955
"All right,",1883.675,1.0,1884.175
but all I'll do is stay.,1886.216,1.375,1886.9035
"Morning, Mr. Kicker.",1899.55,1.25,1900.175
"Hey, Owen.",1905.466,1.292,1906.1119999999999
What fell on you?,1908.55,1.0,1909.05
"A couple of hard cases,
brothers by the name of Fasken.",1910.008,2.75,1911.383
Two of them?,1915.716,1.0,1916.216
Lily's clan is gathering.,1918.008,1.292,1918.654
Do they know?,1925.966,1.0,1926.466
