text,start,duration,time_midpoint
"That's right, I was forgetting.",3694.8,2.083,3695.8415
I got a half of summer's work laid out.,3700.716,1.959,3701.6955
I'm heading for Texas to restock.,3702.883,1.667,3703.7165
"How will you get your beef from Texas
all the way home to Montana?",3704.966,3.084,3706.508
"Yes, by the time you buy your herd,",3708.133,1.75,3709.008
"Kansas will come up with some new kind
of fever and quarantine you out.",3709.966,3.375,3711.6535
"If you move to New Mexico,
the same thing'll happen.",3713.425,2.583,3714.7165
"I reckon you'll have to stay put in Texas,
and that's no life.",3716.091,3.084,3717.633
"Now, Son, you must've heard of railroads.",3719.258,2.25,3720.383
"I'll just lock my herd up
in airtight boxcars,",3722.133,2.667,3723.4665
"put a bag of that clean Texas air
in each car, and unload in Montana.",3725.008,3.625,3726.8205
My name is Strobie.,3737.633,1.042,3738.154
"-I don't think I got your name.
-Oh, Dave Allard.",3738.758,2.375,3739.9455
"I gathered you're sending your crew
back to Montana with your strays",3741.383,3.167,3742.9665
while you head to Texas to restock.,3744.633,1.542,3745.404
"-That's right.
-I can save you the trouble.",3746.258,2.042,3747.279
"I'll have 3,000 double-wintered steers
for sale at the end of the roundup.",3748.966,3.667,3750.7995
In good shape?,3754.05,1.0,3754.55
"You're picking them up daily,
look at them, they've got our brand.",3755.508,3.25,3757.133
What price?,3759.216,1.0,3759.716
"Fourteen,
laid down to Wet Mountain Meadow.",3760.633,2.583,3761.9244999999996
You just made a deal.,3766.883,1.083,3767.4244999999996
"I'll have to find
the nearest telegraph station.",3768.716,2.375,3769.9035
"It'll take a few days
till I can cover a check for $42,000.",3771.383,3.042,3772.904
That's all right.,3774.508,1.0,3775.008
Here's some hot coffee.,3810.675,1.166,3811.2580000000003
"Well, thanks, Mr. Willoughby.",3812.216,1.584,3813.008
"Why don't I save my money
and buy a nice warm store I can sit in?",3813.966,3.334,3815.633
I've seen the stores.,3817.383,1.167,3817.9665
"-They're drafty.
-Beats washing away.",3818.633,2.167,3819.7165
It sure does.,3820.883,1.0,3821.383
"Come on in out of the weather, friend.",3825.05,1.916,3826.0080000000003
"-What are you, East or West division?
-West.",3827.05,2.333,3828.2165
"-My name's Allard.
-Daybright.",3830.841,1.542,3831.612
"Thanks, I needed this.",3832.716,1.167,3833.2995
"I need a horse, too.",3834.258,1.125,3834.8205
"I wanted to ride on through tonight,
and mine's beat.",3835.508,2.417,3836.7165
"Hewie, get the man a horse.",3838.008,1.375,3838.6955
Where are you headed for?,3842.3,1.25,3842.925
"I left the East division for a few days,
I'm looking for a telegraph.",3843.633,3.417,3845.3415
"Missed it in the rain, huh?",3847.133,1.375,3847.8205
"A man can miss anything in this,
I don't know whether I'm drowned or not.",3848.758,3.625,3850.5705
"There's a telegraph at our meeting place,
the Wet Mountain Meadow.",3853.383,3.083,3854.9244999999996
"Hewie, change the man's saddle
while he finishes his coffee.",3857.466,2.75,3858.841
"Say, is that your brand?",3860.3,1.25,3860.925
That's right.,3864.925,1.0,3865.425
I just bought your herd.,3866.508,1.292,3867.154
"That's why I was looking for a telegraph,
to get my credit in shape by wire.",3868.341,3.459,3870.0705
"You must be mistaken, mister.",3873.341,1.459,3874.0705
Does Strobie own the brand?,3875.55,1.375,3876.2375
"-Yes.
-That's it.",3877.508,1.75,3878.383
"The 3,000 double-wintered steers
delivered at the meeting place.",3879.675,3.166,3881.2580000000003
"Strobie's the owner, isn't he?",3885.508,1.5,3886.258
He can sell them.,3887.55,1.0,3888.05
Is there anything wrong?,3890.05,1.208,3890.654
"Not a thing, friend.",3892.716,1.292,3893.362
"Well, thanks for everything.",3897.508,1.583,3898.2994999999996
"I didn't think
he could plan that far ahead.",3926.3,1.916,3927.2580000000003
"You reckon that's why Lee
made his bid to be a partner?",3928.3,2.333,3929.4665
That's why.,3930.883,1.0,3931.383
"Sell the beef
and get the money to clear out.",3932.05,2.083,3933.0915
What's he running from?,3935.258,1.167,3935.8415
There are people he has to answer to.,3939.466,1.875,3940.4035
"You always stand up for him,
don't you, Owen?",3942.925,2.208,3944.029
"When you're loyal to a man,
you're loyal to everything about him,",3948.341,2.584,3949.633
even his faults.,3951.008,1.0,3951.508
Even his son.,3952.716,1.0,3953.216
It's funny what you just said about Arch.,3957.091,2.084,3958.133
"I've been feeling that way
a long time about somebody else.",3959.508,2.917,3960.9665
About Lily.,3965.633,1.0,3966.133
"Day by day and hour by hour,
the two divisions pushed closer together,",4025.925,3.5,4027.675
so did Owen and Lee for the showdown.,4029.925,2.541,4031.1955000000003
"Only an hour away, Owen.",4037.091,1.292,4037.737
The Eastern Division's over the next hill.,4038.633,2.125,4039.6955
"-Hiya, big fellow.
-How do you do all?",4085.133,1.792,4086.029
"-How are you feeling?
-Too many days in the saddle.",4090.132,2.708,4091.486
"-I'll take him.
-Is Lee around?",4093.257,1.417,4093.9655000000002
"-Owen.
-How'd it go?",4097.3,1.25,4097.925
"-How are you?
-Oh, smooth as silk.",4098.632,2.125,4099.6945
What's your count?,4101.8,1.0,4102.3
"-Two thousand, yours?
-Good, a little over a thousand.",4103.05,2.583,4104.3415
"That gives you Allard's 3,000
and some to spare.",4106.507,2.375,4107.6945
Who's Allard?,4111.3,1.0,4111.8
The man you'll sell the herd to.,4113.675,1.625,4114.4875
"That's right, so it is.",4117.341,1.292,4117.987
"It'd be news to Arch,",4119.216,1.084,4119.758000000001
"especially since he's planned to go down
to the panhandle and buy more stock.",4120.757,3.333,4122.4235
The deal's going through.,4125.257,1.25,4125.882
"I'm Arch's foreman, Lee.",4127.507,1.208,4128.111
And I'm a partner.,4128.925,1.0,4129.425
"I pay half your wages, remember?",4130.841,1.625,4131.6535
You give me half my orders?,4132.716,1.375,4133.4035
"Your orders are to keep
your nose out of my business.",4134.507,2.375,4135.6945
And let you steal Arch's cattle?,4136.966,1.625,4137.7785
"I'm a little hard of hearing, Lee.",4139.132,1.708,4139.986
The day after tomorrow we start for home.,4142.632,1.917,4143.590499999999
"It's a big herd,
a man in the way could get run over.",4144.632,2.625,4145.9445
"You better tell Allard it was a mistake,
to forget about it.",4149.216,2.959,4150.695500000001
"Your orders are still to keep
your nose out of my business.",4152.925,2.916,4154.383
"Wait a minute, Lee.",4156.132,1.0,4156.632
I don't get it.,4158.132,1.0,4158.632
"You don't think you can pull this off
with me around, do you?",4159.591,2.625,4160.9035
Let's get on with the cut.,4185.632,1.333,4186.2985
Figure this one out.,4196.133,1.0,4196.633
"I was working down by the river
past the last wagons.",4197.258,2.625,4198.5705
"-It doesn't make sense.
-What?",4200.258,1.375,4200.9455
"While passing one of the wagons,
I saw those two Faskens.",4202.3,2.833,4203.7165
"-Are you sure?
-No mistake.",4206.05,1.458,4206.779
They've been on the roundup.,4207.925,1.375,4208.6125
"They stood there talking with the crew,
and needed a shave.",4209.383,2.542,4210.6539999999995
They've slept in wet clothes like us.,4212.008,1.708,4212.862
Lee knew it and didn't say anything.,4216.258,1.833,4217.1745
He isn't worried like he should be.,4218.633,1.75,4219.508
"You know, I've been thinking
about that deal I made with Dave Allard.",4231.591,3.417,4233.2995
"-Yes?
-I admit I made a mistake.",4235.925,2.583,4237.2165
"Like I always do
when I haven't got you around to steer me.",4238.925,2.916,4240.383
"-Well, I'm glad you see the light, Lee.
-Yes.",4241.925,2.625,4243.2375
"Yes, I better get down to the depot
and stop Allard",4245.216,2.75,4246.591
before he gets too involved in that deal.,4248.05,1.791,4248.9455
"Fine, you go ahead.",4249.925,1.0,4250.425
Will you come with me?,4251.341,1.125,4251.9035
I'm pretty busy here.,4254.008,1.25,4254.633
"It'll be much more convincing
with you around.",4255.966,2.25,4257.091
"All right, I'll tell Mead we're going.",4260.3,1.916,4261.258
Lee and I are going over to the telegraph.,4269.466,1.75,4270.341
"-We won't be long.
-All right.",4271.3,1.625,4272.1125
"Remember we don't blast
till Daybright gets to that boulder.",4294.258,2.958,4295.737
"Yes, I'll remember.",4297.883,1.0,4298.383
"It looks like
this is our last roundup together, Owen.",4302.925,2.666,4304.258
I tried to pull a fast one on you,4306.8,1.541,4307.5705
"by grabbing that Allard deal,
but I couldn't, so I'm going anyway.",4308.425,3.875,4310.3625
"-Just like I told you I would.
-Fine.",4312.55,2.041,4313.5705
"I'm leaving you
to win right down the line.",4315.216,2.125,4316.2785
I'm leaving everything.,4317.758,1.167,4318.3414999999995
"Arch, the ranch, Jen, you.",4319.383,3.542,4321.1539999999995
It's yours.,4324.216,1.0,4324.716
The works.,4325.383,1.0,4325.883
You sure you thought this out well?,4327.341,1.542,4328.112
"You've been trying to tell me for years
how to do the right thing.",4328.966,2.959,4330.445500000001
"You gave me the straight line
about leaving here",4332.008,2.125,4333.0705
and beginning all over again.,4334.216,1.459,4334.945500000001
"I just hate to do it, that's all.",4336.216,1.75,4337.091
Maybe it's because…,4338.8,1.208,4339.404
"Well, we've had a lot of fun together.",4340.466,1.959,4341.445500000001
We have at that.,4342.966,1.084,4343.508000000001
"Remember the time in Kansas when Arch
took us to the Cattleman's Convention.",4344.841,3.125,4346.4035
"-I played cards with the big Texan.
-Yes, I remember.",4349.591,2.084,4350.633000000001
"-You beat him in five cold poker draws.
-Right.",4351.758,2.417,4352.9664999999995
"That's when I found out
what good a kicker I was.",4354.716,2.417,4355.9245
"Yes, we've sure had
a lot of good times, Lee.",4357.841,2.25,4358.966
"-That's what I'll miss.
-I'll miss them, too.",4360.383,2.167,4361.4664999999995
"No matter how old you get,",4364.716,1.042,4365.237
"there's a part of growing up
you never forget.",4365.841,1.875,4366.7785
I'm glad you said that.,4367.8,1.166,4368.383
I'll remember that when I'm gone from you.,4369.383,2.125,4370.4455
"-Where's Owen?
-He went with Lee over to the telegraph.",4420.3,2.625,4421.6125
Do you hear that?,4424.341,1.0,4424.841
"-Somebody's in trouble.
-Take some men and go see.",4425.425,2.375,4426.6125
Go around the other side.,4439.591,1.125,4440.1535
"Try to sneak up behind him,
I'll cover you.",4440.8,2.125,4441.8625
"I'm taking you in, Lee.",4610.175,1.166,4610.758
We're going to settle up.,4611.925,1.291,4612.5705
Not a chance.,4614.883,1.0,4615.383
"We'll face Arch
and tell him the whole truth for once.",4616.508,3.208,4618.112
Come on out.,4621.591,1.042,4622.112
You're forgetting I still got my kicker.,4623.383,3.375,4625.0705
"I always could outdraw you, Owen.",4628.341,2.125,4629.4035
"I'll spot you that,
but it won't change anything.",4630.841,2.417,4632.0495
"Come on out,",4634.008,1.0,4634.508
or do I have to come in and get you?,4636.508,1.833,4637.4245
"That's the whole story, Arch.",4655.508,1.458,4656.237
All of it.,4657.175,1.0,4657.675
"It was in front of me for years, Owen,
and I refused to see it.",4659.258,3.208,4660.862
I lied to myself.,4662.55,1.333,4663.2165
You lied to make it easier for me.,4663.966,2.125,4665.0285
"You didn't kill him, I did.",4667.383,2.0,4668.383
A long time ago.,4670.55,1.041,4671.0705
"The day I looked away
and hoped he'd change.",4672.925,2.166,4674.008
I hoped he'd work out.,4675.841,1.125,4676.4035
I'll have to tell Jen.,4685.55,1.208,4686.154
I'd like to tell her myself.,4687.716,1.417,4688.4245
