text,start,duration,time_midpoint
for I'll never never be a size 10,2179.04,5.12,2181.6
Vicki will be exactly like you then I'll,2188.24,5.079,2190.7794999999996
be surrounded by beautiful,2191.28,4.72,2193.6400000000003
women that compliment and a martini,2193.319,4.361,2195.4995
would just about Square you for putting,2196.0,4.76,2198.38
me in jail for 9 months Martini coming,2197.68,5.2,2200.2799999999997
up Charles yes Claud I was appointed to,2215.68,6.52,2218.94
the prosecutor staff today what about,2219.68,5.12,2222.24
your private practice but this is more,2222.2,4.48,2224.4399999999996
important there are many collaborators,2224.8,5.24,2227.42
who must be brought to Justice sure and,2226.68,4.76,2229.06
the lawyers who defend them will get,2230.04,5.2,2232.64
rich and you'll get convictions and be,2231.44,3.8,2233.34
broke gentleman the,2235.359,3.601,2237.1594999999998
queen hello,2239.44,6.04,2242.46
highness what happened to her hair she,2242.359,6.601,2245.6594999999998
had some yesterday ful thinking that's,2245.48,6.8,2248.88
all you know she's not bad for a first,2248.96,6.52,2252.2200000000003
try you'd better be beautiful a genius,2252.28,6.079,2255.3195
and terribly Rich the beauty she got,2255.48,4.72,2257.84
from my daughter the genius she,2258.359,3.641,2260.1794999999997
inherited from me you better get busy,2260.2,4.919,2262.6594999999998
with your contribution my,2262.0,3.119,2263.5595
boy the last nine months I've devoted to,2265.24,5.359,2267.9195
you now I'm going to have fun what do,2268.079,4.921,2270.5395000000003
sweetheart,2275.599,4.401,2277.7995
E I was wondering if you could uh,2289.72,7.28,2293.3599999999997
uh thank you I trust you keeping a,2293.72,7.8,2297.62
record of these loans huh good,2297.0,4.52,2299.26
sure you won't come,2322.56,4.6,2324.86
along you hate me for not holding your,2324.88,4.12,2326.94
hand while you have your,2327.16,4.6,2329.46
baby if you help my hand the next thing,2329.0,5.0,2331.5
I'd hold yours and the next thing I'd,2331.76,5.43,2334.4750000000004
kiss you and the next thing I,2334.0,4.359,2336.1795
them you're a,2339.56,5.279,2342.1995
glutton hes me not to go out I can,2341.599,5.121,2344.1595
finish this thing tonight please it's,2344.839,5.801,2347.7395
not a thing it's the Great American,2346.72,3.92,2348.68
charie will you still worship me when,2354.0,4.48,2356.24
it it's even better than the first,2415.04,6.279,2418.1795
beautiful it's too good for,2421.319,4.0,2423.319
them send it off,2425.359,3.561,2427.1394999999998
tonight be are wake up spit out for good,2431.24,8.04,2435.2599999999998
luck had a,2435.92,6.439,2439.1395
girl this Christmas night it is 5 years,2439.28,6.44,2442.5
since the end of World War II veterans,2442.359,5.681,2445.1994999999997
everywhere pray that peace will come,2445.72,4.879,2448.1594999999998
with a new,2448.04,2.559,2449.3195
daddy Pap English darling,2479.64,5.0,2482.14
English oh I had a bad,2485.24,7.2,2488.8399999999997
dream grown-ups have them too darling I,2489.48,5.92,2492.44
got your glass of milk,2492.44,2.96,2493.92
one kiss for the road oh you're not ban,2534.88,4.92,2537.34
her you lost the race I need consolation,2537.04,5.2,2539.64
I Charlie I lost the race and your wife,2539.8,5.36,2542.48
won't console me,2542.24,6.319,2545.3995
Charlie next time win the race huh good,2545.16,6.12,2548.22
look I didn't foret,2551.28,6.039,2554.2995
everybody hi,2557.319,4.461,2559.5495
char where is,2575.16,11.2,2580.7599999999998
Charlie you haven't told her,2588.319,6.24,2591.439
yet why spoiler fun why let it spoil,2590.839,7.72,2594.699
yours I'm peculiar that's why I used up,2594.559,6.601,2597.8595
a year of my life trying to write a book,2598.559,4.04,2600.579
somewhat accountable reason I thought,2601.16,3.56,2602.94
somebody would want to publish it my boy,2602.599,3.801,2604.4995000000004
you're not in the least peculiar you're,2604.72,4.16,2606.7999999999997
merely naive now I knew a publisher once,2606.4,4.24,2608.52
and he made it a rule never to read a,2608.88,3.4,2610.58
manuscript oh we'd smell it and weigh it,2610.64,5.199,2613.2394999999997
and feel it tasty but read it no now if,2612.28,5.079,2614.8195
this manuscript smelt and weighed and,2615.839,3.801,2617.7395
felt and tasted like garbage let me,2617.359,3.96,2619.339
published it would you like to know the,2619.64,6.12,2622.7
secret success mediocrity my boy to be a,2621.319,6.641,2624.6394999999998
rich writer you got to remember your,2625.76,5.68,2628.6000000000004
three Rs riches,2627.96,5.42,2630.67
hey hey Saturday evening post bought my,2668.839,6.24,2671.959
"cereal 15,000",2672.319,7.681,2676.1594999999998
bucks good boy thanks thanks uh uh uh,2675.079,7.76,2678.9590000000003
farewell hats forever,2680.0,5.4,2682.7
"$155,000 tax free too he could at least",2682.839,4.601,2685.1394999999998
thrown a poy for,2685.4,5.04,2687.92
Charlie uh run down the police station,2699.359,5.041,2701.8795
will you before now holding some crazy,2701.359,5.681,2704.1994999999997
American Dame seems she held up traffic,2704.4,4.679,2706.7395
by taking a dive into a fountain at noon,2707.04,4.92,2709.5
today not much of a story is it no but,2709.079,5.0,2711.579
you know how Americans in Paris love to,2711.96,5.0,2714.46
read about Americans in Paris all right,2714.079,7.121,2717.6395
what's her name Helen,2716.96,4.24,2719.08
WS that's my,2721.76,6.12,2724.82
no use acting as if you didn't know me,2738.079,5.201,2740.6795
I'm your wife sickness and in health and,2740.4,4.84,2742.82
dry clothes and D you know how you are,2743.28,4.24,2745.4
with coals you better go home and,2745.24,4.839,2747.6594999999998
change we can't go home because it the,2747.52,5.599,2750.3195
dingo again isn't she better off in a,2750.079,5.04,2752.599
nice respectable beastro and all alone,2753.119,4.761,2755.4995000000004
this going to get in the papers one more,2759.4,3.959,2761.3795
crazy American jumping into one more,2761.64,3.64,2763.46
beautiful fountain that isn't news,2763.359,3.281,2764.9995
anymore is that why he did it to get,2765.28,2.52,2766.5400000000004
print I guess it was silly and stupid,2767.8,5.6,2770.6000000000004
but it was fun was,2770.8,6.039,2773.8195
it well almost fun on the verge of being,2773.4,8.4,2777.6
fun only it never is quite is,2776.839,4.961,2779.3195
no somehow never is I don't know why,2784.48,7.639,2788.2995
maybe it's something about Paris or me,2789.52,4.079,2791.5595
or the times or,2792.119,3.881,2794.0595000000003
something it's as if you've got to hurry,2793.599,4.76,2795.9790000000003
before it's like you're trying to find,2798.359,5.081,2800.8995
out something terribly important only,2800.4,5.719,2803.2595
only you never,2803.44,2.679,2804.7795
do oh come on now you always laughed at,2807.599,6.441,2810.8195
these things took a little time but you,2811.04,6.16,2814.12
laughed it isn't that,2814.04,4.76,2816.42
Campbell just sold a cereal of the,2817.2,3.48,2818.9399999999996
Saturday evening post for,2818.8,4.64,2821.1200000000003
"$155,000 and you hate him for it oh",2820.68,4.56,2822.96
darling I think that's wonderfully human,2823.44,3.08,2824.98
she's saying he's talking so fast this,2847.0,4.559,2849.2795
is marel how do you do who are you he,2849.24,5.839,2852.1594999999998
says he's going to immortalize,2851.559,3.52,2853.3190000000004
you what are you running for office or,2856.119,4.641,2858.4395
something oh you know me always good for,2858.52,4.4,2860.72
a couple of laughs Mrs,2860.76,5.799,2863.6595
weeds it's a good thing to make people,2862.92,6.32,2866.08
laugh well don't I get anything I PID,2866.559,5.641,2869.3795
the fine to get her out of,2869.24,2.96,2870.72
English Papa I've been waiting to show,2928.88,6.479,2932.1195000000002
you this morning Mama trust my no Vicki,2931.92,6.199,2935.0195
not half and half all English watch,2935.359,4.121,2937.4195
watch hold it I haven't been kissed,2939.48,5.359,2942.1595
you hey charie Barney you want to see,2947.119,7.44,2950.839
something great,2950.799,3.76,2952.679
pretty young to be hitting the bottle,2966.119,4.161,2968.1995
isn't she it's the floor darling even,2967.64,4.52,2969.9
paboa couldn't dance on a floor like,2970.28,5.76,2973.1600000000003
this you're all right I'm,2972.16,7.52,2975.92
sorry say something nice it's swell kid,2976.04,5.799,2978.9395
great the boss wants me on an interview,2979.68,4.119,2981.7394999999997
with the Royal France I can't handle it,2981.839,4.52,2984.099
got a heavy date cover for me will you,2983.799,5.0,2986.299
the woman's name is Lorraine quall who's,2986.359,3.401,2988.0595
quall Cafe Society so on kid you got a,2989.76,7.2,2993.36
great act there great great all it needs,2993.96,5.32,2996.62
finish you've got the right finish,3000.4,6.0,3003.4
haven't you sweetheart right into my,3002.52,3.88,3004.46
arms still,3009.599,3.24,3011.219
whe this is,3018.68,5.24,3021.2999999999997
Paul I am Wills from the Europa news,3021.48,6.28,3024.62
service I hate to be late I'm,3023.92,6.72,3027.28
sorry and I need a,3027.76,8.12,3031.82
drink Leon say Mrs squir please you can,3030.64,8.36,3034.8199999999997
skip the usual Paris is beautiful,3035.88,5.32,3038.54
American women love French men French,3039.0,4.839,3041.4195
men Love American women prizes are too,3041.2,4.599,3043.4995
high I haven't picked out my next,3043.839,3.321,3045.4995
yet might be the bartender at least he,3047.16,5.36,3049.8399999999997
has talent you've been interviewed,3050.24,5.8,3053.14
before the last time an hour ago,3052.52,6.039,3055.5395
wasn't very young or very attractive the,3056.04,5.559,3058.8195
interview was very very short you can,3058.559,4.8,3060.9590000000003
time a first trip to Paris no no first,3063.359,5.601,3066.1594999999998
divorce here that's all and why' you,3067.24,5.64,3070.06
choose Paris I get saddle Source in Reno,3068.96,6.04,3071.98
and I lose too much money in Las Vegas,3072.88,3.56,3074.6600000000003
according to our files you were married,3075.0,4.28,3077.14
four times three and almonds don't count,3076.44,5.32,3079.1
Leon is something,3079.28,5.079,3081.8195
wrong is something,3081.76,5.0,3084.26
you you really can't tell one of my,3086.76,4.44,3088.98
marriages from another without a,3089.28,5.44,3092.0
program husband number one for,3091.2,5.08,3093.74
failure husband number two for money,3096.28,5.16,3098.86
failure except for the money in the name,3099.4,5.679,3102.2395
qual husband number three an Armond he,3101.44,6.159,3104.5195
forgot to tell he already had a wife,3105.079,5.76,3107.9590000000003
husband number four a bull fighter four,3107.599,6.281,3110.7395
times a bet haven't had a,3110.839,5.401,3113.5395
hit and children,3113.88,5.679,3116.7195
involved no and that's my only,3116.24,6.16,3119.3199999999997
contribution to,3119.559,2.841,3120.9795000000004
humanity I told you I was a,3124.24,3.92,3126.2
pure shouldn't you be writing this down,3129.68,5.08,3132.22
oh the interview stopped long,3132.64,4.76,3135.02
you I'm hungry what about enough uh I'm,3137.4,5.679,3140.2395
not on an expense account I'm just a,3141.48,3.44,3143.2
struggling newspaper man well stop,3143.079,2.921,3144.5395000000003
struggling,3144.92,3.56,3146.7000000000003
the dinner is on my four husbands I,3146.0,3.799,3147.8995
change and I'll be right down but what,3148.48,4.8,3150.88
about Please Mr wills at home my analyst,3149.799,7.76,3153.679
charges $50 an hour to listen to,3153.28,4.279,3155.4195000000004
hey that's my,3176.799,5.04,3179.319
taxi Charles clae I'm glad to see you,3178.76,5.92,3181.7200000000003
how have you been fine you look fine how,3181.839,5.72,3184.699
are you Maran fine you look,3184.68,5.52,3187.44
fine I'm fine,3187.559,5.28,3190.199
too oh excuse me my sister-in-law Mrs,3190.2,5.39,3192.895
matin Mr matin Mrs,3192.839,5.841,3195.7595
PA a CLA with the prosecutor's office oh,3198.68,8.48,3202.9199999999996
I hope we haven't done anything wrong,3202.76,4.4,3204.96
uh Mrs Co just arrived in Paris I'm,3210.28,3.24,3211.9
interviewing,3212.4,4.8,3214.8
her how's Helen fine fine oh and you,3213.52,4.92,3215.98
should see Vicki,3217.2,3.639,3219.0195
she's you know we really should see more,3218.44,5.08,3220.98
of each other after all family and I'll,3220.839,4.801,3223.2395
get in touch with Helen in the,3223.52,5.24,3226.14
morning good night Mrs SEL good night,3225.64,5.52,3228.4
good night good night Charles I really,3228.76,4.52,3231.0200000000004
would like to see you again good night,3231.16,5.82,3234.0699999999997
good night CL thank you,3233.28,6.83,3236.695
is now what's one little wife among all,3244.559,5.401,3247.2595
your husbands I imagine you'll catch it,3247.16,5.8,3250.06
when you get home from Helen not Helen,3249.96,6.72,3253.32
she's the most wonderful most,3252.96,3.72,3254.82
understanding do you mind if we don't go,3257.599,3.041,3259.1195000000002
on with the,3259.76,3.68,3261.6000000000004
interview somehow I'm suddenly cold,3260.64,5.08,3263.18
sober and it's awfully late if I don't,3263.44,4.84,3265.86
get back to the office and do the story,3265.72,6.04,3268.74
can I go with you to the office I mean,3268.28,6.76,3271.6600000000003
why I don't know probably never see each,3271.76,5.799,3274.6595
other again and I I like to drag the,3275.04,3.68,3276.88
night out a,3277.559,3.881,3279.4995000000004
little and I should see that story well,3278.72,4.52,3280.98
that office is awful cold and dingy at,3281.44,3.72,3283.3
this hour of the morning you'd be,3283.24,5.24,3285.8599999999997
surprised how often I feel cold and,3285.16,6.679,3288.4995
dingy I'll be,3288.48,3.359,3290.1595
wellow good,3305.68,4.52,3307.94
morning now what's the,3307.64,5.959,3310.6195
matter oh Charlie how could,3310.2,7.56,3313.98
you don't Charlie me sister what about,3313.599,6.2,3316.699
you I'm sick and tired of you sitting,3317.76,4.44,3319.98
around these crummy cafes day and night,3319.799,4.28,3321.939
the darling of every phony petted by,3322.2,3.52,3323.96
writers who don't write adored by,3324.079,3.441,3325.7995
painters who don't,3325.72,5.16,3328.2999999999997
paint what do you write interviews with,3327.52,6.4,3330.72
useless sloppy women at least I don't,3330.88,4.64,3333.2000000000003
jump into fountains and lap up all the,3333.92,2.72,3335.28
Paris well why don't you ask me why I,3336.64,4.719,3338.9995
drink why I jump in,3339.359,5.96,3342.339
fountains that's right blame me blame me,3341.359,6.321,3344.5195
did I want to stay in Paris what right,3345.319,4.601,3347.6195
have you to criticize,3347.68,6.6,3350.98
me you're suspicious You Ah that's a,3349.92,7.8,3353.82
laugh now you you just listen to,3354.28,3.44,3356.0
me morning,3363.799,3.601,3365.5995
on do you realize what time it,3375.48,4.24,3377.6
is does it matter John it's 8:00 in the,3380.16,9.72,3385.02
morning it's your turn to take bigy to,3385.28,4.6,3387.5800000000004
school do you realize I've been out all,3390.359,7.161,3393.9395
night poor,3394.28,6.12,3397.34
darling all right I'll take her to,3397.52,7.079,3401.0595
school well don't you care I've,3400.4,4.199,3402.4995
been you look,3407.92,5.679,3410.7595
awful was it a tough,3410.4,6.679,3413.7395
assignment I was was interviewing a,3413.599,6.921,3417.0595000000003
woman it's nice they much better coffee,3417.079,5.681,3419.9195
this she was a rich beautiful exciting,3426.799,5.721,3429.6594999999998
woman she was interested in,3432.76,4.12,3434.82
me well don't you even care what are you,3439.079,6.881,3442.5195000000003
trying to say to you,3442.52,7.0,3446.02
I'm trying to say that I love,3445.96,3.56,3447.7400000000002
you what kind of a woman did you say she,3449.72,6.319,3452.8795
was how many kinds are,3453.16,5.6,3455.96
there was she really,3456.039,5.441,3458.7595
pretty I'd lie about her but Maran saw,3458.76,5.599,3461.5595000000003
it too yes she's very pretty,3461.48,5.8,3464.38
Marian we ran into Claude and Marian,3464.359,4.68,3466.699
she'll probably try to build it up into,3467.28,4.48,3469.52
something but just how rich and how,3469.039,7.76,3472.9190000000003
pretty was she oh shut up,3471.76,5.039,3474.2795
I don't hear a thing do,3486.559,3.28,3488.199
you I'll be back in a,3489.92,3.8,3491.82
what say that again it's a,3508.119,8.561,3512.3995
lie you know how Marian has never liked,3512.16,4.52,3514.42
Charlie we're,3519.079,3.361,3520.7595
rich you old froad why didn't you tell,3531.68,5.8,3534.58
us I am not old I couldn't tell you last,3534.559,4.76,3536.9390000000003
night because I was celebrating last,3537.48,3.599,3539.2795
night I stopped by Marian's on my way,3539.319,3.04,3540.839
home this morning they had breakfast,3541.079,3.161,3542.6595
with told her that how much are we worth,3542.359,3.24,3543.979
Marian says that you said that we're,3544.24,3.4,3545.9399999999996
stinking Rich Marion always,3545.599,5.081,3548.1395
editorializes money has no order oh,3547.64,5.959,3550.6195
especially lots of it K English Vicki,3550.68,4.879,3553.1195
English are we millionaires Insanity,3553.599,3.561,3555.3795
there's a wide streak of insanity in,3555.559,3.601,3557.3595
this family Vicki on your mother's side,3557.16,6.28,3560.2999999999997
we have hit an oil gusher we what oil,3559.16,6.48,3562.3999999999996
darling the start the protex on the map,3563.44,4.04,3565.46
you mean those worthless oil leases of,3565.64,4.0,3567.64
ours A Generous wedding present for me,3567.48,4.079,3569.5195
which I trust you will remember and keep,3569.64,4.56,3571.92
in mind how rich are we well there a,3571.559,4.48,3573.799
state law about only pumping out 80,3574.2,4.68,3576.54
barrels a day now at $2 a barrel that's,3576.039,6.28,3579.179
uh that's only $160 a day 7 days a week,3578.88,5.84,3581.8
of course oil is an act of God that,3582.319,6.72,3585.679
"that's $1,100 a week and 27.5% taxfree",3584.72,6.48,3587.9599999999996
what if we sold out my thoughts exactly,3589.039,3.921,3590.9995000000004
a capital gain but if we didn't sell out,3591.2,3.919,3593.1594999999998
we'd have an income for life everybody,3592.96,4.72,3595.32
from Milwaukee cautious sensible just,3595.119,5.2,3597.719
sensible we'll redecorate everything,3597.68,4.639,3599.9995
from top to toe me too I'll have my,3600.319,3.881,3602.2595
haircut we'll take Marian's room and,3602.319,3.72,3604.179
turn it into a riding room for,3604.2,4.44,3606.4199999999996
you do you suppose we really good run,3606.039,5.121,3608.5995000000003
"through $50,000 in a year well we could",3608.64,5.04,3611.16
we no what of course we could drill,3613.68,3.96,3615.66
well Barry never said a word about,3617.64,5.679,3620.4795
running into you last night Mama what,3619.88,6.159,3622.9595
Shroud no more deadlines no more,3661.48,6.8,3664.88
journalism the job is dead lower,3663.799,7.111,3667.3545
away catch,3668.28,6.13,3671.3450000000003
it what are you going to do now Charlie,3674.799,6.04,3677.819
now now I'll finish my third novel if,3677.76,5.68,3680.6000000000004
this one doesn't get published it'll get,3680.839,4.321,3682.9995
I got no money worries I got no job,3685.16,5.439,3687.8795
worries what would I use for an excuse,3688.039,4.401,3690.2395
you got enough money no excuses are,3690.599,5.2,3693.199
necessary good luck to you Charlie all,3692.44,5.09,3694.985
this one will be,3695.799,13.56,3702.579
"good that'll be 5,000 FRS oh I should",3709.359,5.561,3712.1394999999998
like to do more for charity oh that's,3712.359,6.0,3715.359
nice Helen want you,3714.92,7.56,3718.7000000000003
"play 6,000 for another",3718.359,4.121,3720.4195
kid I'm really worth much more you know,3726.559,4.961,3729.0395000000003
but I never expected to see you in a,3729.2,4.839,3731.6195
charity neither did I something wrong,3731.52,6.039,3734.5395
yeah Vicky no,3734.039,6.32,3737.199
Charlie look he hasn't moved from his,3737.559,4.961,3740.0395000000003
room all day he's still there he won't,3740.359,4.601,3742.6594999999998
eat anything he won't say anything just,3742.52,5.96,3745.5
sits there in the dark,3744.96,3.52,3746.7200000000003
what's the matter,3786.16,2.76,3787.54
darling have you had,3792.76,3.4,3794.46
dinner do you want me to fix,3798.2,3.96,3800.18
something go away Helen,3802.24,5.559,3805.0195
alone is it something I've,3809.68,7.679,3813.5195
done please Charlie whatever it is all,3813.039,6.921,3816.4995000000004
right you're a good wife you're devoted,3817.359,6.72,3820.719
and loyal you've done your,3819.96,4.119,3822.0195
duty please go back to your party and,3825.319,4.841,3827.7395
alone I'm only trying to,3833.279,7.361,3836.9595
what you me,3841.0,6.16,3844.08
us I don't,3845.279,4.961,3847.7595
know help what this can you help another,3847.16,6.56,3850.44
rejection can anybody help,3850.24,3.48,3851.9799999999996
that why because some publisher turned,3854.16,6.119,3857.2194999999997
you down again Yes,3857.64,6.679,3860.9795
again again Helen and again can you help,3860.279,6.121,3863.3395
that I'm stupid enough to spend 5 years,3864.319,4.641,3866.6394999999998
writing three stupid books and you help,3866.4,3.8,3868.3
it that I'm no,3868.96,5.0,3871.46
writer but you are you're wonderful,3870.2,5.8,3873.1
they're the ones that are stupid not,3873.96,6.28,3877.1
You Dear Mr Wills we regret to inform,3876.0,7.24,3879.62
you I'm no good Helen go away and let me,3880.24,7.079,3883.7794999999996
alone oh Charlie please I can't explain,3883.24,6.839,3886.6594999999998
my failure to you don't be a good girl,3887.319,3.841,3889.2395
and let me,3890.079,5.081,3892.6195000000002
alone but you're not a failure not to me,3891.16,5.48,3893.8999999999996
when I was 20 I used to think I would,3895.16,3.52,3896.92
write great books I would be able to do,3896.64,4.0,3898.64
this because I was different I wanted,3898.68,3.84,3900.6
Perfection and that made me different,3900.64,3.719,3902.4995
but I'm not 20 anymore and it's too late,3902.52,5.16,3905.1
now will we try again,3904.359,6.801,3907.7595
no I just don't have what it takes all I,3907.68,5.28,3910.3199999999997
need to do now is get used to the idea,3911.16,4.24,3913.2799999999997
I'm rich and the price of a few drinks I,3912.96,4.319,3915.1195000000002
could buy Fame and friends or something,3915.4,4.439,3917.6195000000002
like them why I spend years writing I,3917.279,4.721,3919.6394999999998
can whole caught in some noisy bar and,3919.839,5.421,3922.5495
criticize writing and talk about riding,3922.0,9.829,3926.9145
him never make it boy 25 bucks as I do,3939.839,9.081,3944.3795
we've already got 75 bet make it,3945.119,10.96,3950.599
100 all right 100 sucker fuzzy shs,3948.92,7.159,3952.4995
fuz watch this,3957.76,5.559,3960.5395000000003
s winner and still championne and this,3992.48,5.4,3995.18
is the arm that did,3995.279,6.08,3998.319
it take me,3997.88,3.479,3999.6195000000002
home waiting for the car thing souped up,4003.839,7.72,4007.699
for the race race sports car event want,4007.279,5.721,4010.1394999999998
thought her,4047.96,5.2,4050.56
heart warm,4049.96,5.04,4052.48
and take me,4053.16,4.84,4055.58
please that's what I thought you,4061.4,3.84,4063.32
wereing and lover,4071.2,4.72,4073.56
sing anybody phone,4093.359,6.601,4096.6595
no kind of quiet isn't it it's nice,4097.12,5.36,4099.8
though isn't it why isn't Vicki come in,4099.96,4.399,4102.1595
to say good night,4102.48,3.759,4104.3595
your daughter is in a complete state of,4104.359,5.601,4107.159500000001
Crisis one of her front teeth fell out,4106.239,6.641,4109.559499999999
how she taking it oh life is completely,4109.96,5.48,4112.7
over for her she says she'll come in if,4112.88,4.319,4115.0395
she doesn't have to smile or open her,4115.44,4.08,4117.48
mouth sure I know a big dramatic,4117.199,5.361,4119.8795
situation when I see,4119.52,3.04,4121.040000000001
one you don't really mind staying in,4123.839,5.241,4126.4595
tonight do you of course,4126.12,6.4,4129.32
not how's it going not easy getting,4129.08,5.8,4131.98
started again,4132.52,4.96,4135.0
but you promised and I'm,4134.88,6.319,4138.0395
trying then you'll make,4137.48,3.719,4139.339499999999
it poor little,4153.319,3.721,4155.1795
ballerina thanks thank you very much not,4162.52,4.08,4164.56
a bad kiss at all,4164.96,4.319,4167.1195
considering when will you smile,4166.6,5.719,4169.4595
again at least can you give me an,4169.279,5.361,4171.959500000001
estimate teeth grow back in a few months,4172.319,3.201,4173.9195
know but by that time those muscles will,4175.52,5.36,4178.200000000001
be all set hard and you won't be able to,4177.92,5.16,4180.5
smile they say you're the wickedest,4180.88,3.879,4182.8195000000005
Paris you know what I'll look like,4184.759,3.89,4186.704
soon Daddy,4191.719,5.681,4194.5595
may I borrow a pair of cufflinks I can't,4195.64,4.039,4197.659500000001
it both of you put your upper plates,4199.76,5.64,4202.58
back here you're making me,4202.28,5.6,4205.08
self-conscious can I dance for you Grand,4205.4,4.839,4207.8195
in the morning my dear I have to get up,4207.88,4.64,4210.2
at 6:00 tomorrow well that'll work out,4210.239,4.321,4212.3994999999995
fine cuz I should be getting in by then,4212.52,2.63,4213.835
good night,4214.56,3.66,4216.39
milk literature what's the meaning of,4225.52,5.08,4228.06
this I'm supposed to be working your,4228.12,5.4,4230.82
idea it's a fine idea don't you corrupt,4230.6,5.2,4233.200000000001
him I wouldn't think of it but we will,4233.52,4.639,4235.8395
miss you at the Wilsons can you imagine,4235.8,4.2,4237.900000000001
throwing a white tie party simply,4238.159,6.201,4241.259499999999
because it's Thursday couldn't we go,4240.0,6.52,4243.26
Char really it would be good for me and,4244.36,3.76,4246.24
tomorrow morning I'll chain myself to,4246.52,5.12,4249.080000000001
that chair,4248.12,3.52,4249.88
why do I always end up saying yes when I,4254.199,5.121,4256.759499999999
