text,start,duration,time_midpoint
really mean no by the way I'm bringing a,4256.6,5.599,4259.3995
friend he's an international tennis,4259.32,5.879,4262.2595
Paul now don't worry about him at the,4266.32,4.72,4268.679999999999
Wilsons he's invited everywhere to think,4268.48,5.08,4271.0199999999995
of it that's U how he makes his living,4271.04,5.0,4273.54
you mean he gets paid for being a guest,4273.56,7.0,4277.06
no no he steals the silverware Charming,4276.04,8.04,4280.06
well my uh my daughter and Charles Wills,4280.56,4.36,4282.740000000001
son-in-law how do you do on,4284.92,4.48,4287.16
Shante I hear you played in Rome I play,4291.32,6.319,4294.4794999999995
all the tournaments how do you make out,4295.04,4.88,4297.48
brilliantly until the second round then,4297.639,4.0,4299.639
invariably some young Australian or,4299.92,3.719,4301.7795
American school boy beats me but nobody,4301.639,3.681,4303.4795
beats him in jumping over the net and,4303.639,3.6,4305.439
congratulating the winner I'm the,4305.32,4.48,4307.5599999999995
Champion graceful,4307.239,4.681,4309.5795
loser forgive me,4309.8,4.68,4312.14
but you're the lady in the fountain the,4311.92,4.92,4314.38
cafe dingo well it's my favorite,4314.48,4.0,4316.48
painting whenever I'm in Paris I go,4316.84,4.799,4319.239500000001
there to stare at it well you're in luck,4318.48,5.159,4321.059499999999
now you can stare at the,4321.639,4.361,4323.8195000000005
original come with me,4323.639,5.721,4326.4995
Paul until,4326.0,3.36,4327.68
later sort of appealing isn't he what,4332.76,7.919,4336.7195
appealing yes in a revolting sort of way,4336.199,6.281,4339.3395
well my dear it was the funniest thing,4362.239,4.321,4364.3994999999995
you ever saw all those gangsters on the,4364.199,4.761,4366.5795
television and this asking all those,4366.56,5.88,4369.5
questions nobody in New York working at,4368.96,5.0,4371.46
mostly old,4373.96,2.679,4375.2995
age you're going to drive in this race,4385.56,4.8,4387.96
yourself certainly what do you get if,4388.0,4.8,4390.4
you win what do you get you get to be,4390.36,4.799,4392.7595
winner that's what you,4392.8,6.64,4396.12
get well what do you know it's my,4395.159,7.201,4398.759499999999
wife I your,4399.44,4.26,4401.57
all right sporting blood run along to,4405.719,4.281,4407.8595000000005
the locker room come back in a few,4407.56,5.04,4410.080000000001
minutes Paul Tony his guilty conscience,4410.0,5.8,4412.9
it won't take her,4412.6,3.2,4414.200000000001
oh hey what kind of a wife are you,4415.88,6.83,4419.295
dancing with other men the average guy,4418.88,5.68,4421.72
neglected what's with Mr tennis and you,4424.56,6.52,4427.820000000001
oh we Paul and Helen,4428.12,6.88,4431.5599999999995
now he's sweet and and it doesn't think,4431.08,5.52,4433.84
it's terrible at all that I'm married,4435.0,4.48,4437.24
and have a seven-year-old only maybe he,4436.6,4.68,4438.9400000000005
just wants to be,4439.48,5.52,4442.24
mother not exactly he's made several,4441.28,6.52,4444.54
suggestions that was one well let me,4445.0,4.4,4447.2
know how he makes,4447.8,5.32,4450.46
her Lorraine Lorraine,4449.4,7.4,4453.099999999999
qu you've forgotten me believe me the,4453.12,5.48,4455.86
only thing I've forgotten about you is,4456.8,5.48,4459.54
your name Wills you're open new service,4458.6,6.52,4461.860000000001
oh it's so good to have my arms around,4465.12,4.76,4467.5
you again oh you've got me confused with,4467.04,6.44,4470.26
somebody else we never got that far why,4469.88,7.12,4473.4400000000005
not you get married again of course and,4473.48,6.04,4476.5
I'm in Paris now to get rid of him are,4477.0,5.8,4479.9
you still married yes of course to the,4479.52,7.4,4483.22
same woman to the same wonderful woman I,4482.8,5.8,4485.7
have to say that cuz she's standing,4486.92,3.799,4488.8195000000005
here may I present my wife Helen Mrs qu,4490.719,7.801,4494.6195
oh it's Mrs Johnson now but not for long,4494.679,7.52,4498.439
how do you do I'm not quite sure you're,4498.52,6.119,4501.579500000001
much prettier than I,4502.199,4.721,4504.559499999999
expected and you're much less beat up,4504.639,5.121,4507.1995
than you have a right to,4506.92,2.84,4508.34
be uh is it all right if I uh come back,4510.36,6.52,4513.62
now oh Paul Lane this is the uh,4513.719,5.92,4516.679
temporary Mrs Johnson the best mediocre,4516.88,5.12,4519.4400000000005
tennis player in the world I've seen you,4519.639,4.961,4522.1195
around my hotel I always St at the Royal,4522.0,4.7,4524.35
France tell us,4524.6,3.2,4526.200000000001
yeah is like wine keep sh drun,4577.08,9.76,4581.96
Charlie I'd like to go home home what's,4582.12,7.68,4585.96
the matter nothing I'd just like to go,4586.84,6.839,4590.2595
home that sound reasonable to,4589.8,7.2,4593.400000000001
you are you going to take me home oh I,4593.679,5.721,4596.5395
would but I can't I promis to show L,4597.0,5.239,4599.6195
rain how fast the car would go do you,4599.4,4.6,4601.7
mind if Paul takes me,4602.239,6.48,4605.478999999999
home Paul Paul who Paul anybody party,4604.0,6.199,4607.0995
like this there must easily be six or,4608.719,3.0,4610.219
seven Pauls,4610.199,4.0,4612.199
around you can't can't hold a serious,4611.719,4.401,4613.9195
discussion with,4614.199,5.121,4616.759499999999
her I can get up to 60 M hour with this,4616.12,6.13,4619.1849999999995
baby second,4619.32,18.18,4628.41
I've been up for hours that's a habit,4650.239,5.721,4653.099499999999
you must try and grow out of kitten Why,4652.76,5.0,4655.26
do grown-ups drink milk when they have,4655.96,4.4,4658.16
all 32 teeth well we develop butterflies,4657.76,4.479,4659.9995
in our stomach and milk seems to quiet,4660.36,4.0,4662.36
them down how do they get in your,4662.239,3.96,4664.218999999999
stomach they usually hide in the bubbles,4664.36,5.68,4667.2
of champagne it's a well-known fact of,4666.199,9.401,4670.8994999999995
hydrodynamics good night my dear good,4670.04,5.56,4672.82
night get your coat,4693.6,6.2,4696.700000000001
picky can daddy come with us to the,4696.88,7.279,4700.5195
bar we're going to church first,4699.8,7.24,4703.42
is it Sunday already what happened to,4704.159,4.0,4706.159
Friday and,4707.04,5.44,4709.76
Saturday run long are you coming Daddy,4708.159,7.441,4711.8795
I'll meet you at the bar,4712.48,3.12,4714.04
later Church on Friday what happens at,4716.52,7.96,4720.5
church on Friday the usual,4720.08,6.52,4723.34
thing well as long as you're on that,4724.48,4.679,4726.8195
sort of mood can I expect a little,4726.6,4.599,4728.8995
sympathy for this,4729.159,4.401,4731.3595
head heads,4731.199,3.881,4733.139499999999
little what did I,4735.08,7.88,4739.0199999999995
do that I'd be very interested to,4737.92,5.04,4740.4400000000005
I'd like to go for a ride on that thing,4766.6,6.19,4769.695000000001
myself how about,4769.92,5.939,4772.8895
it must you look so,4779.8,4.08,4781.84
Grim I'm waiting to hear the end of the,4784.08,4.639,4786.3994999999995
midnight ride at po,4786.52,5.4,4789.22
re you got the car up to 103 mil hour,4788.719,6.241,4791.8395
and then started back right all,4791.92,6.92,4795.38
right then then,4794.96,6.679,4798.2995
nothing I dropped the rain at her hotel,4798.84,7.56,4802.62
or she got me at the house I forget,4801.639,7.681,4805.4795
which sure that's all you forgotten,4806.4,4.88,4808.839999999999
sorry to disappoint you but nothing,4809.32,4.8,4811.719999999999
happened last,4811.28,2.84,4812.7
night tonight's another,4814.52,5.96,4817.5
night she'll be beautiful again you'll,4817.36,5.799,4820.2595
be full of wine again and nothing will,4820.48,4.36,4822.66
again who took you home last night that,4824.84,5.6,4827.64
player he didn't exactly take me home,4837.6,6.52,4840.860000000001
oh he asked me back to his hotel for,4841.639,5.241,4844.2595
night care I went did you have to fight,4844.12,3.64,4845.94
out well there was a battle all right,4847.76,5.56,4850.54
but it wasn't Paul I had to fight with,4850.84,5.08,4853.38
it was myself did you,4853.32,6.2,4856.42
win Now you listen I'm under the same,4855.92,6.279,4859.0595
strains and stresses you are I live in,4859.52,6.08,4862.56
Paris too and I'm bored too and all that,4862.199,4.881,4864.639499999999
time I had a picture in my mind of you,4865.6,3.559,4867.3795
and that woman and don't underestimate,4867.08,6.639,4870.3994999999995
Paul he's charming and attentive,4869.159,4.56,4871.438999999999
and and I'm so,4877.28,3.72,4879.139999999999
unhappy Charlie let's go home all right,4881.159,5.321,4883.8195
as soon as Vicki finishes we're I mean,4884.719,6.721,4888.0795
really home America,4886.48,4.96,4888.959999999999
home it won't work running,4892.719,4.721,4895.0795
home Charlie let's go back before we,4898.48,6.159,4901.559499999999
please if you love me let's go back,4908.48,6.159,4911.559499999999
you used to say let's live it up a,4914.639,4.241,4916.7595
little you were right there's lots of,4916.6,6.039,4919.619500000001
time to go home plenty of time for,4918.88,3.759,4920.7595
everything suppose time runs out on us,4923.679,5.401,4926.3795
you are just having a bad day darling,4927.0,3.96,4928.98
tomorrow will I've been having a bad day,4929.08,4.159,4931.1595
for a year,4930.96,4.92,4933.42
now maybe I'm growing,4933.239,6.761,4936.6195
up it's too late to grow,4935.88,4.12,4937.9400000000005
up I tell you what come racing with me,4940.639,5.241,4943.2595
we'll go to Marty Carlo why is winning a,4943.36,3.72,4945.219999999999
important I don't know maybe I could do,4947.08,5.8,4949.98
a short story about racing why,4950.199,5.841,4953.1195
not all right all right I get a kick out,4952.88,5.72,4955.74
of racing it's fun the quot your,4956.04,4.4,4958.24
illustrious father nothing is more,4958.6,3.96,4960.58
important than fun does that make me,4960.44,6.08,4963.48
sound stupid is that what you want me to,4962.56,3.96,4964.54
say come with me,4966.84,4.72,4969.2
no John well maybe I'll take somebody,4975.28,3.35,4976.955
else wouldn't that be,4977.56,4.299,4979.709500000001
reasonable you'll find a reason to make,4982.28,4.2,4984.38
reasonable look out for Vicky will you,4986.48,4.14,4988.549999999999
where are you,4989.12,2.92,4990.58
going to do something,4992.04,5.8,4994.94
important buy new,4995.199,6.281,4998.3395
stop for a while now,5107.96,4.36,5110.14
while quickly,5143.639,5.681,5146.4795
do this is Wills she,5149.32,10.809,5154.724499999999
here this to be,5170.4,3.68,5172.24
good well look who's here what's the,5176.04,6.28,5179.18
news in the racing World call you with,5179.48,5.12,5182.04
the house you weren't there of course,5182.32,4.28,5184.46
here that's not,5186.6,3.44,5188.320000000001
funny you haven't been at that house for,5191.119,3.361,5192.7995
week I didn't think that was very funny,5194.48,7.0,5197.98
either now I think it's very,5198.4,6.2,5201.5
very you remember Paul don't,5201.48,4.92,5203.94
no that's sort of funny,5206.4,5.4,5209.099999999999
too because I remember the will you join,5208.92,8.319,5213.0795
us as dinner ah shut up I love to join,5211.8,8.0,5215.8
you what time does he drink champagne,5217.239,3.601,5219.0395
slipping we've already done,5220.84,5.08,5223.38
that how do you like him don't you think,5225.92,5.36,5228.6
he makes me look years,5228.8,5.12,5231.360000000001
drunken I hope you don't mind a harmless,5231.28,5.08,5233.82
little dinner oh come on Paul you can do,5233.92,4.6,5236.22
better than that you could tell them to,5236.36,6.48,5239.599999999999
go away for instance leave us alone not,5238.52,7.679,5242.3595000000005
meia is your responsibility please we're,5242.84,5.92,5245.8
all very civilized no,5246.199,6.081,5249.2395
no that's my,5248.76,3.52,5250.52
boy touch me again and I'll take a poke,5252.8,5.0,5255.3
at you I wouldn't do that,5255.199,4.881,5257.639499999999
Johnny cuz then I'd have to take a poke,5257.8,3.319,5259.4595
ray what's funny why you me all of us,5261.119,6.0,5264.119
please Charles,5279.76,3.72,5281.62
Guys world's full of Wise,5313.6,6.5,5316.85
hell you're,5351.08,5.92,5354.04
beautiful and Mary and,5353.52,7.119,5357.079500000001
exciting and Rich,5357.0,3.639,5358.8195
also of course I love,5367.52,5.639,5370.3395
you love is never of,5369.96,5.12,5372.52
it at least I'll never let you be,5375.08,4.92,5377.54
lonely how we can you tell him tell,5390.4,7.239,5394.019499999999
him tell him,5394.92,5.44,5397.64
Earth you love,5400.36,5.759,5403.2395
me but I'm not going back to,5403.0,6.0,5406.0
him that's,5406.119,6.52,5409.379
silly of course you're going back to,5409.0,6.96,5412.48
him well if you don't go back to,5412.639,5.881,5415.5795
him spoil everything for us you can see,5415.96,4.88,5418.4
that can't,5418.52,5.32,5421.18
course I stay married and keep you on,5429.04,4.599,5431.3395
side and when I'm,5433.639,3.52,5435.399
lonely oh brother the idea wasn't,5438.44,7.44,5442.16
invented just now it's done all the time,5441.96,5.92,5444.92
half your crowd have,5445.88,4.08,5447.92
Arrangements is that what you expected,5447.88,2.96,5449.36
listen what's the matter with,5454.8,3.8,5456.7
you suddenly I've got very cold,5458.8,4.919,5461.2595
Charlie please,5508.88,4.0,5510.88
do you want me to go,5512.88,5.4,5515.58
away is that what you,5514.6,3.68,5516.4400000000005
sorry couldn't find a,5580.44,6.49,5583.6849999999995
willset he's outside he can't see her I,5624.76,5.8,5627.66
you took my,5704.08,2.76,5705.46
umbrella I'm sorry,5711.199,3.841,5713.1195
please forgive,5722.84,2.76,5724.22
me take care of,5728.92,3.759,5730.7995
Vicki don't let Vicki make the same,5733.719,4.92,5736.179
mistakes I'll Always Love You,5748.719,15.79,5756.6140000000005
out you'll have to leave,5826.119,5.6,5828.919
here now Mr Wills this is no way to get,5832.119,6.641,5835.4394999999995
out of here Ione,5834.92,3.84,5836.84
you better go,5847.96,4.8,5850.36
son I think he's,5849.199,3.561,5850.9794999999995
Charlie what are you going to do,5875.679,3.841,5877.5995
son you've got to talk to Maran if you,5880.08,5.519,5882.8395
don't you're going to lose,5883.639,5.52,5886.399
Vicki she's going into court today going,5885.599,5.841,5888.5195
to ask for custody of Vicki charging,5889.159,4.201,5891.259499999999
your unfit as a,5891.44,4.199,5893.5395
parent she's,5893.36,6.759,5896.7395
right I'll hurt Vicki just as I did,5895.639,6.361,5898.8195000000005
what did you,5902.0,4.239,5904.1195
do I want to go,5903.679,6.44,5906.899
home all the way,5906.239,3.88,5908.178999999999
thing of beauty huh,5933.159,7.401,5936.8595
oh I'm sorry I'm late now Americans,5935.8,7.08,5939.34
always in a haste when it is a rich,5940.56,4.079,5942.5995
American it's even wor not rich anymore,5942.88,6.839,5946.2995
mace what happened to the uh o no no,5944.639,7.401,5948.3395
Maurice it changed back to salt water a,5949.719,6.981,5953.2095
year ago oh that's unfortunate maybe,5952.04,5.96,5955.0199999999995
not you must stand with us tonight like,5958.0,5.04,5960.52
Char I don't know,5963.04,5.639,5965.8595
depends Janet will be very,5966.199,4.361,5968.3795
disappointed we have many things to,5968.679,3.601,5970.4795
together come back Charles,5972.28,4.04,5974.3
please oh I'll,5978.04,3.4,5979.74
son what happened oh a slight stroke,6026.639,10.681,6031.9795
when 8 or nine months ago but you never,6032.8,6.08,6035.84
wrote me about,6037.32,6.04,6040.34
it it wasn't,6038.88,4.48,6041.12
serious mostly old,6044.119,3.641,6045.9394999999995
Charlie I read your,6049.639,4.681,6051.9795
honest thanks yeah I liked it I liked it,6057.679,6.601,6060.9795
fine here for you Havana,6066.92,5.239,6069.5395
cigars the kind you,6072.639,6.401,6075.8395
like shall I open them for you oh,6075.32,6.319,6078.4794999999995
doctor says when I'm better,6081.639,3.841,6083.5595
huh where's,6090.119,5.6,6092.919
Vicki you've come for,6093.04,5.88,6095.98
her if I can get her back,6095.719,6.4,6098.919
again good,6098.92,7.799,6102.8195000000005
good daddy daddy daddy,6102.119,4.6,6104.419
taller Daddy,6120.719,6.681,6124.0595
what you're not gray I told everybody at,6123.52,5.48,6126.26
school you'd be,6127.4,5.64,6130.219999999999
gray oh I'm terribly,6129.0,4.04,6131.02
here Claud,6138.719,4.041,6140.7395
Char I'm very happy to see,6144.599,7.241,6148.2195
you thanks for everything thanks as soon,6147.32,7.879,6151.2595
as I got your telephone message I went,6151.84,8.759,6156.2195
to school and got to viig look daddy,6155.199,5.4,6157.898999999999
look it's wonderful as usual,6168.44,6.52,6171.7
Daddy what could we go to the bra,6172.239,4.44,6174.459
remember the railroad,6174.96,6.52,6178.22
train well I oh please please that was,6176.679,6.761,6180.0595
the very first thing I wanted to do when,6181.48,4.199,6183.5795
came youve got about an hour till Mario,6186.679,6.321,6189.8395
comes back I'll wear my new,6189.52,3.48,6191.26
coat how is,6195.119,4.56,6197.398999999999
Marin she's,6196.96,4.279,6199.0995
I want you to know Claude how much I,6201.239,3.721,6203.099499999999
appreciate oh I didn't do,6202.8,4.64,6205.12
anything I showed Mario your,6204.96,5.759,6207.8395
letter she couldn't stop you from seeing,6207.44,5.52,6210.2
Vicki I was hoping she'd let me have,6210.719,3.92,6212.679
back I've got to have a,6214.639,6.721,6217.9995
Claud I need her yes I think she needs,6217.239,9.201,6221.839499999999
you too thanks Daddy daddy hurry daddy,6221.36,8.319,6225.519499999999
the hour is almost up about your,6226.44,6.08,6229.48
Marion if we are,6234.04,6.0,6237.04
careful it may be all,6236.28,3.76,6238.16
daddy why nothing darling why you didn't,6284.639,6.761,6288.0195
even look at me didn't even waar wave at,6288.56,5.76,6291.4400000000005
me you give me another chance you get,6291.4,5.799,6294.2995
back on that train daddy may I sit out,6294.32,4.08,6296.36
oh I'm really getting too old for that,6301.88,6.0,6304.88
sort of thing don't you think,6304.28,7.8,6308.179999999999
so yes you're real old,6307.88,4.2,6309.9800000000005
darling do you have a think of your,6318.92,5.759,6321.7995
yes I don't want you to for get,6324.96,6.679,6328.2995
her I have a picture of her in my room,6328.04,6.079,6331.0795
grandpa says I look like,6331.639,5.361,6334.3195000000005
her do you think so,6334.119,5.881,6337.059499999999
yes very much,6341.119,6.08,6344.159
like this lucky for,6343.36,3.839,6345.2795
me Daddy why don't I live with,6348.119,7.921,6352.0795
you why aren't you,6352.599,5.12,6355.159000000001
yes but not perfectly happy do you know,6357.719,6.241,6360.8395
mean yes I know what you,6364.56,6.8,6367.96
mean then I can come and live with,6367.32,5.96,6370.299999999999
you I don't,6371.36,5.359,6374.0395
know I don't,6373.28,3.439,6374.9995
don't you want me,6381.88,7.759,6385.7595
to of course darling Oh Daddy if you,6384.0,7.199,6387.5995
really love,6389.639,7.48,6393.379
me please let me come and live with you,6391.199,5.92,6394.159
please we'll,6399.679,6.761,6403.0595
see say yes,6402.56,3.88,6404.5
there you see wasn't so hard to say yes,6415.0,6.36,6418.18
it hello Uncle Claude from the b in,6422.159,5.681,6424.9995
which ear and we bought something for,6425.719,4.88,6428.159
you Uncle Claude and for Aunt Marion and,6427.84,5.24,6430.46
something for me too it's a wonderful,6430.599,5.321,6433.2595
store and a wonderful,6433.08,6.24,6436.2
day oh Aunt,6435.92,6.4,6439.12
you want to see what we bought for you,6442.76,4.2,6444.860000000001
it's a surprise look you're late for,6444.88,4.88,6447.32
your nap but I thought to date go on up,6446.96,5.04,6449.4800000000005
to your room don't you want to see your,6449.76,5.359,6452.4395
present do as I say,6452.0,3.119,6453.5595
please hello Maran hello Charles it's,6461.56,6.96,6465.04
good to see you,6465.8,2.72,6467.16
I'm sorry about getting back so late,6474.119,3.961,6476.099499999999
Vicki oh well she would have been too,6478.88,4.52,6481.14
excited to sleep,6481.4,5.719,6484.259499999999
anyway discipline is very,6483.4,6.0,6486.4
important you've done a wonderful job,6487.119,6.241,6490.2395
with Vicki she's grown,6489.4,7.56,6493.179999999999
up how do you find,6493.36,3.6,6495.16
Paris well most of the old crowd is,6498.159,5.96,6501.138999999999
gone funny I dropped in at the dingo bar,6501.44,6.199,6504.5395
this afternoon just to see how it,6504.119,7.361,6507.7995
looked there wasn't a man I,6507.639,3.841,6509.5595
knew I should think you've had enough of,6513.52,4.199,6515.619500000001
bars as I wrote you I take one drink,6519.84,5.759,6522.7195
every afternoon but no more and I take,6522.84,3.68,6524.68
that drink,6525.599,3.08,6527.139
deliberately just so the idea of taking,6526.52,4.28,6528.660000000001
a drink won't get too big of course,6528.679,4.56,6530.959
Charles we,6530.8,4.48,6533.04
understand sometimes I forget and don't,6533.239,2.92,6534.699
drink but well I went to the,6536.159,7.681,6539.9995
dingo see how it looked I went to a few,6540.8,5.52,6543.56
other places,6543.84,5.08,6546.38
too places where,6546.32,6.16,6549.4
uh Helen and,6548.92,3.56,6550.7
I look Maran I just can't keep on,6552.679,6.44,6555.899
talking I'm all tied up and,6555.8,6.319,6558.9595
Marian can I have Vicky,6566.4,6.19,6569.495
back I don't,6573.0,5.679,6575.8395
know it's all very well to talk about,6576.239,5.561,6579.019499999999
one Drinker day but what guarantee have,6578.679,5.081,6581.2195
that well when I I think of those Wasted,6583.76,8.359,6587.9395
Years but I think about them too,6587.8,4.319,6589.9595
I'm working hard now,6597.84,5.2,6600.4400000000005
Marian I've got a contract for several,6599.36,6.359,6602.5395
short stories and I I'm starting out,6603.04,3.679,6604.8795
book and my sister's coming from,6606.719,5.801,6609.6195
Milwaukee to to keep house for,6608.84,3.68,6610.68
me I want the,6613.88,4.96,6616.36
key please,6616.679,4.96,6619.159
Maran if if we wait much longer I I I'll,6618.84,7.359,6622.5195
lose a childhood and and my chance for a,6621.639,10.361,6626.8195000000005
home I I just can't lose it don't you,6626.199,10.881,6631.639499999999
see It'll be almost like having Helen,6632.0,7.84,6635.92
Back Mar I can't help,6639.84,6.239,6642.9595
it I'll never in my life be able to,6643.56,4.32,6645.72
forget that morning when,6646.079,6.401,6649.2795
Helen soaked and and,6647.88,4.6,6650.18
shivering you locked her out,6652.76,6.04,6655.780000000001
Marion but you want to remember one,6656.04,5.76,6658.92
night how long are you going to make me,6658.8,4.56,6661.08
pay for that one,6661.8,4.04,6663.820000000001
night what about those years Helen and I,6663.36,4.52,6665.62
loved each other I don't want to hear,6665.84,5.239,6668.4595
Marion you're not going to let me have,6671.079,3.881,6673.019499999999
I don't want to talk about it,6680.52,4.779,6682.909500000001
anymore I'm sorry,6694.28,3.52,6696.04
charos what will I,6701.52,6.48,6704.76
thanks I'll get dinner start,6728.239,3.92,6730.199
Mar there's no use talking about it he's,6735.96,4.56,6738.24
not getting Vick,6739.159,6.241,6742.2795
not now not tomorrow never why do you,6740.52,9.76,6745.400000000001
hate him that much yes for what he did,6745.4,9.44,6750.12
yes yes it's true he committed an,6750.28,8.319,6754.4394999999995
unforgivable crime against you,6754.84,6.16,6757.92
personally he's guilty of never knowing,6758.599,3.56,6760.379
him you found him but he married,6762.159,6.92,6765.619
Helen yes he's guilty of that too and,6765.32,6.24,6768.44
being guilty of of course he must be,6769.079,4.441,6771.2995
punished the,6771.56,4.36,6773.740000000001
penalty what would hurt him,6773.52,5.76,6776.400000000001
most take away what he loves most his,6775.92,5.6,6778.72
girl my poor,6788.679,6.52,6791.939
darling we can't have everything we,6791.0,4.199,6793.0995
want take me I wanted all your love,6795.84,7.72,6799.7
I wanted our own,6801.199,6.321,6804.3595
child a child out of our love not out of,6803.56,6.159,6806.6395
disappointment,6828.76,11.79,6834.655000000001
Charles may I see you outside for a,6852.119,4.241,6854.2395
I I don't think Helen would have wanted,6879.56,4.8,6881.96
