text,start,duration,time_midpoint
to me Jeffrey is waiting for me now,5070.48,5.8,5073.379999999999
nobody's waiting for you Jeffrey is dead,5073.0,7.199,5076.5995
Tina dead for both of us father buried,5076.28,6.52,5079.54
him in the garden near the,5080.199,8.0,5084.199
bow I killed him I killed him he was,5082.8,9.2,5087.400000000001
going to leave me and I killed him give,5088.199,7.401,5091.8994999999995
them to me,5092.0,3.6,5093.8
Tina here are the ladders Tina,5111.92,32.569,5128.2045
at that moment I recalled Juliana's,5253.56,6.4,5256.76
words as long as she had that house she,5256.92,5.3,5259.57
would never die,5259.96,17.01,5268.465
and as long as Tina had been in that,5278.92,6.12,5281.9800000000005
house among its memories she had never,5281.6,6.44,5284.820000000001
