text,vader,textblob,llama3
"The image is a black and white photograph, which evokes a sense of timelessness and simplicity. The absence of color allows the viewer to focus on the composition and textures within the frame. The subject of the image is a person's face, captured in close-up. This framing technique emphasizes the facial features and expressions, drawing the viewer's attention directly to them. The background is blurred, further isolating the subject and creating a sense of depth. The lighting appears natural, suggesting that the photo was taken during daylight hours. The overall composition and elements within the image suggest a thoughtful and artistic approach to photography.",0.743,0.035069444444444445,0.8
"The image captures a moment of a train journey, specifically focusing on the iconic ""London Eye"" in London, UK. The scene is set at dusk, with the sky painted in shades of dark blue and the cityscape illuminated by artificial lights. A black steam locomotive, bearing the number 158 801, is the central focus of the image. It's traveling from left to right on a curved track, suggesting motion and direction. The train's journey is set against the backdrop of the London Eye, a large Ferris wheel that stands tall in the distance. The composition of the image places the train in the foreground, drawing attention to its details and actions. Meanwhile, the London Eye, although smaller in size due to the distance, holds prominence in the background, adding depth and context to the scene. Overall, the image evokes a sense of nostalgia and adventure, capturing the essence of a classic mode of transportation against the backdrop of one of the world's most iconic landmarks.",0.3818,0.075,0.7
"The image captures a serene scene on a tree-lined street. A vintage car, painted in hues of blue and white, is parked on the right side of the road. The car's position suggests it's facing towards us, inviting our gaze to follow its direction. The street itself is lined with trees, their leaves forming a natural canopy overhead. The sky peeks through these gaps, adding depth to the scene. The overall composition of the image creates a sense of tranquility and nostalgia, reminiscent of simpler times. As for the sentiment or emotions evoked by film-maker elements, I'll provide a brief overview: 1. Facial Expression: The car's vintage design might evoke feelings of nostalgia or admiration for classic automobiles. 2. Camera Angle: The perspective from which the photo is taken adds depth to the image, making the street and trees appear longer and more expansive. 3. Lighting: Natural light filtering through the tree canopy casts a soft glow on the scene, enhancing its peaceful ambiance. 4. Framing and Composition: The placement of the car within the frame draws our attention towards it, while the surrounding trees create a balanced composition that guides our eyes along the street. 5. Setting and Background: The tree-lined street suggests a quiet residential area or perhaps a park-like setting, adding to the overall calmness of the scene. 6. Color: The blue and white color scheme of the car contrasts nicely with the greenery of the trees, creating a visually pleasing palette that enhances the image's nostalgic feel. 7. Body Language and Gestures: The car is stationary, suggesting it's at rest or perhaps waiting for someone to return from an errand. 8. Props and Costumes: There are no visible props or costumes in this image. 9. Depth of Field: The focus on the car suggests that the photographer wanted to emphasize its vintage design and colors. 10. Character Positioning and Interaction: Since there's only one object, a car, in this image, there's no character positioning or interaction to discuss. Overall, the image evokes feelings of nostalgia and tranquility through its composition, lighting, color scheme, and the presence of the vintage car on a tree-lined street.",0.9843,0.0870600414078675,0.72
"In the image, a man is standing in front of a table adorned with various objects. The man's body language suggests he is engrossed in observing the items on the table. The table itself is covered with a white tablecloth and holds several objects including a teapot, a vase, and a bowl filled with flowers. The setting appears to be indoors, as evidenced by the window in the background. A curtain hangs from this window, adding to the indoor ambiance. The color palette of the image is dominated by shades of brown and beige, which are reflected in the man's attire, the tablecloth, and the objects on the table. The composition of the image places the man as the central figure, with the table and its contents serving as a focal point. The positioning of the man and the table suggests that he is deeply engaged with the items on the table, perhaps contemplating their significance or appreciating their beauty. Overall, the image captures a quiet moment of introspection and appreciation for everyday objects.",0.9476,0.022222222222222223,0.85
"The image captures a scene from the movie ""The Grand Budapest Hotel"". The setting is a hotel lobby, adorned with a chandelier and a floral pattern on the wallpaper. In the foreground, there's a table set for two, complete with a vase of flowers and a bottle of champagne. Two characters are present in the scene. On the left, a man dressed in a blue suit is seated at the table, looking up at the woman standing to his right. The woman, wearing a pink dress and a pearl necklace, stands tall with her hands on her hips. The image evokes a sense of elegance and sophistication, enhanced by the grandeur of the hotel lobby and the formal attire of the characters. The chandelier and floral wallpaper add a touch of opulence to the scene, while the champagne bottle suggests a celebration or special occasion. The man's upward gaze towards the woman indicates admiration or respect, adding a romantic element to the image. The composition of the image is balanced with the table in the foreground drawing the viewer's eye into the scene, and the characters positioned against the backdrop of the lobby creating depth and perspective. The colors used are rich and vibrant, from the blue of the man's suit to the pink of the woman's dress, contributing to the overall visual appeal of the image. Overall, this image is a beautiful representation of the film ""The Grand Budapest Hotel"", capturing its essence through thoughtful composition, color use, and character portrayal.",0.9921,0.17550125313283207,0.65
"The image captures a moment in a restaurant setting. At the center of the frame, a man is seated at a table covered with a white tablecloth. He's wearing a blue blazer and a white shirt, adding a touch of formality to the scene. His gaze is directed off to the side, suggesting he might be engaged in conversation or lost in thought. The table setting includes a plate of food, indicating that the man is likely having a meal. A glass of water sits on the table as well, possibly belonging to him. The background features a window adorned with curtains and a plant, adding a homely touch to the restaurant ambiance. In terms of color, the image has a warm and inviting palette dominated by shades of blue, white, and green. The man's blue blazer stands out against the white tablecloth, while the green from the plant in the background adds a refreshing contrast. The composition of the image places the man at the center, drawing attention to him as the main subject. His body language and facial expression suggest a relaxed yet thoughtful mood. The camera angle is slightly elevated, looking down on the man, which gives us a comprehensive view of his surroundings while maintaining focus on him. Overall, the image presents a snapshot of a quiet moment in a restaurant, with the man's attire, table setting, and surrounding environment all contributing to the scene's narrative.",0.9231,0.025120772946859906,0.42
"In the image, actress Ginnifer Goodwin is captured in her role as Mary Margaret Blanchard from the TV show ""Once Upon a Time"". She stands in front of a white door with vertical blinds, positioned slightly to the left. Dressed in a light purple blazer and a black and white polka dot blouse, she exudes an air of elegance. Her hair is styled in a neat bob, adding to her classic look. She gazes off to the side with a slight smile on her face, her expression one of quiet contemplation. The overall scene is set against a backdrop of a room painted in soothing shades of white and gray.",0.8627,0.030555555555555558,0.65
"In the image, a man is seated at a table in what appears to be a restaurant or cafe. He is dressed in a blue blazer and a white shirt, giving off an air of casual elegance. His facial expression is one of concern as he looks directly into the camera, suggesting that he might be worried about something. The setting is cozy and intimate, with a window visible in the background adorned with curtains. The table is set with various items including a plate of food, a glass of water, and a vase filled with flowers, adding to the homely atmosphere. The image captures a moment of quiet introspection amidst a bustling environment, as suggested by the man's concerned expression and the busy setting around him. The colors in the image are warm and inviting, further enhancing the overall ambiance.",0.8442,0.049999999999999996,0.45
"In the image, actress Jessica Chastain is captured in her role as ""The Queen"" from the movie ""Crimson Peak"". She stands against a backdrop of a floral wallpaper adorned with a red and gold pattern. Dressed in a light purple suit that contrasts beautifully with the vibrant background, she pairs it with a blue polka dot blouse underneath. Her hair is styled into loose curls, adding to her regal appearance. Jessica Chastain's expression is serious as she gazes off to the side, embodying the stern and authoritative demeanor of her character. The image captures a moment that seems to be straight out of a period drama film, with Jessica Chastain's portrayal of ""The Queen"" commanding attention.",0.802,0.1673789173789174,0.7
"In the image, a man is seated at a table in what appears to be a restaurant or cafe. He is dressed in a blue robe and has dark hair. His facial expression suggests that he is surprised or startled by something off-camera. The table before him holds a plate of food and a glass of water. The background features a window with curtains, suggesting an indoor setting. The overall color scheme of the image is muted, with the man's blue robe standing out against the neutral tones of his surroundings.",0.0516,-0.008333333333333331,0.2
"The image captures a moment of a woman standing in front of a floral wallpaper. She is dressed in a pink blazer and a black polka dot blouse, adding a pop of color to the scene. Her gaze is directed off to the side, suggesting she might be lost in thought or observing something out of frame. The camera angle is slightly elevated, giving us a unique perspective of her. The lighting is soft, casting gentle shadows and highlighting her features. The framing and composition of the image place her as the central focus, with the floral wallpaper serving as an interesting backdrop. The overall mood of the image is serene and contemplative.",0.8137,0.08240740740740742,0.7
"The image portrays a scene from the movie ""Mildred Pierce"" featuring actress Joan Crawford. She is standing in a room adorned with floral wallpaper, positioned slightly to the left of the frame. Dressed in a beige trench coat and a black polka dot blouse, she exudes an air of elegance and sophistication. Her facial expression is one of slight smile, adding a touch of warmth to her otherwise serious demeanor. The camera angle is from a low angle, looking up at her, which enhances her towering presence in the frame. The lighting is diffused, casting soft shadows and highlighting her features. The framing and composition of the image are such that she occupies most of the space, drawing the viewer's attention directly to her. The overall color palette is muted, with the beige of her coat contrasting against the black of her blouse and the floral pattern of the wallpaper. Her body language and gestures suggest a sense of calm and composure. The props and costumes are simple yet effective in setting the scene for this character-driven narrative. The depth of field is shallow, focusing on Joan Crawford while subtly blurring the background. The positioning of the character and her interaction with the environment create a dynamic yet harmonious composition that tells a story without words.",0.9572,0.011666666666666667,0.65
"The image captures a moment of a woman stepping out of a car. The woman, dressed in a pink dress and jacket, is seen from the side, her body slightly turned towards the camera as she exits the vehicle. The car itself is white with a contrasting black interior, parked on a tree-lined street that adds a serene backdrop to the scene. The image is taken from a low angle, making the woman appear larger than life, adding a dramatic effect to the composition. The lighting in the image is natural and bright, suggesting it might be daytime. The overall mood of the image is positive and uplifting, with the woman's action of stepping out of the car symbolizing freedom and new beginnings.",0.9337,0.030536130536130537,0.7
"The image captures a moment of a woman in motion, walking on a sidewalk. She is dressed in a vibrant purple jacket and pants, which stand out against the more muted colors of her surroundings. A black purse is slung over her shoulder, adding to her casual yet stylish attire. She is moving towards the right side of the frame, suggesting a sense of purpose or destination. Her face is turned slightly to the left, indicating that she might be looking at something or someone off-frame. The background features a white building with columns, providing a stark contrast to the woman's colorful outfit. The building's architecture suggests it could be an important or significant structure. The image is taken from a low angle, which gives the viewer a unique perspective and emphasizes the woman's figure against the backdrop of the building. This angle also adds a sense of depth and dimension to the scene. Overall, the image evokes a sense of movement and style, with the woman's vibrant outfit and confident stride taking center stage. The composition and framing of the shot further enhance these elements, creating a visually engaging scene.",0.9423,0.13503401360544215,0.75
"In the image, a man and a woman are walking on a path in front of a white house. The man is dressed in a black suit, while the woman is wearing a pink dress. They are both moving towards the camera, with the man slightly ahead of the woman. The house behind them has a porch supported by columns and a railing. A car is parked on the right side of the image, near the house. The sky above is blue, suggesting it might be a clear day. The overall scene gives off a sense of a peaceful residential area.",0.7964,-0.008134920634920639,0.65
"The image captures a serene moment in a garden setting. A woman, dressed in a blue dress and purple heels, is seen walking on a path lined with bushes. She carries a black purse over her shoulder, adding a touch of elegance to her stride. The path she treads on leads towards a white building adorned with green shutters, nestled amidst lush trees. The image is taken from a low angle, making the woman appear larger and more prominent in the frame. The lighting is natural, suggesting it's daytime, and the colors are vibrant, enhancing the overall mood of the scene. The composition of the image, with its focus on the woman and her journey towards the building, evokes a sense of anticipation and curiosity about what lies ahead for her.",0.8977,0.08333333333333333,0.75
"In the image, a man is seen walking on a path that leads to a white building with a green roof. The man is dressed in a blue suit and tie, and he carries a black briefcase in his hand. He appears to be in motion, perhaps heading towards the building. The setting suggests an outdoor environment, possibly during the day given the visibility of the surroundings. The image captures a moment of solitude and purpose, as the man strides confidently towards his destination. The colors used are predominantly blue, green, and white, creating a calm and serene atmosphere. The man's body language and facial expression suggest determination and focus, indicating that he is on an important mission or meeting. The composition of the image places the man in the center, drawing attention to him immediately. His position relative to the building suggests that he is close to it, perhaps about to enter. The camera angle is not specified but appears to be a standard perspective shot, capturing the scene from a distance and providing a comprehensive view of the surroundings. The lighting in the image is natural, suggesting that it was taken during daylight hours. The absence of any artificial light sources indicates that the photo was likely taken outdoors or on a cloudy day with ample natural light. Overall, this image evokes a sense of anticipation and purpose, as the man in the blue suit walks towards his destination under a clear sky.",0.9598,0.04083333333333334,0.65
"In the image, actress Cate Blanchett is captured in a moment of quiet contemplation. She stands in front of a mirror, her reflection revealing a thoughtful expression on her face. Dressed in a beige trench coat and a black polka dot scarf, she exudes an air of sophistication and elegance. The setting appears to be a room with a window that offers a glimpse of a building outside, adding depth to the scene. The overall composition of the image, with Cate Blanchett's reflection in the mirror and the view from the window, creates a sense of introspection and introspective mood.",0.7783,0.05555555555555556,0.7
"The image captures a scene from the movie ""Forrest Gump"". The focus is on the character Forrest Gump, portrayed by Tom Hanks. He is seen looking out of a car window with a concerned expression on his face. The interior of the car forms the background of the image. The color palette is dominated by shades of brown and gray, reflecting the indoor setting and the seriousness of the scene. The lighting is diffused, adding to the overall calm and serious mood of the image. The framing and composition are such that Forrest Gump's face is in sharp focus, drawing attention to his expression and making it a central element of the image. The car window through which he peers adds depth to the image, creating a sense of space and perspective. The body language and gestures of Forrest Gump further emphasize his concern or worry. There are no props or costumes visible in this particular scene. The overall sentiment evoked by this image is one of concern or worry, as expressed through Forrest Gump's facial expression and the serious atmosphere of the scene.",-0.6486,-0.02954545454545454,-0.7
"The image captures a moment from the movie ""The Good Shepherd"" featuring actor Robert De Niro. In this scene, De Niro is seen in character as J. Paul Marat, the leader of the Knights of Malta. He is standing behind a glass window, his face etched with an expression of concern or worry. The room around him is dimly lit, adding to the overall somber tone of the image. The color palette is muted, further enhancing the serious and intense atmosphere of the scene.",-0.4215,0.038095238095238085,-0.5
"The image captures a moment from the movie ""Forrest Gump"". The focus is on the character of Forrest Gump, portrayed by Tom Hanks. He is seen in his signature black suit and tie, standing in front of a window that offers a view of trees outside. His expression is one of concern or worry, suggesting an intense moment in the plot. The camera angle is from behind Forrest, looking through the window at him, adding depth to the scene. The lighting is natural, coming through the window and illuminating Forrest's face, casting shadows that add contrast and dimension to the image. The framing of the shot places Forrest centrally, drawing attention to his expression and making it the focal point of the image. The composition balances the elements of light, shadow, and subject matter to create a compelling visual narrative.",0.4588,0.03333333333333333,0.6
"The image captures a moment from the movie ""To Kill a Mockingbird"". The focus is on two characters, Scout Finch and her father Atticus Finch, standing in front of a mirror. Scout, positioned on the left side of the frame, is looking at her reflection with a slight smile on her face. On the right side of the frame, Atticus is looking at his daughter with a warm smile. The background reveals a serene setting with trees and a house, adding to the overall calmness of the scene. The image beautifully encapsulates the bond between the characters and their quiet moments together.",0.8522,0.241005291005291,0.7
"The image captures a scene from the movie ""Forrest Gump"". The focus is on the character Forrest Gump, portrayed by Tom Hanks. He is seen through a car window, his face filling most of the frame. His expression is one of surprise or shock, as if he has just witnessed something unexpected. The setting appears to be a forest, with trees visible in the background. The lighting is natural and diffused, suggesting it might be daytime. The color palette is dominated by earth tones, with the green of the trees contrasting against the lighter colors of Gump's clothing. Gump's body language and gestures are expressive, indicating his surprise or shock. His facial expression mirrors this, adding to the overall impact of the scene. There are no discernible props or costumes in the image. The composition is such that Gump's face is the central element, with the car window framing him perfectly. The forest in the background provides a sense of depth and context to the scene. The image does not contain any text or other objects that can be counted or located precisely. Overall, the image effectively conveys a moment of surprise or shock in the ""Forrest Gump"" movie, using a combination of facial expression, body language, setting, lighting, and composition to create a compelling visual narrative.",0.836,0.19218749999999998,0.7
"In the image, a man is seen walking away from the camera on a sidewalk. He is dressed in a dark suit and tie, suggesting a formal or professional setting. The background of the image features trees lining the sidewalk, indicating that the location could be a park or a similar outdoor area. The man's posture and direction of movement suggest he is moving towards the right side of the frame. The color palette of the image is dominated by shades of green from the trees and blue from the sky, creating a calm and serene atmosphere. The lighting appears natural, with no signs of artificial light sources visible in the image. As for the film-maker's elements, the facial expression of the man is neutral, neither revealing joy nor sadness. The camera angle is not specified, but given that it's a still image, we can assume it was taken at eye level or slightly lower to capture the man's upper body and face. The framing of the shot places the man in the center of the frame, drawing attention to him as the main subject. The setting and background are well-composed, with the trees providing a sense of depth and perspective. The color is balanced, neither too bright nor too dark, which contributes to the overall mood of the image. In terms of body language and gestures, the man appears relaxed but purposeful in his stride. His hands are not visible in the frame, so we cannot comment on any hand gestures he might be making. As for props and costumes, there are no additional objects or clothing items that can be identified from the image. The depth of field is not specified, but given that it's a still image, we can assume that it was set to capture the man in sharp focus while keeping the background slightly blurred. This technique helps emphasize the subject and creates a sense of three-dimensionality in the image. Finally, there are no visual effects or post-processing techniques visible in the image. The overall composition is simple yet effective, focusing on the man as the main subject against a natural backdrop.",0.9437,0.05034562211981568,0.42
