text,vader,textblob,llama3
"In the image, a man and a woman are engaged in what appears to be a conversation. The man is dressed in a dark suit and tie, while the woman is wearing a black dress. They are seated at a table covered with a white tablecloth. On the table, there are two glasses filled with red wine and a small plate of food. The setting is a restaurant or bar, as indicated by the presence of plants and a planters box in the background. The lighting in the image is dim, creating an intimate atmosphere. The man and woman are positioned close to each other, suggesting they are engaged in a private conversation. The overall color scheme of the image is muted, with the dark clothing of the man and woman contrasting against the white tablecloth. The red wine in the glasses adds a pop of color to the scene. In terms of body language and gestures, both the man and woman appear to be listening intently to each other, indicating that their conversation is serious or important. Their facial expressions are not visible in the image, but their posture suggests they are actively engaged in the discussion. The props and costumes in the image - the man's suit, the woman's dress, the glasses of wine, and the plate of food - all contribute to setting the scene for a sophisticated conversation taking place in a relaxed yet elegant environment. The depth of field is shallow, focusing on the man and woman at the table while blurring the background, further emphasizing their interaction. Overall, the image captures a moment of connection between two individuals, set against the backdrop of a cozy restaurant or bar. The use of lighting, color, composition, and body language all contribute to creating an atmosphere that is both intimate and engaging.",0.9839,0.027160493827160504,0.6
"In the image, a man is seated at a table in what appears to be a restaurant or cafe. He is dressed in a black suit and tie, giving him a formal appearance. His facial expression is one of concern or worry, as if he's deeply engrossed in thought or anticipating an event. The woman sitting across from him seems to be the focus of his attention. She is holding a small object in her hand, which could possibly be a pen or pencil. Her presence and the man's focused gaze suggest that she might be important to him. The setting is quite simple - a table with chairs around it. The background is blurred, drawing focus to the two main characters. The lighting is soft and diffused, creating a calm atmosphere. The colors in the image are muted, further emphasizing the serious tone of the scene. In terms of body language and gestures, both characters appear relaxed but alert. The man's posture suggests he's listening intently to the woman, while her gesture with the object could indicate she's explaining something or asking for his opinion. The props and costumes in the image are minimalistic - just the man's suit and tie, the woman's dress, and the small object she's holding. These elements add depth to the scene without overwhelming it. Overall, this image captures a moment of intense focus and concern between two characters in a casual yet intimate setting. The use of lighting, colors, and composition all contribute to creating a sense of calm intensity.",0.9441,0.03508771929824562,0.45
"In the image, actress Gwyneth Paltrow is captured in a moment of quiet conversation. She's seated on a couch, her posture relaxed yet attentive. Dressed in a black suit and a crisp white blouse, she holds a drink in one hand and a small plate of food in the other, suggesting a casual social setting. Her gaze is directed towards another person who is partially visible off-screen, indicating an ongoing interaction. The overall scene conveys a sense of intimacy and warmth.",0.8807,-0.04166666666666667,0.65
"In the image, a man and a woman are seated on a couch in what appears to be a living room. The man is dressed in a dark suit and tie, while the woman is wearing a black dress. The man is holding a small glass of wine in his hand, which he is sniffing. His facial expression suggests that he is making a face or reacting to something, possibly an unpleasant smell from the wine. The background features a wall with a window, adding depth to the scene. The overall atmosphere of the image seems to be one of discomfort or displeasure.",-0.4019,-0.20277777777777775,-0.7
"The image captures a scene from the movie ""The Godfather"". In the center of the frame, we see Al Pacino, portraying the character Michael Corleone, seated at a table. He is dressed in a black suit and tie, embodying the formal attire of the era. Across from him, Diane Lane, playing the character Kay Adams, is seen wearing a black dress complemented by a pearl necklace. The setting is a dimly lit room adorned with plants, adding to the intensity of the scene. The characters are engaged in an intense conversation, their faces reflecting deep thought and concern. Michael's gaze is directed towards Kay, indicating a shift in the dynamics of their relationship. The overall composition of the image suggests a pivotal moment in the narrative, evoking emotions of suspense and intrigue.",0.7717,0.04583333333333333,0.45
"In the image, there are three individuals seated around a table in what appears to be a restaurant or cafe. The person on the left is dressed in a black suit and tie, while the individual in the middle is wearing a blue dress. On the right, the third person is also clad in a black suit and tie. The table between them holds a small vase filled with flowers and a glass of water. The background features a window that offers a view of trees outside. The overall atmosphere suggests a casual yet intimate gathering among friends or colleagues.",0.5994,-0.00650793650793651,0.6
"The image captures a scene from the movie ""The Grand Budapest Hotel"". The setting is a restaurant, characterized by its green plants and a large window in the background. In the foreground, there's a table where three individuals are seated. On the left, a man dressed in a black suit is shaking hands with another man on the right, who is wearing a gray suit. The third person, a woman in a black dress, is looking at the man in the gray suit. The image evokes a sense of professionalism and formality, emphasized by the formal attire of the characters and their actions. The handshake between the two men suggests a business agreement or partnership, while the woman's gaze towards the man in the gray suit indicates her attention is focused on him. The color palette of the image is dominated by shades of black, gray, and green, which adds to the overall formal and professional atmosphere of the scene. The positioning of the characters and their interactions are carefully composed to create a balanced and engaging visual narrative.",0.9022,0.03333333333333333,0.42
"The image captures a scene from the movie ""Forrest Gump"". In the center of the frame, Forrest Gump is seated at a table in a restaurant. He's dressed in a blue suit and tie, looking out of place amidst the hustle and bustle around him. Across from him, a waitress is standing, her attention focused on taking his order. The background is filled with other patrons, their faces blurred and indistinct, adding to the sense of chaos that Forrest seems so at ease with. The color palette of the image is muted, with the blue of Forrest's suit standing out against the otherwise neutral tones. The overall composition of the image places Forrest as the focal point, his gaze directed towards something outside the frame, leaving us to wonder what has caught his attention.",0.1725,0.025000000000000005,0.4
"In the image, we see a scene from the movie ""The Godfather"". The main focus is on two characters, Don Vito Corleone and Carmela Corleone. They are both dressed in formal attire, suggesting a significant event or meeting. Don Vito Corleone, played by Marlon Brando, is standing to the left of the frame. He is wearing a dark suit with a white shirt and a black tie. His facial expression is one of anger as he points his finger at Carmela, indicating a tense moment in their conversation. Carmela Corleone, played by Talia Shire, is sitting to the right of Don Vito. She is dressed in a black dress and has a red flower pinned to her lapel, adding a touch of color to her outfit. Her expression is one of concern as she looks at Don Vito, reflecting the intensity of their conversation. The setting is an indoor room with wooden paneling on the walls and a window in the background. The lighting is dim, creating a serious and intense atmosphere that matches the gravity of the characters' expressions and actions. Overall, this image captures a pivotal moment in ""The Godfather"", filled with tension and emotion as Don Vito and Carmela engage in what appears to be a critical conversation.",-0.128,0.008869047619047615,-0.7
"The image captures a moment from the movie ""Forrest Gump"". The main subject is Forrest Gump, portrayed by Tom Hanks. He is seen in his signature attire - a blue suit and tie. His face carries a shocked expression as he looks off to the side, suggesting an unexpected event or revelation. The setting appears to be a room with a striped wall and a mirror on the right side of the frame. The overall composition and elements within the image contribute to the dramatic effect of the scene.",-0.3182,-0.09345238095238095,0.7
"The image captures a moment from the movie ""Forrest Gump"". The central figure is Tom Hanks, portraying the character of Forrest Gump. He is seated at a table, his hands clasped together in front of him. His expression is one of concern or worry, suggesting that he is deeply engrossed in thought or facing an important decision. The setting appears to be a restaurant or diner, with a window visible in the background. The color palette of the image is muted, adding to the overall serious tone of the scene.",-0.1298,0.013333333333333341,0.2
"In the image, a man and a woman are seated at a table in what appears to be a restaurant or cafe. The man is dressed in a dark suit and tie, while the woman is wearing a black dress. They are engaged in conversation, with the man holding a glass of wine in his hand. The table between them holds a menu and a small vase filled with flowers. The setting is characterized by a green plant visible behind the couple, adding a touch of nature to the scene. A window can also be seen in the background, suggesting that the location might have an outdoor view or natural light coming in. In terms of color, the dominant hues are green from the plant and black from the woman's dress. The man's dark suit adds contrast to the scene. The body language of both individuals suggests a relaxed yet attentive atmosphere, indicating they are enjoying their time together. The props and costumes used in this image contribute to creating an authentic dining experience for the characters. The menu on the table indicates that they might be discussing what to order, while the vase with flowers adds a touch of elegance to the setting. As for visual effects and post-processing, there's no text present in the image, so no additional elements need to be considered here. The relative positions of the objects and characters are accurately represented, providing a clear and detailed depiction of the scene.",0.9504,0.07583333333333335,0.65
"The image presents a serene scene of two windows set against a backdrop of a mountainous landscape. The left window is adorned with a painting of a tree, while the right window features a depiction of a bird in flight. Both paintings are rendered in a realistic style, capturing the intricate details of their respective subjects. The windows themselves are framed by dark wood, adding a rustic charm to the overall setting. A metal handle can be seen on the right window, suggesting it might be used for opening or closing the window. The background reveals a picturesque landscape with mountains and water, further enhancing the tranquil ambiance of the scene. The colors in the image are predominantly earthy tones, with shades of brown and green being most prominent, reflecting the natural elements within the paintings and the surrounding environment. In terms of body language and gestures, the bird in flight appears to be soaring freely, while the tree stands tall and firm, symbolizing stability amidst the changing landscape. The positioning of these elements within their respective windows creates a harmonious balance between motion and stillness. Overall, the image evokes a sense of calm and tranquility, inviting viewers to immerse themselves in the peaceful scenery depicted within its frames.",0.9884,0.12433862433862435,0.7
"The image captures a moment inside a car, featuring two individuals. The person on the left is donned in a pink jacket and a red scarf, holding onto the steering wheel of the car. On the right, another individual is seen wearing a black suit and tie, looking towards the left with an expression of concern etched on their face. The interior of the car is dimly lit, creating a sense of intimacy and tension. The background is dark, further emphasizing the occupants of the car. The overall color scheme is muted, adding to the somber atmosphere of the scene. In terms of composition, the two individuals are positioned in such a way that they command attention, with the person on the left appearing closer due to their proximity to the camera. The steering wheel held by the individual on the left adds an element of dynamism to the otherwise static scene. The image is devoid of any text or discernible actions beyond what has been described. The relative positions of the objects and individuals remain constant, with no apparent movement or interaction between them. The focus remains firmly on the two individuals within the car, their expressions and attire suggesting a narrative that extends beyond the frame of the image.",-0.25,0.0008658008658008653,-0.7
"The image captures a scene from the movie ""Moulin Rouge"" featuring actors Nicole Kidman and Ewan McGregor. Kidman, portraying the character Satine, is seated in the driver's seat of an old car with her hand delicately placed on the steering wheel. She gazes out of the window, lost in thought. Beside her, McGregor, playing the character Christian Proust, is seen smoking a cigarette. The interior of the car and the background are blurred, drawing focus to the characters and their expressions. Kidman's expression is one of concern or worry, while McGregor's appears more serious. The overall color palette of the image is muted, adding to the dramatic effect of the scene.",0.0534,-0.06666666666666665,0.3
"In the image, there are two individuals seated in a car. The person on the left is holding a cigarette and appears to be engaged in conversation with the person on the right. The individual on the right seems to be listening attentively. The setting of the image is outdoors, with trees visible in the background. The lighting suggests that it might be daytime. The colors in the image are predominantly neutral tones, with some variation in the clothing and props. The overall composition of the image gives a sense of a casual, relaxed conversation taking place between friends or acquaintances.",0.8689,0.06734693877551019,0.35
"The image captures a serene night scene in a residential area. The main focus is on a white picket fence that stretches across the frame, its posts standing tall and evenly spaced. The fence is adorned with a few bushes of varying sizes, adding a touch of green to the otherwise monochrome setting. On the left side of the image, there's a house painted in a light color, possibly white or beige. A window is visible on the second floor, hinting at life within. On the right side, another house can be seen, this one with a dark roof and a single window on the first floor, suggesting it might be unoccupied. The sky above is a deep black, indicating that it's nighttime. The absence of any artificial light sources or moving objects gives the image a tranquil, almost timeless quality. There are no discernible texts or countable objects in the image. The relative positions of the houses and the fence suggest a well-planned residential layout. Please note that this description is based on the visible elements in the image and does not include any speculative or imaginary content.",0.5864,0.005357142857142859,0.7
"The image captures a scene from the movie ""No Country for Old Men"". The central figure is Carson Wells, portrayed by actor Woody Harrelson. He is seated in the driver's seat of an old car, his face etched with a determined expression. The setting is a dimly lit street at night, adding to the overall somber tone of the scene. The composition and lighting are such that Wells is the focal point, drawing the viewer's attention immediately to him. The color palette is predominantly dark, further enhancing the dramatic effect of the image. The body language and gestures of Wells suggest a sense of resolve and determination, reflecting his character's stubbornness in the face of adversity. The props and costumes are minimalistic, focusing on the car and Wells' attire, which includes a hat and a suit. The depth of field is shallow, with Wells sharply in focus against the blurred background, emphasizing his importance in this scene. The visual effects and post-processing techniques used here are subtle yet effective, ensuring that the viewer's attention remains firmly on Wells and his expression.",0.9403,-0.04499999999999999,0.7
"The image captures a scene from the movie ""Forrest Gump"". In the foreground, there's a man dressed in a black suit and hat. He is standing next to a car that has a woman sitting inside. The car is parked on a street with a building visible in the background. The photo is taken from a low angle, giving a unique perspective to the scene. The lighting is dim, adding a sense of mystery and intrigue to the image. The colors are muted, further enhancing the dramatic effect of the scene. The man's facial expression and body language suggest he might be observing or waiting for something. The woman inside the car appears calm and composed. The overall composition of the image suggests a significant moment in the movie, possibly related to the plot or character development.",0.5267,0.04583333333333334,0.45
"The image captures a moment from the movie ""Pulp Fiction"". The scene unfolds in a dimly lit room, with the focus on two characters: John Travolta and Uma Thurman. John Travolta, dressed in a black suit and hat, stands behind Uma Thurman who is seated on a couch. She's wearing a pink jacket and holding a white glove in her hand. The image is taken from a low angle, adding to the dramatic effect of the scene. The overall mood of the image is intense and suspenseful, reflecting the high-stakes nature of the characters' situation in the film.",0.34,-0.08,0.7
"The image captures a moment of interaction between two individuals in the backseat of a car. The person on the left, clad in a blue shirt and gray pants, is engaged in conversation with the person on the right, who is dressed in a black suit and tie. The interior of the car forms the backdrop of this scene, with the window framing their exchange. The composition of the image places the two individuals at the center, drawing attention to their interaction. The lighting is diffused, creating a soft glow that enhances the overall mood of the scene. The color palette is dominated by shades of blue and gray, reflecting the attire of the individuals and the interior of the car. In terms of body language and gestures, both individuals appear engaged in the conversation, with their postures suggesting active listening and response. Their facial expressions are not visible in the image, but one can imagine them maintaining eye contact or focusing on each other's faces to emphasize the seriousness of their discussion. The props and costumes used in this scene are minimalistic yet effective. The individuals' attire, the car interior, and any other elements that might be present in the background contribute to the overall narrative of the image without overwhelming the viewer with too many details. The depth of field is shallow, focusing on the two individuals while blurring the background. This technique helps create a sense of intimacy between the subjects and further emphasizes their interaction. In terms of character positioning and interaction, the two individuals are seated close to each other, suggesting a shared experience or a common topic for discussion. Their relative positions indicate that they are facing each other, maintaining eye contact, and actively participating in the conversation. The visual effects and post-processing elements used in this image are subtle yet impactful. They enhance the mood of the scene without detracting from the authenticity of the subjects' interaction. Overall, the film-maker has skillfully utilized various elements to create a compelling narrative that captures a moment of connection between two individuals in an everyday setting.",0.9753,0.0028571428571428563,0.42
"The image captures a scene of a vintage car, painted in vibrant hues of red and blue, parked on a street at night. The car is positioned slightly off-center to the right, facing towards the left side of the frame. It's a two-door coupe with a white roof, adding to its classic charm. In the background, there are houses nestled among trees, their details softened by the darkness of the night. A street lamp stands tall on the left side of the image, casting a warm glow that illuminates the scene. The car itself is adorned with a license plate and a bumper sticker, hinting at its journey through time. The overall composition of the image evokes a sense of nostalgia and tranquility, as if inviting the viewer to take a leisurely drive down memory lane in this beautiful vintage car.",0.9479,0.13437118437118437,0.7
"The image captures a scene of a vintage car, painted in vibrant hues of red and blue, parked on a street at night. The car is positioned facing the left side of the frame, its headlights piercing the darkness. The background reveals a white picket fence, standing tall against the night sky, with a house nestled behind it. A solitary tree stands guard next to the fence, adding to the serene ambiance of the scene. The camera angle is particularly striking, taken from a low vantage point that looks up at the car, lending it an imposing presence. The lighting is dim, casting long shadows and creating a sense of depth and dimension in the image. The framing is precise, with the car perfectly centered in the frame, drawing the viewer's attention immediately. The setting is further enhanced by the darkness of the night sky, providing a stark contrast to the brightly lit foreground. The colors are rich and vivid, with the red and blue of the car standing out against the white fence and the dark background. In terms of body language and gestures, there's a sense of stillness in the image, as if time has momentarily paused. There are no discernible props or costumes, and the depth of field is shallow, focusing all attention on the car. The visual effects are minimal but effective, with the headlights of the car providing the only source of light in this nocturnal setting. The post-processing is subtle yet impactful, enhancing the overall mood and atmosphere of the image without detracting from its core elements.",0.882,0.09333333333333332,0.75
"The image captures a scene of quiet solitude, featuring a vintage car parked on the side of a street. The car, painted in a dark hue, stands out against the backdrop of the night sky. Its chrome grill and headlights gleam under the soft glow of a nearby street lamp, adding a touch of elegance to its robust form. The car is positioned facing towards the right side of the image, as if ready to embark on a journey into the darkness. The background reveals a house nestled amidst lush green trees, their leaves rustling softly in the night breeze. A white fence encircles the property, standing guard under the watchful gaze of the street lamp. The overall composition of the image evokes a sense of nostalgia and tranquility, as if inviting the viewer to step into this serene tableau and lose themselves in its timeless charm. The careful arrangement of elements - from the car's placement to the positioning of the house and trees - creates a harmonious balance that is both visually pleasing and emotionally engaging.",0.9753,0.0565934065934066,0.7
"The image captures a scene from the movie ""Casablanca"" featuring Ingrid Bergman and Humphrey Bogart. The setting is a car, with Bogart in the driver's seat and Bergman seated in the backseat. Bogart, dressed in a black suit and hat, gazes at Bergman through the rearview mirror. Bergman, wearing a white dress, looks back at him. The color palette of the image is dominated by shades of black, white, and gray, reflecting the classic Hollywood style of the film. The composition and framing of the scene create a sense of intimacy between the two characters, while their body language and facial expressions convey tension and unspoken emotions.",-0.0516,-0.023809523809523808,0.5
