text,vader,textblob,llama3
"In the image, actress Cate Blanchett is captured in her role as Carol Aird from the film ""Carol"". She stands in a room adorned with white walls and a chandelier hanging from the ceiling. Dressed in a pink dress complemented by a pearl necklace, she embodies the elegance of her character. Her gaze is directed off to the side, and her expression is one of concern or worry. Behind her, another man is seated at a table draped with a white tablecloth. He is dressed in a black suit and appears to be observing Cate's character. The overall scene suggests a moment of tension or intrigue within the narrative of the film.",-0.0772,-0.1111111111111111,0.45
"In the image, a man is standing in a room filled with people. He is dressed in a black tuxedo and a white shirt, giving off an air of sophistication. His facial expression is serious, suggesting that he might be in a formal or important setting. The camera angle is from a low angle, looking up at the man, which adds to his imposing presence. The lighting in the room is dim, creating a more intimate and subdued atmosphere. The background consists of other people sitting on chairs, indicating that this could be a social gathering or event. The color palette of the image is dominated by shades of black, white, and gray, further emphasizing the formal and elegant mood of the scene. The man's body language and gestures are neutral, suggesting he is calmly observing his surroundings. There are no discernible props or costumes in the image. The depth of field is shallow, with the man sharply in focus while the people in the background are slightly blurred, drawing attention to him as the main subject of the photo. The character positioning and interaction show that the man is standing apart from the seated individuals, possibly indicating a position of authority or prominence at the event. There are no visible visual effects or post-processing elements in the image.",0.5994,0.04236111111111112,0.4
"The image captures a scene from the movie ""A Room with a View"". The central figure is Lucy Honeychurch, portrayed by Helena Bonham Carter. She is standing in a room filled with people, her gaze directed off to the side, embodying a sense of contemplation or introspection. Her attire consists of a purple dress and a pearl necklace, adding a touch of elegance to her character. In the background, there's a man dressed in a black suit, possibly a significant figure in the scene. The room they're in is adorned with chandeliers hanging from the ceiling, suggesting an atmosphere of sophistication or grandeur. A table can be seen as well, further indicating that this might be a social gathering or event. The image does not contain any discernible text. The relative positions of the objects and characters suggest a dynamic scene, with Lucy Honeychurch at the center, drawing the viewer's attention. The man in the black suit is positioned slightly behind her, adding depth to the composition. Overall, the image provides a glimpse into the narrative of ""A Room with a View"", capturing the essence of Lucy Honeychurch's character and the setting in which she finds herself.",0.9153,-0.002083333333333326,0.65
"The image captures a scene from the movie ""Casablanca"" featuring actor Humphrey Bogart in his iconic role as Rick Blaine. He is standing on a balcony, dressed in a black suit and tie, exuding an air of sophistication and mystery. The balcony overlooks a cityscape, with the silhouette of a palm tree adding to the exotic ambiance. The color palette of the image is dominated by shades of blue and green, creating a cool and serene atmosphere. The composition of the image places Bogart centrally, drawing the viewer's attention directly to him. His facial expression is serious, reflecting the intensity of his character. The camera angle and lighting further emphasize Bogart, making him the focal point of this memorable scene from cinema history.",0.7351,0.10416666666666667,0.7
"In the image, a man and a woman are engaged in a conversation on a balcony. The man, dressed in a black suit, stands behind the railing of the balcony while the woman, wearing a white dress, sits comfortably on a bench. Their interaction suggests a casual yet intimate exchange. The setting is a room with white walls that reflect the soft light from two lamps positioned on either side of the balcony. A large window punctuates one wall, draped with an orange curtain that adds a pop of color to the otherwise neutral palette. The composition of the image places the man and woman centrally, drawing attention to their conversation. The camera angle is slightly elevated, providing a clear view of both characters and their surroundings. The lighting is diffused, creating a warm and inviting atmosphere. In terms of body language and gestures, the man's posture suggests he is actively engaged in the conversation, while the woman appears relaxed, indicating a comfortable exchange. Their facial expressions are not visible in the image, but one can imagine them engaged in a serious discussion or perhaps sharing a light moment. The props and costumes are minimalistic - the man's black suit and the woman's white dress stand out against the white walls of the room. The lamps on either side of the balcony add symmetry to the scene. The depth of field is shallow, with the focus primarily on the man and woman. This effect further emphasizes their conversation and interaction. Overall, the image captures a moment of connection between two characters in an intimate setting, evoking emotions of warmth, comfort, and engagement.",0.9841,0.04497354497354497,0.7
"The image portrays a scene from the movie ""Casablanca"". The central figure is Humphrey Bogart, portraying the character Rick Blaine. He is standing in a doorway, dressed in a black suit and tie, exuding an air of sophistication and mystery. His face carries a slight smile, hinting at a sense of contentment or resolve. The setting is a room adorned with curtains featuring a red and gold pattern, adding a touch of opulence to the scene. A table draped with a white tablecloth can be seen in the background, further enhancing the grandeur of the surroundings. The overall composition of the image, with its focus on Bogart's character and the detailed setting, evokes a sense of nostalgia and admiration for the timeless appeal of classic cinema. The use of color, lighting, framing, and depth of field all contribute to creating an atmosphere that immerses the viewer in the world of ""Casablanca"".",0.9452,0.05333333333333333,0.8
"In the image, a man is standing in front of a window that offers a view of a beach. The man is dressed in a black suit and tie, giving him an air of formality. He holds a cigarette in his hand, suggesting a moment of relaxation or contemplation. His gaze is directed towards the camera, engaging the viewer directly. The room he's in has white walls that contrast with the colorful curtains on either side of the window. The curtains add a touch of warmth and homeliness to the scene. The beach visible through the window suggests an outdoor setting, perhaps indicating a connection between the man's indoor environment and the world outside. The overall composition of the image, with its focus on the man and his interaction with the camera, creates a sense of intimacy and immediacy. The colors, objects, and their arrangement all contribute to this effect, creating a snapshot that is both visually engaging and emotionally evocative.",0.959,0.11333333333333333,0.42
"The image portrays a scene from the movie ""The Godfather"". The central figure is Al Pacino, portraying the character of Tony Montana. He is standing in front of a tree with dark green leaves against a backdrop of a blue sky and a body of water. Al Pacino is dressed in a black tuxedo with a blue vest and a white shirt. His facial expression is serious as he looks off to the side, suggesting deep thought or contemplation. The overall composition of the image suggests a moment of quiet introspection amidst the grandeur of nature.",0.4767,-0.07083333333333332,0.3
"In the image, a man is standing in front of a tree against a backdrop of a blue sky and mountains. He is dressed in a black tuxedo with a white bow tie, holding a cigarette in his right hand. His facial expression is one of sadness or contemplation as he looks off to the side. The camera angle is low, looking up at him, giving him an imposing presence. The lighting is natural, suggesting it might be daytime. The tree and man are the main subjects of this image, with the blue sky and mountains providing a contrasting background. The color palette is dominated by shades of blue, green, and black. The man's body language and gestures suggest he is deep in thought or lost in his own world. There are no other discernible objects or characters in the image.",-0.2023,0.04543650793650793,-0.7
"The image captures a lively scene from a parade. A group of people, dressed in vibrant costumes and carrying flags, are the main focus. They are walking on a grassy field under a clear blue sky dotted with fluffy white clouds. The perspective is from behind the group, giving a sense of motion and direction towards the right side of the image. The colors in the image are vivid and bright, adding to the festive atmosphere. The costumes worn by the people are colorful and varied, reflecting the diversity of the parade participants. The flags they carry add another layer of color and movement to the scene. The grassy field on which the group is walking is lush and green, contrasting nicely with the blue sky above. The clear weather suggests a perfect day for an outdoor event like this. In terms of composition, the people are arranged in a way that leads the viewer's eye towards the right side of the image, where they appear to be heading. This gives a sense of anticipation and excitement about what lies ahead in the parade. Overall, the image is a dynamic representation of a parade, capturing the energy, color, and movement of the event. The use of facial expressions, camera angle, lighting, framing, setting, color, body language, props, costumes, depth of field, character positioning, visual effects, and post-processing all contribute to creating an engaging and visually appealing image.",0.987,0.10553751803751803,0.85
"The image captures a scene from the movie ""What's Up, Tiger Lily?"" featuring actress Abbie Cornish. In the center of the frame, Abbie is seated at a table draped with a white tablecloth. She's wearing a pink dress and a hat, adding a touch of elegance to her appearance. Her hands are gently holding a small object, perhaps indicating a moment of contemplation or discovery. To her left, another actress is also seated at the table, dressed in a contrasting black dress. She seems to be engaged in conversation with Abbie, suggesting an interaction between the two characters. On Abbie's right, there's another character who appears to be observing the scene from behind the table. This person is wearing a red jacket and seems to be standing, possibly indicating a different status or role within the scene. The background of the image reveals a serene park setting with lush trees under a clear blue sky. The natural lighting suggests it might be daytime, adding to the overall calm and peaceful atmosphere of the scene. In terms of color, the pink dress of Abbie stands out against the more muted colors of the other characters' outfits and the greenery in the background. The white tablecloth on the table provides a neutral base for the objects placed on it. The body language and gestures of the actors suggest a moment of quiet conversation or contemplation. Abbie's hands gently holding the object might indicate she's deep in thought, while the other characters' positions relative to her suggest they are all part of this shared narrative. In terms of props and costumes, the small object held by Abbie seems significant, perhaps symbolic of something important within the context of the scene. The red jacket worn by the person standing behind the table adds a pop of color to the scene. The depth of field is shallow, focusing on Abbie and the objects on the table while blurring the background, which helps to draw attention to the characters and their interactions. Overall, this image captures a moment from ""What's Up, Tiger Lily?"" that evokes a sense of calm and introspection, with each element contributing to the narrative and emotional depth of the scene.",0.9854,-0.0010338345864661618,0.65
"The image captures a scene from the movie ""What's Up, Doc?"" featuring the character of Marlene Dietrich. She is seated at a table, holding a glass of wine in her hand. Her expression is one of surprise or shock, adding an element of intrigue to the scene. The setting appears to be outdoors, with trees visible in the background under a clear blue sky. The colors in the image are vibrant, with Marlene's pink dress standing out against the natural backdrop. The composition of the image places Marlene as the central figure, drawing the viewer's attention to her expression and actions. The overall mood of the image is one of suspense and curiosity, reflecting the character's surprised reaction to an unseen event in the film.",0.9022,0.04583333333333334,0.5
"In the image, there are two women standing in front of a wooden table. The woman on the left is wearing a pink dress and holding a plate of food. She appears to be in the middle of a conversation with the other woman. The woman on the right is dressed in a blue dress and seems to be listening attentively. The setting is outdoors, with trees visible in the background. A mannequin can also be seen in the distance, adding an interesting element to the scene. The colors in the image are vibrant, with the pink of the woman's dress standing out against the more muted tones of the surroundings. The composition of the image places the two women as the main focus, with their interaction and expressions suggesting a sense of camaraderie or shared experience. The outdoor setting and the presence of the mannequin add an element of intrigue to the scene, inviting viewers to imagine the story behind this moment captured in time.",0.8689,0.09243197278911564,0.7
"In the image, there are three women standing in a garden setting. The woman on the left is wearing a pink dress and has blonde hair. She is holding a basket filled with food. In the middle, another woman is dressed in a blue dress and also has blonde hair. She is holding a tray of food. On the right, the third woman is wearing a purple sweater and has brown hair. She is looking at the other two women. The garden setting includes trees and bushes in the background. The lighting appears to be natural daylight. The camera angle suggests that it was taken from a distance, possibly with a wide-angle lens. The framing and composition of the image place the three women as the main focus, with the garden serving as a picturesque backdrop. The color palette is dominated by shades of green from the foliage, blue from the sky, and various colors from the women's clothing. The body language and gestures of the women suggest a casual, relaxed atmosphere. The props and costumes are simple yet elegant, adding to the overall aesthetic of the image. The depth of field is shallow, with the women in focus and the background slightly blurred. This effect draws attention to the women while still allowing for appreciation of the garden setting. The character positioning and interaction suggest a sense of camaraderie among the women, as they are all engaged in the same activity - possibly preparing or enjoying food. Overall, the image captures a moment of tranquility and friendship in a beautiful garden setting, with careful attention to detail in every aspect of its creation.",0.986,0.04562074829931972,0.85
"The image captures a scene from the movie ""The Wizard of Oz"". The focus is on three women, each dressed in vibrant purple dresses that stand out against the backdrop. They are positioned around a table laden with food and drink items, suggesting a social gathering or celebration. On the left, one woman is seen holding a tray filled with drinks, her face lit up with a smile as she looks directly at the camera. Her cheerful expression adds a warm and welcoming atmosphere to the scene. In the center, another woman is engrossed in examining a plate of food on the table. She holds a fork in her hand, poised over the plate, indicating her interest in the meal. Her focused gaze suggests curiosity or anticipation. On the right, the third woman is holding a tray filled with plates of food. Like her companion on the left, she too looks directly at the camera, adding to the overall engagement and interaction within the scene. The background features trees under a clear blue sky, providing a serene and natural setting for this gathering. The colors in the image are vivid and bright, enhancing the visual appeal and drawing attention to the characters and their actions. Overall, the image is a snapshot of a moment filled with warmth, camaraderie, and celebration, as depicted through the facial expressions, body language, and props used by the film-maker.",0.9915,0.1712797619047619,0.85
"The image captures a serene scene on a lake, where two women are the main subjects. The woman in the foreground is standing on a rock, her back turned to us as she gazes out at the water. She's dressed in a blue tank top and purple skirt, adding a pop of color against the natural backdrop. In contrast, the woman in the background is seated on a bench, also facing away from the camera. She's wearing a pink dress that stands out amidst the greenery around her. The lake itself stretches out behind them, its calm surface reflecting the sky above. The image is taken from a low angle, making the women appear larger and more prominent. This perspective also emphasizes the vastness of the lake and the sky beyond. The lighting is natural, suggesting it's daytime, and the colors are vibrant and varied - from the blues and purples of the women's clothing to the greens of the trees in the background. The framing and composition of the image place the two women at the center, drawing our attention to them immediately. Their body language suggests a moment of quiet reflection or perhaps anticipation of an event yet to come. Overall, this image evokes a sense of tranquility and introspection, as if inviting us to pause and reflect on our own thoughts and emotions just like these two women by the lake.",0.9682,0.12280701754385966,0.75
"The image presents a serene scene of nature. Dominating the frame is a mountain, its slopes blanketed in lush green trees and shrubs. The vegetation appears dense, suggesting that this could be a temperate or tropical region. In the foreground, a cluster of trees stands tall, their leaves a vibrant mix of greens. They are positioned on the left side of the image, providing a natural frame for the mountain in the background. The sky above is a clear blue, devoid of any clouds. This suggests that the weather is fair and it might be a bright day. The absence of any text or human-made objects reinforces the sense of untouched natural beauty. Overall, the image captures the tranquility and grandeur of nature, with the mountain as its centerpiece.",0.9776,0.11815476190476192,0.85
"The image presents a serene scene of nature. Dominating the frame is a large tree, its branches reaching out in various directions. The leaves are a vibrant green, indicating that it's likely spring or summer. The background reveals a mountainous landscape under a clear blue sky, adding to the tranquility of the scene. In terms of camera angle and lighting, the image appears to be taken from a low angle, looking up at the tree, which gives a sense of grandeur to the tree. The lighting is natural, suggesting that it was taken during the day with the sun shining brightly. The composition of the image places the tree in the foreground, drawing immediate attention to it, while the mountainous landscape and sky form the background, providing context and depth to the scene. The color palette is dominated by shades of green from the leaves and blue from the sky. There are no discernible props or costumes in the image, and no facial expressions can be determined due to the natural setting. In terms of body language and gestures, there's a sense of calmness and stillness conveyed through the tree standing tall and firm, unyielding to any external forces. The mountainous landscape in the background adds to this sense of stability and permanence. The depth of field is shallow, with the tree in sharp focus while the mountains and sky are slightly blurred, creating a bokeh effect that further emphasizes the tree as the main subject of the image. Overall, the image captures a moment of peace and tranquility in nature, with the large green tree standing as a symbol of life amidst the vast landscape.",0.9801,0.0016754850088183464,0.7
"The image presents a serene scene of nature. The main focus is on the trees, which are lush and green with yellow leaves scattered throughout, indicating a change in seasons. The trees are set against a backdrop of a clear blue sky, adding to the tranquility of the scene. The photo is taken from a low angle, giving an upward perspective towards the trees. This angle emphasizes the height and grandeur of the trees, making them appear majestic and towering. In terms of lighting, the image is bathed in natural light, suggesting it was taken during the day. The sunlight filters through the leaves, casting dappled shadows on the ground below. The composition of the photo is such that the viewer's eye is drawn upwards from the foreground with the trees to the sky in the background. This creates a sense of depth and perspective. There are no discernible texts or human-made objects in the image, reinforcing the natural theme. The absence of people also gives the scene a timeless quality. The body language and gestures of the trees suggest a calm and peaceful atmosphere. Their stillness contrasts with the implied movement of leaves rustling in the wind. As for props and costumes, there are no man-made objects or clothing visible in the image. This further emphasizes the natural theme. In terms of depth of field, the focus is on the trees in the foreground, while the sky in the background appears slightly blurred. This effect draws attention to the details of the trees while still allowing for a sense of vastness from the expansive sky. The character positioning and interaction are not applicable as there are no discernible characters or actions taking place in the image. Finally, the visual effects and post-processing techniques used in the photo are minimalistic, ensuring that the focus remains on the natural elements. The overall effect is a harmonious blend of colors, shapes, and textures that evoke a sense of peace and tranquility.",0.9858,0.0636904761904762,0.85
"In the image, a woman is standing in a kitchen. She is wearing a blue and white striped dress and has her hair styled in an updo. The kitchen features a counter with various dishes on it, and there's a window adorned with pink curtains. The woman appears to be looking off to the side, her face bearing a slight smile. This image captures a moment of quiet domesticity, with the woman as the central figure amidst the everyday setting of the kitchen.",0.4601,-0.01851851851851852,0.65
"The image portrays a scene in a kitchen. The main subject is a person, dressed in a white apron and a blue shirt with stripes, standing at the counter. They are holding a bowl filled with food, indicating that they might be preparing a meal. The kitchen itself has a clean and modern design. The counter where the person is standing is made of light-colored stone, providing a contrast to the dark wood cabinets. A window with white curtains can be seen in the background, suggesting natural light entering the room. In terms of facial expression, the person appears focused on their task at hand, perhaps indicating concentration or determination. Their body language and gestures suggest they are in the middle of cooking or preparing food. The camera angle is from behind the person, giving us a clear view of their actions but not revealing their face. This could be an intentional choice to keep the focus on the activity rather than the individual. Lighting in the image is diffused, creating a soft and even illumination that enhances the overall mood of the scene. Framing and composition are well-balanced, with the person centrally positioned and the elements of the kitchen symmetrically arranged around them. The color palette is dominated by shades of white (the apron), blue (the shirt), and brown (the cabinets). These colors contribute to a calm and serene atmosphere. In terms of props and costumes, the person's attire suggests they are engaged in some form of culinary activity. The bowl of food they're holding is likely an important element in this scene, indicating that cooking or meal preparation is the central theme. The depth of field is shallow, with the person sharply in focus while the background elements are slightly blurred. This effect draws our attention to the person and their actions, emphasizing their importance in the image. Overall, the image captures a moment of everyday life, focusing on the act of cooking or meal preparation. The use of color, lighting, framing, and composition all contribute to creating a scene that is both visually appealing and emotionally engaging.",0.9844,0.05732323232323233,0.42
