text,vader,textblob,llama3
"The image portrays a scene from the movie ""Dances with Wolves"". The main focus is on the character of Lt. John Dunse, portrayed by Kevin Costner. He is standing in front of a large tree, his body adorned with a red and white blanket. His arms are raised above his head, holding onto a branch as if he's about to climb it or perhaps just taking a moment to rest. In the background, there are two other characters: a man on horseback and another man on foot. The man on horseback is wearing a blue shirt and appears to be observing the scene from a distance. The man on foot is dressed in a brown shirt and seems to be engaged in conversation with Lt. Dunse. The setting is a rocky landscape, suggesting that this scene takes place outdoors, possibly in a wilderness or rural area. The color palette of the image is dominated by earth tones, which adds to the overall ruggedness of the scene. The composition of the image places Lt. Dunse as the central figure, with the other characters and elements arranged around him. This gives a sense of depth and perspective to the image, drawing the viewer's eye towards Lt. Dunse and his actions. Overall, this image captures a moment of tension or anticipation in the movie ""Dances with Wolves"", with each character poised in their own way, ready for what comes next.",0.7269,0.05818452380952381,0.3
"The image portrays a scene from the movie ""Dances with Wolves"". The central figure is a Native American man, dressed in traditional attire. He is shirtless, wearing a headdress and carrying a bow and arrow. His body language suggests that he is in motion, possibly running or walking. The setting is an outdoor landscape, characterized by trees and rocks. The colors in the image are predominantly earth tones, with some blue and green accents from the sky and foliage. In the background, there are other people present, but they are blurred and not the focus of the image. This suggests that the man in the foreground is the main subject of this scene. The composition of the image places the man centrally, drawing the viewer's attention to him immediately. The camera angle is low, looking up at the man, which adds a sense of grandeur and importance to his figure. Overall, the image captures a moment of action and narrative within the context of the movie ""Dances with Wolves"". The use of color, composition, and body language all contribute to conveying this sentiment.",0.7351,-0.016071428571428573,0.7
"The image captures a scene of a group of people on horseback in a field. The individuals are dressed in traditional cowboy attire, complete with hats and boots, suggesting a historical or western setting. The horses they ride appear to be brown, adding to the rustic charm of the scene. The photo is taken from an elevated angle, providing a bird's eye view of the group as they move across the field. This perspective allows for a comprehensive view of the scene, including the surrounding landscape and the people within it. The color palette of the image is dominated by earth tones, with the brown of the horses and the clothing blending seamlessly with the greenery in the background. The overall effect is one of harmony between man and nature, evoking a sense of tranquility and connection to the land. In terms of body language and gestures, the riders appear relaxed and at ease on their mounts, suggesting a level of comfort and familiarity with their surroundings. Their positioning relative to each other indicates a sense of camaraderie and shared purpose among the group. As for props and costumes, the traditional cowboy attire worn by the riders is indicative of a specific time period or cultural context. The horses themselves are integral to the scene, serving as both means of transportation and extensions of the riders' personalities. In terms of depth of field, the image has been captured with a shallow focus, drawing attention to the group in the center while allowing for a softer background. This technique helps to create a sense of depth and three-dimensionality in the image. Finally, visual effects and post-processing techniques have been used to enhance the overall aesthetic appeal of the image, adding contrast and texture to the scene without detracting from its historical or western themes. The result is a visually striking representation that effectively conveys the sentiment and emotions evoked by the film-maker's elements.",0.9726,0.04429824561403509,0.75
"The image captures a dramatic scene from the movie ""Dances with Wolves"". The central figure is Kevin Costner, portraying the character of Marlon Brando. He is seen in a close-up shot, his face etched with determination and resolve. His body language suggests he is preparing for an impending battle or conflict. Costner's costume is a striking combination of earthy tones - predominantly brown and beige, reflecting the rugged wilderness setting. The background reveals a group of men on horseback, their presence adding to the tension of the scene. The horses are in motion, suggesting they are charging towards the camera, further emphasizing the impending conflict. The composition of the image is such that Costner's face fills most of the frame, drawing attention to his expression and making him the focal point of the scene. The men on horseback are positioned behind him, their forms slightly blurred due to the depth of field effect used by the photographer. The color palette of the image is dominated by earthy tones - browns, beiges, and greens - which adds a sense of realism and authenticity to the scene. The lighting appears natural and harsh, with shadows cast on the faces of the characters, adding depth and dimension to their expressions. Overall, the image is a powerful representation of a pivotal moment in the movie ""Dances with Wolves"", capturing the intensity and emotion of Kevin Costner's character, Marlon Brando, as he prepares for an impending conflict.",-0.4767,0.04107142857142857,0.85
"The image captures a scene from the movie ""Dances with Wolves"" featuring Kevin Costner in his role as the character, Wolf. The setting is a rocky landscape under a clear blue sky. Wolf, dressed in a white shirt and black pants, is standing on a rock, holding a bow and arrow. His body language suggests he is ready for action. In the background, there are other people also armed with bows and arrows, indicating a potential conflict or standoff. The overall color palette of the image is dominated by earth tones, contrasted by the blue sky. The composition of the image places Wolf in the foreground, drawing attention to his character and actions, while the other characters and elements provide context to the scene.",0.4215,-0.0015151515151515123,0.5
"The image captures a moment of tranquility and freedom, featuring a horse in mid-gallop. The horse, adorned with a saddle, is the central figure in this composition. It's positioned on a dirt path that cuts through a serene landscape. The background is a lush tapestry of trees and shrubs, their green hues contrasting with the earthy tones of the path. The horse's body language speaks volumes about its emotions - it appears to be in full gallop, embodying a sense of freedom and joy. Its tail is raised high, adding to the dynamic nature of the scene. The camera angle is particularly striking. It's taken from a low angle, looking up at the horse. This perspective not only emphasizes the horse's size but also gives us a unique view of its surroundings. The lighting in the image is natural and diffused, enhancing the overall calmness of the scene. In terms of framing and composition, the horse is perfectly centered, drawing our attention immediately to it. The path leads our eyes towards the horse, further emphasizing its importance in this image. The color palette is dominated by earthy tones - browns and greens - which create a harmonious blend with nature. However, there are pops of green from the trees that add visual interest. As for body language and gestures, the horse's posture and movement convey a sense of energy and excitement. The raised tail and full gallop suggest a moment of exuberance or perhaps even playfulness. In terms of props and costumes, the saddle on the horse is the only noticeable item. It's functional yet adds to the overall aesthetic of the image. The depth of field is shallow, with the horse in sharp focus while the background is slightly blurred. This effect further emphasizes the horse as the main subject of this image. Finally, visual effects and post-processing are minimalistic - they don't detract from the beauty of the scene but rather enhance it. The overall sentiment evoked by this image is one of freedom, joy, and a deep connection with nature.",0.9964,0.11699999999999999,0.85
"The image captures a dramatic scene featuring a horse and its rider in the midst of an action-packed moment. The horse, adorned with a saddle and bridle, is rearing up on its hind legs, creating a sense of movement and power. The rider, holding onto the reins tightly, appears to be in control despite the horse's actions. The setting is a rocky terrain scattered with trees and shrubs, adding an element of ruggedness to the scene. The color palette is dominated by earthy tones, with the brown of the horse blending seamlessly with the surrounding environment. The composition of the image places the horse and rider as the central focus, drawing the viewer's attention immediately to their dynamic interaction. The background elements are strategically positioned to frame this action-packed moment, further emphasizing the drama unfolding in the center. Overall, the image is a testament to the film-maker's ability to capture intense emotions and dramatic action through thoughtful composition, lighting, and visual effects.",0.8689,-0.02655677655677655,0.7
"The image captures a scene from the movie ""The Good, the Bad and the Ugly"". The main focus is on Clint Eastwood, portraying the character of the Man with No Name. He is seen riding a horse, donned in a white hat and a beige jacket. His facial expression is serious, reflecting the intensity of his character. In the background, there are other characters on horses, including Lee Van Cleef who plays the role of the Ugly. The setting appears to be a rocky landscape under a clear blue sky. The colors in the image are predominantly earth tones with the exception of the blue sky. The composition of the image is such that Clint Eastwood's character is in the foreground, drawing immediate attention, while the other characters and background elements provide context and depth to the scene. The use of natural lighting enhances the contrast between the characters and their surroundings, highlighting the details of their costumes and props. Overall, the image effectively conveys the dramatic and intense atmosphere typical of the Western genre, with Clint Eastwood's character at its center.",-0.1027,-0.06893939393939393,0.85
"The image captures a dramatic scene set in a desert-like environment. At the center of the frame, a person is lying on the ground, their body language suggesting they are either falling or being dragged by another individual who is standing over them. The person on the ground is dressed in a gray shirt and blue pants, while the standing figure is clad in a black shirt and blue pants. The background of the image reveals a rocky terrain interspersed with patches of sand, adding to the arid atmosphere of the scene. A horse can be seen in the distance, further enhancing the desert-like setting. In terms of facial expressions, the person on the ground appears to be in distress or pain, while the standing figure seems to be exerting force over them. The camera angle is from a low perspective, looking up at the two individuals, which adds a sense of power and dominance to the standing figure. The lighting in the image is natural, with the sun casting shadows on the ground and highlighting the figures against the rocky backdrop. Framing and composition are such that the viewer's attention is drawn immediately to the action unfolding between the two main characters. Color-wise, the image is dominated by earth tones of brown and beige, reflecting the desert setting. However, there are splashes of blue from the standing figure's pants and the person on the ground's shirt, providing a stark contrast that draws the eye. In terms of body language and gestures, both figures are engaged in intense physical interactions - one is being dragged by the other, indicating a struggle or conflict between them. The props and costumes used in the image are simple yet effective in conveying the scene's narrative. The depth of field is shallow, with the two main characters sharply in focus while the background elements are slightly blurred, creating a sense of depth and distance. Character positioning and interaction are such that the viewer is left to wonder about the story behind this moment - whether it's an act of aggression or self-defense, or perhaps part of a larger narrative unfolding off-frame. Visual effects and post-processing have been used sparingly but effectively in this image. The most noticeable effect is the use of color grading, which has been applied to give the image a slightly overexposed look, enhancing its dramatic and intense feel. Overall, the film-maker's elements come together to create a powerful and evocative scene that leaves a lasting impression on the viewer.",0.8466,0.007657657657657654,0.45
"The image captures a dramatic scene from the movie ""The Good, the Bad and the Ugly"". In the center of the frame, two men are on horseback, engaged in what appears to be a tense standoff. The man on the left is clad in a gray jacket and blue jeans, while his companion on the right sports a black jacket and pants. Their horses, both dark brown in color, stand ready for action. The setting is a rocky landscape under a clear blue sky, adding to the intensity of the scene. In the background, another man can be seen lying on the ground, possibly indicating some sort of conflict or altercation has taken place. The image evokes a sense of tension and anticipation, as viewers are left to wonder about the outcome of this standoff. The facial expressions and body language of the characters suggest determination and readiness for whatever comes next. The composition of the image, with its focus on the two men in the foreground and the third man in the background, creates a sense of depth and perspective. Overall, the film-maker has skillfully used various elements such as facial expression, camera angle, lighting, framing, color, body language, props, and visual effects to create a compelling and engaging scene that captures the essence of the movie's narrative.",0.5868,-0.018430335097001753,0.7
"The image captures a dramatic scene set against the backdrop of a stormy sky. Dominating the center is a large tree, its branches reaching out in various directions. Suspended from these branches are two individuals, their bodies hanging upside down as if they've been caught mid-air. Their arms and legs are spread wide, creating an impression of weightlessness. The person on the left appears to be in a state of surrender or defeat, while the one on the right seems more defiant or rebellious. This contrast is further emphasized by their facial expressions - the left individual looks terrified, while the right one exudes determination and resolve. Adding to the tension of the scene are two ropes that hang from the tree, suggesting they might be used for hanging people. The overall composition of the image, with its central focus on the tree and the suspended individuals, creates a sense of drama and suspense.",-0.8766,0.031051587301587302,0.5
"The image captures a moment of solitude and introspection. A man, dressed in a black shirt and blue jeans, stands alone against the backdrop of a dark sky. His face is obscured by the shadow cast by his cowboy hat, adding an air of mystery to his persona. The low angle from which the photo is taken further emphasizes his solitary figure, making him appear larger than life. The overall color palette is dominated by shades of black and blue, enhancing the somber mood of the scene. Despite the darkness, there's a certain calmness that permeates the image, as if inviting the viewer to pause and reflect along with the man in the frame.",0.2359,-0.026904761904761897,0.4
"The image presents a dramatic scene set against the backdrop of a sunset. Dominating the frame is a tree, its branches reaching out in various directions. Suspended from these branches are two figures, their forms silhouetted against the vibrant hues of the sky. On the left side of the tree, one figure appears to be hanging upside down, while on the right side, another figure seems to be suspended right side up. Their exact identities or actions are indeterminable due to the silhouette effect, but they add a sense of intrigue and mystery to the scene. The sunset in the background is a riot of colors, painting the sky with shades of orange, pink, and purple. The warm tones contrast sharply with the darker silhouettes of the figures and tree, creating a visually striking image. Despite the simplicity of the elements - a tree, two figures, and a sunset - the image conveys a sense of drama and tension, inviting viewers to fill in the blanks with their own interpretations and stories. The absence of any discernible text or explicit action further enhances the ambiguity, leaving room for personal interpretation.",-0.6187,0.10203924162257497,0.7
"The image captures a scene from the classic Western film ""High Noon"". The main focus is on two characters, Gary Cooper as Marshal Will Kane and Grace Kelly as Helen O'Connor. They are positioned in the center of the frame, with the marshal on the left and the sheriff on the right. In terms of facial expressions, both characters have serious looks on their faces, indicating a tense atmosphere. The camera angle is from a low angle, looking up at the characters, which adds to the dramatic effect. The setting is a small town street, lined with buildings and shops. The color palette is dominated by earth tones, creating a warm and rustic feel. However, there are splashes of red in the background, possibly indicating danger or conflict. In terms of body language and gestures, both characters appear tense and alert, ready for action. They are standing close to each other but facing away from each other, suggesting an unspoken tension between them. The props and costumes are simple yet effective. The marshal is wearing a traditional Western outfit, while the sheriff is dressed in a more formal attire. Their outfits contrast with each other, highlighting their different roles within the film. The depth of field is shallow, drawing focus to the characters in the center of the frame. This technique also emphasizes the background elements, making them appear out of focus and adding depth to the image. Overall, the image is a powerful representation of the classic Western genre, capturing the tension and drama inherent in the story.",0.3182,0.019236694677871147,0.7
"The image captures a scene from the movie ""Forrest Gump"". The central figure is Forrest Gump, portrayed by Tom Hanks. He is standing in front of a wooden fence that has barbed wire on top. The setting appears to be a field with a cloudy sky overhead. Forrest Gump is dressed in a black shirt and a cowboy hat, and he's wearing a blue bandana around his neck. His facial expression is serious as he looks off into the distance. The image composition places Forrest Gump at the center of the frame, drawing attention to him against the backdrop of the field and sky.",0.128,-0.012499999999999994,0.4
"The image captures a scene from the movie ""Butch Cassidy and the Sundance Kid"". The central figure is Butch Cassidy, portrayed by Paul Newman. He is astride a white horse with black spots, which stands out against the dusty street setting. Cassidy is dressed in a light-colored outfit and a dark hat, adding to his distinctive look. The background of the image reveals other characters from the film, including the Sundance Kid, who is on foot next to the horse. There's also a man sitting on a bench, possibly a bystander or an acquaintance of Cassidy's. The setting is a dusty street with buildings visible in the distance, suggesting a small town or city environment. The lighting and framing suggest that this might be a daytime scene. In terms of color, the white horse stands out against the more muted colors of the street and buildings. Cassidy's light-colored outfit contrasts with his dark hat, drawing attention to him as the main character. Cassidy's body language and gestures are not explicitly described, but given the context, it can be inferred that he is in control of the situation, guiding the horse down the street. The props and costumes used in this scene are consistent with the western genre of the film. The white horse, Cassidy's outfit, and other character clothing all contribute to the authenticity of the scene. The depth of field is not explicitly described, but given that it's a still image, it can be assumed that the focus is on Cassidy and his horse, with the background elements slightly blurred. In terms of visual effects and post-processing, there are no specific details provided. However, given the context of the film, it can be inferred that these elements were used to enhance the overall look and feel of the scene.",-0.4215,-0.05096618357487923,0.7
"The image captures a scene from the movie ""Forrest Gump"". In the center of the frame, we see Tom Hanks portraying the character of Forrest Gump. He is seated at a table in a restaurant, engaged in conversation with another man who is also present in the frame. The man on the right is dressed in a blue jacket and has his hand resting on the table. The setting appears to be a dimly lit room, adding a sense of intimacy to the scene. A window can be seen in the background, through which a sign reading ""Soulsville"" is visible, possibly indicating the name of the restaurant or the establishment they are in. In terms of camera angle and lighting, the image is taken from a low angle, looking up at Forrest Gump, emphasizing his presence in the scene. The lighting is soft and diffused, casting a warm glow on the characters and their surroundings. The composition of the image places Forrest Gump as the focal point, with the other man and the window serving as secondary elements that add depth to the scene. The colors are muted, contributing to the overall calm and relaxed atmosphere of the setting. In terms of body language and gestures, both characters appear engaged in their conversation, suggesting a sense of connection and camaraderie between them. Forrest Gump's facial expression is neutral, while the other man seems more animated in his discussion with Forrest. The props and costumes are simple yet effective in setting the scene. Forrest Gump's attire consists of a blue jacket similar to the one worn by the other man, suggesting a shared experience or commonality between them. The table they are seated at is covered with a white tablecloth, adding a touch of formality to their gathering. The depth of field is shallow, focusing on the characters and the objects in the foreground while allowing the background elements to remain blurred. This technique draws attention to the main subjects and helps create a sense of space and distance within the scene. In terms of character positioning and interaction, Forrest Gump and the other man are seated close together at the table, indicating a shared experience or commonality between them. Their relative positions suggest an intimate conversation taking place, with both characters facing each other and leaning in to hear what the other has to say. Visual effects and post-processing techniques have been used to enhance the overall mood of the scene. The colors have been muted, and the lighting has been diffused to create a warm and inviting atmosphere. The image has also been treated to remove any grain or noise, resulting in a clean and polished final product that is pleasing to the eye. Overall, this image captures a quiet moment between two characters in a dimly lit restaurant, with careful attention paid to the composition, lighting, color, body language, and visual effects to create an engaging and immersive scene.",0.9889,0.06839285714285714,0.65
"The image captures a dramatic scene from the movie ""The Great Escape"". In the center of the frame, Colonel Ross (played by Richard Attenborough) stands tall and firm. He is dressed in a blue uniform adorned with gold epaulettes, a white shirt, and a black tie. His gaze is directed towards the man lying on the table before him. The man on the table is played by Steve McQueen. He is seen wearing a red and green plaid shirt and has his eyes closed, suggesting he might be in pain or unconscious. The table between them is covered with various objects including a cup of coffee, a bottle of whiskey, and a book. The setting appears to be an office or study room, characterized by wooden paneling on the walls and a window in the background. The overall atmosphere suggests tension and conflict between the two characters.",0.0258,-0.030769230769230764,0.45
