text,vader,textblob,llama3
"In the image, there are two individuals standing in front of a tree. The person on the left is adorned with a fringed dress and has long hair cascading down her back. She holds a bow and arrow, poised as if ready for action. On the right, another individual is dressed in a blue shirt paired with black pants. He holds a rifle, mirroring the readiness of his companion. The setting is outdoors, with a serene lake visible in the background. The tree they stand before provides a natural backdrop to their scene. The image captures a moment frozen in time, evoking emotions of anticipation and preparedness. The facial expressions of the individuals suggest focus and determination, while their body language speaks volumes about their readiness for whatever lies ahead. The camera angle is particularly striking, taken from a low angle that looks up at the individuals, lending them an air of authority and dominance. This perspective also emphasizes the vastness of the sky above and the expanse of nature surrounding them. Lighting plays a crucial role in setting the mood of the image. The natural light filtering through the trees casts dappled shadows on the scene, adding depth and texture to the image. Framing is another key element, with the tree trunk serving as a natural frame that draws attention to the individuals at its center. Color is also an essential aspect of this image. The blue shirt of the individual on the right contrasts beautifully with the greenery in the background, while the fringed dress of the individual on the left adds a touch of elegance and femininity to the scene. The props and costumes are meticulously chosen to enhance the narrative of the image. The bow and arrow held by the individual on the left suggest a sense of adventure and danger, while the rifle held by the individual on the right indicates readiness for battle. These elements together create a story that is open to interpretation. Finally, depth of field is used effectively to draw focus to the individuals in the foreground while still allowing the viewer to appreciate the beauty of the background. The positioning of the characters and their interaction with each other adds an element of intrigue to the image. Overall, this image is a testament to the power of visual storytelling, using every element - from facial expression and body language to camera angle and lighting - to create a captivating narrative that leaves a lasting impression.",0.9888,0.09048586914440573,0.7
"In the image, a man and a woman are standing in front of a tree. The man is dressed in a blue shirt and holds a phone in his hand. He appears to be looking at the screen of the phone with an expression of concern on his face. The woman, wearing a yellow dress, stands next to him, her attention also directed towards the phone. The background consists of a blurred landscape featuring trees and bushes. The overall color palette of the image is dominated by shades of blue and green.",0.4939,-0.03333333333333333,0.3
"The image portrays a scene from the movie ""Dances with Wolves"". The main character, played by Kevin Costner, is standing in front of a river. He is dressed in a Native American costume and holds a buffalo skin in his hands. His facial expression is serious, reflecting the intensity of the moment. The camera angle is low, looking up at him, which adds to his imposing presence. The lighting is natural, with the sun shining brightly behind him, casting long shadows and highlighting his figure against the backdrop of the river and trees. The framing and composition of the image are balanced, with the character positioned centrally in the frame. The setting is a lush, green forest, filled with trees and a clear river flowing through it. The color palette is dominated by earth tones, with the exception of the blue sky peeking through the leaves. The body language and gestures of the character suggest a moment of contemplation or preparation. The props and costumes are authentic representations of Native American culture, adding to the historical accuracy of the scene. The depth of field is shallow, focusing on the character while keeping the background in focus. The character's positioning and interaction with his surroundings create a sense of solitude and connection with nature. The visual effects and post-processing techniques used in this image enhance the overall mood and atmosphere of the scene, making it a powerful representation of the movie ""Dances with Wolves"".",0.8779,0.01666666666666667,0.65
"In the image, a woman is standing in front of a tree-lined path. She is dressed in a black dress and has long hair. The woman is holding a bow and arrow, poised as if ready to shoot. The setting appears to be outdoors, with trees and rocks visible in the background. The color palette of the image is dominated by shades of green and brown, with some blue and gray tones present as well. The woman's body language suggests readiness and determination, while her facial expression is serious and focused. The camera angle is from a low angle, looking up at the woman, which adds to the dramatic effect of the scene. The lighting is natural, suggesting it might be daytime. The framing and composition of the image are balanced, with the woman centrally positioned in front of the tree-lined path.",0.8625,-0.07361111111111111,0.4
"The image captures a tranquil scene in a forest. At the heart of the image is a large tree trunk, its bark rough and weathered. A cat, its fur a mix of gray and white, sits on the ground next to the trunk. The cat's body language suggests it is at ease, perhaps taking a break from its usual activities. The background is filled with other trees and foliage, their leaves a vibrant green. The forest extends into the distance, creating a sense of depth in the image. The lighting is natural, suggesting that the photo was taken during the day under clear skies. In terms of composition, the cat is positioned to the left of the tree trunk, drawing the viewer's eye towards it. The other trees and foliage fill up the rest of the frame, creating a balanced and harmonious scene. The color palette is dominated by shades of green from the forest, contrasted with the gray and white of the cat. These colors are natural and earthy, enhancing the overall peaceful and serene mood of the image. Overall, this image evokes feelings of calm and tranquility, as if inviting the viewer to take a moment to appreciate the beauty of nature.",0.9917,0.031547619047619054,0.7
"The image captures a dramatic scene from the movie ""No Country for Old Men"". The central figure is Carson Wells, portrayed by actor Woody Harrelson. He stands in the middle of the frame, donned in a gray suit and a white hat, exuding an air of seriousness and determination. His gaze is directed off to the side, suggesting he is deeply engrossed in thought or observing something out of frame. The background is filled with other characters from the film, their faces blurred and indistinct, creating a sense of depth and focusing attention on Wells. The lighting is dim, casting long shadows and adding to the overall somber tone of the scene. The color palette is muted, further enhancing the serious atmosphere. Wells' body language and gestures are subtle yet expressive. His posture is upright, indicating confidence and authority. His expression is serious, reflecting the intensity of his character's situation in the film. The props and costumes are simple yet effective. Wells' gray suit and white hat stand out against the darker colors of the background characters, drawing the viewer's eye to him immediately. The blurred faces of the other characters suggest a crowd or gathering, but their identities remain anonymous, adding to the intrigue of the scene. The depth of field is shallow, with Wells sharply in focus while the background characters are slightly blurred, creating a sense of depth and three-dimensionality. This technique also helps to emphasize Wells as the main subject of this image. Overall, the film-maker has skillfully used various elements such as facial expression, camera angle, lighting, framing, setting, color, body language, gestures, props, costumes, depth of field, character positioning, visual effects, and post-processing to create a powerful and evocative scene from ""No Country for Old Men"".",0.9722,0.0013020833333333417,0.75
"The image captures a scene from the movie ""The Good, the Bad and the Ugly"". The central figure is Clint Eastwood, portraying his character, the Man with No Name. He stands in the middle of the frame, dressed in a gray suit and a beige hat, embodying the ruggedness of his character. His face carries a serious expression, reflecting the intensity of the scene. The background is filled with other men, also donned in suits and hats, adding to the western ambiance of the film. The setting appears to be an outdoor location, possibly a town or city street, further enhancing the historical context of the movie. The color palette of the image is dominated by shades of gray and beige, which are complemented by subtle hints of blue and green in the background. These colors contribute to the overall western aesthetic of the film. In terms of body language and gestures, Clint Eastwood's character maintains a neutral stance with his arms resting at his sides. This posture, combined with his serious expression, conveys a sense of calm determination that is characteristic of his character. The composition of the image places Clint Eastwood's character as the focal point, with the other men in the background providing context and depth to the scene. The framing of the image is such that it draws attention to Eastwood's character while still allowing for a clear view of the surrounding elements. Overall, the image is a powerful representation of a pivotal moment from the movie ""The Good, the Bad and the Ugly"", capturing the essence of Clint Eastwood's iconic character in a single frame.",-0.296,-0.02864823348694314,0.75
"The image portrays a scene from the movie ""The Good, the Bad and the Ugly"". The central figure is Clint Eastwood, portraying his character, the Man with No Name. He stands in front of a wooden building, its rustic charm accentuated by the warm lighting that casts long shadows behind him. Dressed in a light-colored outfit that blends seamlessly with the surroundings, he wears a wide-brimmed hat that shields his face from the sun. His arms are crossed over his chest, a universal gesture of confidence and determination. His facial expression is serious, reflecting the gravity of the situation at hand. The overall composition of the image, with Eastwood positioned centrally against the backdrop of the wooden building, creates a sense of balance and tension, capturing the essence of this iconic Western film.",0.7351,-0.01666666666666666,0.7
"The image captures a moment on a city street, where the central figure is a man dressed in a blue shirt and jeans. He is walking towards the camera, his stride confident and purposeful. His face is set in a serious expression, suggesting he might be on an important errand or meeting. In the background, there are other people present, but they are blurred and not the focus of the image. Their presence adds to the bustling atmosphere of the city street, but their identities and actions remain indistinct due to the depth of field effect applied to the photo. The setting is a typical urban environment with buildings lining the street. A sign for a bar is visible, indicating that this could be a commercial area or nightlife district. The lighting in the image is natural, suggesting it was taken during the day under clear weather conditions. Overall, the image evokes a sense of everyday life in a city, with its focus on the man in the blue shirt and jeans as he navigates through his urban landscape.",0.8402,0.008823529411764707,0.42
"The image captures a scene from the movie ""The Good, the Bad and the Ugly"". The central figure is Clint Eastwood, portraying his character, the Man with No Name. He is standing on a balcony that overlooks a bustling street filled with people and horses. Dressed in a black jacket and pants, he holds a rifle in his hand, ready for action. His face is set in a determined expression, reflecting the resolve of his character. The image is taken from a low angle, looking up at Eastwood, which adds to the intensity of the scene. The color palette is dominated by earth tones, with splashes of red and blue adding contrast and depth. The composition of the image places Eastwood in the center, drawing the viewer's attention directly to him. The busy street in the background provides context and sets the stage for the unfolding drama. The overall effect is a powerful depiction of a pivotal moment in the film.",0.6486,0.0431372549019608,0.7
"The image captures a scene from the movie ""Forrest Gump"". The main focus is on Forrest Gump, played by Tom Hanks, who is seen running towards the camera. He is dressed in a blue shirt and jeans, embodying the casual and carefree spirit of his character. In the background, there are several people standing on a porch. They are wearing period clothing, suggesting that this scene takes place in an earlier time period. The porch they're standing on has a sign that reads ""Battalion"", indicating some sort of military or historical context to the scene. The setting is a small town street lined with buildings and shops. The colors in the image are predominantly blue, green, and beige, creating a calm and serene atmosphere. Forrest Gump's facial expression is one of determination and focus as he runs towards the camera, his body language reflecting his forward momentum. The other people on the porch appear to be watching him, their expressions neutral but attentive. The camera angle is from a low angle, looking up at Forrest Gump, which adds to the sense of motion and importance of his character in this scene. The lighting is natural daylight, illuminating the scene with soft, even light that enhances the colors and details of the image. Overall, the film-maker has used various elements such as facial expression, camera angle, lighting, framing, setting, color, body language, props, and costumes to create a vivid and engaging depiction of this iconic movie scene.",0.9517,0.05266666666666667,0.85
"The image captures a lively scene from the movie ""Lone Star Sisters"". The main focus is on two women, each adorned in traditional cowboy hats and vibrant red dresses. One woman stands confidently with her hands resting on her hips, while the other walks towards the camera, adding a sense of movement to the scene. In the background, several men can be seen walking away from the camera, further enhancing the depth of the image. The setting is a bustling street lined with buildings and shops, suggesting a busy day in a small town. The color palette of the image is dominated by earthy tones, creating a warm and inviting atmosphere. However, the red dresses of the women stand out vividly against this backdrop, drawing attention to their characters. Overall, the image beautifully encapsulates the spirit of the movie - a snapshot of life in a small town with its unique charm and character.",0.9666,0.13303872053872054,0.7
"The image captures a scene from the movie ""The Good, the Bad and the Ugly"". The central figure is Clint Eastwood, portraying his character, the Man with No Name. He is standing on a wooden porch of a store named ""Claims Boot"". Eastwood is dressed in a light brown jacket, a dark shirt, and a black cowboy hat, embodying the classic western hero attire. In his right hand, he holds a gun, ready for action. To his left, there's another man wearing a red shirt and a black cowboy hat. He is holding a horse by its reins, suggesting a sense of control or ownership over the animal. The positioning of these characters indicates an interaction between them, possibly related to the plot of the movie. The background reveals a bustling street scene with several people and horses, adding depth to the image and hinting at the setting of the movie. The store sign ""Claims Boot"" is prominently displayed, indicating the location within the narrative of the film. Overall, the image evokes a sense of anticipation and tension, characteristic of Clint Eastwood's western films. The use of color, lighting, framing, and composition all contribute to creating an engaging visual narrative that draws the viewer into the world of ""The Good, the Bad and the Ugly"".",-0.1027,0.003791887125220474,0.7
"The image captures a scene from the movie ""Rango"". The main focus is on Rango, a character from the film, who is riding a horse. He is dressed in a black outfit and a yellow scarf, adding a pop of color to his attire. The setting is a desert landscape with a rock formation visible in the background, providing a stark contrast to the clear blue sky above. The lighting is bright and sunny, illuminating the scene and casting shadows that add depth to the image. The composition of the image places Rango centrally, drawing the viewer's attention directly to him. His facial expression and body language suggest he is in motion, further emphasized by his position on the horse. The camera angle is low, looking up at Rango, which adds a sense of grandeur and importance to his character. The overall mood of the image is adventurous and exciting, reflecting the action-packed nature of the film.",0.9493,0.09375000000000001,0.7
"The image captures a scene from the movie ""The Good, the Bad and the Ugly"". The two main characters are Clint Eastwood and Lee Van Cleef. They are both dressed in blue jackets with yellow scarves and black hats adorned with gold stars. Clint Eastwood is positioned on the left side of the frame, while Lee Van Cleef is on the right. Both characters have serious expressions on their faces, reflecting the intensity of the scene. The background features a desert landscape under a clear blue sky. The image does not contain any text or other discernible objects.",-0.2023,-0.059432234432234415,0.4
"The image presents a close-up of the face of a Native American man, who is adorned with red and white face paint. His hair is styled in a traditional manner, and he wears a headband made from what appears to be leather or fur. The background features a tree branch against a clear blue sky. The man's expression is serious, suggesting a moment of solemnity or contemplation. The image does not contain any text or other discernible objects. The overall composition suggests a focus on the man and his cultural heritage.",0.25,-0.02583333333333333,0.6
"The image captures a close-up of the face of Native American actor Wes Studi, embodying his character, Standing Bear. He is adorned with traditional Native American head and neck decorations in earthy tones of red and brown. His expression is serious, reflecting the solemnity of his character's role. The backdrop features a tree branch against a clear blue sky, adding to the naturalistic setting of the scene. The image does not contain any discernible text or additional objects. The focus is solely on Studi and his character, Standing Bear, evoking a sense of authenticity and cultural richness.",0.6369,0.029629629629629634,0.7
"The image presents a close-up of a man's face, set against the backdrop of a clear blue sky and lush green trees. The man is adorned with a red headdress that contrasts vividly with his skin tone. His face is painted white, with striking red stripes adorning his cheeks and forehead, adding an element of intrigue to his appearance. The camera angle is particularly noteworthy, as it's taken from a low angle, looking up at the man, which lends him an imposing presence. The lighting in the image is natural and bright, illuminating the scene and highlighting the details on the man's face and the surrounding environment. In terms of framing and composition, the man's face occupies the central focus of the image, with the sky and trees providing a serene and expansive background. The colors in the image are vibrant, with the red of the headdress and stripes standing out against the white of his face and the green of the trees. The man's body language and gestures suggest a sense of calm and tranquility, further emphasized by the peaceful setting. His facial expression is neutral, adding to the overall composition of the image. As for props and costumes, there are no discernible items in the image apart from the red headdress worn by the man. The depth of field is shallow, with the background appearing blurred, drawing attention back to the man's face. In terms of visual effects and post-processing, the image does not contain any obvious digital alterations or manipulations. The overall composition of the image suggests a careful balance between the elements, resulting in a visually appealing and engaging scene.",0.9666,0.07803030303030302,0.65
"The image captures a scene from the movie ""Dances with Wolves"". In the foreground, a man dressed in a white shirt and blue jeans is perched on a rock. He holds a rifle, his gaze directed towards the distance. The background reveals a grassy field dotted with trees and bushes. A group of people can be seen in the distance, their forms small against the vast landscape. The image evokes a sense of tension and anticipation, as if the man is waiting for something to happen. The colors are muted, adding to the overall somber mood of the scene.",-0.5719,-0.05,0.3
"The image captures a scene of tranquility and solitude, featuring a single tree standing against the backdrop of a clear blue sky. The tree, with its rough bark and twisted branches, is the central focus of the image. Its branches extend outwards in various directions, creating an intricate network that fills most of the frame. The camera angle is particularly striking, taken from a low vantage point looking up at the tree. This perspective emphasizes the height and grandeur of the tree, making it appear as if it's reaching towards the sky. The lighting is natural and soft, with the sun casting gentle shadows on the tree's bark, adding depth and texture to the scene. The color palette is dominated by the earthy tones of the tree against the vibrant blue of the sky. This contrast creates a sense of balance in the image, drawing the viewer's eye from the ground up towards the sky. There are no discernible texts or human-made objects in the image, reinforcing the sense of solitude and natural beauty. The absence of any other elements allows the viewer to fully appreciate the tree and its surroundings without distraction. In terms of body language and gestures, there is a stillness that pervades the scene, with no movement or action taking place. This further enhances the peaceful and serene mood of the image. Overall, the image is a study in contrasts - between light and shadow, natural and man-made elements, color and texture - all coming together to create a visually striking and emotionally evocative scene.",0.9897,0.08875915750915751,0.7
"The image presents a serene scene of nature. At the center of the frame, a tree with a twisted trunk stands tall against the backdrop of a clear blue sky. The tree's branches extend outwards, creating an intricate network that adds to the complexity of the scene. On one of these branches, a bird has found its perch. Its brown feathers blend harmoniously with the earthy tones of the tree, suggesting it might be a species native to this region. The bird appears calm and at ease in its natural habitat, adding a sense of tranquility to the image. The composition of the image is balanced, with the tree and the bird forming the focal point. The blue sky provides a stark contrast to the earthy tones of the tree and the bird, further emphasizing their presence. Overall, the image captures a moment of peace and serenity in nature, with the bird and the twisted tree standing as symbols of resilience and adaptation.",0.9738,-0.07272727272727272,0.8
"The image captures a scene of nature's beauty and power. A tree branch, twisted and gnarled from years of growth, dominates the frame. The bark is rough and textured, a testament to its age and resilience. On this branch, a small bird nest has been built, a symbol of life persisting amidst the harshness of nature. The sky above is a clear blue, providing a stark contrast to the dark brown color of the tree branch. The sun shines brightly, casting shadows that add depth to the scene. The perspective of the image is from below, looking up at the branch and nest, giving a sense of scale and grandeur to the tree. The bird's nest is located on the right side of the branch, its location carefully chosen for safety and visibility. Despite the harsh conditions, it has managed to thrive, creating a small haven in the midst of nature's chaos. Overall, the image evokes a sense of awe at the resilience and beauty of nature, as well as the delicate balance that exists within it. It's a reminder of the importance of preserving our natural habitats for future generations.",0.9831,-0.050840336134453774,0.85
"The image captures a dramatic scene from the movie ""The Magnificent Seven"". The central focus is on four characters, each distinct in their attire and actions. In the foreground, two men are astride horses. One man is clad in a black jacket and blue pants, while the other sports a white shirt and blue pants. Their bodies lean forward slightly, suggesting motion as they ride. Behind them, another pair of men can be seen. They are dressed in dark jackets and pants, their postures upright as they walk on foot. The backdrop is a clear blue sky, with trees dotting the landscape in the distance. The overall composition of the image suggests an action-packed narrative unfolding against a serene natural setting.",0.9001,0.0036458333333333403,0.7
