text,vader,textblob,llama3
"The image features a logo for a company named ""Absolute Westerns"". The logo is set against a black background, creating a stark contrast that makes the elements of the logo stand out. At the center of the logo, there's a green cactus with a white flower on it. The cactus and flower are the main elements of the logo, drawing attention to the middle of the image. Above the cactus, the word ""Absolute"" is written in bold, white letters. This text is positioned at the top of the logo, serving as an identifier for the company. Below the cactus, the word ""Westerns"" is also written in bold, white letters. This text is located at the bottom of the logo, indicating the type of content that the company specializes in. The overall design of the logo is simple yet effective, using color and typography to create a memorable brand identity. The use of a cactus as part of the logo suggests a connection to Western culture or the American West, which aligns with the company's name ""Absolute Westerns"".",0.9081,0.10757575757575757,0.65
"The image captures a moment of solitude and reflection in an outdoor setting. At the center of the frame, a person is seated on a large rock, their back turned to the camera. They are dressed in a green shirt and blue pants, adding a splash of color to the otherwise earthy tones of the scene. The rock they're sitting on is significant in size, almost dwarfing the person who's perched atop it. The surrounding area is strewn with smaller rocks and boulders, creating a sense of ruggedness and natural beauty. The image is taken from a high angle, looking down at the person and the rock. This perspective gives us a comprehensive view of the scene, allowing us to appreciate not only the main subject but also the intricate details of the environment around them. In terms of lighting, the image is bathed in natural light that enhances the colors and textures within the frame. The absence of any artificial or man-made elements further emphasizes the raw, untouched nature of this outdoor setting. Overall, the image evokes a sense of tranquility and introspection, as if inviting us to pause and reflect alongside the person on the rock.",0.9493,0.0025230463980464,0.7
"The image captures a moment of solitude and adventure in the wilderness. A lone figure, clad in a brown jacket and pants, stands amidst a rocky terrain. The individual is positioned centrally within the frame, their gaze directed towards the right side of the image, suggesting a sense of direction or purpose. The setting is rugged and natural, with rocks scattered around the figure's feet and trees dotting the landscape in the background. The color palette is dominated by earthy tones, with shades of brown and gray pervading the scene, reflecting the raw beauty of nature. In terms of composition, the image is well-balanced with the figure centrally placed, creating a focal point that draws the viewer's attention. The camera angle appears to be slightly elevated, providing a comprehensive view of the surroundings while also emphasizing the solitary figure against the expansive backdrop. Lighting plays a crucial role in setting the mood and atmosphere of the image. The natural light illuminates the scene, casting soft shadows and highlighting the textures of the rocks and trees. This lighting technique adds depth to the image, enhancing its three-dimensional feel. Overall, the image is a testament to the power of visual storytelling, using elements such as facial expression, camera angle, lighting, framing, color, body language, props, and composition to convey a narrative that speaks volumes about adventure, solitude, and the human connection with nature.",0.9382,0.03676739926739927,0.7
"The image captures a scene of solitude and tranquility in a desert-like setting. At the center of the frame, a person is seated on a large rock, their back turned to the camera. They are dressed in a blue shirt and black pants, adding a splash of color to the otherwise earthy tones of the surroundings. The rock they're sitting on is significant in size, almost dwarfing the person who's perched atop it. The ground around them is strewn with smaller rocks and boulders, creating a rugged terrain that contrasts with the smoothness of the rock. In the background, a dirt path meanders off into the distance, disappearing amidst the rocky landscape. The path suggests a journey or exploration, perhaps leading to an unknown destination out of frame. The color palette of the image is dominated by earth tones - browns and grays that speak of a harsh, unforgiving environment. However, there are splashes of blue from the person's clothing that stand out starkly against this backdrop, adding depth and contrast to the scene. Overall, the image evokes a sense of solitude and introspection, as if the person is taking a moment to reflect amidst the vastness of nature. The composition and elements within the frame - from the seated figure to the rocky terrain and distant path - all contribute to this narrative.",0.34,-0.02133699633699634,0.45
"The image presents a captivating scene of a toy robot, painted in hues of green and brown, perched atop a rock formation. The robot is adorned with a white hat, adding to its character. It's holding a blue object in its hand, perhaps a symbol of its purpose or function. The setting is an outdoor landscape, with the rock formation on which the robot sits being the central focus. The background is filled with trees and bushes, providing a natural backdrop to this intriguing scene. The colors in the image are predominantly green, brown, and blue, reflecting the natural environment and the robot's design. In terms of body language and gestures, the robot appears to be in a relaxed state, sitting comfortably on the rock formation. Its facial expression is neutral, neither revealing excitement nor showing signs of distress. The composition of the image places the robot at the center, drawing attention to it immediately. The camera angle is from above, providing a bird's eye view of the scene and emphasizing the height of the rock formation compared to the surrounding vegetation. Overall, the image evokes a sense of curiosity about the story behind this toy robot and its adventures in this natural setting.",0.9165,0.055555555555555566,0.65
"The image captures a scene set in a desert-like environment. At the center of the frame, a man is lying on his stomach on a large rock. He's wearing shorts and appears to be looking towards the camera. The rock he's resting on is situated in the middle of the frame, with a smaller rock located to its left. The background of the image features a rocky cliff face, adding to the ruggedness of the desert setting. Above, the sky is clear, suggesting it might be midday. The colors in the image are predominantly earth tones, with shades of brown and beige dominating the scene. There's no text present in the image, and the relative positions of the objects remain constant - the man on the rock, the smaller rock to his left, and the rocky cliff face in the background. The image does not contain any other discernible objects or individuals. The overall composition of the image suggests a quiet, solitary moment captured in a harsh yet beautiful desert landscape.",-0.4939,0.0434873949579832,0.45
"In the image, a man is seen astride a horse on a rocky outcropping. The man is dressed in a blue jacket and jeans, with a cowboy hat adorning his head. He holds a rope in his hand, suggesting he might be herding or controlling something. The horse beneath him is brown and white, standing calmly on the uneven terrain. In the background, there's another person lying on the ground. They are dressed in a white shirt and blue pants, seemingly at rest or perhaps even asleep. Their position contrasts with the man on the horse, adding an element of intrigue to the scene. The setting is rugged and natural, with trees dotting the landscape under a clear blue sky. The rocky outcropping where the man and horse are located adds a sense of adventure and exploration to the image. The color palette is dominated by earth tones, reflecting the natural environment. However, the man's blue jacket stands out, drawing attention to him as the main subject of the image. The body language and gestures of the characters suggest different narratives - one of action and control, another of rest and relaxation. The visual effects are minimalistic, focusing on the interaction between the characters and their environment rather than on elaborate special effects. Overall, this image captures a moment in time, telling a story through its composition, color palette, character positioning, and body language. It invites viewers to imagine the narrative behind it, sparking curiosity and interest.",0.9682,0.04785714285714286,0.45
"The image captures a poignant scene from the film ""Forrest Gump"". In the center of the frame, we see Forrest Gump himself, lying on the ground with his arms outstretched. His expression is one of sadness and resignation, reflecting the challenges he has faced throughout the film. To his left stands a man in a cowboy hat, who appears to be comforting or supporting Forrest. The man's presence adds a layer of complexity to the scene, suggesting themes of friendship, guidance, or perhaps even mentorship. The setting is a rocky landscape under a clear blue sky, which contrasts with the somber mood of the scene. The starkness of the surroundings further emphasizes the isolation and vulnerability that Forrest has faced. In terms of composition, the image is well-balanced with Forrest in the center and the man to his left. The use of natural lighting enhances the colors in the scene, from the earthy tones of the rocks to the vibrant blue of the sky. Overall, this image evokes a range of emotions, from sadness and resignation to hope and resilience, encapsulating the core themes of ""Forrest Gump"".",0.0516,0.03205128205128205,0.5
"The image captures a scene from the movie ""No Country for Old Men"". In the center of the frame, Carson Wells, played by Woody Harrelson, is kneeling on the ground. He's dressed in a brown jacket and a cowboy hat, holding a gun pointed at the head of Carson Chisolm, played by Antonio Banderas. Chisolm is wearing a white shirt and a bandana around his neck. The background features a blue sky with clouds and trees. Wells' facial expression is intense as he points the gun, while Chisolm's expression is calm despite the danger. The camera angle is low, looking up at Wells and Chisolm, emphasizing their confrontation. The lighting is natural, suggesting it might be daytime. Framing and composition place Wells in the foreground with Chisolm slightly behind him, drawing attention to their interaction. The colors are vibrant, with the blue of the sky contrasting against the brown of Wells' jacket and the green of the trees. Wells' body language and gestures convey a sense of tension and urgency, while Chisolm's remain composed. Props and costumes are simple yet effective in setting the scene. Depth of field is shallow, focusing on Wells and Chisolm and blurring the background. Character positioning and interaction suggest a confrontation or standoff. Visual effects and post-processing enhance the drama and intensity of the scene.",0.9466,0.02549019607843137,0.4
"The image captures a scene from the movie ""Forrest Gump"". In the center of the frame, we see Tom Hanks portraying the character of Forrest Gump. He is dressed in a green jacket and a cowboy hat, holding a fishing rod in his right hand. His facial expression is one of concern as he looks at someone off-screen. In the background, there's another person who appears to be in distress. This individual is wearing a white headscarf and has their hands covering their ears, suggesting they might be experiencing some sort of pain or discomfort. The setting is outdoors under a clear blue sky with trees visible in the distance. The overall composition of the image suggests an intense moment in the story, with Forrest Gump seemingly trying to help the distressed individual.",-0.5849,0.025974025974025972,0.4
"The image portrays a scene from the movie ""Forrest Gump"". In the center of the frame, we see Tom Hanks portraying the character of Forrest Gump. He is dressed in a green jacket and a cowboy hat, holding a fishing rod in his right hand. His facial expression is one of sadness or pensiveness as he looks off into the distance. The setting is an open field with trees visible in the background under a blue sky. The composition of the image places Forrest Gump slightly to the left of center, drawing our attention to him and his thoughtful expression. The color palette of the image is dominated by shades of green from Forrest's jacket and the surrounding field, contrasted against the blue of the sky. The lighting appears natural, suggesting it might be a bright day. In terms of body language and gestures, Forrest Gump's posture suggests he is deep in thought, perhaps reflecting on his life or lost loved ones. His gaze is directed away from the camera, further emphasizing this introspective mood. As for props and costumes, Forrest Gump's green jacket and cowboy hat are notable elements that contribute to his character's distinct look. The fishing rod he holds might suggest a pastime or interest of his character. In terms of depth of field, the focus is primarily on Forrest Gump, with the background slightly blurred, creating a sense of depth and drawing our attention to him. Finally, visual effects and post-processing elements are minimal in this image, allowing the viewer to fully immerse themselves in the scene without any distractions. The overall composition and elements within the frame work together to create a poignant moment from the movie ""Forrest Gump"".",0.949,0.08278388278388278,0.7
"The image captures a dramatic scene from the movie ""Dances with Wolves"". In the center of the frame, we see Kevin Costner, portraying the character of Dan Jones. He is lying on the ground, his body covered in blood and dirt, indicating a recent altercation or conflict. His facial expression is one of pain and defeat, further emphasizing the intensity of the scene. To the left of Dan Jones stands another man, dressed in a cowboy hat and a gray shirt. His stance suggests he is standing over Dan Jones, possibly victorious from their confrontation. The positioning of these two characters creates a clear narrative of conflict and resolution within the frame. The setting is a rocky canyon, providing a stark and rugged backdrop to the scene. The lighting is dramatic, with shadows cast on the ground and rocks, adding depth and dimension to the image. Framing and composition are well-balanced, drawing attention to the characters and their actions while also highlighting the surrounding environment. Color in the image is predominantly earth tones, reflecting the natural setting and enhancing the overall mood of the scene. However, there are splashes of red from Dan Jones' bloodied attire, providing a stark contrast and further emphasizing the violence of the scene. Body language and gestures play a significant role in conveying emotion within this still. The man's posture suggests dominance and victory, while Dan Jones' position on the ground indicates defeat and vulnerability. Props and costumes are simple yet effective - the cowboy hat and gray shirt for the standing character, and the bloody attire for Dan Jones. Depth of field is shallow, with a focus on the characters in the foreground and a blur of the rocky canyon in the background. This technique draws attention to the characters and their actions while also providing context to the scene. Overall, this image is a powerful representation of a pivotal moment from ""Dances with Wolves"", capturing not only the physical details but also the emotional resonance of the scene.",-0.6705,-0.020192307692307697,0.5
"The image portrays a scene from the movie ""The Good Life"". In the center of the frame, actor Eddie Kaye Thomas is seen lying on the ground. He's shirtless and wearing a headband, his arms are outstretched as if he's trying to push himself up. His facial expression is one of determination and effort. Standing over him is actor Zach Galifian, dressed in a cowboy hat and a gray jacket. He's reaching down towards Thomas, his body language suggesting he's about to offer assistance or perhaps issue an order. The setting is a rocky cliff face, adding a rugged texture to the scene. The color palette is dominated by earth tones, with the exception of Thomas' headband which stands out in contrast. In terms of composition, Thomas is positioned centrally in the frame, drawing the viewer's attention immediately. Galifian, standing over him, is slightly off-center, creating a sense of balance in the image. The rocky cliff face forms the backdrop, its rough texture adding depth to the scene. The overall sentiment evoked by this image is one of tension and urgency, as Thomas struggles to push himself up while Galifian reaches down towards him. The precise positioning of the actors and their actions suggest a pivotal moment in the story.",0.0828,0.08383838383838384,0.45
"The image captures a scene from the movie ""Forrest Gump"". The central figure is Forrest Gump, portrayed by actor Tom Hanks. He is standing in an open field under a clear blue sky. His attire consists of a green jacket and a wide-brimmed beige hat, typical of the character he portrays. In his hand, he holds a small object, possibly a trinket or memento. His facial expression is one of deep thought, suggesting a moment of contemplation or reminiscence. The overall composition of the image places Forrest Gump at the center, drawing the viewer's attention directly to him and his actions.",0.7003,-0.03974358974358974,0.7
"The image captures a scene from the movie ""Forrest Gump"". The main focus is on Forrest Gump, portrayed by Tom Hanks, who is sitting on a rock. He is dressed in a cowboy hat and a denim jacket, holding a fishing rod in his hand. His expression is one of sadness as he gazes into the distance. In the background, there's another person standing on a cliff. This individual is wearing a green shirt and appears to be observing the scene. The setting is outdoors with a clear blue sky overhead and trees visible in the distance. The color palette of the image is dominated by earth tones, creating a natural and rustic atmosphere. The lighting is diffused, adding to the serene mood of the scene. The framing and composition are well-balanced, drawing attention to Forrest Gump while still giving a sense of the surrounding environment. Overall, the image evokes a sense of solitude and introspection, as Forrest Gump seems lost in thought amidst the vastness of nature.",0.8658,0.02380952380952381,0.35
"In the image, a man and a woman are standing in front of a tree. The man is dressed in a cowboy hat and jeans, while the woman is wearing a tank top and shorts. They are positioned on a dirt path with rocks scattered around them. The background consists of trees and bushes, providing a natural setting for the scene. The man's body language suggests that he is observing something off-camera, indicating curiosity or interest. His facial expression is neutral, which might suggest that he is not in a state of strong emotion at the moment. The woman, on the other hand, appears to be looking directly at the camera. Her gaze and direct interaction with the viewer create a sense of connection. The colors in the image are natural and muted, with the man's jeans and the woman's tank top providing contrast against the earthy tones of the dirt path and the greenery in the background. In terms of composition, the positioning of the subjects and their relative locations to each other and the camera create a balanced scene. The tree behind them serves as a focal point, drawing the viewer's eye towards the center of the image. Overall, the image captures a moment between two individuals in a natural setting, with elements such as body language, facial expression, color, composition, and visual effects contributing to the overall narrative and emotion of the scene.",0.9517,0.06228070175438598,0.45
"In the image, there are two men standing in a desert setting. The man on the left is shirtless and has his back turned to the camera. He is wearing a white headband. The man on the right is dressed in a cowboy hat, jacket, and pants. Both men are looking off into the distance with serious expressions on their faces. The background of the image features a desert landscape with trees and rocks scattered around. The lighting in the image is diffused, giving it a soft and warm tone. The framing of the image places the two men as the central focus, with the expansive desert serving as a backdrop to their scene. The color palette of the image is dominated by earth tones, with the exception of the man's white headband and the blue sky peeking through in the background. The body language and gestures of the men suggest a sense of tension or anticipation, perhaps indicating that they are on a journey or mission in this vast desert landscape. The props and costumes worn by the men contribute to their character portrayal. The cowboy hat and jacket suggest a western theme, while the white headband adds an element of intrigue. The positioning of the characters and their interaction with each other and the environment further enhances the narrative of the image. Overall, the film-maker has skillfully used various elements such as facial expression, camera angle, lighting, framing, setting, color, body language, gestures, props, costumes, depth of field, character positioning, visual effects, and post-processing to create a compelling and engaging scene.",0.6486,0.05579004329004329,0.3
"The image captures a scene from the movie ""Butterfly"" featuring actors Marlon Brando and Johnny depp. In the foreground, Marlon Brando, dressed in a blue shirt and jeans, stands with his arms crossed. His expression is serious as he looks off to the side. Behind him, Johnny Depp, wearing a cowboy hat and a blue jacket, is positioned with his hands on his hips. He too appears to be looking off to the side, mirroring Brando's intense gaze. The setting is outdoors, with trees visible in the background. The overall color scheme of the image is muted, adding to the dramatic atmosphere of the scene.",0.0,-0.1380952380952381,0.4
"In the image, there are two men in a desert setting. The man on the left is dressed in a gray jacket and a white cowboy hat, holding a gun in his hand. He appears to be walking towards the other man. The man on the right is wearing a black tank top and blue shorts, standing still with his hands behind his back. The background of the image features trees and rocks, adding to the desert ambiance. The overall color scheme of the image is dominated by earth tones, with some blue and green accents from the clothing and vegetation. The positioning of the men suggests a possible confrontation or meeting in this rugged landscape.",0.0772,-0.00815018315018315,0.2
"The image captures a scene from the movie ""The Good, the Bad and the Ugly"". In the foreground, Clint Eastwood, portraying the character of the Man with No Name, is seen walking towards the camera. He is dressed in a gray jacket, blue jeans, and a brown cowboy hat, holding a gun in his hand. His facial expression is serious, reflecting the intensity of his character. In the background, Lee Van Cleef, playing the character of the Ugly Man, is seen walking away from the camera. He is wearing a black vest and pants, with no shirt visible. His body language suggests he is moving away, further into the desert landscape that stretches out behind him. The setting is a rocky desert landscape under a clear blue sky. The vastness of the desert and the simplicity of the characters' attire contrast sharply with each other, emphasizing the harsh reality of their surroundings. The color palette of the image is dominated by earth tones - browns and grays from the desert and the characters' clothing, punctuated by the bright blue of the sky. The lighting is natural, suggesting it's daytime, and the framing places Eastwood in the center of the frame, drawing the viewer's attention to him. The composition of the image, with Eastwood in the foreground and Van Cleef in the background, creates a sense of depth and perspective. The positioning of the characters also suggests a narrative - Eastwood moving towards Van Cleef, possibly indicating a confrontation or a chase scene. Overall, the image is a powerful representation of the film's title - ""The Good, the Bad and the Ugly"", capturing the essence of its characters and setting in a single frame.",-0.7579,-0.09313186813186812,0.7
