text,start,duration,time_midpoint,vader,textblob,llama3,vader_norm,textblob_norm,llama3_norm
date that's more important dinner date,3667.14,5.219,3669.7495,0.2716,0.45,0.5,-0.1814341801617401,-0.057645689551826244,-0.3437471802319158
we're home with whom do you think Skip,3669.72,5.099,3672.2695,0.0,0.0,0.4,-0.18073026316316954,-0.0582763585762303,-0.3415095813292955
it Mama come on let's go no no don't,3672.359,5.22,3674.969,0.2235,0.0,-0.7,-0.17995968838766419,-0.058980603792226624,-0.3390912948543832
skip ad I've done a date with whom,3674.819,6.3,3677.969,0.0,0.0,0.2,-0.17908353083755413,-0.059796969787175545,-0.33637876874309386
with Mr Noble what's happened to her,3677.579,5.701,3680.4295,0.4588,0.6,-0.7,-0.17834956051505305,-0.06049221195874368,-0.33413499716627654
Teddy I used to think that maybe you and,3681.119,3.901,3683.0695,0.0,0.0,0.4,-0.1775468219711401,-0.06126310560932043,-0.33170907344748773
she ma will you come on we only got a,3683.28,2.03,3684.295,0.0,0.0,0.7,-0.17716888261685748,-0.06162950619575474,-0.33057662555051875
say hello for me,3690.119,5.85,3693.044,0.0,0.0,0.3,-0.17437488538584986,-0.06439457348433177,-0.3223817842607974
I'm sorry jay but,3698.88,5.459,3701.6095,-0.0387,-0.5,-0.7,-0.17148130079771162,-0.06733490706818582,-0.3141874311996453
that's how I feel having wounded my,3701.819,4.381,3704.0095,0.0,0.0,-0.7,-0.1706433506073093,-0.06819630403702456,-0.31186399464183806
vanity both as a man or does that what,3704.339,3.601,3706.1395,-0.2263,0.0,0.2,-0.1698899179709817,-0.06897361547047896,-0.30979261452370566
was it they called me yes a merchant,3706.2,3.419,3707.9095,0.4019,0.0,0.2,-0.16925692358228953,-0.06962839973195067,-0.30806490191539565
Prince would you mind telling me just,3707.94,4.32,3710.1,0.0,0.0,0.4,-0.1684649636134243,-0.07044947021473667,-0.3059189647613124
why you changed your mind it's very,3709.619,4.021,3711.6295,0.0,0.2,0.3,-0.16790640663546966,-0.0710295804904293,-0.30441566364117895
you're very attractive and so is your,3713.64,2.76,3715.02,0.4927,0.8497647307926743,0.8,-0.16665208417090474,-0.072334598789405,-0.3010695066191412
but I think in the long run I can get,3716.4,3.48,3718.14,0.0,-0.05,0.4,-0.1654784485244562,-0.07355750270004455,-0.2979745281977244
more out of my own business,3718.2,4.02,3720.21,0.0,0.55,-0.7,-0.164689690897572,-0.07437980372782065,-0.29591331125359954
it'll take longer but I'll have more,3719.88,4.14,3721.95,0.0,0.5,0.7,-0.16402052592097596,-0.07507742939206222,-0.29417613413653215
when it's over oh,3722.22,3.54,3723.99,0.0,0.0,-0.7,-0.16322890950037403,-0.07590246296597968,-0.2921343990381262
myself for instance and let's not fight,3725.76,5.16,3728.34,0.2924,0.0,0.7,-0.16151577467005798,-0.07768573801834837,-0.28776381413508456
that young partner of yours you will,3728.579,5.161,3731.1595,0.0,0.1,-0.7,-0.16038743042461978,-0.07885766517175813,-0.28491976300331306
have him too aren't you yes,3730.92,5.28,3733.56,-0.3089,0.0,0.4,-0.1594158401688007,-0.07986450936699235,-0.28249210175284434
and I'll have all of him and I thought,3733.74,3.96,3735.72,0.0,0.0,0.4,-0.15853312510673706,-0.080777073637985,-0.28030315967377906
that a little of me would be worth all,3736.2,2.46,3737.43,0.2263,0.0562499999999999,0.7,-0.15782869233689836,-0.0815036411017039,-0.2785674613288242
I thought so too once but I don't think,3738.66,5.1,3741.21,0.0,0.0,0.2,-0.15625418277013697,-0.08312147908779359,-0.274722831246511
so anymore I see,3741.54,4.38,3743.73,0.0,0.0,0.3,-0.1551914591962471,-0.08420807459566154,-0.27215449079382303
do you mind if I keep that sketch I gave,3743.76,4.44,3745.98,0.0,0.0,0.7,-0.15423393293324136,-0.08518299981309763,-0.2698583057061062
it to you I'm gonna have it framed and,3745.92,3.78,3747.81,0.0,0.0,0.5,-0.15344920022127673,-0.08597887746302971,-0.26798892147838704
hung up in my office with a motto,3748.2,3.54,3749.97,0.0,0.0,0.7,-0.15251618815026569,-0.0869212659472111,-0.26578064319750566
underneath never underestimate the,3749.7,5.24,3752.32,0.2235,0.0,0.6,-0.15149289451998046,-0.08794972931951005,-0.26337630091040365
competition from 7th Avenue,3751.74,3.2,3753.34,0.0,0.0,0.6,-0.15104611087629913,-0.08839701606128698,-0.2623322339462508
tennis come up,3764.579,3.081,3766.1195,0.0,0.0,0.4,-0.14531828836364089,-0.09402551052289047,-0.24924294666314073
we have an Uninvited Guest,3767.7,6.24,3770.82,0.0,0.0,-0.7,-0.14315347975688114,-0.09609585742886295,-0.24443339696260963
or was he invited it's your partner,3770.28,7.019,3773.7895,0.0,0.0,0.2,-0.14177059028718048,-0.09740034467831438,-0.2413990408663556
my partner yes Mr Sherman he's on his,3773.94,4.859,3776.3695,0.4019,0.0,0.3,-0.14055972833903566,-0.09853047480877929,-0.23876607221464516
way up I must confess I'm a little,3777.299,3.3,3778.949,0.0,-0.1875,0.6,-0.13934058340817132,-0.09965655883190774,-0.2361373782353474
puzzled is he coming here as an outraged,3778.799,3.961,3780.7795,-0.6369,-0.7095428228987268,-0.7,-0.13847036701191529,-0.10045292500126204,-0.23427457629462586
lover or as a protector to deliver you,3780.599,4.74,3782.969,0.5859,0.0,0.8,-0.13742405355352783,-0.10140205497162762,-0.23204961662605003
from the Lion's Den,3782.76,4.319,3784.9195,0.0,0.0,0.2,-0.13648705425801477,-0.10224408376260359,-0.23007071990368966
I should like to know what role he's,3785.339,3.361,3787.0195,0.3612,0.0,0.5,-0.135473167203845,-0.10314657352134922,-0.22794381450761753
playing so as to determine what part to,3787.079,3.301,3788.7295,0.2023,0.0,0.4,-0.13464375449963883,-0.10387805542545828,-0.22621493097939435
play myself,3788.7,3.84,3790.62,0.34,0.0,0.7,-0.13372286893647076,-0.10468290581838105,-0.22430693788137718
I'm sorry Harriet but,3790.38,3.719,3792.2395,-0.0387,-0.5,-0.7,-0.13293076458550246,-0.10536895181677491,-0.22267544880228698
it would have been stupid of me not to,3792.54,2.88,3793.98,-0.5267,-0.7095428228987268,0.8,-0.13207621192753627,-0.10610249780185994,-0.22092532319858224
let him come up in control he must know,3794.099,4.52,3796.359,0.0,0.0,0.4,-0.13090278937248745,-0.10709842890058377,-0.21853895173756374
that you're here of course,3795.42,3.199,3797.0195,0.0,0.0,0.7,-0.13057591766787818,-0.1073734899073225,-0.21787764543859592
ah good evening Mr Sherman,3810.2,4.379,3812.3895,0.4404,0.7,0.4,-0.12284405632336556,-0.11356291050546855,-0.20266718511050724
this will only take a minute,3814.619,3.2,3816.219,0.0,0.0,0.7,-0.12088267805156494,-0.11503111250701772,-0.19893903854541
I see the Dr Noble as the cure for what,3825.0,3.72,3826.86,0.4588,0.6,0.2,-0.11536724831654589,-0.11892181748007477,-0.18873510477748506
ails you oh well there's plenty for,3826.92,4.02,3828.93,0.2732,0.0,0.7,-0.11428390149902448,-0.11964315040979429,-0.18677919061222026
everyone and may I pour you a martini I,3828.72,3.42,3830.43,0.0,0.0,0.7,-0.11349687558503534,-0.12015808748059185,-0.18536819319520595
didn't come here to join a little party,3830.94,3.0,3832.44,0.5584,-0.1875,0.4,-0.11243970677752874,-0.1208378392556438,-0.18348583394942788
Mr Noble I came to take back a few,3832.14,3.24,3833.76,0.4588,0.1333333333333333,-0.7,-0.11174389376636588,-0.12127787140169624,-0.18225486799087007
things I said to my partner this,3833.94,3.84,3835.86,0.0,0.0,0.4,-0.11063445175386834,-0.12196755316604448,-0.1803050093965696
afternoon Diddy listen to me listen to,3835.38,5.36,3838.06,0.0,0.0,0.4,-0.10946902613154519,-0.12267647566276228,-0.17827346879255285
I suppose you got a good story to cover,3848.76,3.12,3850.32,0.4404,0.7,0.3,-0.10292064830671564,-0.1263753739626309,-0.16716028154616266
well you're both celebrating too soon I,3851.88,4.14,3853.95,0.7003,0.0,-0.7,-0.10096616219964973,-0.12738977685664452,-0.16393707471531263
want to tell you something Mr Noble and,3854.52,3.24,3856.14,0.5106,0.6,0.4,-0.09978397661742215,-0.12798416833950274,-0.16200725443533612
Harriet once told me,3856.02,3.36,3857.7,0.0,0.0,0.4,-0.09894055791112945,-0.12839953722793898,-0.16063934342926398
she'll never get out of our deal she's,3857.76,3.24,3859.38,0.0,0.0,-0.7,-0.09803109175183304,-0.12883941466983062,-0.1591724815384075
going to stick and make me Rich and make,3859.38,3.959,3861.3595,0.5574,0.375,0.7,-0.09695800410817822,-0.12934784610379682,-0.15745244871315248
our company a success,3861.0,4.2,3863.1,0.5719,0.3,0.8,-0.09601321216100152,-0.12978611131909934,-0.15594752068438922
you'll design overalls if I want you to,3863.339,3.78,3865.229,0.0772,0.0,0.3,-0.09485600752854617,-0.13031108350812518,-0.1541161109431153
and you're going to like it,3865.2,4.02,3867.21,0.3612,0.0,-0.9,-0.09377782726983827,-0.13078862373742392,-0.15242131901900557
you lied cheated and double crossed your,3867.119,3.661,3868.9495,-0.7096,0.0,0.7,-0.09283002560334967,-0.13119929432563968,-0.15094051620302554
way out of a model's room into a,3869.22,4.079,3871.2595,0.0,0.0,0.5,-0.09156994489721194,-0.13173220432078,-0.14898470084561266
partnership with me and Cooper and now,3870.78,3.839,3872.6995,0.0,0.0,0.7,-0.0907836677997077,-0.1320572543002858,-0.14777162251369702
you're lying cheating and trying to,3873.299,2.461,3874.5295,-0.7720604106479415,0.0,-0.8,-0.08978364526693518,-0.132462447070385,-0.1462367822354697
double cross your way into something,3874.619,3.18,3876.209,0.0,0.0,0.4,-0.08886513434181377,-0.1328265749123628,-0.1448348336173605
better well you can stop trying you're,3875.76,3.78,3877.65,0.4215,0.5,-0.7,-0.088076540808102,-0.133133112046422,-0.14363704655451837
stuck let's stop screaming like a,3877.799,3.54,3879.569,-0.5106,0.0,-0.7,-0.087025676860963,-0.1335329321812201,-0.1420492008221189
Seventh Avenue sales I am a Seventh,3879.54,3.48,3881.28,0.0,0.0,0.5,-0.08608811504880776,-0.13388135866376608,-0.14064044509646473
Avenue salesman but I'm nobody's Teddy,3881.339,3.901,3883.2895,0.0,0.0,0.2,-0.08498633984330188,-0.1342809178832245,-0.1389943072338067
not even Harriet's,3883.02,4.38,3885.21,0.0,0.0,-0.7,-0.08393278573820352,-0.1346530810092483,-0.13742952634369734
Harriet of Nobles,3885.24,5.72,3888.1,0.0,0.0,0.6,-0.08234649047338452,-0.13519535341223088,-0.1350903424729026
you mean Nobles Harriet,3887.4,3.56,3889.18,0.0,-0.3125,0.2,-0.08175345936889548,-0.1353925502361616,-0.13422096073281814
and I won't tell Cooper about your dirty,3892.44,4.2,3894.54,-0.4404,-0.6,0.4,-0.07880900898393503,-0.13632768648425905,-0.12994457103097679
little scheme he likes you,3894.18,5.6,3896.98,0.3687,-0.1875,0.7,-0.07746823633175873,-0.13672955584937554,-0.1280189116226579
it might break his heart,3896.64,3.14,3898.21,0.6369,0.0,-0.7,-0.07679233659861753,-0.13692652991814605,-0.12705316636909303
can you get me out of it,3907.619,3.141,3909.1895,0.0,0.0,-0.7,-0.07076197367895176,-0.13852038465536756,-0.11857945875539912
he loves you but he wants to own you,3910.859,6.48,3914.099,0.3291,0.4,-0.7,-0.06806965068444916,-0.13913883684741257,-0.11487536129412305
because he's a man who has nothing,3913.68,6.06,3916.71,0.0,0.0,-0.7,-0.06663950799221327,-0.13944441318094777,-0.11292664941754589
I have everything and all I want is to,3917.339,4.381,3919.5295,0.0772,0.0,0.7,-0.06509677766608213,-0.13975636742054476,-0.11083880548701536
share my pleasure in it with you can you,3919.74,5.54,3922.51,0.7096,0.0,-0.7,-0.06346804090102749,-0.14006594181391935,-0.10865028624691611
get me out of it yes,3921.72,3.56,3923.5,0.4019,0.0,0.7,-0.0629275641018169,-0.14016420677345207,-0.10792755531884106
I've given Ellie a list of the dates and,3929.22,3.48,3930.96,0.0,0.0,0.4,-0.058864567852977064,-0.14083226680694166,-0.10254865541114026
the places where I'll be you can expect,3930.839,4.02,3932.849,0.0,0.0,0.4,-0.05783879170704765,-0.14098134346785854,-0.10120535509821703
the first orders in a week take me along,3932.7,3.84,3934.62,0.0,0.25,0.7,-0.05687834029866905,-0.14111381241209564,-0.09995280994540738
Mr chairman you can double the business,3934.859,3.421,3936.5695,0.0,0.0,0.4,-0.055822554199515026,-0.14125151325809135,-0.09858166025640623
don't mean such a hurry to grow up and,3936.54,3.66,3938.37,0.0,-0.15625,0.7,-0.054848897223051814,-0.1413711711000344,-0.09732240348182068
become a baby be good Ellie if you can't,3938.28,5.579,3941.0695,0.4404,0.7,0.4,-0.05339181218909676,-0.14153713181038954,-0.09544712607261585
be good at least get in on time will it,3940.2,5.899,3943.1495,0.4404,0.1999999999999999,0.4,-0.052271457062317936,-0.14165407562097268,-0.09401259298786525
I can't stand such a thing such an,3956.88,4.56,3959.16,0.0,0.0,-0.8,-0.04372698018777382,-0.1422422276394365,-0.0832706822996084
atmosphere two partners not talking to,3958.74,3.599,3960.5395,0.0,0.0,-0.7,-0.04299818155138619,-0.14226756358351692,-0.08236979943619432
each other,3961.44,4.52,3963.7,0.0,-0.125,0.5,-0.04133343600610289,-0.1423107693743447,-0.08032045944272173
here are some sketches for the new line,3962.339,3.621,3964.1495,0.0,0.1363636363636363,0.3,-0.04109724501456868,-0.14231524471811613,-0.08003064394886318
Harriet wait,3967.74,3.2,3969.34,0.0,0.0,0.4,-0.03838074600275415,-0.14233707934240883,-0.0767137305533768
I don't understand a gown for 10.95 and,3971.339,6.24,3974.459,0.0,0.0,-0.7,-0.03572227771454838,-0.14230542294459259,-0.07349574420173755
maybe these materials you're crazy our,3974.94,5.879,3977.8795,-0.34,-0.6,-0.7,-0.03395803008508013,-0.14225526139506267,-0.07137478836607464
prices are going up Sam before rise,3977.579,4.861,3980.0095,0.0,0.0,0.4,-0.0328645437427205,-0.1422124190656051,-0.07006583742741057
clear those material racks all of them,3980.819,3.601,3982.6195,0.3818,0.1,-0.7,-0.03153019791550015,-0.1421478858437814,-0.06847421832071764
right away because the new materials are,3982.44,3.659,3984.2695,0.0,0.211038961038961,0.7,-0.030689886163643078,-0.14210029861984996,-0.0674749952854495
coming in tonight this is impossible for,3984.42,3.6,3986.22,0.0,-0.6666666666666666,-0.7,-0.02969985202830508,-0.1420373072488359,-0.0663007405916087
a 10.95 pounds we're forming a second,3986.099,3.781,3987.9895,0.0,0.0,0.7,-0.028804862064364202,-0.14197388408232345,-0.06524195020534762
Corporation with your boy Go assets,3988.02,3.96,3990.0,0.1779,0.0,0.7,-0.027791718643208358,-0.1418946225099263,-0.06404643870916647
Harriet Boyd Originals they'll make the,3989.88,3.179,3991.4695,0.0,0.0,0.7,-0.02705376525002437,-0.1418318728866424,-0.06317764771518576
you'll do this without Teddy I want a,3994.52,4.9,3996.97,-0.0572,0.0,-0.7,-0.0243113845292973,-0.14156125599315456,-0.059963181172867946
challenge you can what do you want me to,3997.44,3.48,3999.18,0.1531,0.0,0.2,-0.023218656237881427,-0.14143681064837163,-0.05868827390697394
do get down on my hands and knees and,3999.42,3.659,4001.2495,0.0,-0.1555555555555555,-0.7,-0.022200289204125923,-0.14131220148243476,-0.05750301222573388
beg him to talk to me we're in business,4000.92,4.5,4003.17,0.0,0.0,0.7,-0.02125956072613859,-0.14118962793433895,-0.056410502252621064
to make a profit aren't we yes well the,4003.079,4.141,4005.1495,-0.0444,0.0,0.3,-0.020294365673231507,-0.1410563504526967,-0.05529187987637044
Harriet Boyd line has been guaranteed a,4005.42,3.56,4007.2,0.0,0.0,0.4,-0.019299386089223384,-0.1409109186662434,-0.054141089327733725
profit of 50 000 for the first season,4007.22,4.379,4009.4095,0.4404,0.25,0.8,-0.01823286690171921,-0.1407458736467196,-0.05291009901303832
yes I never want to see anything for,4008.98,6.24,4012.1,0.3565,0.0,-0.8,-0.016942198132621683,-0.14053332142643601,-0.051423741929647514
10.95 again as long as I live,4011.599,3.621,4013.4095,0.0,0.0431818181818181,0.85,-0.016317261859853428,-0.14042530460098437,-0.050705311641152745
yes it's Dallas Texas aesthetic,4027.88,6.04,4030.9,0.4019,0.0,0.7,-0.00818692114916942,-0.13870358063535543,-0.041420247687684125
Teddy how are you teddy fine fine,4033.92,6.96,4037.4,0.3818,0.4166666666666667,0.6,-0.005275340400366855,-0.1379356694022064,-0.03811530600792029
I'm mailing us three fat ones and our,4038.299,4.8,4040.699,0.0,0.0,0.8,-0.003821979494313079,-0.13752032346457518,-0.03646774039156929
Whopper from Hermione Griggs,4040.88,4.8,4043.28,0.0,0.0,0.6,-0.0026967150160156573,-0.13718355697920032,-0.035192672211813984
yeah I got that flow got that rhythm you,4043.099,6.0,4046.099,0.296,0.0,0.7,-0.0014797472016856144,-0.1368040254785722,-0.033813931104779496
working hard naturally naturally all,4045.68,6.24,4048.8,-0.1027,-0.0958333333333333,0.7,-0.0003257505187530818,-0.1364290402969494,-0.0325064687193714
right that'd be all right yeah yeah,4049.099,5.821,4052.0095,0.5267,0.2857142857142857,0.7,0.0010298958299477861,-0.13596920820576078,-0.0309700483337684
they're gonna have to tell them Harriet,4056.0,3.96,4057.98,0.0,0.0,-0.7,0.0035054809451570976,-0.13507332607760758,-0.028161295283487903
every day we're invoice trouble this is,4057.619,4.021,4059.6295,-0.4019,-0.2,0.3,0.004178566719345657,-0.13481668031226796,-0.027396574098066798
great trouble if you can get it he keeps,4059.96,4.26,4062.09,0.34,0.3,0.3,0.005173665548499494,-0.1344266101288748,-0.02626488822293469
sending in orders and we can't fill them,4061.64,4.979,4064.1295,0.0,0.0,0.5,0.0059903029642290155,-0.13409677142340518,-0.025335000742206404
Sam listen to me,4064.22,4.379,4066.4095,0.0,0.0,-0.7,0.006894322785072846,-0.13372112281698237,-0.02430419088877749
in four weeks we jumped from a cheap,4066.619,3.301,4068.2695,0.0,0.4,0.6,0.007624754998410221,-0.13340931700506403,-0.023470073258604545
little dress house always on the verge,4068.599,3.301,4070.2495,0.0,-0.1875,0.4,0.008395259169451512,-0.1330721566332207,-0.022588841895674353
of bankruptcy to our gown house we have,4069.92,3.48,4071.66,0.0,0.0,-0.7,0.00893966465301382,-0.13282870474668407,-0.021965279430632208
the Noble stores as a client a,4071.9,3.24,4073.52,0.4588,0.6,0.3,0.009651803786096817,-0.13250354705975748,-0.021148332580999456
guaranteed profit on every garment in,4073.4,3.419,4075.1095,0.4404,0.0,0.8,0.010255138145437619,-0.1322219901683279,-0.020454990108003723
the future as millionaires is that,4075.14,4.32,4077.3,0.0,0.0,0.6,0.011078601997228103,-0.1318284572078704,-0.019506712623553427
trouble no that's not trouble well relax,4076.819,5.28,4079.459,-0.7061,-0.05,0.5,0.011881056059248513,-0.13143438563562043,-0.018580238448206235
Mr millionaire and be happy until teddy,4079.46,5.099,4082.0095,0.5719,0.8,0.4,0.01281714532777756,-0.130961016943153,-0.01749617372881647
gets back I'll try and be happy oh Sam,4082.099,4.5,4084.349,0.5719,0.4,0.3,0.013664335212412358,-0.13051943045669423,-0.016511673257977345
now Teddy Sherman is marching through,4084.559,4.321,4086.7195,0.0,0.0,0.4,0.014511422109569332,-0.1300648780933032,-0.015523735859500043
the South but believe me the big battle,4086.599,4.2,4088.699,-0.5267,0.0,0.6,0.015209945707378294,-0.12967987637292971,-0.014706138457149633
of Beyond seventh heaven if it's a,4088.88,3.99,4090.875,0.5106,0.0,0.5,0.015968418872997363,-0.1292510228988769,-0.013815110559968527
battle he wants he'll get it,4090.799,7.11,4094.354,-0.3818,0.2,0.7,0.01716036552512635,-0.12855327388404703,-0.012407285234029631
see now you are Miss Moore right thank,4170.9,5.279,4173.5395,0.2263,0.2857142857142857,0.8,0.03639729887743125,-0.10924372622826564,0.014300048115932338
you very much Miss Moore and Miss Tate,4173.839,4.621,4176.1495,-0.3566,0.26,0.4,0.036741016094559834,-0.10851502033995522,0.01501411872670515
thank you very much and you and Miss,4176.179,5.341,4178.8495,0.2263,0.26,0.7,0.03707489647063314,-0.1077562923795071,0.015742169880362155
Lane thank you very much yeah oh just a,4178.46,4.68,4180.8,0.6096,0.26,0.6,0.03730225263089852,-0.1072051558742186,0.016261414302855562
minute I'll take those girls help,4181.52,2.94,4182.990000000001,0.4019,0.0,0.7,0.03754357670487324,-0.10658338769920303,0.016837740044779233
yourselves any of the stuff that you,4183.14,3.539,4184.909500000001,0.0,0.0,0.2,0.03774287247709408,-0.10603589580769653,0.017337093098873012
want make yourselves right at home thank,4184.46,6.2,4187.56,0.4215,0.2857142857142857,0.7,0.037999151688257064,-0.1052761187096688,0.018017762432888287
you again see you next year bye,4186.679,3.981,4188.6695,0.0,0.0,0.2,0.03809987327186061,-0.10495679776057117,0.01829965244994365
Daddy this is Hermione getting enough,4205.94,5.1,4208.49,0.0,0.0,0.4,0.03922947351429864,-0.09913574946325959,0.023037496634270356
Fried Chicken,4209.36,4.14,4211.429999999999,0.0,-0.6,0.7,0.039286110569379265,-0.09825521561917942,0.023692894123532593
honey you miss me just pick the models,4211.04,4.92,4213.5,-0.1531,0.0,0.7,0.039308331801497995,-0.09763287579438587,0.024147116093596467
out of your hair and listen dear I'm,4213.5,5.64,4216.32,0.3818,0.0,0.4,0.03931502142788641,-0.09678201231061313,0.02475636319125815
confused what do you mean honey I mean,4215.96,5.699,4218.8095,-0.3182,-0.3416666666666666,0.2,0.039298488031867515,-0.09602806134514784,0.025285177843213685
honey I want to do a big promotion on,4219.14,4.68,4221.4800000000005,0.0772,0.0,0.6,0.03925759889696118,-0.09521648540415784,0.0258431772952089
that order I gave you and when I called,4221.659,3.721,4223.519499999999,0.0,0.0,0.4,0.03921038089628424,-0.09459478926033192,0.026262967034488608
Cooper and asked him when I could expect,4223.82,4.14,4225.889999999999,0.0,0.0,0.4,0.03913825882541741,-0.09387022467402248,0.026744063482795323
my first deliveries all I got was double,4225.38,5.46,4228.11,0.0,0.125,-0.7,0.039054055453160305,-0.09318981343384963,0.027188056897671474
talk now I can't sell double talk Teddy,4227.96,5.88,4230.9,0.0,0.0,-0.7,0.03892560527428572,-0.09233227763091628,0.027737193641633
I can listen to it but I can't sell it,4230.84,4.62,4233.150000000001,0.0,0.0,-0.5,0.03880383850658346,-0.09163883806711455,0.028172974625163993
that's funny,4233.84,4.44,4236.06,0.4404,0.25,0.7,0.03862254309593427,-0.09073963048793518,0.02872738482366355
maybe they're a little snowed under okay,4235.46,4.86,4237.89,0.1621,0.15625,0.2,0.03849490960497508,-0.0901728517622364,0.029070802920309287
lover boy but I need this stuff or I'll,4238.28,3.419,4239.9895,0.34,0.0,0.4,0.038335645725877825,-0.08952143119637611,0.02945989687268648
have to cancel,4240.32,3.72,4242.179999999999,-0.25,0.0,-0.7,0.03815498495186136,-0.08884050063846506,0.029860354505933356
this isn't all romance,4241.699,3.421,4243.4095,-0.4449,0.0,-0.7,0.03804714738615329,-0.088457757306142,0.030082696566740855
bye now I'll get back to you all right,4245.12,4.22,4247.23,0.0,0.1428571428571428,0.2,0.03768283496844377,-0.08726608231109609,0.03076263611600668
Hello Operator I want to talk to Circle,4253.88,5.339,4256.5495,0.0772,0.0,0.5,0.03661250113739161,-0.08434613390925756,0.032354099655979913
72099 in New York City,4256.42,5.37,4259.1050000000005,0.0,0.1363636363636363,0.2,0.03627502479840547,-0.08354273312672576,0.03277450837100778
all right thank you,4259.219,6.72,4262.579,0.3612,0.2857142857142857,0.4,0.03578659432812114,-0.08244903996723243,0.033335426095583015
hello Teddy Sam what's with the orders,4284.12,5.22,4286.73,0.0,0.0,0.2,0.031490180825311506,-0.0748185485488803,0.03692498358380453
I'm getting complaints we're doing what,4286.699,4.921,4289.1595,-0.4019,0.0,-0.7,0.030974997821816147,-0.07405039999727976,0.03725873882927465
we can Teddy well it's just not good,4289.34,3.42,4291.05,-0.0788,-0.35,-0.7,0.030564122556210643,-0.07345285027992064,0.037515308768654984
enough Sam what are you trying to do,4291.62,3.74,4293.49,0.0,0.0,-0.7,0.030021052341403603,-0.07268192432205192,0.0378424900461944
sabotage the business,4292.76,2.6,4294.06,-0.5267,0.0,-0.7,0.029892132617481183,-0.0725018903054857,0.03791828955248795
that's why I come home,4297.62,4.619,4299.9295,0.0,0.0,0.7,0.02852005771507815,-0.07064968146193701,0.03868535723110383
we have a little problem,4299.78,4.56,4302.06,-0.3415,-0.1875,-0.5,0.028002256760319755,-0.06997827913210267,0.03895791271308386
all right I'll clean up a Nashville I'll,4302.239,3.841,4304.1595,0.4019,0.3261904761904762,0.4,0.027481884925204335,-0.06931721602487703,0.039223564760428424
catch the plane tomorrow I'll be home,4304.34,3.66,4306.17,0.0,0.0,0.2,0.02697428198890877,-0.06868476174515713,0.039475292830038984
day after tomorrow but what's up I'll,4306.08,3.3,4307.73,0.0,0.0,0.7,0.02657422583441641,-0.06819445248568706,0.039668863628811134
meet you at the airport,4308.0,5.179,4310.5895,0.0,0.0,0.4,0.025827041833426618,-0.06729676927340777,0.04001981829490389
why are we the plane okay,4309.38,3.799,4311.279500000001,0.2263,0.5,0.4,0.025644083689512924,-0.06708037633947256,0.04010377243763036
they're lovely really lovely Miss Boyd,4333.76,5.02,4336.27,0.7914,0.5,0.7,0.018359967632980114,-0.0593200518256888,0.04297780281550617
thank you very much and when do we get,4337.04,3.84,4338.96,0.3612,0.26,0.7,0.017504179632251593,-0.05849592841730397,0.04327072328631664
started on the Mr Noble we've probably,4338.78,3.84,4340.7,0.4588,0.6,0.2,0.016943690117743937,-0.057964255808961654,0.04345880413106156
released the New York advertising in a,4340.88,3.6,4342.68,0.0,0.1363636363636363,0.4,0.016299370930160775,-0.057360640874006164,0.043671561747998036
week be ready to make deliveries in,4342.62,5.76,4345.5,0.3612,0.2,0.3,0.015369913193028413,-0.05650359975495807,0.043972375805273974
three goodbye goodbye miss Boyd,4344.48,6.9,4347.929999999999,-0.1531,0.0,0.3,0.014558085096721247,-0.05576768496378845,0.044229636533794976
you can confirm the reservations for,4360.34,4.42,4362.55,0.0,0.0,0.4,0.00947130010809673,-0.051396191310660026,0.04574608410893136
tomorrow night and have Ms Boyd's,4362.48,3.6,4364.28,0.0,0.0,0.7,0.008847557193883172,-0.05088584520753983,0.045922696208279636
baggage and mine picked up in the,4364.76,2.82,4366.17,0.0,0.0,0.3,0.008161120843523488,-0.05033011152313021,0.04611512841345954
afternoon yes,4366.08,2.76,4367.46,0.4019,0.0,0.4,0.0076896429449151045,-0.049951909334880445,0.046246190428120185
