text,start,duration,time_midpoint,vader,textblob,llama3,vader_norm,textblob_norm,llama3_norm
around with married women we're not,2402.16,3.36,2403.84,0.0,0.25,-0.7,0.16463538707909298,0.07295184917179959,0.1433918562810927
Mr Noble prefers to advance the women,2407.98,3.24,2409.6,0.4588,0.6,0.7,0.16510340459594267,0.07029500028502693,0.1433560742744586
that have to fall in love with him,2409.72,4.92,2412.18,0.6369,0.5,0.7,0.16530222125163113,0.06911894851849014,0.14333596922363934
through careers got marriage I'm running,2411.22,4.859,2413.6495,0.0,0.0,0.4,0.16541241032982978,0.06845310713811062,0.14332321130412823
the lingerie department of the Chicago,2414.64,3.12,2416.2,0.0,0.0,0.2,0.16559832928416277,0.06730451805011241,0.1432986096946761
you're happy reasonably you reasonably,2417.76,6.599,2421.0595000000003,0.5719,0.3999999999999999,0.5,0.16593352071892795,0.06514164298839947,0.14324212116757373
I'm in business for myself that is with,2421.72,5.7,2424.57,0.0,0.0,0.4,0.16615979274556034,0.06360077777186593,0.14319248495917314
two partners one of them's an angel the,2424.359,5.101,2426.9095,0.0,0.0,0.6,0.1663030434886126,0.06258430054893835,0.1431548443719469
other louse,2427.42,3.659,2429.2495,-0.3818,-0.125,-0.7,0.16644019663394924,0.06157613668367644,0.14311327125701118
come on let's dance over there I want to,2429.46,3.85,2431.385,0.0772,0.0,0.7,0.16655994735022245,0.060663677176306524,0.14307170635802982
show you after,2431.079,8.241,2435.1995,0.0,0.0,0.4,0.16676079352599926,0.059052293833972085,0.14298827679444276
Teddy I mean Mr Sherman got it for me,2440.859,4.98,2443.349,0.0,-0.3125,0.7,0.16713238152954824,0.05569225307896511,0.14276636279152927
wholesale didn't you hear Noble all I,2443.02,4.44,2445.24,-0.357,0.6,-0.7,0.16720713320900982,0.05492929308320734,0.1427055598316114
need is Talent energy and brains,2445.839,3.841,2447.7595,0.5994,0.0,0.7,0.16729987164116678,0.053922852397147406,0.1426186714005888
Commodities of which I'm extravagantly,2447.46,5.04,2449.98,0.0,0.0,0.6,0.16737503656556404,0.05304557933087263,0.14253631422219695
endowed positively loaded come on Ellie,2449.68,4.8,2452.08,0.5267,0.2272727272727272,0.7,0.16744039665361132,0.05222444481710042,0.14245325342868606
let's get on that dance floor we got to,2452.5,3.72,2454.36,0.0,0.0,0.7,0.1675049886286495,0.05134247156213519,0.1423571774973612
get our money's worth see you later Mama,2454.48,3.8,2456.38,0.2263,0.15,0.4,0.16755661650779174,0.05056950535734378,0.14226675929927046
well you look at that,2473.82,11.519,2479.5795000000003,0.2732,0.0,0.6,0.1677558244876187,0.04229753348698108,0.14082211909440145
oh that that doesn't bother me I'm not,2485.339,4.841,2487.7595,0.2584,0.0,-0.7,0.16764446307917652,0.03966652748461801,0.14010826906439225
jealous anymore you don't understand,2488.079,5.841,2490.9995000000004,-0.4588,0.0,-0.7,0.16757285221097967,0.03866858218377959,0.13979212050560766
that's one of my partners oh the angel,2490.18,6.6,2493.48,0.0,0.0,0.7,0.16750727705789076,0.03792196622718221,0.13953666774431187
oh not the angel,2493.92,5.08,2496.46,0.0,0.0,-0.7,0.16741602189525454,0.0370452849517096,0.13921395797860836
I never suspected the Tobias ball could,2496.78,3.839,2498.6995,0.1695,0.0,0.6,0.16733838828064218,0.0364012291103992,0.13895980098576077
be so entertaining I was right to the,2499.0,3.18,2500.59,0.4927,0.3928571428571428,0.8,0.16726674761373383,0.035867543120798394,0.13873730804985
committee and apologized putting them,2500.619,3.181,2502.2095,0.3182,0.0,0.4,0.16720089772668192,0.03541771781812045,0.1385408257824337
off all these years,2502.18,4.08,2504.22,0.0,0.0,-0.5,0.1671133576754373,0.03486883045076648,0.13828922938299454
it's been a lovely evening but now I,2503.8,5.039,2506.3195,0.34,0.5,-0.7,0.16701504330308983,0.03430704067621714,0.13801726707544582
must finish my nightcap and go,2506.26,4.5,2508.51,0.0,0.0,0.7,0.1669048929978934,0.03373344922397397,0.13772328546787932
nightcaps are meant to be lingered over,2508.839,3.961,2510.8195,0.0,0.0,0.4,0.16678031075848657,0.033142734885621576,0.1374018076290188
not to be finished well I'm sorry but,2510.76,4.5,2513.01,0.1027,-0.5,-0.7,0.1666540669252353,0.03259592625115139,0.13708576057424227
it's late and I'm a working girl this,2512.8,4.559,2515.0795000000003,0.0,-0.3,-0.5,0.16652750942700215,0.03209150347749663,0.13677703623104673
nightcap will have to be finished oh,2515.26,4.319,2517.4195000000004,0.0,0.0,-0.7,0.16637581061178663,0.031535564072464745,0.1364158882733883
dress I designed it myself,2522.66,5.679,2525.4995,0.0,0.0,0.7,0.16578074146958247,0.029735989828542597,0.13506712997311426
I'm one of those pilgrims in the 1095,2525.82,4.86,2528.25,0.0,0.0,0.2,0.16555255812587222,0.02916680188399396,0.1345708093315958
line who wants to achieve the mecca of,2528.339,3.361,2530.0195,0.0,0.2,0.5,0.16539877714972653,0.028812510214543285,0.13424121307951087
as it Nobles I did use that face and die,2531.7,4.26,2533.83,-0.5994,0.0,-0.7,0.16504887557207357,0.028081584636058227,0.13350353931783387
I can only say that I hope no one would,2534.46,3.24,2536.08,0.1779,0.0,-0.7,0.1648301674563881,0.027670722415026393,0.13304982085309638
remember it I assumed you wanted,2535.96,3.24,2537.58,0.0,0.0,0.6,0.1646794060982822,0.027405330168405514,0.1327399451045664
everyone to remember everything,2537.7,3.3,2539.35,0.0,0.0,0.7,0.16449646266613394,0.027100856295339697,0.13236682154579413
in my position I find that the only,2539.2,3.06,2540.73,0.0,0.0,-0.7,0.16435007418074565,0.026869949210087434,0.1320703902656356
people who ever remember what I say are,2541.0,2.88,2542.44,0.0,0.0,-0.7,0.16416415966294817,0.026591641901141952,0.13169647502070822
those who want something from me well,2542.26,3.54,2544.03,0.34,0.0,0.2,0.16398684509769493,0.026340570505098658,0.1313423555201933
what's wrong with that what you have is,2543.88,3.66,2545.71,-0.4767,-0.5,0.2,0.16379488481129276,0.026083292269707996,0.1309615653176449
what people should want I'm not,2545.8,4.02,2547.8100000000004,0.0772,0.0,-0.7,0.16354834722852493,0.025773162848324326,0.13047619087316326
objective as a matter of fact,2547.54,4.26,2549.67,0.0258,0.0,0.2,0.16332394393055463,0.025509022566435426,0.13003776105040546
they're words that describe thoughts,2549.82,5.279,2552.4595000000004,0.0,0.0,0.6,0.16297691035693573,0.025131251265899105,0.12936560558979862
I've had things I've felt,2551.8,5.7,2554.65,0.0,0.0,0.3,0.162695701675553,0.024849877636115812,0.1288258096021968
when you said people I translated,2555.099,4.861,2557.5295,0.0,0.0,0.2,0.1623146006922375,0.024500182296240902,0.12810070568619722
Harriet Boyd when you said talent I said,2557.5,5.64,2560.32,0.4215,0.0,0.7,0.16193309136787565,0.0241828814305901,0.12738174078229095
my and when you said luck I said it had,2559.96,5.3,2562.61,0.4588,0.0,0.2,0.16161120511044624,0.023938150673026112,0.12678017093766253
to be my luck,2563.14,4.5,2565.39,0.4588,0.0,0.6,0.1612099668173439,0.023659769838890655,0.12603636776016242
well good night,2565.26,3.76,2567.1400000000003,0.6124,0.7,0.7,0.1609515882081214,0.02349493239663287,0.1255607841514977
you're sure you don't want me to drive,2567.64,3.42,2569.35,0.2681,0.5,0.7,0.16061898990876947,0.023298114134405492,0.12495232244055574
you home no thanks,2569.02,3.599,2570.8195,-0.3412,-0.1,-0.7,0.16039399042341965,0.023174186862966392,0.1245430052531838
you really pride yourself on your,2571.06,3.48,2572.8,0.4005,0.2,0.6,0.160085958309456,0.023015850780823306,0.12398554462848199
Independence don't you,2572.619,4.081,2574.6595,0.0,0.0,0.7,0.15979180248829933,0.02287617760586783,0.1234562393302598
I noticed you left your partner without,2574.54,5.1,2577.09,0.0,0.0,-0.7,0.15940021293225637,0.02270659074781082,0.1227560674711895
an excuse or even a good night,2576.7,5.639,2579.5195,0.4939,0.3249999999999999,0.4,0.1590008719636713,0.022551585080065058,0.12204709837928243
I shouldn't I usually when men have,2579.64,4.439,2581.8595,0.0,-0.25,-0.7,0.15860890006461842,0.02241582123629187,0.12135601337709861
beautiful women for partners pleasure,2582.339,3.48,2584.079,0.8225,0.8497647307926743,0.4,0.1582305760893209,0.02229915550554117,0.12069336233241175
and business get mixed up,2584.079,3.78,2585.969,0.0,0.0,0.2,0.15790348515053862,0.02220898630690694,0.12012381648147771
in our partnership our only pleasure is,2585.819,3.78,2587.709,0.5719,0.0,-0.8,0.1575984061954853,0.022133350975509915,0.11959534995558574
business then you'll need a change,2587.859,4.5,2590.109,0.0,0.0,0.3,0.15717149974837463,0.022040494122456976,0.11886020921183578
either your point of view or your,2589.599,5.301,2592.2495000000004,0.0,0.0,0.2,0.15678488211754482,0.02196875413039689,0.11819873909022773
pull that right there for me Terry,2640.2,4.139,2642.2695,0.0,0.2857142857142857,0.7,0.14641689749228062,0.02293819493392915,0.10180719278662378
Miss Boyd I don't see how you think of,2645.4,2.939,2646.8695,-0.1531,0.0,-0.7,0.14535932382089203,0.02324931795852392,0.10027267547902206
these things,2647.14,4.82,2649.55,0.0,0.0,0.2,0.14473687701479748,0.02344528168133258,0.09938130911446619
I guess maybe it's a gift huh,2648.339,3.621,2650.1495,0.4404,0.0,0.2,0.14459706903903286,0.02349055158403914,0.09918230576333772
fancy just a little something I'm,2653.16,3.939,2655.1295,0.0,-0.1875,0.4,0.14342765983335642,0.023886455544553997,0.09753519701014988
whipping up for myself Sam it's,2655.3,3.48,2657.04,0.0,0.0,0.4,0.14297539520744043,0.02404751565125763,0.09690658482750115
beautiful Harriet,2657.099,3.181,2658.6895,0.5994,0.8497647307926743,0.2,0.1425833782737377,0.02419055124357994,0.09636553170382207
but come down from the clouds for a,2658.78,2.4,2659.98,0.0,-0.1555555555555555,0.8,0.14227571839410008,0.024304984467437906,0.09594340227745708
minute I want to talk to you about,2660.28,2.339,2661.4495,0.0772,0.0,0.4,0.14192438617866526,0.024437951647642484,0.09546404836443546
there's a manufacturer closing up in,2662.619,3.301,2664.2695000000003,0.0,0.0,0.4,0.14124731085179343,0.024700900497813084,0.09454841490199242
yourself for nothing if you got a spring,2664.24,3.42,2665.95,0.0,0.0,-0.7,0.14084211444934053,0.024862359247628123,0.0940056289851706
design for the material it's a smart,2665.92,4.8,2668.32,0.4019,0.2142857142857142,0.7,0.14026860713123426,0.02509595581990438,0.0932440620280844
deal buy it you got a design I'll have,2667.66,5.28,2670.3,0.0,0.0,0.7,0.1397877137452816,0.025296279449199672,0.09261156317656213
one good girl,2670.72,4.859,2673.1495,0.4404,0.7,0.8,0.13909299579665851,0.025592601133523515,0.09170773134965883
now that's what I was looking for,2672.94,3.96,2674.92,0.0,0.0,0.7,0.13865986200527872,0.02578136402129286,0.09115020305718631
can you get out of that without putting,2675.579,3.601,2677.3795,0.0,0.0,-0.7,0.1380564151712977,0.026049326277609315,0.09038119280553754
all the pins loose sure,2676.9,4.679,2679.2395,0.0,0.2115384615384615,-0.7,0.13759878457402877,0.026256294126638255,0.08980407795713281
what are you going to show Renee 7 12.,2679.18,3.659,2681.0095,0.0,0.0,0.3,0.13716234590104567,0.026456612935916474,0.08925861927828854
show it in the blue it suits your,2681.579,3.721,2683.4395,0.0,0.0,0.3,0.13656176137076897,0.026736830534828483,0.0885159687517543
coloring bit yes Miss Boyd,2682.839,4.621,2685.1495,0.2732,0.0,0.7,0.13613822382551613,0.026937533897346874,0.08799784752508985
Mr Sherman he is a member of the family,2685.3,3.779,2687.1895000000004,0.0,0.0,0.7,0.13563205467749082,0.02718065702614132,0.08738479251787569
I just spoke to Sam you're making a,2687.46,3.84,2689.38,0.0,0.0,0.4,0.1350875512285304,0.02744605666541034,0.08673287515076702
mistake with Ron jeez why an,2689.079,3.721,2690.9395,-0.34,0.0,-0.7,0.13469933030146733,0.027637665797083998,0.08627291678898674
old-fashioned material and it won't sell,2691.3,4.799,2693.6995,0.0,0.0,-0.7,0.13401123145335353,0.02798202137930822,0.08546771880105841
make it sell I'm against it settle it,2692.8,5.22,2695.4100000000003,0.0,0.0,-0.7,0.13358420502715937,0.028198693285594774,0.08497457061244428
with Cooper you leave those sketches,2696.099,3.72,2697.9590000000003,-0.0516,0.0,0.7,0.13294715385643713,0.028526031012942196,0.08424834849706278
alone for a minute Harriet listen to me,2698.02,3.54,2699.79,-0.25,0.0,0.2,0.13248911790753984,0.02876434026543143,0.083733308024475
you're involved in this you're supposed,2699.819,3.361,2701.4995,0.0,0.0,0.4,0.13206121514604052,0.028989147845446026,0.08325760274354096
to be designing the spring line unless,2701.56,3.299,2703.2095,0.0,0.0,0.2,0.1316329875979612,0.02921618400776573,0.08278687735078008
of course it's all too dull since you,2703.18,3.54,2704.95,-0.4019,-0.2916666666666667,-0.7,0.13119696984403073,0.029449419676650757,0.08231315011665406
got your claws in the noble not blood,2704.859,4.441,2707.0795,0.4588,0.6,0.4,0.13066337202529144,0.029737627804985973,0.08174115008484559
ink very funny,2706.72,4.2,2708.82,0.4927,0.325,0.8,0.1302272052878148,0.02997542629881318,0.0812800205744695
I'm telling you there's plenty you can,2709.3,3.42,2711.01,0.0,0.0,0.7,0.12967842935161872,0.030277378249979992,0.08070818597976274
do you can drop a hint around the house,2710.92,4.14,2712.99,-0.2732,0.0,0.3,0.12918239234110873,0.030552891614583258,0.08019944359351919
I want to be a Salesman,2712.72,4.2,2714.82,0.0772,0.0,0.7,0.12872410362041936,0.030809560853888994,0.07973640078681829
look Ellie you've got to think of me,2715.06,4.44,2717.28,0.0,0.0,0.7,0.12810841303210344,0.031157509087504785,0.07912507664549652
like I was a relative on whose side my,2716.92,4.74,2719.29,0.3612,0.0,0.5,0.12760575993652834,0.031444161750152216,0.07863530246091163
mothers are my fathers all right make,2719.5,5.04,2722.02,0.0,0.2857142857142857,0.5,0.12692380294459873,0.03183667111776944,0.07798450002310876
jokes excuse me you're buying a salad oh,2721.66,5.1,2724.21,0.3182,-0.05,0.6,0.12637749106474924,0.032154013216908445,0.07747475816957988
you're one of the partners here,2724.54,6.059,2727.5695,0.0,0.0,0.5,0.1255410037744984,0.03264474366575511,0.07671482039202736
Mr Noble my heartfelt apologies what can,2726.76,5.88,2729.7000000000003,0.7579,0.3,0.4,0.12501166214268628,0.03295820475362243,0.07624709715372856
I do for you Mr Noble sir is Miss Boyd,2730.599,4.381,2732.7895000000003,0.34,0.6,0.4,0.12424584914596537,0.03341555272240445,0.07558903780261031
in why yes sir I have a seat sir I'll,2732.64,3.66,2734.47,0.4019,0.0,0.6,0.12383028276536737,0.033665581092185724,0.07524137756720127
call her I'll inform her of your,2734.98,3.619,2736.7895,0.0,0.0,0.3,0.12325795689694993,0.03401198693732397,0.07477371460685987
Mr Noble well,2741.06,5.98,2744.05,0.6249,0.6,0.7,0.12147722128814537,0.03510429234158346,0.07340469639019098
the mountain has come to Muhammad,2744.579,5.421,2747.2895000000003,0.0,0.0,0.5,0.12068869475664112,0.03559456017459488,0.07284217736500095
come in Mr novel,2747.04,2.96,2748.52,0.3182,0.0,0.3,0.12039025972456982,0.03578110542941118,0.07263660522572804
could you go for him what kind of a,2754.42,4.5,2756.67,0.0,0.6,0.3,0.11843029588156073,0.03701889117410822,0.07139182303181144
question is that Arnold Fisher,2756.579,4.141,2758.6495,0.0,0.0,0.2,0.117959012914803,0.03731959097787004,0.0711211209048925
this is my partner Teddy Sherman Teddy,2760.72,4.68,2763.06,0.0,0.0,0.4,0.11691634141699281,0.037988720656739416,0.07056424301585526
well if we're going to be formal Harry,2765.4,3.06,2766.9300000000003,0.2732,0.0,0.8,0.11601040891347385,0.03857411947500723,0.0701296701872101
and I'm Mr Sherman you're Miss Boyd and,2766.54,3.66,2768.37,-0.1531,0.0,0.2,0.11567558264131773,0.03879135839243836,0.06998119565226027
our visitors Mr Noble but if we're not,2768.46,3.42,2770.17,0.25,0.6,0.4,0.11525884791944058,0.03906236624409625,0.06980587360768623
I'm Teddy Sherman you're a Harriet boy,2770.2,5.72,2773.06,0.0,0.0,0.3,0.11459407774439191,0.03949603629317357,0.0695486215350987
and you were Mr Noble,2771.88,4.04,2773.9,0.4588,0.6,0.7,0.1144018856270141,0.039621711086040186,0.06947952840315211
if anyone wants me I'll be at my club,2781.0,3.859,2782.9295,0.0,0.2,0.7,0.1123671194270687,0.0409593672946274,0.06890335854955722
I waited for you to call and when you,2787.9,5.219,2790.5095,0.0,0.0,0.4,0.11070679283153978,0.04205848189120857,0.06866464357539467
didn't I did it's your spring line yes,2790.06,5.88,2793.0,0.4019,0.0,-0.7,0.11017161111562729,0.04241376359833124,0.06863712122767571
it's very nice,2793.119,5.581,2795.9095,0.4754,0.78,0.7,0.10955321469283932,0.04282468635678988,0.06863775921440192
did I boil oh no,2795.94,5.46,2798.67,-0.296,0.0,-0.7,0.10897350311586274,0.043210155394956415,0.06867159444024927
and why didn't you press your advantage,2798.7,7.58,2802.49,0.25,0.0,0.2,0.10818296805870942,0.043735939009569624,0.06877283519869581
I didn't know I had one well here I am,2801.4,4.88,2803.84,0.2732,0.0,0.4,0.10790692613663805,0.04391950634229565,0.06882396762253964
what's this,2806.8,4.26,2808.9300000000003,0.0,0.0,0.2,0.10688238501204766,0.0446002993818545,0.0690903471441342
just doodling,2808.119,5.881,2811.0595000000003,0.0,0.0,0.6,0.10646158921699513,0.04487950809892015,0.06923688780729612
would you like to have lunch with me and,2814.0,4.14,2816.07,0.3612,0.0,0.4,0.10549048994740516,0.0455223868335899,0.06966527876746484
go to a fashion show I would there's,2815.44,4.32,2817.6,0.0,0.0,0.4,0.10519941630443952,0.04571455972252563,0.06981985736874577
some new things in from Paris I'd like,2818.14,4.699,2820.4895,0.3612,0.1363636363636363,0.7,0.10465687852236603,0.04607193521322302,0.07014264737131251
to have your comments on,2819.76,3.079,2821.2995,0.0,0.0,0.7,0.1045065013087021,0.04617077703623497,0.07024044383688673
you should doodle more often well if I'm,2823.599,4.98,2826.089,0.3353,0.5,0.4,0.1036330172097901,0.04674271214964026,0.07088513912002195
encouraged I might,2826.06,5.75,2828.935,0.3612,0.0,0.7,0.10312700514037003,0.04707200406212027,0.07132286188215498
don't I look encouraging,2828.579,8.281,2832.7195,-0.4168,0.0,0.7,0.10246966058540272,0.04749702839766452,0.07196927952606678
like it yes I like it very much,2840.22,8.829,2844.6345,0.7717,0.26,0.8,0.10052178382737018,0.04873134531943371,0.07449944095007943
like this one oh it's lovely but it's,2857.22,5.32,2859.88,0.4854,0.5,-0.7,0.09832063253208756,0.050051377344453536,0.0788890436427398
impractical the only place a woman could,2860.319,4.981,2862.8095,0.0,0.0,0.7,0.09793771584039417,0.05026806406643984,0.07988715900625463
wear a gown like this would be in a,2862.54,4.52,2864.8,0.3612,0.0,0.7,0.09768487070328735,0.05040823206739745,0.08059297497169304
perfume mad,2865.3,5.76,2868.1800000000003,-0.4939,-0.625,0.6,0.09726860697419046,0.050633203113297644,0.081839862905554
Lorraine good afternoon Mr Noble what is,2867.06,6.519,2870.3195,0.7096,0.6499999999999999,0.2,0.09701332820491965,0.0507671507024221,0.08265891757043115
the reaction on this one oh the men like,2871.06,4.38,2873.25,0.3612,0.0,0.4,0.09667357534398034,0.05094002186325302,0.08381589558233438
him but the women know you can't sit,2873.579,3.381,2875.2695000000003,0.0,0.0,0.4,0.09644586551959117,0.051052045088220636,0.08463548877285552
down in it,2875.44,5.12,2878.0,0.0,-0.1555555555555555,-0.5,0.09614598445584786,0.05119431873433179,0.08577066340024146
now what about this,2876.96,3.6,2878.76,0.0,0.0,0.2,0.09606410269251994,0.05123204405154863,0.08609187719311896
I'd lower the neckline a bit to make it,2880.839,2.891,2882.2845,-0.296,0.0,0.4,0.09569304705824021,0.0513963580128381,0.08760940383955398
more formal,2882.819,3.901,2884.7695,0.0,0.5,0.4,0.0954396614051765,0.051501723528269656,0.08870503754973344
Oh I thought it had a certain Flair what,2890.8,4.98,2893.29,0.2732,0.2142857142857142,0.7,0.0946179369241549,0.051797596029840756,0.0925972295240912
it wouldn't have on a hanger,2893.92,5.399,2896.6195,0.0,0.0,-0.7,0.09431472820146511,0.05188587933135782,0.09416448992620512
the model brought her Flair with her,2895.78,8.16,2899.86,0.0,0.0,0.7,0.09402819004402964,0.05195715869406284,0.09570879019460606
do you believe in hunches no well I do,2899.319,6.3,2902.469,-0.2057,0.0,0.7,0.09380315703767844,0.05200409583328818,0.09696306775402476
I have a hunch that you and I should,2903.94,5.22,2906.55,0.0,0.0,0.4,0.09346037657869667,0.052058906306464675,0.09893943561275093
have a serious talk and tonight oh I,2905.619,6.141,2908.6895,-0.0772,-0.3333333333333333,0.7,0.09328476539354146,0.052078608500132184,0.09998037632918177
believe in that,2909.16,2.6,2910.46,0.0,0.0,0.7,0.09314138422320857,0.05209023231868124,0.10084324419268693
well are we about ready for the,2912.16,4.199,2914.2595,0.5574,0.2,0.2,0.09283907263809041,0.052100922189158426,0.10269633873886139
unveiling in a minute,2914.079,4.26,2916.2090000000003,0.0,0.0,0.7,0.092686524640415,0.052098885500041194,0.10364628735382608
I've switched a few of your ideas around,2916.359,3.901,2918.3095,0.0,-0.2,0.4,0.09252388249015353,0.052091003727275105,0.10466789880751773
I hope you don't,2918.339,3.061,2919.8695,0.4404,0.0,-0.7,0.09240413842271837,0.05208134291509285,0.10542473820514914
them to round,2921.4,4.08,2923.44,0.0,-0.2,0.4,0.09213298036592936,0.05204706160514355,0.10714840947202894
I also expect them to be improved about,2922.54,5.4,2925.24,0.4767,0.0,0.4,0.09199758979437887,0.05202337905164104,0.10801157820171009
that we'll know in a minute,2925.48,4.08,2927.52,0.0,0.0,0.2,0.09182711319764535,0.05198724546401695,0.1090980117201718
that serves it,2929.56,3.2,2931.16,0.0,0.0,0.4,0.09155674355756999,0.051915399710042685,0.11081333604171491
you're a fabulous girl,2933.7,4.32,2935.86,0.5267,0.4,0.8,0.09120949399625199,0.05179701258631175,0.11298546728587085
no not in the least bit nervous are you,2936.04,4.559,2938.3195,-0.5106,-0.3,-0.7,0.0910279675503731,0.05172361416627696,0.1140992248251454
nervous why should I be,2938.02,5.22,2940.63,-0.2732,0.0,0.6,0.09085720255248224,0.05164753212829441,0.11512855574484085
your work is about to be judged by if,2940.599,5.041,2943.1195,0.0,0.0,-0.7,0.09067265848599576,0.05155785327894278,0.1162168211705152
you will forgive me J.F Noble,2943.24,4.44,2945.46,0.6249,0.6,0.7,0.09049836627159993,0.05146628141539553,0.11721800583346784
now don't you care whether I like it or,2945.64,3.719,2947.4995,-0.033,0.0,-0.7,0.09034565404070856,0.05138076896373203,0.11807137297953516
not I care very much,2947.68,4.32,2949.84,-0.3875,0.26,-0.6,0.0901692122090842,0.05127609770197858,0.11902688278020537
and you are sure that I'm going to no,2949.359,6.5,2952.609,0.0258,0.5,-0.7,0.08995848009918905,0.05114327236717922,0.12012164716549435
I'm just sure it's good,2952.0,3.859,2953.9295,0.6369,0.6,0.7,0.08985710854701937,0.05107650937612746,0.12062913519254743
but it's incomplete,2970.44,7.02,2973.9500000000003,0.0,0.0,-0.7,0.0882159564765102,0.049797050365088136,0.12688054454994005
here's how I'd like to see it finished,2973.9,3.56,2975.6800000000003,0.3612,0.0,0.7,0.08806202120209435,0.0496632381204544,0.12726937260027213
I like the way it sounds oh yes,2985.319,6.04,2988.339,0.6369,0.0,0.7,0.0868557106155396,0.04857357777309015,0.1292063862634791
yes I like it very much but you mind if,2989.26,4.14,2991.3300000000004,0.3818,0.26,0.7,0.08654739701613245,0.048287985582287155,0.12940789689467427
I speak frankly,2991.359,3.181,2992.9495,0.0,0.0,0.7,0.08637630572879806,0.04812890401763872,0.12947253634484782
you're going to say something,2993.4,2.62,2994.71,0.0,0.0,0.2,0.08618688081186046,0.04795244182378972,0.12950630254555692
disagreeable,2994.54,2.88,2995.98,-0.4019,0.0,-0.7,0.08604794817515755,0.047822866907149916,0.12950655143779854
I'm going to say that if you think I'm,2999.46,3.48,3001.2,0.0,0.0,0.3,0.08545584917154068,0.04727032689714791,0.12928753007771202
interested in you personally as a woman,3001.079,3.601,3002.8795,0.4019,0.125,0.7,0.08525782342572145,0.04708575579328933,0.1291391465454885
you're wrong,3002.94,3.419,3004.6495,-0.4767,-0.5,-0.7,0.08504498437637087,0.04688767601635667,0.12894023194175938
but I know what you need and what you,3004.68,4.2,3006.78,0.0,0.0,0.4,0.08478300041704248,0.04664441856890747,0.12864161332514096
want have ambition and talent,3006.359,4.621,3008.6695,0.4767,0.0,0.7,0.08454520540797872,0.04642427372693996,0.1283214397103352
and I can help you fulfill them,3008.88,4.5,3011.13,0.6808,0.0,0.7,0.0842276400772524,0.04613141833950198,0.12782459780925085
with my help you can jump from that 1095,3010.98,3.839,3012.8995,0.4019,0.0,0.8,0.08399357237242443,0.04591649829722485,0.1274101203706549
business of yours to the top of your,3013.38,2.76,3014.76,0.2023,0.5,0.2,0.0837421969944597,0.04568665074084867,0.1269215948644859
profession,3014.819,3.121,3016.3795,0.0,0.0,0.4,0.08351888526378518,0.04548335264765772,0.1264515171342304
in a few years you can become one of the,3016.14,3.719,3017.9995,0.0,-0.2,0.7,0.08329122519276327,0.045276998553232216,0.1259387971631237
leading designers in the country it's,3017.94,5.22,3020.55,0.0,0.0,0.8,0.08292391874614932,0.04494607154292078,0.12504453438730234
exactly exactly what I want then take it,3019.859,5.941,3022.8295,0.0772,0.25,0.6,0.08258620537428377,0.04464407115885539,0.12415634683152131
the office open,3023.16,4.86,3025.59,0.0,0.0,0.4,0.08216495070138624,0.04427050015418281,0.12297057039140288
but I have two partners a small business,3025.8,4.14,3027.8700000000003,0.0,-0.25,0.2,0.08180659216058783,0.04395550116137836,0.12190196072443281
and an unbreakable contract for five,3028.02,3.42,3029.73,0.0,0.0,0.4,0.08150707934395039,0.043694222024569684,0.12097152887623727
we'll find a way to break it,3031.44,5.48,3034.18,0.0,0.0,-0.7,0.08076354866159446,0.043053494737282656,0.11853662872917783
may I use the design it's a present,3034.56,4.58,3036.85,0.0,0.0,0.7,0.08029860314165921,0.04265853641665428,0.11693787538709359
you know if we're going to work together,3039.14,3.76,3041.02,0.0,0.0,0.7,0.07954311326970603,0.042026009759283424,0.11424095338391708
