text,start,duration,time_midpoint,vader,textblob,llama3,vader_norm,textblob_norm,llama3_norm
Dear Miss Bruce I'm Paul's father I'm in,3797.099,4.02,3799.109,0.25,0.0,0.4,0.10919827826158628,-0.06267155240932683,0.025792677798611992
town shall come to see the performance,3799.68,3.36,3801.36,0.0,0.0,0.7,0.10924697795867336,-0.062025102337208496,0.02541255419094171
tonight I would like very much to have a,3801.119,3.361,3802.7995,0.3612,0.26,0.7,0.10927148786357935,-0.061614562347324285,0.025166367164313492
few words with you afterwards if it is,3803.04,4.319,3805.1995,0.0,-0.2,0.5,0.10930089931485681,-0.06093504115049249,0.024750619818839126
convenient Yours Faithfully Gerald Lundy,3804.48,4.74,3806.85,0.4215,0.0,0.7,0.10931285171911934,-0.06047131184896591,0.024460922172119086
what does he want it's very simple,3807.359,3.48,3809.099,0.0772,0.0,0.7,0.1093183364811959,-0.059844114584002246,0.024061293669581544
darling he wants to explain to me that,3809.22,3.24,3810.84,0.5859,0.2,0.3,0.10931406350359446,-0.05936229254281732,0.023748125158125816
he's allergic to Grocer's daughters who,3810.839,3.421,3812.5495,-0.296,0.0,-0.7,0.10930266598223223,-0.05889232692769445,0.023437440608191907
go on the stage,3812.46,3.839,3814.3795,0.0,0.0,0.7,0.10928258910960112,-0.05839267343519341,0.023101413655575664
well I'll give him that pleasure and,3814.26,3.539,3816.0295,0.7003,0.0,0.4,0.10925753333847105,-0.05794520855569394,0.022795431615831068
I'll explain to him that I have a few,3816.299,3.661,3818.1295,0.0,-0.2,0.4,0.10921614902240273,-0.05737987076461492,0.022401942384409873
allergies myself and one of them is weak,3817.799,6.78,3821.189,-0.4404,-0.375,-0.7,0.10913692473821593,-0.056564548745397646,0.021820695013077724
needs Squadron leaders foreign,3819.96,4.619,3822.2695,0.0,-0.125,0.4,0.10910360743122521,-0.056278959765630895,0.021613203700227405
it's smiling from,3861.44,6.74,3864.81,0.4588,0.0,0.7,0.10565942784523648,-0.04599184021220978,0.012655314535583818
what can either be a place,3865.44,5.9,3868.39,0.0,0.0,0.2,0.10518722627774922,-0.04520956775317622,0.01184305413645339
the fact is you're the one who makes the,3873.079,6.631,3876.3945,0.0,0.0,0.7,0.10403377479020509,-0.04350625878884941,0.010001703227370642
bed you see,3878.28,14.059,3885.3095,0.0,0.0,0.2,0.10259319082112632,-0.04168297918434408,0.007914542118500902
your smile is gone and so you're on your,3892.339,7.661,3896.1695,0.3612,0.3,-0.7,0.10062195746964026,-0.03956565621268754,0.005329264634834499
the Weeping will own my friends,3901.579,10.78,3906.969,0.0516,0.6,-0.7,0.09843282742008583,-0.03757157046243605,0.002722619609361499
is such a lonely tree just look and see,3906.92,10.419,3912.1295,-0.3612,-0.0499999999999999,-0.7,0.09730826310314232,-0.036657462770792654,0.0014677854848605604
all the birds have flown,3912.359,4.98,3914.849,0.0,0.0,0.4,0.09669559098558314,-0.036185740305180764,0.0008047037267092472
make it long and long,3917.359,10.081,3922.3995,0.0,-0.05,0.2,0.09492315053963507,-0.0349119519113844,-0.0010410184909864645
took you cry will soon attract a crowd,3921.619,10.0,3926.619,-0.1531,0.0,0.3,0.09388759812907298,-0.034222957613056965,-0.0020744144315722425
you'll find my logic well-founded,3927.44,9.639,3932.2595,0.0,0.0,0.7,0.09245377483157914,-0.033327304095131516,-0.0034565345138551956
love your surrounded but cry and you cry,3931.619,8.661,3935.9495,-0.7009330120738096,0.5,0.2,0.0914855521960045,-0.032756976141615754,-0.004360447284472629
my mind is,3950.52,5.48,3953.26,0.0,0.0,0.2,0.08663353294630631,-0.030244130621605504,-0.0085834358308477
such a lonely tree just look and sleep,3964.52,8.92,3968.98,-0.3612,-0.0499999999999999,0.2,0.08180274104859912,-0.0281903682714975,-0.01236470757270707
all the birds have flown,3969.02,7.079,3972.5595,0.0,0.0,-0.7,0.08064865976815037,-0.027752530132451585,-0.01321475169230824
you'll find my logic,4006.039,7.981,4010.0295,0.0,0.0,0.7,0.0674461388035786,-0.023814004959090307,-0.021736957385831215
well-founded let your surrounded,4008.74,5.28,4011.38,0.0,0.0,0.6,0.06693416496102095,-0.023693544258607344,-0.022027942767613058
you'd better set the Gypsy number it's,4138.52,4.06,4140.55,0.4939,0.5,-0.7,0.009031270990416257,-0.01846709073872469,-0.04038122133603632
no good there's no room for them to work,4140.9,3.6,4142.7,-0.5583,-0.35,0.3,0.007953349398518043,-0.018477369781316054,-0.04047140532304313
the rigging stock I can't fly the drop,4142.58,3.719,4144.4395,0.2057,0.8,-0.7,0.007079353116215825,-0.018487821320606668,-0.04053785149555098
we'll have to stop the show for 15,4144.5,5.12,4147.06,-0.296,0.0,-0.5,0.005759597690398105,-0.018507155542364574,-0.04062682958092006
minutes very well,4146.299,3.321,4147.9595,0.3384,0.2,0.7,0.00530573997560902,-0.018514782979289796,-0.040654266867548854
well Mrs Toliver,4152.92,5.2,4155.52,0.2732,0.0,0.3,0.0014751650398117657,-0.01859860016603537,-0.0408227896539663
you don't have to stop the show let me,4155.779,5.341,4158.449500000001,0.2235,0.0,0.7,-1.598474699164877e-05,-0.018640375909385203,-0.0408587448075596
go on what oh let me do my ads I have,4158.12,5.099,4160.6695,0.0,0.0,0.8,-0.001148271056799929,-0.01867542276366626,-0.040875279491283154
all me props here I've always had them,4161.12,5.699,4163.9695,0.0,0.0,0.2,-0.0028347293485455447,-0.01873284483742911,-0.04088300388969965
here oh Fred Mrs Toliver 20 years ago I,4163.219,6.54,4166.4890000000005,0.0,0.0,0.2,-0.00412476255925009,-0.018780915122821745,-0.040875500231499336
know you knocked them cold,4166.819,4.86,4169.249000000001,0.0,-0.6,0.3,-0.005540122599174558,-0.01883771666925883,-0.04085413715264164
what do you think Sam,4169.759,4.381,4171.9495,0.0,0.0,0.7,-0.006926950599420505,-0.018897429073414268,-0.04082009861150265
well what have we got to lose,4171.679,3.961,4173.6595,-0.1531,0.0,-0.7,-0.007806018526360239,-0.018937328811077514,-0.040791902071649414
all right Fred,4174.14,4.049,4176.164500000001,0.0,0.2857142857142857,0.4,-0.009094900506558187,-0.01899866747295766,-0.04074139904419026
I'm on I'm on,4175.64,5.699,4178.489500000001,0.0,0.0,0.5,-0.010292219428198551,-0.019058635708220358,-0.040684845532384606
got Wally Miss he was a bit of all right,4181.339,5.101,4183.8895,-0.1531,0.2857142857142857,0.3,-0.013076152460581495,-0.019208992224045415,-0.04051813658546509
in his day how do you know I cleaned the,4184.04,4.679,4186.3795,0.0,0.0,0.2,-0.014360901790878754,-0.019283442233899085,-0.040424893494846736
theater when he worked 20 years ago,4186.44,4.259,4188.5695,0.0,0.0,0.45,-0.01549120443217884,-0.01935154286397634,-0.04033448810441746
of course won't be the same without Lucy,4188.719,4.741,4191.0895,0.0,0.0,0.7,-0.01679205460751279,-0.01943289856482284,-0.040220856033530934
Lucy well she was the other half of the,4190.699,5.431,4193.4145,0.2732,-0.1458333333333333,0.5,-0.017992303807875903,-0.019510761384962074,-0.040107013070150986
act the better half,4193.46,5.58,4196.25,0.4404,0.1666666666666666,0.7,-0.01945594794558551,-0.019609306544323878,-0.03995663502613591
they did oh luck it was yesterday,4199.04,6.199,4202.1395,0.4588,0.0,0.4,-0.02249439841629152,-0.019826308892465856,-0.03960456513007023
come with me,4202.4,2.839,4203.8195,0.0,0.0,0.7,-0.023360463841865988,-0.01989119397370645,-0.03949448998502616
it was a Teleport to follow me and we'll,4207.28,5.399,4209.9795,0.0,0.0,0.4,-0.026532211639158455,-0.020140118890375917,-0.03905517649590708
finish with anywhere,4209.719,2.96,4211.199,0.0,0.0,0.2,-0.0271592513840067,-0.02019141146508799,-0.03896166607580749
but Fred's going on to do his act I,4215.9,6.06,4218.929999999999,0.0,0.0,0.4,-0.031125579771965138,-0.020531549666984516,-0.03832004135707537
follow him and finish up with anywhere,4219.199,4.741,4221.5695,0.0,0.0,0.4,-0.03247565556532849,-0.02065344708449756,-0.038082112153275914
now how do you know it's worse than the,4221.96,4.12,4224.02,-0.4767,-0.4,0.4,-0.033726876793274886,-0.020769167101571145,-0.0378528463290598
what would you expect didn't cross me,4242.239,6.121,4245.299499999999,0.0,0.0,-0.7,-0.04447751069789835,-0.021870879093224792,-0.035541605827399105
are you ready Maestro let's torture the,4245.96,3.73,4247.825,-0.34,0.2,-0.7,-0.045736658333459385,-0.022012396998538648,-0.035231370847487106
sign the wood boys it may be a cold,4263.0,4.76,4265.38,0.0,-0.6,0.2,-0.054362075777274636,-0.023052160403434947,-0.03288461549466162
and now I'm going to play pop Goes the,4268.4,4.38,4270.589999999999,0.34,0.0,0.4,-0.056873280185776115,-0.023378152243123243,-0.032128318310671145
Weasel for you with sound effects Pop,4270.32,6.2,4273.42,0.0,0.4,0.6,-0.05822684818030837,-0.023558284370131945,-0.03170684669216432
Goes the Weasel with sound effects,4272.78,3.74,4274.65,0.0,0.4,0.4,-0.05881275585594516,-0.023637223733263244,-0.03152138776381406
wait a minute,4278.42,2.66,4279.75,0.0,0.0,0.3,-0.06122608129862155,-0.023968583875179656,-0.03073811760467173
I'm gonna let you pop the bag yeah I'm,4282.86,3.42,4284.57,0.296,0.0,0.7,-0.06348209047325105,-0.02428749295133574,-0.029977425615593467
gonna let you pop the baby you take the,4284.84,4.02,4286.85,0.0,0.0,0.5,-0.06454045580228666,-0.024440194359813247,-0.029610957575310907
bag so you take the bag take it back I,4286.28,4.86,4288.71,0.0,0.0,-0.7,-0.06539954053439656,-0.02456561230211272,-0.029308935464143537
left I'll play the music when I give you,4288.86,5.29,4291.505,0.34,0.0,0.2,-0.06668300232721806,-0.02475546166031747,-0.028850044195718266
the cube you pop the bag,4291.14,4.32,4293.3,0.0,0.0,0.4,-0.06750242675796059,-0.024878237899593255,-0.028552214705525165
he doesn't do it,4307.3,3.879,4309.239500000001,0.0,0.0,-0.7,-0.07460142905805733,-0.025994890122846205,-0.02580854189664005
look give me the bag give me the bag you,4309.56,3.48,4311.3,0.0,0.0,0.4,-0.07549438825518964,-0.02614234903287726,-0.02544191013603286
don't get the idea look here give me the,4311.179,2.821,4312.5895,0.0,0.0,-0.7,-0.07605017446505155,-0.026234953416755465,-0.025211188984954284
I'd expect to pop it up blowing it up,4314.0,4.159,4316.0795,0.0,0.0,0.6,-0.07754241479462967,-0.026486772260385906,-0.024581980291032514
what's the matter are you too good to,4335.9,3.92,4337.86,0.4588,0.7,-0.7,-0.08643105385333683,-0.028090433738045466,-0.020518339129646762
let's say maybe you'd like to hear,4340.159,5.281,4342.7995,0.3612,0.0,0.3,-0.08833728794455081,-0.028459888688162394,-0.019569527581337384
listen to the Mockingbird oh you're,4342.44,5.46,4345.169999999999,0.0,0.0,0.4,-0.08923672165442194,-0.028637705918205292,-0.01911131590198685
gonna get it anyhow oh listen to the,4345.44,4.94,4347.91,0.0,0.0,0.7,-0.09026364714954849,-0.028843586916922206,-0.018579558155053754
Mockingbird,4347.9,2.48,4349.139999999999,0.0,0.0,0.3,-0.09072014702148952,-0.028936113841316856,-0.01834015249891948
wait a minute I'm gonna give you another,4352.4,3.839,4354.3195,0.0,0.0,0.5,-0.09261131712468113,-0.029326315340620666,-0.01732770840481787
if you take the bread whistling,4356.239,6.241,4359.3595,0.0,0.0,0.4,-0.09440207617751224,-0.029706610845703287,-0.016336666786117535
in this number when I say when I say oh,4358.96,5.259,4361.5895,0.0772,0.0,0.7,-0.09517844488601336,-0.02987496872128484,-0.015896606357198258
listen to the Mockingbird oh listen to,4362.48,3.9,4364.429999999999,0.0,0.0,0.5,-0.09615288172203316,-0.0300894288209134,-0.015334886477403074
the Mockingbird is the cue for the bird,4364.219,4.731,4366.5845,0.0,0.0,0.5,-0.09688101575447945,-0.03025206625089366,-0.014908048763524445
whistle you got it yes,4366.38,5.689,4369.2245,0.4019,0.0,0.7,-0.09776013649625723,-0.030451271764777077,-0.014384247841620684
say I forgot to mention in this number,4379.88,5.4,4382.58,0.0964,0.0,0.2,-0.10197890130459789,-0.03145578866220859,-0.011726675945878513
I do a very clever imitation of the,4382.82,5.2,4385.42,0.5095,0.0416666666666666,0.6,-0.10282507491105891,-0.03166827777548153,-0.011161104132799303
Mockingbird in flight,4385.28,9.899,4390.2295,0.0,0.0,0.7,-0.10421579491426863,-0.032026856864411916,-0.010204039013176413
here it is,4395.179,2.781,4396.5695000000005,0.0,0.0,0.5,-0.10596592238515393,-0.03249662910793788,-0.00894518518747678
well what do you want me to do break my,4398.9,3.86,4400.83,0.34,0.0,-0.7,-0.1070875130083961,-0.03281011792005092,-0.008101977008357786
oh listen to the Mockingbird oh listen,4409.76,5.959,4412.739500000001,0.0,0.0,0.6,-0.10998178832752756,-0.033674944770836934,-0.005762706504254499
to the Mockingbirds,4412.46,3.259,4414.0895,0.0,0.0,-0.8,-0.11028685428572868,-0.03377175844590634,-0.0054996297977736985
look guys bombing,4418.3,4.48,4420.54,0.0,0.0,0.7,-0.11167785634932417,-0.034230442803235124,-0.004249876124572581
but I'm all right,4421.04,5.76,4423.92,0.0,0.2857142857142857,0.4,-0.11236198394492647,-0.03446803000675087,-0.0036003351343242705
look the time to pop is over,4422.78,8.419,4426.9895,0.0,0.0,-0.7,-0.11295610263444013,-0.03468202408951601,-0.0030139893522305194
now it's the bird effect the bird effect,4426.8,4.399,4428.9995,0.0,0.0,0.4,-0.11333097046882147,-0.03482120045761129,-0.0026319719359192955
the Mockingbird oh listen to the mocking,4438.5,4.49,4440.745,-0.4019,0.0,0.8,-0.11529178901335817,-0.035618080195074356,-0.0004341331302855746
give me the bird,4441.02,6.12,4444.080000000001,0.0,0.0,-0.8,-0.11577533211757396,-0.03583882325274038,0.00017797794963398273
thank you folks thank you,4454.159,4.681,4456.4995,0.6124,0.0,0.7,-0.1172806150236624,-0.03663678090380565,0.00240348988196204
voice recording d i,4456.38,4.46,4458.61,0.0,0.0,0.2,-0.11748903281342483,-0.03676834109868143,0.002772453675456533
I've lost Medici,4465.98,3.38,4467.669999999999,-0.3182,0.0,-0.7,-0.11822265260535172,-0.03731861595446743,0.004322555883563774
I have a very beautiful thing I'm going,4476.06,4.26,4478.1900000000005,0.6361,0.8139359607615205,0.8,-0.11873783514884376,-0.037925913065625275,0.006047421030665288
to play for you a number from our show,4477.98,4.32,4480.139999999999,0.4019,0.0,0.6,-0.1187925897053068,-0.03803449222782982,0.006357573391477369
called anywhere,4480.32,4.2,4482.42,0.0,0.0,0.3,-0.11884044192356337,-0.03815979488381784,0.006716368738659605
when you hear me play this,4482.3,5.82,4485.21,0.34,0.0,0.7,-0.11887556199866407,-0.03831065555196993,0.007149907635242868
You'll wish you were Anywhere But Here,4484.52,5.699,4487.369500000001,0.2144,0.0,-0.7,-0.11888525328582357,-0.03842551992831825,0.007481404373718163
are you ready Professor let's give him,4488.12,4.22,4490.23,0.3612,0.2,0.6,-0.11887490428527575,-0.038575058481563854,0.007915184249921218
night I played 108 courses of this give,4559.48,6.46,4562.709999999999,0.34,0.0,0.4,-0.1109809778615743,-0.0411658771104028,0.017414790148241998
them another one boy,4563.719,3.641,4565.5395,0.0,0.0,0.5,-0.11042166618478684,-0.041212197692340226,0.017748422661789325
this way sir,4617.92,3.48,4619.66,0.0,0.0,0.2,-0.09720843229391692,-0.04111213186104406,0.024094260827246052
how do you do I'm Paul's father I know,4630.26,6.0,4633.26,0.0,0.0,0.4,-0.09331851285123721,-0.04076088529706379,0.025760143497371484
this is my friend Miss Kane her best,4633.739,5.401,4636.4395,0.7783,0.8139359607615205,0.7,-0.09238670478870704,-0.04065804751259018,0.026158497284965686
friend and I'm staying,4636.26,5.88,4639.2,0.4939,0.0,0.8,-0.09157170595722658,-0.040562238127681005,0.026507492181044503
oh I'm sure if Miss Bruce doesn't object,4639.14,5.22,4641.75,0.1779,0.5,0.4,-0.09081423277392695,-0.040468291332032814,0.026832610163060454
I'm very much afraid I've taken on a,4644.36,3.359,4646.0395,0.0,-0.6,-0.5,-0.08953082057342905,-0.04029832895152278,0.02738579080974001
difficult task,4646.58,2.76,4647.96,-0.3612,-0.5,-0.8,-0.0889527529367772,-0.04021733326768475,0.027636146541548307
you'll be surprised how easy it's going,4647.719,2.52,4648.979,0.5859,0.2666666666666666,0.7,-0.08864522791706292,-0.0401731165648384,0.0277696846839615
sit down Mr Lundy,4650.239,3.261,4651.8695,0.0,-0.1555555555555555,0.2,-0.08777003904594223,-0.04004297705284816,0.02815120966427144
have you heard from my son in the last,4660.92,3.54,4662.6900000000005,0.0,0.0,0.3,-0.08446234291335245,-0.039492854258380644,0.029618033186666712
well I haven't kept track of the time,4664.46,4.8,4666.86,0.2732,0.0,0.2,-0.08317750293976293,-0.039253783778993676,0.030200987757748907
you know I haven't Mr Lundy neither have,4669.26,3.54,4671.030000000001,0.0,0.0,-0.7,-0.08188889856982103,-0.03899933340223598,0.0307946131402506
you haven't but is here in London isn't,4672.8,5.1,4675.35,0.0,0.0,0.3,-0.08055127227706185,-0.0387192856660743,0.03142143052762872
he his friends were no no he was,4675.56,3.84,4677.4800000000005,0.6108,0.0,-0.7,-0.07989115705802885,-0.03857497613030547,0.03173510470023656
detailed for a special mission of some,4677.9,3.72,4679.759999999999,0.4019,0.3785714285714285,0.6,-0.07918436810006085,-0.038415901583197534,0.03207435926527351
sort that much I did learn something,4679.4,4.319,4681.559499999999,0.0,0.2,0.6,-0.07862652315969174,-0.03828696902084914,0.032344723408966325
quite important I'd be important enough,4681.62,5.039,4684.1395,0.4391,0.2666666666666666,0.7,-0.07782692070713133,-0.038096872020328215,0.032736458891955394
to take him away from his own Squadron,4683.719,5.281,4686.3595000000005,0.0,0.6,-0.7,-0.07713927390862253,-0.03792832220381962,0.03307749440040508
I received a trunk with books and,4686.659,4.201,4688.759499999999,0.0,0.0,0.4,-0.07639649435277257,-0.03774088775167646,0.0334504033972328
personal belongings yesterday did you,4689.0,3.659,4690.8295,0.0,0.0,0.2,-0.0757565397696452,-0.03757484080503057,0.03377563862145271
mean something's happened,4690.86,3.0,4692.36,0.0,-0.3125,0.3,-0.07528388049591662,-0.037449443011433645,0.03401829480322599
no I believe that during his absence his,4693.86,3.96,4695.839999999999,-0.296,-0.0125,-0.7,-0.07421110799796377,-0.0371559445010223,0.034577112044567
Squadron is being moved to another,4696.56,3.78,4698.450000000001,0.0,0.0,0.2,-0.0734086404546675,-0.03692812911475346,0.035002825876767694
station that's all,4697.82,5.3,4700.469999999999,0.0,0.0,0.2,-0.07278902870025131,-0.03674724980843763,0.03533628511221969
um among the things he sent home,4707.239,4.92,4709.699,0.0,0.0,0.2,-0.06997832147018349,-0.03586950542243957,0.03690578515870956
or with this Bible,4710.179,5.281,4712.8195000000005,0.0,0.0,0.2,-0.06903701084970121,-0.03555339773674683,0.03745423113395904
the one I gave him when he enlisted,4712.159,6.0,4715.159,0.0,0.0,0.4,-0.0683348148459389,-0.035309908937900696,0.037871537870216576
this is precisely the way it came,4715.46,5.46,4718.19,0.0,0.4,0.6,-0.06742994326495852,-0.034986104829307224,0.03842017127117198
your photograph,4718.159,4.981,4720.6495,0.0,0.0,0.6,-0.06670002849474461,-0.03471637976679206,0.038872112908478355
the page in the theater program and see,4720.92,4.259,4723.0495,0.0,0.0,0.4,-0.06599177938910364,-0.034447111492845794,0.039319070317699496
where he's written this is for her,4723.14,4.019,4725.1495,0.0,0.0,0.6,-0.06537549291107368,-0.03420655290295743,0.03971506129438829
what's he trying to suggest Roslyn needs,4725.179,3.48,4726.919,0.0,0.0,0.2,-0.06485880475295581,-0.03400024714002972,0.040052337615000023
quiet Judy I didn't disturb a thing here,4728.659,5.461,4731.389499999999,0.3089,0.0,0.4,-0.06356470473061035,-0.033464226119455445,0.040919426890894395
it is where your picture was in First,4732.26,3.6,4734.06,0.0,0.25,0.7,-0.0627998416882919,-0.033133824478785844,0.04144785165167148
Corinthians,4734.12,3.539,4735.8895,0.0,0.0,0.5,-0.06227958985001174,-0.03290303280779957,0.04181447238770855
the First Corinthian is one of Paul's,4735.86,4.56,4738.139999999999,0.0,0.25,0.6,-0.061643962462118645,-0.03261414898898982,0.042270677213371737
Epistles the Saint Paul my Paul was,4737.659,4.201,4739.759499999999,0.0,0.0,0.5,-0.06118961849341487,-0.03240284449128817,0.04260257722371967
named after him,4740.42,3.36,4742.1,0.0,0.0,0.4,-0.06053769455742443,-0.032092384182010096,0.04308764523203658
I do think he's trying to tell me,4743.78,5.04,4746.3,0.0,0.0,0.4,-0.05938236361905057,-0.03152009231989214,0.04397440034866152
something or or she means maybe it's um,4746.0,6.06,4749.03,0.0,0.0,0.2,-0.05864190293349625,-0.031137566929968837,0.044562242418451484
you know a code or something maybe,4748.82,4.8,4751.219999999999,0.0,0.0,0.2,-0.058054164806720154,-0.03082465799423767,0.04504045363702313
let's see now,4752.06,6.139,4755.1295,0.0,0.0,0.2,-0.05701939743776219,-0.03025257882763116,0.04590910995651554
I'm concerned anything to her foreign,4753.62,4.579,4755.9095,0.0,-0.125,0.3,-0.05681523220716593,-0.03013636007375227,0.04608474749992185
what was that last one it's better to,4761.92,5.44,4764.64,0.4404,0.25,0.4,-0.05458501955183186,-0.02878775308617202,0.04810490870936096
marry than Mr Lonely look,4764.9,5.339,4767.5695,-0.3612,-0.0999999999999999,0.7,-0.053860492475212296,-0.02831537073287998,0.0488056262636442
the words this is for her come right,4767.36,6.66,4770.69,0.0,0.2857142857142857,0.6,-0.053102671702922565,-0.027801077807200286,0.049565014369699935
opposite just better to marry,4770.239,6.181,4773.3295,0.4404,0.25,0.4,-0.05247326277663442,-0.02735704658427937,0.05021797202164234
do you suppose that that's the way I,4774.02,4.26,4776.150000000001,0.0,0.0,0.2,-0.05181281289184238,-0.026873373731474554,0.0509266321907962
translated it,4776.42,4.1,4778.47,0.0,0.0,0.2,-0.05127920611278246,-0.026468365035706598,0.05151811890185118
well I'll be,4778.28,8.12,4782.34,0.2732,0.0,0.7,-0.05040907454788178,-0.025778274083885097,0.05252228400046012
I admit it is an extraordinary way to,4786.4,4.9,4788.849999999999,0.2023,0.3333333333333333,0.7,-0.04900412829232258,-0.024576121342036107,0.05426191834516031
propose to a girl,4789.02,3.49,4790.765,0.0,0.0,0.2,-0.04860543132057565,-0.02421253541492365,0.054785951233882066
what do you think,4791.3,4.439,4793.5195,0.0,0.0,0.7,-0.04804398403265911,-0.023681552572230084,0.05554969491742377
what do you think,4795.739,4.191,4797.8345,0.0,0.0,0.2,-0.0471937627167431,-0.02283062900982797,0.05677014611093007
I hope you're going to accept,4797.659,5.58,4800.449,0.6705,0.0,0.7,-0.04669649926617181,-0.02230360316433242,0.057524119428472485
the last time I proposed was 27 years,4803.239,3.541,4805.009499999999,0.0,0.0,-0.7,-0.045862488741394744,-0.0213634569754467,0.058865927692723086
seem to have lost my technique,4806.78,4.86,4809.21,-0.3182,0.0,-0.7,-0.045133017971082434,-0.020473873598264337,0.06013230893241768
will you marry us rather,4809.3,4.15,4811.375,0.0,0.0,0.8,-0.04477195383932125,-0.020006439226168182,0.06079662977129842
of course I will,4811.64,6.45,4814.865000000001,0.0,0.0,0.8,-0.04421182079841934,-0.019240048194849757,0.06188439146423411
talk apparently over to those being,4820.94,3.96,4822.919999999999,0.0,0.05,-0.7,-0.043025811012269044,-0.01740988112012381,0.06447606940390825
it has every sanction I know,4824.9,3.68,4826.74,0.0,0.0,0.2,-0.042517036226813326,-0.016511784213255117,0.06574543768707145
goodbye my dear,4832.34,4.44,4834.56,0.3818,0.0,0.7,-0.04157973725715497,-0.014613961672334027,0.06842370335952853
goodbye what I've learned about this,4834.44,4.799,4836.8395,0.0,0.0,0.2,-0.041331671262503374,-0.014046111425678126,0.06922413349508175
theater tonight has made me very humble,4836.78,4.08,4838.82,0.0,-0.26,0.4,-0.04112497792184409,-0.013547493525809126,0.06992666245161147
and very proud,4839.239,3.361,4840.9195,0.5256,0.8139359607615205,0.8,-0.040914629191779836,-0.013013644273554156,0.07067852836687623
it's nice to know that my daughter's a,4840.86,2.64,4842.179999999999,0.4215,0.6,0.7,-0.040792587772190365,-0.012690550208920308,0.07113342644498945
as well as my son,4843.5,8.71,4847.855,0.2732,0.0,0.8,-0.040281272454949814,-0.011212333246600478,0.07321342871809794
you tell me have you heard,4856.239,6.341,4859.4095,0.0,0.0,0.2,-0.039419249544095904,-0.008087434855709844,0.07760507976867713
what what's the matter Tommy nothing,4859.46,4.44,4861.68,0.0258,0.0,0.3,-0.03927578227909371,-0.007455902107468378,0.07849192917456756
I'm just wondering what's going to,4862.58,2.88,4864.02,0.0,0.0,0.2,-0.03913617631323739,-0.0067992255797808135,0.07941389357695222
happen to the deal we all made to stick,4863.9,3.66,4865.73,0.0,0.0,-0.7,-0.03903928941338894,-0.0063156642682968035,0.08009269252732834
to the music box for the duration,4865.46,4.62,4867.77,0.0,0.0,0.7,-0.03892919935220277,-0.005734768671095439,0.08090800906357283
I'm not gonna leave the music box Paul's,4867.56,4.619,4869.869500000001,0.0382,0.0,0.7,-0.03882194870934478,-0.005132425342266472,0.08175330909635213
got his job and I've got mine,4870.08,4.02,4872.09,0.0,0.0,0.6,-0.03871496520205598,-0.004490463184712227,0.08265409021223331
don't make me laugh,4872.179,3.841,4874.0995,-0.4449,0.3,-0.7,-0.03862365895999382,-0.003905217122323819,0.08347519650844938
all Mr Paul has to do is raise his,4874.1,3.3,4875.75,0.0,0.0,0.5,-0.038552447611206575,-0.003421520242702656,0.08415377037445432
finger and you'll come running wherever,4876.02,3.74,4877.89,0.0,0.0,0.7,-0.03846501911273937,-0.0027903864238612115,0.08503911476893125
you're kidding aren't you the only,4881.38,3.94,4883.35,0.1027,0.0,-0.7,-0.038265586999821494,-0.0011601608057013682,0.0873257068349964
person I've been kidding is myself I've,4883.699,3.241,4885.3195,0.1027,0.0,0.5,-0.03820145507403204,-0.0005652370347505879,0.08816009854669825
had a lot of funny ideas about you only,4885.32,3.24,4886.94,0.4404,0.125,0.7,-0.038151592714483616,-7.305939879295125e-05,0.08885037347418293
they're not so funny now,4886.94,3.48,4888.679999999999,-0.464,0.25,-0.7,-0.038100856028253034,0.0004580672781474253,0.08959526720169361
I never got around to telling you Ross,4888.56,2.82,4889.97,0.0,0.0,-0.7,-0.03806504590511649,0.0008535877562601535,0.09014997536292536
I'm in love with you,4891.38,3.9,4893.33,0.6369,0.5,0.8,-0.03797861197847166,0.001890680743312979,0.09160449155661682
