text,start,duration,time_midpoint,vader,textblob,llama3,vader_norm,textblob_norm,llama3_norm
Henry you'll tell him you picked me,3397.68,3.96,3399.66,0.0,0.0,0.8,-0.20310216465759592,-0.11421047691117782,-0.1229196886035391
Vicki you can't back down now not after,3399.64,4.24,3401.76,0.0,-0.0777777777777777,0.7,-0.2022748691916277,-0.11375575630493373,-0.12106505950277212
you promised Henry's strong he can face,3401.64,4.6,3403.94,0.7003,0.4333333333333333,0.7,-0.2013775494848987,-0.11327505901620219,-0.1190829961470099
honey I'll tell,3406.24,9.599,3411.0395,0.0,0.0,0.7,-0.1981883346884052,-0.11164882747941085,-0.11225322153206267
him poor Henry poor Henry not a word,3409.039,9.121,3413.5995000000003,-0.7351,-0.4,-0.7,-0.19694006520385895,-0.1110397481895868,-0.1096599347401778
4:30 thank you,3419.76,3.359,3421.4395000000004,0.3612,0.0,0.7,-0.19280260521256118,-0.10910030495499312,-0.10133710192597863
Peter hello,3434.24,6.599,3437.5395,0.0,0.0,0.4,-0.18288601605814933,-0.10477163288358972,-0.08279977785372312
hello Henry don't you feel well oh I'm,3441.44,6.04,3444.46,-0.2057,0.0,0.2,-0.17806887835616586,-0.10277021114006357,-0.07440476685898477
all right all right don't mind,3444.599,2.881,3446.0395000000003,0.0,0.2857142857142857,0.4,-0.1769248827749582,-0.1023017020567122,-0.07246423184372104
I I suppose you have something to tell,3450.119,7.361,3453.7995,0.0,0.0,-0.6,-0.1710717357969157,-0.09993723166741124,-0.06283915901198019
me yes dear uh bill and,3452.64,6.76,3456.02,0.6486,0.0,0.4,-0.16932739027096447,-0.09924158467806138,-0.06006594550521659
we bought a,3459.4,7.6,3463.2000000000003,0.0,0.0,0.3,-0.1634830463641722,-0.0969346723913267,-0.05108101730286715
suit that's nice gray light,3462.72,8.639,3467.0395,0.4215,0.5,0.4,-0.16023360727202363,-0.095665238842681,-0.04628467755247056
gray I didn't eat did you enjoy your,3467.0,6.76,3470.38,0.4939,0.4,0.4,-0.1573383541039794,-0.09454063878088893,-0.04212838589942138
lunch we ate in a little restaurant off,3471.359,4.68,3473.699,0.0,-0.1875,0.2,-0.1544004830251958,-0.09340481341701562,-0.038022287344764275
Broadway and then we went to Inspiration,3473.76,5.4,3476.46,0.5267,0.0,0.6,-0.15191105722703674,-0.09244599443071719,-0.034629814882375695
Point it sounds romantic yes it,3476.039,7.76,3479.9190000000003,0.6597,0.0,0.6,-0.14873535239686614,-0.09122698973971992,-0.030416688181175284
was I I mean I'm,3479.16,4.639,3481.4795,0.0,-0.3125,-0.7,-0.14728233214798925,-0.09067059625214392,-0.02853155225062077
all Henry don't act like this please how,3485.039,5.08,3487.579,0.1318,0.0,0.2,-0.14148511514499315,-0.0884575938686083,-0.021274142033480985
else can I be sitting here hour after,3488.359,4.24,3490.479,0.0,0.0,0.3,-0.13866483761145756,-0.08738418940750481,-0.0178951842398003
hour alone thinking about the line of,3490.119,4.72,3492.4790000000003,-0.25,0.0,0.3,-0.13669649789656915,-0.08663598497142462,-0.015595486626963063
tyer strike,3492.599,4.121,3494.6595,-0.128,0.0,-0.7,-0.13452924882299883,-0.08581291200512957,-0.013118962744386446
Vicki about,3494.839,4.561,3497.1195,0.0,0.0,0.4,-0.13205806510321655,-0.08487517428562584,-0.010366099969354154
myself well maybe if you took something,3496.72,5.52,3499.48,0.2732,0.0,-0.7,-0.12966130987429975,-0.08396626870324858,-0.0077683227345815035
dear get the acid out of your system,3499.4,6.04,3502.42,0.3818,0.0,-0.7,-0.1266419955812728,-0.08282182394619422,-0.004596897338324682
Vicki I I wish you all the happiness in,3502.24,4.04,3504.26,0.743,0.7,0.2,-0.12473349178330069,-0.08209860025607646,-0.0026504202285602173
world what do you,3506.28,3.36,3507.96,0.0,0.0,0.8,-0.12085291868746557,-0.08062811945897444,0.001168251536618297
mean don't misunderstand why I'm doing,3509.72,5.119,3512.2795,0.2755,-0.3125,-0.7,-0.11625249810487508,-0.07888425539587117,0.005453143992710784
this dear the months I've been married,3512.2,4.839,3514.6195,0.3818,0.25,0.7,-0.11372983772824988,-0.07792739946593404,0.007690896622501574
to you are the happiest in my life and,3514.839,3.96,3516.819,0.6369,0.0,0.8,-0.11133969989966484,-0.07702024826670265,0.009737715806797127
if I had the opportunity to live them,3517.039,4.961,3519.5195000000003,0.4215,0.1363636363636363,0.8,-0.10838066280142523,-0.07589624230716764,0.012172455412421198
over even knowing they'd be followed by,3518.799,5.681,3521.6395,0.0,0.0,0.4,-0.10603927079515056,-0.07500598843061032,0.01402085833953552
heartbreak I'd come to you once,3522.0,6.119,3525.0595,-0.5719,0.0,-0.7,-0.10222897919201236,-0.0735553134558801,0.01688340232625721
more with all my,3524.48,3.639,3526.2995,0.0,0.5,0.8,-0.10083762098334478,-0.07302492980512797,0.01788598772439988
love you're so sweet Henry yes I'm,3530.96,7.76,3534.84,0.8874,0.425,0.7,-0.09111953470517486,-0.06930868696769196,0.024321192479592156
sweet I know I'm just a plain dull,3535.319,4.8,3537.719,0.0772,-0.0519841269841269,-0.7,-0.08779313683913131,-0.06803124412496095,0.026320615652906953
businessman why should any woman want,3540.119,4.041,3542.1395,0.0772,0.0,-0.7,-0.08263955824506063,-0.0660458095655805,0.029242452927822443
me I married,3544.2,7.44,3547.92,0.0,0.25,0.4,-0.07582122364342488,-0.06340600644606703,0.03282057363670891
well how can you ask a thing like,3551.799,5.881,3554.7395,0.5574,0.0,-0.7,-0.06767154754939071,-0.06022893613458235,0.0367414786022086
Bill he's everything a woman loves,3560.039,6.241,3563.1595,0.5719,0.0,0.8,-0.05746896695157748,-0.056213675960001416,0.04123221451133538
handsome Reckless,3563.52,7.039,3567.0395,0.128,0.5,0.4,-0.052721402442829864,-0.054329401262194175,0.043204466956921574
unreliable athletic,3566.28,7.96,3570.26,0.0,0.0,-0.6,-0.048761033255075734,-0.05274926653891961,0.04480787013078459
selfish I'm lick Vicky no use fighting,3570.559,5.081,3573.0995000000003,-0.4922,-0.5,-0.7,-0.045255445673406364,-0.05134400180707791,0.046202510657413424
away well if that's the way you feel how,3575.64,5.36,3578.32,0.2732,0.0,0.2,-0.03877983418364557,-0.048731087950607266,0.04873722990479874
I feel has nothing to do with it far be,3578.64,4.52,3580.9,0.0,0.1,-0.7,-0.03556637866328746,-0.04742585554572332,0.04998364856683861
it for me to interfere with your plans,3581.0,4.799,3583.3995,0.0,0.0,-0.7,-0.032445739748673666,-0.046152628020219216,0.05119199051415391
go ahead quit but what kind of A man,3583.16,4.52,3585.42,0.0,0.6,0.3,-0.02991820451995057,-0.04511715596321394,0.05217171251953165
gives up before the fighting starts I,3585.799,3.601,3587.5995,-0.3612,0.0,-0.7,-0.027187231306325152,-0.04399396832061014,0.05323371532471747
haven't a chance neither did Washington,3587.68,4.399,3589.8795,-0.1877,0.0,-0.7,-0.024325722838200517,-0.0428120975194806,0.0543528433755813
at Valley Forge nor Lincoln nor Fulton,3589.4,4.56,3591.6800000000003,0.0,0.0,0.2,-0.02206298456640648,-0.04187382353313718,0.05524417696766887
nor the men who invented the airplane,3592.079,3.361,3593.7595,0.0,0.0,0.2,-0.019446624590110522,-0.04078473382126488,0.05628374655729909
think of their heart heartbreaks,3593.96,3.359,3595.6395,0.34,0.0,-0.7,-0.017078788805868758,-0.039795143009304736,0.05723447811802856
struggling against tremendous odds with,3595.44,4.639,3597.7595,-0.4215,0.3333333333333333,0.3,-0.014406190325651363,-0.03867356614429288,0.05832086680580507
the whole world laughing at,3597.319,6.561,3600.5995,0.4939,0.2,-0.8,-0.010822422620187302,-0.03716172532157703,0.059803456636851896
them they laugh right back and carried,3600.079,5.921,3603.0395,0.5574,0.1952380952380952,0.7,-0.007740843386051417,-0.03585431019711765,0.06110561248615072
on with every ounce of strength they had,3603.88,3.8,3605.78,0.4939,0.0,0.7,-0.004277670970655012,-0.03437655287587081,0.06260355598040021
day after day night after night on and,3606.0,3.599,3607.7995,0.0,0.0,0.7,-0.0017246753468072168,-0.03328129579305508,0.06373390554962612
on till they,3607.68,4.919,3610.1395,0.0,0.0,0.2,0.0012340199723915798,-0.032005582371441355,0.06507440339961265
won I shouldn't give up of course not,3609.599,6.0,3612.599,0.5719,0.0,0.7,0.004343896816593466,-0.030657077374365307,0.06652188000538904
carry on never take no for an answer you,3612.599,5.121,3615.1595,0.2235,0.0,0.7,0.007580951502195045,-0.029244915670919407,0.06807418619697753
can't lose if you have the will to win,3615.599,3.601,3617.3995,0.7234,0.8,0.9,0.01041186335943705,-0.028002623578044297,0.06947300074122226
the spirit to stay in there and keep,3617.72,3.639,3619.5395,0.1779,0.0,-0.7,0.013115131544489442,-0.026809812620657333,0.07084731006694306
fighting until the last man is downed,3619.2,4.44,3621.42,-0.3612,0.0,0.4,0.0154892656590387,-0.025756842923924765,0.07208729514653153
are there others I'm speaking,3621.359,5.121,3623.9195,0.0,0.0,0.2,0.018642490191161022,-0.02435034957218169,0.07378485059233439
theoretically,3623.64,5.36,3626.32,0.0,0.0,0.3,0.021667720001814578,-0.02299216533735967,0.07547115530439999
don't quit now don't hang your head and,3626.48,4.96,3628.96,0.0,0.0,0.7,0.02499060908875122,-0.02149014809818149,0.07739269233436916
run away fight for the woman you love,3629.0,4.4,3631.2,0.3818,0.5,0.7,0.027806079686140045,-0.02020890553169144,0.07908101202435282
darling you're mine that's the way to,3631.44,3.96,3633.42,0.5859,0.0,0.7,0.03059237067455265,-0.01893297150603762,0.08080928217225594
talk why there's only one man for you,3633.4,4.08,3635.44,0.0,0.0,0.5,0.033123782727348665,-0.017766707766478984,0.08243146975219257
and I'm that man that's it and tonight,3635.4,4.63,3637.715,0.0,0.0,0.4,0.035969929069615464,-0.01644722396150937,0.08431736082896876
we celebrate tonight we tell the world,3637.48,4.48,3639.72,0.5719,0.0,0.8,0.03847369709192487,-0.01527909853739453,0.08603314720459132
right but who'll tell,3641.96,4.399,3644.1595,0.0,0.2857142857142857,0.7,0.04400061636116127,-0.012675260940096349,0.09002043086950368
oh oh Henry don't worry don't worry I'll,3646.359,5.76,3649.239,0.094,0.0,0.2,0.05029196370667513,-0.009666968578308746,0.09492079898921174
tell him all Vicki do you realize what,3650.079,4.04,3652.099,0.0,0.0,-0.7,0.05381725397116601,-0.007959624164070936,0.0978490291563011
you've done for me you dragged me out of,3652.119,4.0,3654.119,-0.0516,0.0,0.7,0.05629911585874023,-0.006747943900778753,0.09999337800776475
the fire of Despair old darling this is,3654.119,3.761,3655.9995,0.0258,0.1,-0.7,0.058603348457999554,-0.005615821380218515,0.10204440222966249
the beginning of a better and finer life,3656.119,3.641,3657.9395,0.4404,0.5,0.7,0.06097398224143985,-0.004443929620413354,0.10421292771309708
for both of us and tonight's the,3657.88,3.32,3659.54,0.0,0.0,0.4,0.06292463403705406,-0.0034742529216866334,0.10604024228854211
celebration guess where we celebrate,3659.76,4.44,3661.98,0.5719,0.0,0.4,0.06588925670771224,-0.0019912645334943316,0.10888890887033012
Henry I have something I must Franks yes,3661.2,5.28,3663.84,0.4019,0.0,0.8,0.0681414910407468,-0.000857216714497857,0.11110846964167229
Franks dinner at Franks with the most,3664.2,5.399,3666.8995,0.0,0.5,0.8,0.07183118576786303,0.001014343722759426,0.11484281815407192
wonderful woman in the,3666.48,3.119,3668.0395,0.5719,0.8440272939529759,0.2,0.07320109618955772,0.0017135252612954504,0.11625897384485313
world poor Bill yes poor,3669.92,5.08,3672.46,-0.5423,-0.4,0.8,0.07848689893886088,0.004432983316529381,0.1218637564461084
Bill go the limit Peter make me,3677.2,4.24,3679.32,0.0,0.0,0.4,0.08660262719026114,0.008674525744691531,0.13085813523939058
something to remember the tie is so,3679.52,5.24,3682.14,0.0,0.0,0.4,0.08990626255096903,0.010423742820244,0.1346358540020737
important sir it either makes or breaks,3681.44,5.52,3684.2,0.2023,0.4,0.7,0.0923069978691011,0.011703019038443837,0.13741759796924677
is that the door,3684.76,6.319,3687.9195,0.0,0.0,-0.7,0.09661398343923326,0.014015102803852092,0.14247593427060593
downstairs no sir this Lou should be,3686.96,8.28,3691.1,-0.296,0.0,0.2,0.10026757500762937,0.015993452913867518,0.14682526422436828
back oh well a woman at her,3691.079,4.161,3693.1595,0.2732,0.0,0.3,0.10261856882617432,0.017274679378173376,0.14964733356356583
hairdresses I haven't had this thing on,3695.44,3.84,3697.36,0.0,0.0,0.2,0.10737621573735512,0.019887005644356543,0.15540139004859516
in months it fits you beautifully Mr L I,3697.28,3.279,3698.9195,0.8143,0.8440272939529759,-0.7,0.10912946077926532,0.020856239886614548,0.1575326393566088
didn't realize sir that your shoulders,3699.28,6.039,3702.2995,0.0,0.0,0.7,0.11290428985376703,0.022954988061696577,0.1621328462386203
are so broad didn't you are,3700.559,4.76,3702.939,0.0,0.0625,-0.7,0.11361456098112727,0.02335170489841164,0.16299938381952406
they I'll move your things back into Mrs,3706.68,4.639,3708.9995,0.0,0.0,0.3,0.12028169758620776,0.027103505182804178,0.17112522706991692
L's room immediately sir yes thanks I'll,3709.0,5.96,3711.98,0.6808,0.2,0.4,0.12351677771452546,0.028942095472606833,0.1750477315930917
be downstairs and uh I must say it's uh,3711.319,5.76,3714.199,0.0,0.0,0.2,0.12590595634905122,0.03030750333704022,0.17792830193314504
congratulations thank you again Peter oh,3714.96,4.44,3717.18,0.7506,0.0,0.3,0.12908895923668467,0.03213654634149565,0.18173663850891714
Mr L yeah Will Mr cardu be dining here,3717.079,5.28,3719.719,0.7125,0.0,0.7,0.13177542796526368,0.03368911338880936,0.18491793254960942
tonight I'm sure I don't,3719.4,9.08,3723.94,0.3182,0.5,-0.7,0.1361902107307098,0.03625807329478966,0.19006220569187784
know for fell sir uh I said I didn't,3722.359,6.121,3725.4195,0.0,0.0,-0.7,0.1377221144926407,0.0371545874273141,0.19181822154141182
know 75 East,3729.0,4.799,3731.3995,0.0,0.0,0.4,0.14382935006068046,0.040754836548509386,0.19863388310775637
yes no no don't stop,3734.2,4.159,3736.2795,0.4462,0.0,0.3,0.14870956975624913,0.0436618104296133,0.20381954949580028
going some screw,3741.039,3.841,3742.9595,-0.1027,0.0,0.2,0.1552324163060162,0.047589097732197105,0.21028424140775281
where do you want to go ma'am oh drive,3744.88,4.399,3747.0795,0.0772,0.0,0.3,0.15916142156150442,0.049977926903816784,0.21386226855165333
around the block,3747.16,4.119,3749.2195,-0.4404,0.0,0.3,0.1611730647734189,0.05120781257248054,0.2155866307723844
please do you want to make an easy half,3749.279,3.921,3751.2395,0.6705,0.1333333333333333,0.4,0.16305328699412658,0.05236154097867321,0.2171257755091942
dollar sign yes sir what do I do well,3751.279,3.121,3752.8395,0.5859,0.0,0.4,0.16452957916132802,0.053270262542065405,0.21828177892624404
when I come back I'll just put on your,3753.2,2.839,3754.6195,0.0,0.0,0.4,0.1661583025354152,0.05427573268054435,0.2195002164168044
prettiest smile and start singing Here,3754.4,3.879,3756.3395,0.7351,0.3,0.8,0.16771831832113848,0.055241672149815756,0.22060798924699512
Comes The Ride sure thing is that you,3756.039,3.28,3757.679,0.3182,0.5,0.4,0.16892373184728754,0.05598998862171071,0.22142207135884287
right darling together at,3770.24,5.68,3773.08,0.5859,0.2857142857142857,0.7,0.18216299809845338,0.0643224886457439,0.22742253737825752
well where do you,3775.92,2.52,3777.18,0.2732,0.0,0.2,0.18548724086649893,0.06644831722021272,0.2278730020999748
yourself where's Vicki why didn't she,3783.559,5.24,3786.179,0.0,0.0,-0.7,0.1924722072168709,0.07096130368924708,0.22695878485762364
tell you she told me she decided to stay,3786.599,4.44,3788.819,0.0,0.0,0.7,0.1944378867508687,0.0722429888416922,0.22616404102879306
with me that's what I me she what you,3788.799,4.8,3791.199,0.0,0.0,0.2,0.19617671848093363,0.07338117886656895,0.2252322638240945
heard me now may I ask where the devil,3791.039,4.32,3793.199,-0.6597,0.0,-0.7,0.1976132423066517,0.07432467421103175,0.22428751713354264
you think you're going I thought I was,3793.599,4.321,3795.7595,0.0,0.0,-0.7,0.19941906622739405,0.07551489652541533,0.22285729035079826
going to Franks because she also decided,3795.359,7.881,3799.2995,0.0,0.0,0.4,0.20185329840546665,0.07712684880036676,0.22046693906374648
to stay with me she she did yes,3797.92,5.32,3800.58,0.4019,0.0,0.3,0.20271576399818472,0.07770010467747132,0.21948683466865512
did I tell you you look lovely thanks,3807.2,4.359,3809.3795,0.7717,0.35,0.7,0.20837737029318879,0.0814922977385805,0.21118583254356726
sweetheart why should she do a thing,3809.52,4.519,3811.7795,0.6486,0.0,0.7,0.20983956432147638,0.08248032433887756,0.20847321332893098
like this because we're both so,3811.559,4.961,3814.0395,0.3612,0.0,0.7,0.21118366853863502,0.08339188369547985,0.20575401656694506
sweet let's pull out of here leave her,3814.039,5.52,3816.799,0.4215,0.35,-0.7,0.2127812189595896,0.0844796346289031,0.20222500160934173
flat we'll show her right we'll show,3816.52,6.36,3819.7,0.0,0.1303571428571428,0.3,0.2144083468220452,0.08559254725791361,0.19827750285203638
her you know something though what maybe,3819.559,5.52,3822.319,0.0,0.0,0.5,0.21583065209434302,0.08656972809260279,0.19451386378981533
she couldn't help it maybe it's like she,3822.88,3.919,3824.8395,0.0624,0.0,0.3,0.21715716271623772,0.08748495551872594,0.19072072700959136
says she loves us both so much she can't,3825.079,3.72,3826.939,0.5719,0.2,0.7,0.21823009502501445,0.08822809285879168,0.18743850686387944
kick one of us out I guess she is in a,3826.799,3.161,3828.3795,0.0,0.0,-0.7,0.2189492739637209,0.08872771346096972,0.18512442955881947
pretty tough,3828.799,4.441,3831.0195,0.4019,-0.0694444444444444,0.4,0.2202311285003227,0.08962136643493752,0.18075739346588693
spot she's been a good little wife to,3829.96,4.879,3832.3995,0.4404,0.25625,0.4,0.22088241064386652,0.09007702312018653,0.17841205992725334
both of us,3833.24,4.879,3835.6795,0.0,0.0,0.5,0.2223781136412244,0.09112784878662661,0.1726738833088425
let's stay all right let's stay but,3834.839,6.041,3837.8595,0.0,0.2857142857142857,0.3,0.22333111322420382,0.09180079579294836,0.16873885743356234
punish her you make her suffer give her,3838.119,3.761,3839.9995,-0.7845,0.0,-0.7,0.22423437157081313,0.09244126560321798,0.164787296324425
works poor Vicky yeah poor,3841.88,4.88,3844.32,-0.6124,-0.4,-0.7,0.22595944140104984,0.09367235139888758,0.15656009495558587
Vicki to think that the woman we trusted,3850.88,5.12,3853.44,0.4767,0.0,-0.7,0.22915895068098474,0.09598936014696399,0.13824630678224392
would do this to us yes after we've,3853.599,5.841,3856.5195,0.4019,0.0,-0.7,0.2301009088812018,0.0966823263714312,0.13182000367205168
given her the best years of Our,3856.0,3.44,3857.72,0.6369,0.8440272939529759,-0.7,0.2304488595342288,0.09693989972650241,0.12928696640207404
waiting say it I deserve,3870.24,3.96,3872.22,0.0,0.0,-0.7,0.23377774987385608,0.09947277101507096,0.09778920167283948
it oh I I know what you're,3875.839,7.0,3879.339,0.0,0.0,0.2,0.2348046088998165,0.10030800312439261,0.08198569702595274
thinking go ahead and think it couldn't,3879.2,4.76,3881.58,0.0,0.0,-0.7,0.23504266194486048,0.10051279061401601,0.07700331777413033
understand how a woman could be this,3882.839,2.841,3884.2595,0.0,0.0,-0.7,0.235272986392274,0.10072031846495422,0.07105352946672873
cruel to two men just because she loved,3883.96,4.44,3886.18,0.0258,-0.15,-0.8,0.2354013896367268,0.1008437477762657,0.06679878284063576
them and doesn't want to hurt,3885.68,4.8,3888.08,0.3724,0.0,0.4,0.23549805800379053,0.10094482533223201,0.06260106227098443
them couldn't believe that I meant what,3888.4,4.48,3890.64,0.0,0.0,-0.7,0.2355801972396502,0.10104756736183164,0.056969073633436285
I said to both of you could you I can't,3890.48,5.68,3893.32,0.0,0.0,-0.7,0.23560653499358128,0.10111348916208966,0.051110210714843916
help it if it doesn't make sense,3892.88,3.28,3894.52,0.4019,0.0,0.3,0.2355984070387991,0.10112905297958069,0.04850146399711153
me Bill yes Hank how do you feel like a,3902.52,6.88,3905.96,0.6369,0.0,0.2,0.234891629222422,0.10083307026953582,0.02425671743253351
man who's had his insides torn out and,3907.839,3.96,3909.819,-0.25,0.0,-0.7,0.23439162138768532,0.10054696318896023,0.016408893475063194
can't die have you any faith left in,3909.4,4.959,3911.8795,0.7137,0.0,-0.7,0.2340695863284545,0.10035466396898604,0.012303216204374325
no look at me please I'm,3914.359,7.44,3918.079,0.0258,0.0,-0.7,0.2328665460289229,0.09960702833720136,0.0003536072463613581
here say anything you want but say it to,3918.96,5.2,3921.56,0.0387,0.0,0.5,0.23203508256362734,0.09907401730336027,-0.006060114179252163
me have you ever known anyone as cold,3921.799,4.56,3924.079,0.0,-0.6,-0.7,0.231362566980663,0.09863661260471353,-0.01055437828086977
and it's heartless I've read about them,3924.16,3.8,3926.06,-0.4939,0.0,-0.7,0.23079156592016317,0.09826178321020285,-0.013996586298149143
the women who break a man's soul and,3926.359,2.96,3927.839,0.0,0.0,-0.7,0.23024698367660573,0.09790182191285156,-0.017015380981220813
laugh in his,3927.96,3.8,3929.86,0.5574,0.3,0.6,0.22959159223683107,0.09746586226170059,-0.020358255792517606
face tried to apologize I've done,3929.319,4.641,3931.6395,0.1027,0.0,-0.7,0.22898199216428258,0.09705800507913545,-0.023222522103212392
everything I could and here set two men,3931.76,4.12,3933.82,0.0,0.0,0.2,0.22819324831625645,0.09652734996183684,-0.026627188120223216
who love just such a,3933.96,5.639,3936.7795,0.6369,0.25,0.7,0.22704862309229756,0.09575217323016813,-0.031055007798673446
woman two bitter disillusion,3935.88,8.32,3940.04,-0.5859,-0.1,-0.7,0.22568798141777963,0.0948240625768973,-0.03566244829497596
shells with nothing to live for,3939.599,8.24,3943.719,0.0,0.1363636363636363,-0.7,0.22402610025739167,0.09368229445748377,-0.04050095576977983
nothing will you,3944.2,3.639,3946.0195,0.0,0.0,-0.5,0.22291828659375348,0.09291694969773368,-0.04332417795232542
listen all right that's enough for me if,3948.0,4.16,3950.08,0.0,0.1428571428571428,-0.7,0.22083594024233275,0.09147116547234177,-0.047934326289631145
you don't want to be human you don't,3950.92,3.399,3952.6195,-0.0572,0.0,-0.7,0.21945279013242738,0.09050675107805187,-0.050584040336153935
have to I don't care what you you think,3952.16,3.72,3954.02,-0.3875,0.0,-0.7,0.2186638658732292,0.08995548265394074,-0.051970946435788
about me or anything else now get out,3954.319,4.161,3956.3995,0.0,0.0,-0.7,0.21728145996544734,0.0889877537629946,-0.05420934961817796
get out of this,3955.88,2.6,3957.18,0.0,0.0,-0.8,0.21681662152692407,0.08866190481265585,-0.05491185172917843
house where are you,3958.88,5.88,3961.82,0.0,0.0,0.2,0.2139390899259787,0.08664068683694248,-0.05877589169227852
going hey what's the matter stop them,3961.279,4.601,3963.5795,-0.2732,0.0,-0.7,0.21279769971307394,0.08583734950951423,-0.06010594611383025
happened will you be dining at home sir,3970.599,5.52,3973.359,0.0,0.0,0.2,0.20596989250065698,0.0810196650679038,-0.06624748209649783
home I suppose you're crying no all,3980.079,5.72,3982.939,-0.6486,-0.2,-0.7,0.19852801031633244,0.0757572066484771,-0.07043049120930378
now what happened to that beautiful,3985.799,5.0,3988.299,0.5994,0.8440272939529759,0.7,0.1940601416657013,0.07259684947875532,-0.07209198416192163
scheme of yours of seeing one at a time,3988.0,7.0,3991.5,0.0,0.0,0.4,0.19129315099735866,0.07064019165304818,-0.07288019447176465
I promise to stay Mar to them both both,3990.799,6.52,3994.059,0.3182,0.0,0.6,0.1890297370728511,0.0690402258273883,-0.07340990095841639
they found it out when they met here,3995.0,4.0,3997.0,0.0,0.0,0.3,0.18637356878666858,0.06716351334257503,-0.0739164904940397
they wouldn't talk to me and I told them,3997.319,4.841,3999.7395,0.0,0.0,-0.7,0.1838479584518831,0.06538010776626717,-0.07429735577267184
to go oh Vicki you're a downright,3999.0,5.16,4001.58,0.0,0.0,0.7,0.18212397758110485,0.06416343200088179,-0.07450754186636666
heel I know,4002.16,4.919,4004.6195,0.0,0.0,0.2,0.17923028357014448,0.062122620846469224,-0.07478068219431519
it but you you can't hurt one by picking,4004.16,4.52,4006.42,0.5667,0.0,0.7,0.17748938615845913,0.06089573124263079,-0.0749023349738167
the other if you love the two of them,4007.079,3.321,4008.7395,0.6369,0.1875,0.7,0.17521804576725747,0.05929610753379116,-0.07501892285185816
making pitiful fools of both because you,4008.68,4.32,4010.84,-0.7506,0.0,-0.7,0.17313396647331783,0.05782951801485537,-0.07508880049632455
don't want to offend one now isn't that,4010.4,5.48,4013.14,0.1695,0.0,-0.7,0.17082302998223572,0.05620465017336766,-0.07513026462697339
insane well it's all over now it's my,4013.0,3.68,4014.84,-0.1531,-0.720824601899625,0.4,0.16909596141509553,0.054991292140221006,-0.07513972382331585
fault selfish to say this Dad but it was,4016.68,4.08,4018.72,-0.4404,-0.5,0.2,0.16509555693305833,0.05218419109581419,-0.07510356098706156
wonderful while it,4019.279,3.8,4021.179,0.5719,0.8440272939529759,0.8,0.1625193793828012,0.05037911571302543,-0.07504619366172974
lasted any woman would be thrilled when,4020.76,3.839,4022.6795,0.4404,0.6,0.7,0.1609322966212974,0.0492681549201225,-0.07500070808608125
suddenly your husband fell madly in love,4023.079,2.801,4024.4795,0.3612,0.25,0.8,0.15901371799024772,0.047926275369616,-0.07493761173331735
with her all over,4024.599,4.601,4026.8995,0.0,0.0,0.7,0.15640962619535437,0.04610697297880112,-0.07484144048241399
again and two husbands oh there you go,4025.88,5.84,4028.8,0.0,0.0,-0.5,0.1543452549011807,0.044666450526884914,-0.07475965508745279
again saying they'd do anything for me,4029.2,5.919,4032.1595,0.0,0.0,0.8,0.15065599833809293,0.04209598793208697,-0.07460933647359623
if I only tell them I love them that's,4031.72,6.0,4034.72,0.6369,0.25,0.2,0.14781105188311314,0.04011733162608191,-0.07449658471658188
something dad it certainly is if you,4035.119,5.561,4037.8995,0.34,0.2142857142857142,0.5,0.1442402414113322,0.03763836493831503,-0.07436821241036436
like dog fights so for a night in a day,4037.72,5.24,4040.34,-0.0516,0.0,0.5,0.14147194742055458,0.035720110320376086,-0.0742848078936854
I had all the love and attention two men,4040.68,4.56,4042.96,0.6369,0.5,0.8,0.13847469050099342,0.033646835857004,-0.0742161124760524
