text,start,duration,time_midpoint
any help um,114.78,3.379,116.4695
what do you want to see the president,189.48,3.6,191.28
the first vice president and second vice,191.459,5.481,194.1995
president appointment for seven years,193.08,3.86,195.01000000000002
maybe I can help you,201.0,3.26,202.63
welcome home good to see you Max boy we,238.799,4.5,241.049
sure missed you it's about time and come,241.379,3.481,243.1195
on let's sit down we got lots to talk,243.299,3.481,245.0395
about sit right here Max how about some,244.86,3.84,246.78
wine Max good we'll all have some yeah,246.78,4.22,248.89000000000001
you look great Max never look better did,253.08,3.6,254.88000000000002
yeah he's even got a good tan just in,256.68,3.779,258.5695
time for lunch,258.959,3.96,260.939
we'll go to Luigi's nice thick steaks,260.459,5.041,262.97950000000003
food can we remember Luigi's Max hey,262.919,6.121,265.9795
snap the best first thing you need is,265.5,5.28,268.14
some new clothes have I got a tailor,269.04,3.84,270.96000000000004
Uptown shoulders Max wants clothes,270.78,4.02,272.78999999999996
you'll buy clothes but he wants to eat,272.88,4.34,275.05
maybe there's other things he wants,277.259,2.401,278.4595
Max knows what he wants did me always,279.66,4.86,282.09000000000003
and at all costs money everything costs,282.66,3.599,284.45950000000005
is a thousand dollars,286.259,4.621,288.5695
I notice you got the painting of par,289.259,3.541,291.02950000000004
hanging downstairs it's a copy of the,290.88,3.24,292.5
one at the house,292.8,3.36,294.48
it's a nice touch,294.12,3.78,296.01
Bank should always hang paintings of the,296.16,3.84,298.08000000000004
dead men who started them gives them a,297.9,4.26,300.03
sense of tradition,300.0,3.84,301.92
like this one this Bank stinks with,302.16,3.72,304.02000000000004
today has been dead five years let it,303.84,4.079,305.87949999999995
rest make the money Max where's my,305.88,3.72,307.74
living I call the house there was no,307.919,3.861,309.8495
what's wrong,313.86,4.32,316.02000000000004
doesn't she live in the big house,318.18,3.0,319.68
she moved where,321.18,5.82,324.09000000000003
back on Mulberry Street why who knows,323.34,5.46,326.07
we kept the big hospital just as it was,327.0,3.6,328.8
she won't go near it,328.8,3.239,330.4195
come on drink up we've got a whole,330.6,4.099,332.64950000000005
bottle of killed,332.039,2.66,333.36899999999997
I kind of lost my taste for champagne,338.22,3.919,340.1795
cigars too,342.36,2.899,343.8095
a Big Rich Bank,348.6,4.8,351.0
must be quite a responsibility,351.18,5.4,353.88
lots of Big Rich worries,353.4,5.34,356.07
you know something Joe,356.58,4.08,358.62
you look worried,358.74,3.66,360.57
me I've got nothing to worry about I got,360.66,4.46,362.89000000000004
nothing period,362.4,2.72,363.76
how's Maria,366.24,5.94,369.21000000000004
fine is she still is beautiful yeah,368.28,5.16,370.85999999999996
you know being married has got us,372.18,2.459,373.4095
worries too,373.44,2.58,374.73
especially to a beautiful girl like,374.639,5.181,377.22950000000003
Maria does she ever ask about me,376.02,3.8,377.91999999999996
I must come up to dinner soon anytime,381.24,4.459,383.4695
that's a nice family you got Joe,387.539,4.1,389.589
blondes like their mother,393.78,3.08,395.32
how good time has been to you,398.16,5.06,400.69
to all three of you,400.199,3.021,401.7095
Tony's got Maria,404.639,4.321,406.7995
two blonde kids who hate spaghetti,406.8,5.1,409.35
Pietro second vice president,408.96,4.019,410.9695
I can remember when your greatest,411.9,4.98,414.39
ambition was 50 bucks for six rounds,412.979,7.681,416.8195
yes time has been more than good to you,416.88,6.36,420.06
tell me why do you all look so worried,420.66,4.68,423.0
what do you want Max seven years I want,423.24,4.679,425.5795
them back not much I told you it's not,425.34,4.5,427.59
working Max you're not scaring anyone I,427.919,4.821,430.3295
want seven years back,429.84,2.9,431.28999999999996
better take the money it's all you get,436.08,3.86,438.01
I'll bust his head,447.919,5.981,450.9095
he's out for blood he'll get blood,450.84,5.579,453.62949999999995
plenty of blood will you calling,453.9,6.56,457.17999999999995
Angelina we don't need Angelina,456.419,4.041,458.4395
we're going to keep it in the family,460.56,3.479,462.2995
where it belongs,461.88,5.12,464.44
it's always been,464.039,2.961,465.5195
a man who throws away money is a big,470.4,4.1,472.45
a big problem,474.96,2.84,476.38
Saturday night,679.86,5.099,682.4095
how come you're home on a Saturday night,682.079,6.841,685.4994999999999
you don't ask girls questions like that,684.959,6.361,688.1395
if you must know nobody asked me,688.92,4.859,691.3494999999999
there always was your trouble unpopular,691.32,3.92,693.2800000000001
I guess you've been alone every night,693.779,4.74,696.149
nobody's that unpopular,695.24,4.42,697.45
anyone to kill time with you've had a,699.66,4.14,701.73
lot of time to kill and a lot of time,701.64,4.74,704.01
have you seen your brothers,706.38,6.62,709.6899999999999
I had to see them before anything and,708.779,4.221,710.8895
don't be like that Max especially not,715.62,3.719,717.4795
tonight how would you expect me to be,717.959,2.82,719.3689999999999
full of jokes,719.339,3.781,721.2295
happy Max laughing boy it's over seven,720.779,3.961,722.7595
years past and gone forget them,723.12,4.5,725.37
vengeance is a rare wine a joy Divine,724.74,4.2,726.84
says the Arab,727.62,3.839,729.5395
I'm gonna get drunk on it,728.94,4.2,731.0400000000001
where did you pick that up some,731.459,3.601,733.2595
philosopher in the death house then,733.14,4.199,735.2395
you've come back a fool check,735.06,3.899,737.0094999999999
I was once the smartest of them all what,737.339,3.801,739.2395
did it get me,738.959,4.981,741.4495
us you and me and everything we've,741.14,5.199,743.7395
waited for Max let's get out of New York,743.94,4.62,746.25
tonight let's go to San Francisco you,746.339,4.261,748.4695
can start again whatever you want what I,748.56,4.14,750.63
want is right here in New York just what,750.6,3.9,752.5500000000001
goes on in that fine Italian brain of,752.7,3.42,754.4100000000001
yours murder,754.5,3.18,756.09
is that what you planned for seven years,756.12,3.0,757.62
a vendetta,757.68,3.899,759.6294999999999
that's how I killed time what about me I,759.12,4.62,761.43
was in a jail for seven years I was in a,761.579,4.741,763.9495
bigger jail than yours I was in a Jailer,763.74,4.32,765.9
side of the world you'll have to wait a,766.32,3.959,768.2995000000001
little longer I've done my last night's,768.06,4.7,770.41
let me have the porter please,774.18,3.26,775.81
what's that for I'm getting two tickets,777.48,3.24,779.1
on a plane to San Francisco you'll have,779.04,5.4,781.74
one empty seat it's now or never,780.72,6.78,784.11
you mustn't threaten an Italian,784.44,6.5,787.69
it doesn't mix well in our blood,787.5,3.44,789.22
am I part of your Vendetta am I on your,791.1,4.08,793.14
isn't it enough to destroy your brothers,795.18,4.62,797.4899999999999
and yourself why me why did you come,796.74,6.36,799.92
back to me at all and for what a dead,799.8,6.539,803.0695
man an evil man a bad man you're filled,803.1,5.64,805.9200000000001
with this poison it breathes in you the,806.339,3.961,808.3195000000001
world's better off with your father dead,808.74,4.58,811.03
but you're not,810.3,3.02,811.81
good boy that's what Gino maletti likes,813.48,5.82,816.39
it's the truth because it hurts hate Max,816.54,5.82,819.4499999999999
hate don't ever love listen to your dead,819.3,5.3,821.9499999999999
on the floor,939.38,5.88,942.32
yeah scrubbing my back,1025.939,4.041,1027.9595000000002
oh that's good A little Lord now a,1038.38,8.28,1042.5200000000002
little longer find it harder,1042.679,3.981,1044.6695000000002
go on a scrub and scrub a hard,1049.12,4.32,1051.28
the import people are calling again,1120.74,4.319,1122.8995
about their long now the shipment is on,1122.9,4.32,1125.0600000000002
a duck not now after a little while,1125.059,4.021,1127.0695
first I take care of my friends,1127.22,3.36,1128.9
oh look up,1129.08,5.18,1131.6699999999998
oh Gene here,1130.58,3.68,1132.4199999999998
in America how many times speaking,1135.64,3.399,1137.3395
you gotta learn sometime I'm gonna need,1139.039,5.161,1141.6195
some money to buy one horse what four,1141.38,4.86,1143.8100000000002
you need a horse the only one she died,1144.2,4.26,1146.3300000000002
she cannot pick up a junk,1146.24,4.34,1148.41
how much it cost one horse,1148.46,5.36,1151.14
150 dollars,1150.58,3.24,1152.1999999999998
all right the sign here look uh,1159.74,4.1,1161.79
okay eighty thousand dollars on the,1164.96,3.48,1166.7
housing project see,1166.58,3.9,1168.53
I fell up in Chicago on the telephone,1168.44,3.9,1170.39
wants to know if you renew on the,1170.48,5.1,1173.03
brewery hello,1172.34,3.24,1173.9599999999998
but Gina this is only a little twenty,1189.34,3.699,1191.1895
oh God interest I take him out in,1193.039,6.321,1196.1995
doctor said I gotta send them to Denver,1209.9,7.56,1213.68
where he died Denver,1214.88,4.5,1217.13
that's a long trip,1217.46,4.26,1219.5900000000001
that's in Kansas,1219.38,5.159,1221.9595000000002
oh how much today cost,1221.72,5.459,1224.4495
62 dollars,1224.539,6.201,1227.6395
hey Tony Pedro,1227.179,3.561,1228.9595000000002
you know what is the banking hours 903,1230.919,4.781,1233.3095
huh but you're never open on time,1234.02,3.42,1235.73
whenever you mind when I open you open,1235.7,4.44,1237.92
on time what's the matter your nose,1237.44,4.739,1239.8095
I won last night by a knockout in the,1240.14,4.38,1242.3300000000002
second round what would you get I can't,1242.179,4.021,1244.1895000000002
take money it would hurt my amateur,1244.52,4.98,1247.01
standing no money and why you fight,1246.2,6.96,1249.68
par you fight too I'm his manager he's,1249.5,5.4,1252.2
also a sport huh,1253.16,3.899,1255.1095
I got to work,1254.9,5.48,1257.64
do Sports I guess,1257.059,3.321,1258.7195
this is too much oh I'm sorry I make a,1264.26,4.94,1266.73
no no no no no bye bye bye bye,1269.86,7.559,1273.6395
pop will you come here a minute I want,1277.539,5.52,1280.299
to show you something,1280.58,2.479,1281.8194999999998
you've got to make Max get in office,1289.76,3.84,1291.68
somewhere else look at those characters,1291.559,3.48,1293.299
hanging around they're getting waste and,1293.6,3.0,1295.1
worse all the time they give the bank a,1295.039,3.361,1296.7195
black eye well Maxi bring good business,1296.6,4.079,1298.6395
bail bonds for criminals after all we're,1298.4,5.159,1300.9795000000001
running a Bangkok what do you mean to we,1300.679,5.461,1303.4095
I am the bank hold on go back to your,1303.559,4.821,1305.9695
momento no freeing here you want to fill,1316.36,4.179,1318.4495
the fountain then you go to post office,1319.34,4.16,1321.4199999999998
go see what the lady wants,1330.88,4.74,1333.25
yes ma'am where will I find Mr minetti,1336.02,4.74,1338.3899999999999
we got lots of manettes here my father,1338.84,4.56,1341.12
my brother Joe which one is the attorney,1340.76,6.06,1343.79
oh the lawyer Max,1343.4,6.2,1346.5
son of a gun,1350.539,3.441,1352.2595
oh wow you're lying yes go ahead you,1355.88,4.08,1357.92
told me that did he have a gun,1358.22,4.079,1360.2595000000001
that's bad any Witnesses,1359.96,3.66,1361.79
has he got any money,1363.62,4.52,1365.8799999999999
doors are made Tanaka I had time whoever,1373.88,6.44,1377.1000000000001
it is say you'll call him back,1377.179,3.141,1378.7495000000001
well I'll call you back,1380.78,3.139,1382.3495
where do your clients sit they don't,1385.28,3.24,1386.8999999999999
my name is Irene Bennett what's your,1388.52,3.24,1390.1399999999999
you were recommended to me by the film,1391.76,3.6,1393.56
of Hanford Sloan and Elliot oh it's a,1393.5,3.24,1395.12
very high class firm I used to work for,1395.36,2.16,1396.4399999999998
they don't recommend many clients to me,1397.52,3.42,1399.23
unless unless what unless they're low,1398.96,4.28,1401.1000000000001
a friend of mine is in trouble with the,1403.58,3.9,1405.53
police what did he do what makes you say,1405.5,3.9,1407.45
he don't look like you've got all the,1407.48,3.84,1409.4
trouble for a woman so what did he do,1409.4,4.8,1411.8000000000002
oh a lot of things bad checks took some,1411.32,5.4,1414.02
jewelry so someone else's car what's he,1414.2,3.479,1415.9395
I said he was a friend,1417.679,5.821,1420.5895
this car and jewelry yours weren't they,1420.679,4.5,1422.929
yes so what you've got to worry about,1423.5,3.539,1425.2695
are the bad checks why don't you make,1425.179,2.821,1426.5895
it's too late they were turned over to,1428.0,3.48,1429.74
the district attorney what do you want,1429.919,2.581,1431.2095000000002
I'll give you my check to cover them in,1432.5,4.44,1434.72
your Thief that should clean things up,1434.24,5.28,1436.88
money is a great cleanser,1436.94,5.52,1439.7
and expensive he was worth it maybe to,1439.52,5.72,1442.3799999999999
you but not to me,1442.46,2.78,1443.8500000000001
what's wrong I'm a lawyer not a garbage,1446.02,3.399,1447.7195
you think you can skip through life with,1449.419,3.061,1450.9495000000002
a checkbook opens and closes all the,1450.86,3.66,1452.6899999999998
doors I'm not that hard up take your,1452.48,4.079,1454.5195
business someplace else period that was,1454.52,3.36,1456.2
a pretty insulting little speech that's,1456.559,3.0,1458.059
what I had in mind but it didn't take,1457.88,4.14,1459.95
you can insult women you're not the type,1459.559,6.061,1462.5895
no no from you they love it,1462.02,5.34,1464.69
nothing touches you everything bounces,1465.62,3.66,1467.4499999999998
off that chromium finish,1467.36,4.38,1469.55
the chromium's wearing thin look I'm,1469.28,4.379,1471.4695
tired and I'm bored with this mess will,1471.74,3.36,1473.42
you take my case,1473.659,3.361,1475.3395
after what I said,1475.1,5.78,1477.99
especially after what you said,1477.02,3.86,1478.95
say please I'll pay my way thanks say,1481.1,5.24,1483.7199999999998
I'll take your case Miss uh,1492.62,4.98,1495.11
I'm not very good at remembering names,1497.6,5.66,1500.4299999999998
you'll remember my name,1499.36,3.9,1501.31
you busy come on in,1510.98,3.319,1512.6395
smell the air in here,1517.4,4.62,1519.71
they sell at a drop at a time,1522.02,3.48,1523.76
you gotta have a doctor's prescription,1524.179,3.421,1525.8895
like chloroform it gets in your brain,1525.5,5.52,1528.26
what was it a Dame how's things at home,1527.6,4.62,1529.9099999999999
how's the lane,1531.02,3.06,1532.55
what's on your mind,1534.08,3.06,1535.61
you remember PA promised to raise my,1537.14,3.48,1538.88
salary after I was married has he done,1538.88,3.84,1540.8000000000002
Elaine's getting pretty sore she says,1542.72,3.9,1544.67
she thought she married a banker,1544.46,4.02,1546.47
some Banker,1546.62,5.039,1549.1395
how can I entertain on 65 a week you're,1548.48,4.92,1550.94
married or do you have to Entertainer a,1551.659,3.0,1553.159
after all she comes from a fine,1554.659,3.0,1556.159
Philadelphia family,1556.039,3.12,1557.599
very social,1557.659,3.481,1559.3995000000002
take it downtown buy a new dress charger,1559.159,4.861,1561.5895
tonight no no that won't do any good,1561.14,5.22,1563.75
Elaine's proud,1564.02,3.899,1565.9695
first time she came into the bank and,1566.36,3.059,1567.8895
saw me behind the cage like I come and,1567.919,3.181,1569.5095000000001
collect she almost cried she censored it,1569.419,3.661,1571.2495000000001
you mean she's impatient slow her down,1571.1,3.72,1572.9599999999998
Joe you're gonna take over some day the,1573.08,3.479,1574.8194999999998
bank's gonna be yours who else all you,1574.82,3.599,1576.6195
got to do is wait it's the way he treats,1576.559,3.961,1578.5394999999999
me now in front of everybody go back to,1578.419,3.661,1580.2495000000001
your cage shut up drive me home do this,1580.52,3.84,1582.44
do that how do you think I feel Maxie,1582.08,3.9,1584.03
don't talk to you like that nobody talks,1584.36,3.299,1586.0095
to me like that I'm the oldest and I'm a,1585.98,3.24,1587.6
married man you don't have to treat me,1587.659,3.0,1589.159
like a servant all right all right I'll,1589.22,2.76,1590.6000000000001
talk to him tell him to talk to me like,1590.659,4.38,1592.8490000000002
he talks to you okay what else,1591.98,5.72,1594.84
okay don't go,1609.74,5.16,1612.32
sure I like you I'm talking to you,1612.08,4.26,1614.21
No not tonight it's Wednesday my mother,1614.9,4.32,1617.0600000000002
cooks supper on Wednesday I eat at home,1616.34,4.439,1618.5594999999998
I'll buy you a drink five minutes one,1619.22,4.11,1621.275
drink period,1620.779,11.72,1626.639
no no no no no no no no no no no no no,1636.86,4.679,1639.1995
no no no no no no no no no no,1639.32,5.219,1641.9295
that's about it,1663.44,5.4,1666.14
how much I give we'll give it the most,1665.72,6.839,1669.1395
Dominica huh how much you give well I,1668.84,6.06,1671.87
give a 5 000 more than him yeah and my,1672.559,3.801,1674.4595
name it goes on top,1674.9,4.92,1677.3600000000001
oh yeah okay okay you coming to the bank,1676.36,5.25,1678.985
we have to wait for Max but watch you,1746.659,4.081,1748.6995000000002
but we're expecting after then I guess,1750.74,3.24,1752.36
at our place well why don't you bring,1752.48,3.299,1754.1295
him here we got a plenty to eat lots of,1753.98,3.6,1755.78
room my friends don't happen to like,1755.779,4.321,1757.9395
spaghetti no I'm getting a little tired,1757.58,5.76,1760.46
of it myself sure me too,1760.1,6.6,1763.3999999999999
make you feel bad your stomach huh make,1763.34,6.839,1766.7595
you feel sick huh frankly yes you too,1766.7,5.82,1769.6100000000001
well you come here every Wednesday you,1772.52,5.519,1775.2794999999999
eat your Mama's spaghetti you get sick,1775.039,5.581,1777.8295
or you will go find jobs in some other,1778.039,4.88,1780.479
we waited for Max,1784.22,4.459,1786.4495
speed out of bread,1785.899,2.78,1787.289
hey PA can I give Maria some wine,1793.1,5.54,1795.87
Maria can have anything she wants,1798.64,4.919,1801.0995
no no no no no no no,1813.34,4.14,1815.4099999999999
I don't like a man coming late for,1817.48,4.48,1819.72
supper before he's married Max is busy,1819.74,4.4,1821.94
changing the record though man,1824.2,3.719,1826.0595
sorry I'm late everybody,1834.679,3.901,1836.6295
you're looking bigger and better every,1836.62,5.2,1839.2199999999998
we're engaged aren't we,1847.22,3.199,1848.8195
is it fun to get kissed you don't,1850.779,3.941,1852.7495
remember not till after you're married,1852.98,3.8,1854.88
oh then it's no more fun,1854.72,5.22,1857.33
oh Max did you what we talked about this,1859.94,5.7,1862.79
forgot we'll get it over with right now,1865.64,4.259,1867.7695
no no not here why not we're all family,1867.32,5.82,1870.23
huh how about giving Joe a raise the,1869.899,5.701,1872.7495
bank's doing good he works hard,1873.14,4.98,1875.63
hello you want the race,1875.6,4.319,1877.7595
well we don't have to talk about it now,1878.12,4.62,1880.4299999999998
Paul we talk about it tomorrow no Max is,1879.919,4.681,1882.2595000000001
quite right might as well know we stand,1882.74,3.9,1884.69
all right huh,1886.64,5.279,1889.2795
when the first I get married I make a 15,1889.34,5.459,1892.0694999999998
a week I have a four kids,1891.919,4.681,1894.2595000000001
how many kids you got,1894.799,3.661,1896.6295
I wouldn't raise a child in a two-room,1896.6,2.15,1897.675
well we all live in a one room,1900.82,5.92,1903.78
back at the barbershop I work seven days,1904.279,4.801,1906.6795
a week or 16 hours a day under my feet,1906.74,4.2,1908.84
never sit down you're sitting down now,1909.08,3.54,1910.85
Pam we're all out of the barbershop all,1910.94,3.3,1912.5900000000001
Joe wants a few more bucks a week you,1912.62,4.86,1915.05
promised him I promise you boy don't you,1914.24,6.12,1917.3
remember PA at the wedding,1917.48,6.54,1920.75
um wedding all of that Reno,1920.36,5.58,1923.1499999999999
I don't even remember even though we get,1924.02,4.1,1926.07
when I die you get all of the dollars,1932.679,5.681,1935.5195
the bank isn't for you,1936.02,5.89,1938.965
but Tony for Pietro all of the dollars,1938.36,5.819,1941.2694999999999
when I die,1944.179,5.781,1947.0695
hey answer the telephone,1974.779,20.64,1985.099
Max telephone excuse me,1996.82,4.44,1999.04
it's all taken care of,2011.159,4.961,2013.6395
something new,2014.32,4.079,2016.3595
right now my fee is double for evening,2016.12,4.679,2018.4595
be right over,2020.799,2.72,2022.1589999999999
Tony if I don't get back in time take,2027.899,4.78,2030.289
Maria to the show sure sure Max where do,2030.76,5.419,2033.4695
you go Max business power business,2032.679,3.5,2034.429
but I'll get back in time,2037.899,3.561,2039.6795
Prima classes,2064.899,3.321,2066.5595
you didn't waste any time,2086.26,3.379,2087.9495
looks like you're gonna afford a lot of,2095.2,3.899,2097.1495
trouble what is it now I've got cheers,2096.94,3.72,2098.8
my lawyers to sit in pick anyone you,2099.099,3.301,2100.7495000000004
like I haven't had any dinner I'm hungry,2100.66,3.54,2102.43
how about a drink before you eat you,2102.4,3.0,2103.9
said you had to see me right away what,2104.2,3.18,2105.79
about you know you don't really talk to,2105.4,4.08,2107.44
people you cross-examine them I'm a,2107.38,4.199,2109.4795
lawyer me you give facts sympathy you,2109.48,3.42,2111.19
get from doctors and relatives I don't,2111.579,3.061,2113.1095
want sympathy from anybody don't worry,2112.9,3.959,2114.8795
you're not likely to get it thank you so,2114.64,3.3,2116.29
look Miss Bennett can we get to the,2117.94,3.96,2119.92
point I'm here on an SOS an emergency,2119.5,4.68,2121.84
you said something very important it is,2121.9,4.02,2123.9100000000003
important well let's have the facts,2124.18,4.08,2126.22
they're not easy to find words for or,2125.92,3.84,2127.84
start looking I'm no good at reading,2128.26,3.78,2130.15
Minds you're a thoroughly unpleasant,2129.76,4.68,2132.1000000000004
young man but a wonderful lawyer the,2132.04,4.44,2134.2599999999998
facts where's your briefcase,2134.44,4.44,2136.66
I'm waiting for something to put in it,2136.48,4.8,2138.88
well it seems a friend of mine another,2138.88,4.68,2141.2200000000003
I have many friends as long as your,2143.56,4.08,2145.6
money holds out why not that's insulting,2145.54,5.1,2148.09
maybe I'm hungry that's no excuse what,2147.64,5.58,2150.43
about your friend you and your insults,2150.64,5.16,2153.22
why don't you stop trying,2153.22,4.56,2155.5
it's a girlfriend this time believe it,2157.78,3.839,2159.6995
or not she's in San Francisco that's my,2159.46,4.2,2161.56
home and she just called it's a long,2161.619,3.841,2163.5395000000003
involved mess,2163.66,3.84,2165.58
you'd probably have to go out there San,2165.46,3.84,2167.38
Francisco did she ask you to get hold of,2167.5,4.56,2169.78
me no of course not that was my idea she,2169.3,4.62,2171.61
was desperate no because what's the mess,2172.06,3.779,2173.9495
about well I couldn't possibly explain,2173.92,4.08,2175.96
it it's got to do with trust funds of,2175.839,4.201,2177.9395
father's estate all sorts of legal,2178.0,4.02,2180.01
complications I see I'm supposed to hop,2180.04,3.36,2181.72
a plane with a letter of introduction,2182.02,3.059,2183.5495
from you to her is that oh no nothing,2183.4,4.08,2185.44
like that after all she's my best friend,2185.079,4.5,2187.329
I'd want to be there too oh so we'd pop,2187.48,3.3,2189.13
a plane together,2189.579,4.701,2191.9295
if I can spare the time,2190.78,3.5,2192.53
have you got an empty bottle what four,2195.099,3.781,2196.9895
spin the bottle if we're gonna play like,2197.32,2.94,2198.79
kids let's make it a kissing game it's,2198.88,3.479,2200.6195000000002
much more fun the words were hard to,2200.26,3.839,2202.1795
find I told you I don't belong to the,2202.359,3.181,2203.9494999999997
California bar you're smart enough to,2204.099,3.661,2205.9295
know that but it is my home or was the,2205.54,3.84,2207.46
trust funds the father's estate yours,2207.76,3.24,2209.38
but no legal complications then you,2209.38,2.94,2210.85
don't need a lawyer,2211.0,4.619,2213.3095
I've got other complications,2212.32,5.759,2215.1995
still no drink I still don't know why,2215.619,4.74,2217.989
now who's playing a kid game,2220.359,5.22,2222.969
what goes with you anyway at the moment,2223.3,5.22,2225.9100000000003
I'm lonesome I resigned from the Lonely,2225.579,4.921,2228.0395000000003
Hearts Club your fears double at night,2228.52,3.72,2230.38
you made that perfectly clear,2230.5,4.7,2232.85
I'll get my ramp,2232.24,2.96,2233.72
you going someplace,2236.56,4.7,2238.91
we're going out,2238.42,2.84,2239.84
take off your wrap,2267.099,5.781,2269.9895
take off your rap and sit down,2269.5,3.38,2271.19
I'm going to give you a short history of,2277.2,4.24,2279.3199999999997
Max minetti born on the east side and,2279.28,4.14,2281.3500000000004
back of my old man's Barbershop today he,2281.44,3.659,2283.2695
owns a bank and Clips coupons instead of,2283.42,2.4,2284.62
but I still like the smell of garlic and,2285.82,2.94,2287.29
I'm engaged to a beautiful Italian girl,2288.76,4.02,2290.7700000000004
she can give me kids and make me a home,2291.16,4.62,2293.47
she knows only one man me Max minetti,2292.78,5.7,2295.63
period don't you want to know about me,2295.78,5.28,2298.42
I know about you you're Lonesome what,2298.48,3.599,2300.2795
what do you want lies what else is there,2302.079,5.821,2304.9895
you like to get hurt,2306.04,4.2,2308.14
always picking the wrong guy,2307.9,4.679,2310.2395
at the sickness with a lot of women,2310.24,3.96,2312.22
